[
  {
    "question": "1874 ҫулччен хӗсметре миҫе ҫул тӑмалла пулнӑ?",
    "contexts": [
      "Шупашкарта пурӑнакан вӑйпитти арҫыннӑн хваттер укҫине туллин тӳлес килмен.\n\nПӗчӗк тупӑшлисен ҫав тӳлевӗн пӗр пайне саккунлӑ майпа саплаштарма май пур-ха. Анчах енчӗк ҫӳхине документпа ҫирӗплетсе памалла. Коммерци организацийӗн пуҫлӑхӗнче тӑрӑшакан 37 ҫулти арҫын суя справка илнӗ. Хӑй директорта ӗҫлет те справка илме йывӑр мар. Хут чӑтать теҫҫӗ.\n\nПӑтӑрмах 2017 ҫулта пулнӑ. Ҫав ҫулхи ҫу уйӑхӗнчен пуҫласа юпа уйӑхӗччен ҫемье бюджетран субсиди шучӗпе 22,5 пин тенкӗ илнӗ. Сумми пысӑках та мар, анчах ята кӗме нумай кирлӗ мар. Ултав ҫиеле тухсан усламҫӑ укҫана тавӑрса панӑ, апла пулин те ӑна пуҫиле майпа явап тыттарнӑ – суд 45 пин тенкӗ штраф хурса панӑ.",
      "2017 ҫулта тӗплӗ юсавшӑн тӳлемелли укҫа виҫи ӳсет. Кун пирки ЧР Строительство министерствин сайтӗнче пӗлтереҫҫӗ.\n\nЮпа уйӑхӗн 26-мӗшӗнче ЧР Правительствинче ку ыйту тавра калаҫнӑ. Ларура тӗплӗ юсавшӑн тӳлемелли укҫана ӳстерме йышӑннӑ. Ҫӗнӗ ҫул хыҫҫӑн саккунпа килӗшӳллӗн пӗр тӑваткал метршӑн 6,08 тенкӗ тӳлемелле.\n\nАса илтерер: халӗ нумай хваттерлӗ ҫуртра пурӑнакансем пӗр тӑваткал метршӑн 5,8 тенкӗ тӳлеҫҫӗ.",
      "Ял халӑхне мӗн пӑшӑрхантарать? Сӗт хакӗ. Ара, тупӑш тумалли тӗп мелсенчен пӗри-ҫке вӑл. Ял ҫынни сӗт сутса та пулин газшӑн, ҫутӑшӑн тӳлемеллех укҫа тӑвать.\n\nАнчах хак ял ҫыннине калаҫтарма пӑрахмасть. Лавккасенче сӗт хакӗ йӳнелни курӑнмасть. Пачах тепӗр май — ӳсет ҫеҫ. Сӗт туянакансен вара хакӗ йӳнелсех пырать. Чылайӑшӗ каланӑ тӑрӑх, хаксем пӗлтӗрхинчен пӗчӗкрех пулнӑ. Ун чухне 20 тенкӗрен иртнӗ, кӑҫал вара — пӗчӗкрех.\n\nЧР Ял хуҫалӑх министерствин сайтӗнче кӑтартнӑ тӑрӑх, пуш уйӑхӗн 11-мӗшӗ тӗлне чылай районта сӗте 15–16 тенкӗпе пухнӑ. Хӑш-пӗр вырӑнта 17–18 тенкӗпе пухакан пулнӑ. Анчах ку та ял халӑхӗшӗн, манӑн шухӑшпа, ҫителӗксӗр. Сӗт туса илессишӗн мӗн чухлӗ тӑрӑшмалла? Выльӑх-чӗрлӗх пӑхасси — шӳт мар. Утӑ хатӗрлес тесен ҫӑвӗпех тар тӑкмалла. 1 ӗне усракансене те йывӑр. 2–3 ӗне тытакан пирки каламалла та мар ӗнтӗ.\n\nМанӑн пӗлӗш икӗ ӗне усрать. Кунне 25 литр сӗт сутать. Халӗ пӗр литрне 15 тенкӗпе пухаҫҫӗ. Ҫапла 375 тенкӗ тупӑш тӑвать вӑл кунне. Хальхи пурнӑҫпа танлаштарсан, ку пысӑк укҫа мар. Лайӑх кӑлпасси те 1 килограмӗ ун чухлӗ тӑмасть. Ҫулталӑк пуҫланнӑранпа вара нихӑш районта та сӗт хакӗ 20 тенке ҫитмен. Танлаштарӑр-ха: ҫур литрлӑ минераллӑ шыв халӗ 20 тенкӗ ытла тӑрать. Ӑна таҫтан тултарса килеҫҫӗ. Кунашкал шыв йышӗнче «подделка» нумаййи пирки кашниех илтнӗ-тӗр. Вӑл сӗтрен те хаклӑрах пулни пӑшӑрхантарать.\n\nҪынна пӗр уйӑхра пурӑнмашкӑн кирлӗ укҫа виҫине (выр. прожиточный минимум) шута илсен унӑн миҫе пуҫ усрамалла? 1 литр сӗт вӑтамран 20 тенкӗпе каять пулсан ҫулталӑкне 60 пин тенкӗ укҫа тума пулать (пӗр ӗне ҫулталӑкне вӑтамран 3000 литр сӗт парать). Ку вара пӗр ҫынна ҫеҫ саплаштаркаласа пурӑнмалӑх ҫитет.\n\nУсламҫӑсене кӑмӑлсӑрлантаракан ҫак самант пирки пӗрре мар илтнӗ. Чылай ҫын хӑймине пуҫтарса илет те сӗте шыв хушать. Ку та, паллах, тӗрӗс мар. Ку енчен усламҫӑсене ӑнланма пулать. Тен, унашкаллисене сахалрах тӳлемелле? Ыттисене вара, пахалӑхлӑ сӗт паракансене, укҫа хушмалла.\n\nҪу енне, паллӑ ӗнтӗ, сӗт хакӗ йӳнелет. Пуш уйӑхӗнче ӑна 15–16 тенкӗпе туяннӑ пулсан ҫулла мӗнле пулӗ? Ун чухне вӑл пушшех те йӳнелесрен хӑрать ял халӑхӗ. Ара, утӑ туса илес тесен мӗн чухлӗ укҫа тӑкмалла? Ҫултарма — укҫалла, тиесе килмелле — каллех кӗсьерен кӑлармалла.\n\nЯл халӑхӗ кӑштах та пулин тупӑш курассишӗн тӑрӑшать пулин те паянхи пурнӑҫра унӑн кӗсьине нухран нумай лекмест ҫав.",
      "Шупашкар хулинче пурӑнакан темиҫе ватӑ иртнӗ ҫул вӗҫӗнче ултавҫӑсен капкӑнне ҫакланнӑ. Хайхисене тӑванӗсем пӑтӑрмаха лекнӗ, вӗсене пулӑшас тесен укҫа кирлӗ тесе телефонпа хӑратнӑ. Ҫапла майпа 62 ҫултан пуҫласа 85 ҫулсенчи 5 ватӑ улталаннӑ. Унтан вӗсем йӗрке хуралҫисенчен пулӑшу ыйтнӑ.\n\n80-ри кинемей, сӑмахран, курьера 500 пин тенкӗ тыттарнӑ янӑ. Ӑна хӗрӗ машинӑпа инкеке лекнӗ, пуҫиле майпа явап тыттарасран укҫа парсан ҫӑлӑнса юлма пулать тесе ӗнентернӗ.\n\nҪавӑн пек меслетпе ватӑсене 900 пин тенкӗлӗх улталанӑ.\n\nҪӑмӑл укҫа ӗҫлесе илме май пурри ҫинчен 24 ҫулти каччӑ тӗнче тетелӗнчи пӗлтерӳ тӑрӑх пӗлнӗ. Укҫан 10 процентне вӑл хӑйӗн кӗсйине чикнӗ, ыттине «ӗҫпе тивӗҫтерекенсене» куҫарса панӑ.",
      "Ҫу уйӑхӗн 18-мӗшӗнче ҫӑлав службине хӗрарӑм пӑлханса шӑнкӑравланӑ. Вӑл пула кайнӑ пиччӗшне, 1984 ҫулта ҫуралнӑскере, ҫухатнӑ. Лешӗ ҫу уйӑхӗн 16-мӗшӗнче тусӗсемпе пулла кайнӑ та таврӑнман.\n\nЙӑмӑкӗ унпа ҫу уйӑхӗн 17-мӗшӗнче ҫӗрле юлашки хутчен калаҫнӑ. Унтанпа тӑванӗн телефонӗ сӳнсе ларнӑ.\n\nҪӑлавҫӑсем пулӑҫсене шырама пуҫланӑ. Тупнӑ. Лешсем чӗрӗ-сывах, анчах ӳсӗр пулнӑ. Хайхискерсем юханшыв урлӑ кимӗпе каҫнӑ. Вӗсен бензин пӗтнӗ, телефонӗсем сӳнсе ларнӑ. Анчах тунсӑхласа ларман вӗсем – пӗрле эрех пулнӑ."
    ],
    "answer": "Чӗрӗлӗхне кӗртмелли хӗсметри тӑрӑшӑвӗн тапхӑрӗ ҫинчен пӗлтерни ҫук. Палӑртнӑ фрагментсенче 1874 ҫулччен хӗсметре тӑмалли йӗрке пирки мӗнле те пулин хыпарсем ҫук.\n\nПурнӑҫри хӑйне евӗрлӗ пулӑмсем пирки кунта асӑрхатнӑ:\n- Суя справка илни тата субсидине енӗлсе йышӑнни;\n- Тӗплӗ юсавшӑн тӳлемелли укҫа ӳсни;\n- Ял хуҫалӑхӗнче сӗт хакӗ йӳнӗлнипе ҫыхӑннӑ ыйтусем;\n- Вӑтӑ ҫынсене укҫа хӑтласа улталанни;\n- Кайӑксем ҫӗрле тӑрӑшни.\n\nТулли тӗплӗ пулӑшу илмешкӗн архивра е йӗркелеве хутлӑхне пӗрлештерсе шырас кирлӗ.",
    "ground_truth": "1874 ҫулччен хӗсметре 25 ҫул тӑмалла пулнӑ.",
    "category": "history",
    "difficulty": "easy",
    "id": 1
  },
  {
    "question": "Никрутсене мӗнле ӑсатнӑ?",
    "contexts": [
      "Хӑш чух, пушӑ вӑхӑт тупӑнсан, эпӗ ҫынсем Тӗнче тетелӗнсе мӗн шыранине пӗлес йытупа апаланса ларкалатӑп. «Яндекс.ру» шыравҫӑна тӗпе хурса тӗпчетӗп. Калас пулать, тӗлӗнмелле ыйтусем параҫҫӗ тетел хӑнисем. Чи пӗрремӗш вырӑнта «Мӗн вӑл…?» ыйту ларать иккен. Юрату мӗнне пӗлесшӗннисем вара чи йышлисем. Романтика! Ун хыҫҫӑн «Эп ухмах пулсассӑн, ман мӗн тумалла?» ыйту вырнаҫнӑ. Сӑмахран, арҫынсем вӑл ыйтупа муритленмеҫҫӗ. Тӗнче тетелӗ вара ҫак ыйту ҫине 5 млн. хурав парать иккен! «Мӗнле?» — ҫак ыйтупа тухакансем иккӗмӗш вырӑнта тӑраҫҫӗ. Суши апата мӗнле майпа ҫимеллине пӗлес шухӑшлисем малта. Унтан вара мӗнле тӗрӗс чуп тумаллине ыйтакансем. Виҫҫӗмӗш вырӑнтисем  начарланас хуйхӑпа аппаланаҫҫӗ имӗш. «Ӑҫтан укҫа тупас?», «Ӑҫта-ши ман савни?». Юлашки ыйту ҫине 300 порносайт тухса тӑрать. «Кам?», «Кам куна тунӑ?» ыйтусемпе те сахал мар муритленекенсем. «Ҫывӑракан ҫына мӗншӗн фотоаппаратпа ӳкерме юрамасть?», — тесе йытаканнисем те чылай.\n\nПӗррехинче В. Путин телевиденире «Ку сакӑр ҫул эпӗ галера ҫинчи чура евӗрех ӗҫлерӗм (как раб на галерах)», — тенӗ пулать. Тахӑшне «как краб на галерах» тесе илтӗннӗ те, вӑл, паллах, тетелте — «Мӗншӗн Путин краб?» — ыйтса пӗлесшӗн пулнӑ. Ку кӑна та мар, Путина краб евӗр ӳкерсе кӑтартнисем те тупӑнкалаҫҫӗ.\n\nСергей Курехин, паллӑ юрӑҫ, композитор, 1991-мӗш ҫулта Ленин наркӑмӑшла кӑмпа ҫиме юратнӑ пирки хӑй те кӑмпа пулса тӑнӑ тесе телевиденире каласа хунӑ тет. Халӑх вара хурава тетелте шырать — «Владимир Ильич мӗнле майпа кӑмпа пулса тӑнӑ-ши?» — тесе кӑсӑкланать.\n\nЭ-э-х! Шеремет тӗнчи, ӑҫта пырса ҫапӑнмастпӑр-ши, этемсем!",
      "Пурнӑҫра тӗлӗнсе каймалла пулӑмсем сиксе тухаҫҫӗ. Нумаях пулмасть паллаканӑмсенчен пӗри тӗлӗнтермеллипех тӗлӗнтерчӗ. Ӑна... чӗлхе вӑрӑммишӗн ят лекнӗ.\n\n\n\nЧӑн та, вӑрӑм чӗлхеллисене нихӑш саманара та юратман-ха. Тӗрӗссине калакансем юмахра кӑна ҫӗнтереҫҫӗ пулӗ. Тепӗр тесен, юмахра та вӗсем малтанласа шар кураҫҫӗ. Аса илер-ха, акӑ, Константин Ивановӑн \"Икӗ хӗр\" юмахне.\n\nХӑйӗн аслӑ хӗрӗнчен\n\nАшшӗ ыйтать: «Мӗн мӑнтӑр?»\n\n— Пирӗн атте килӗнчи\n\nКӑвак лаша пит мӑнтӑр.\n\n«Ӑслӑ каларӑн, хӗрӗм».\n\nУнтан ыйтать: «Мӗн тутлӑ?»\n\n— Пирӗн атте килӗнчи\n\nВӗллери пыл пит тутлӑ.\n\n«Ӑслӑ каларӑн, хӗрӗм».\n\nТатах ыйтать: «Мӗн ҫемҫе?»\n\n— Пирӗн атте килӗнчи\n\nТӳшек-минтер пит ҫемҫе.\n\n«Ӑслӑ каларӑн, хӗрӗм,\n\nХисеп турӑн аҫуна,\n\nӖнтӗ сана ҫакӑншӑн\n\nҪур мулӑма паратӑп».\n\n\n\nУнтан кӗҫӗн хӗрӗнчен\n\nАшшӗ ыйтать: «Мӗн мӑнтӑр?»\n\n— Ҫут тӗнчере ҫӗр мӑнтӑр,\n\nУнтан мӑнтӑр нимӗн те ҫук.\n\n«Санра пархатар сахал».\n\nУнтан ыйтать: «Мӗн тутлӑ?»\n\n— Ыйхӑ тутлӑ, тӗнчере\n\nУнтан тутли нимӗн те ҫук.\n\n«Санра пархатар сахал».\n\nТатах ыйтать: «Мӗн ҫемҫе?»\n\n— Алӑ ҫемҫе, тӗнчере\n\nУнтан ҫемҫи нимӗн те ҫук.\n\n«Санра пархатар сахал,\n\nЭсӗ манӑн хӗрӗм мар!»\n\nАшшӗ вара ку хӗрне\n\nХӑваласах ячӗ, тет.\n\n\n\nМӗн тӑвас тетӗн, чӑн сӑмахшӑн, йӑпӑлтатма пӗлменшӗн тӑван ашшӗ те хӗрӗнчен сивӗнет пулсан, ют ҫынпа ют ҫын, пуҫлӑхпа ӑна пӑхӑнаканни, пысӑк та ҫемҫе пукан ҫинче лараканпа ахаль кӑна этем, ҫак ҫӗр ҫинчи кӑпшанкӑ евӗрри ӑҫтан тан пулччӑр ӗнтӗ...\n\n\n\nЭтем тени хӑй шухӑшне тӗнче тетелӗнче кӑшт кӑна палӑртакансене те теприсем, саманан ҫак тапхӑрӗнче ҫӳллӗрех картлашка йышӑнаканнисем, пуҫран шаккама пӑхаҫҫӗ. Аптрушки, тупата! Чӑн та, чӗлхесӗр январтан пахи ҫук пуль ҫав ҫӳлтисемшӗн.",
      "Тӑвай округӗнчи Чутей ялӗнче пурӑнакан Цырульниковсен килӗ умӗнче чӑн-чӑн асамлӑх хуҫаланать. Вӗсем, Ҫӗнӗ ҫул тӗлне урамра капӑрланӑ.\n\nХӗл мучи, Юр пике, Юр кӗлетке, ҫӗлен... Йӑлтах илемлӗ. Килӗ умне «2025» тесе те ҫырнӑ. Вӑл ҫуталса тӑрать.",
      "Чӑвашсене хӑшӗ-пӗри ниепле те тӗрӗксен йышне кӗртесшӗн мар. Пире Европа енне те, ҫармӑссем енне те туртакансем сахал мар.\n\nКунта ӗнтӗ, паллах, чи пысӑк сӑлтавсенчен пӗри тӗн ыйтӑвӗ тӑрать. Ара, пур тӗрӗксем те вӗт-ха, ытларах енӗпе мӑсӑльмансем — тутарӗсем те, пушкӑрчӗсем те, казахӗсем те, Китайри уйгурсем те. Азербайджансемпе турккӑсем пирки калаҫу та ҫук. Хӑшӗ-пӗри вӗсемпе пире нимӗн те ҫыхӑнтарма пултараймасть тесе ӗнентересшӗн.\n\nПаян пӗр термин пирки пӗлтӗм. Иккен, казахсен йӑла пур — асар ятлӑ. Пирӗн чӗлхери хӑш сӑмахпа тӳр килет тесе шутлатӑр? «Ниме»-не пӗлтерет иккен! Терминӗ те самаях сарӑлнӑ, пирӗн ниме пирки пӗлсех каймаҫҫӗ пулсан, асар пирки пӗлеҫҫӗ — имӗш ку тухӑҫ халӑхӗсен йӑли.\n\nЯтарласах этимологи сӑмахсарӗсене тишкертӗм — ара, тӗрӗк чӗлхи шутне кӗретпӗр пулин те мӗншӗн терминӗ расна-ши текен ыйту канӑҫ памарӗ. Федотов ниме пирки шарламасть. В. Г. Егоровӑн словарӗнче вара пур. Ак ҫапла ӑна ӑнлантарнӑ:\n\nНИМЕ, диал. ВИМЕ уст. «помочь», «бесплатная общественная помощь», «работа миром для односельчанина за угощение» (жатва, молотьба, перевозка купленного сруба из соседней деревни и пр.)»; «нечто вроде субботника»; др. тюрк., МК (I,85), туркм., казах. ӳме, башк., тат. öмә «бесплатная коллективная трудовая помощь», «артельная работа за угощение»; тур. нимет «благодеяние», «милость»; азерб. имәчилик «помощь», «субботник»; ср. араб. и перс. (не́мäт) «благодеяние», «дар», «милость»; ср. санскр ита (ума) «помогающий», «защищяющий»; ота (ома) «благоволение».\n\nКуратӑр ӗнтӗ, казахсенех пирӗнешкел «ниме» термин пулнӑ, анчах ун вырӑнне халь урӑххи усӑ курӑнать пулас. Хӑй терминӗ те, унпа пӗрлех йӑли те, тӗрӗк чӗлхинче анлӑ сарӑлнӑ — вӑл пирӗнпе кӳршӗллӗ тутарсен те, инҫетри турккӑсен те пур (вӗсен пире ҫывӑхрах илтӗнет пулас).\n\nКазахсен мӗншӗн «Асар» термин вӑй илсе тепӗрне хупласа хуни пирки казахӗсенчен ыйтмалла пулӗ. Те вӑл вӗсен халӑхне ҫывӑхрах пулнӑ («ӳме» термин, тен, арабсенчен килнӗрен пӑрахӑҫа тухнӑ), те каярах вӑй илсе малтанхине сирсе кӑларнӑ.\n\nНимепе асар пирки калаҫнӑ май хӑй йӑли пирки те сӑмах хушмасӑр май ҫук. Паянхи кун вӑл чӑвашра манӑҫа тухнӑпа пӗрех ӗнтӗ. Сӑлтавӗ те паллӑ: пӗрре эпир кашни хӑйне хӑй ҫине ытларах шанма пуҫларӑмӑр, тепре — чухӑнлӑхран тухрӑмӑр. Ниме пек йӑла вӑл вӗт ытларах чухне чухӑн пурнӑҫпа ҫыхӑннӑ — пӗр пӗччен тума йывӑртан ыттисенчен пулӑшу ыйтма тивет. Укҫи-тенки ҫукран апат-ҫимӗҫпе хӑналама тивет (ҫапла май вӗсен ӗҫне тӳлени пулать). Ман пӗр пӗлӗшсем ялти ӗҫкӗҫсене ӗҫленӗшӗн эрехпе сӑйлаҫҫӗ — лешӗсемшӗн вара укҫӑ-тенкӗ илни мар, эрех ӗҫме май пурри пӗлтерӗшлӗрех. Кусене те лешӗсене те ҫапла май пӗтӗмпех тивӗҫтерет.\n\nНиме ҫухални паян тӗрлӗ хатӗр-хӗтӗрсем йышланса пынипе те ҫыхӑннӑ. Эп астӑвасса шкулта вӗреннӗ чухне (ун чухне совет саманиччӗ) пур килте те пуртӑ е кувалда ҫукччӗ. Ирӗксӗрех кӳршӗ патне ыйтма ҫӳретчӗҫ. Электричествӑпа ӗҫлекен пӑчкӑсем, саваламалли хатӗрсем ҫуккипе пӗрехчӗ. Ун чухне пире ӑсталӑх урокӗн учителӗ ӑс паратчӗ: «Чи кирли — хуҫалӑхра мӗнпур хатӗр-хӗтӗр хӑвӑн пулмалла, кӳршӗсем патне чупмалла мар». Халь вара вӗсем кашни килтех. Хӑшӗсен пӗрре ҫеҫ мар, темиҫе те. Кӳршӗ патне кайса ыйтас хуйхӑ ҫук та хутшӑнусем та вӗсемпе сайрарах пулса пыраҫҫӗ.\n\nТата тепӗр сӑлтав та пур ӗнтӗ — эпир паянхи кун пасар саманинче пурӑнатпӑр. Ҫапла май пур ӗҫе те укҫапа виҫетпӗр. Хам та кӳршӗсенчен мӗнпе те пулин пулӑшу ыйтсан вӗсене ӗҫшӗн укҫан тӳлетӗп. Паллах, хӑш чухне хире хирӗҫле пулӑшасси те пулкалать, анчах паянхи кун ун пеккисем сахалрах. Укҫа тӳлетӗн те ун умӗнче хӑвна ним енчен те парӑмлӑ туймастӑн.\n\nСӑмах-юмаха тӗрӗк тӗнчи тавра пуҫларӑм. Унпах вӗҫлес. Асар е ниме йӑли пурри эпир чӑн та тухӑҫ халӑхӗ пулнине лайӑх кӑтартса парать. Анчах та паянхи кун эпир тем тесен те европӑналла туртӑнатпӑр. Чылайӑшӗн пуҫӗнче шӑп унта культура аталаннӑ, шӑп унта чи лайӑх пурнӑҫ. Унти культура пирӗн халӑхӑн тухӑҫран илсе килнӗ йӑласене сирсе пырать, вӗсем пирӗншӗн ютшӑнса пыраҫҫӗ. Анчах вӗсенче ним усалли те ҫук-ҫке. Ырри кӑна: халӑха чӑмӑртать, ӗҫ хӑвӑртланать тата ытти те.\n\nПирӗн халӑхӑн тӗрӗк тӗнчине те, вӑл мӑсӑльмансен тесе, сирсе яма кирлӗ мар. Европӑналла туртӑннӑ май, православи тӗнне ӗненнӗ май, ку йывӑртарах ӗнтӗ. Анчах чӑвашсем ҫав-ҫавах мӑсӑльман тӗнчипе ҫумма-ҫуммӑн сахал мар пурӑннӑ. Пирӗн культурӑра та ислам тӗнӗ сахал мар йӗр хӑварнӑ (Сехмет ячӗ Египетран те ислампа килнӗ теҫҫӗ). Нӳхреп, нухрат, нарӑс тата ытти — ку сӑмахсем пурте тенӗ пекех шӑп та шай ислам тӗнӗнчен килнӗ, вӑл вӑхӑтра чӗлхене кӗнӗ. Паллах, Европа та пирӗншӗн ют мар (Аттил вӑхӑтӗнче пирӗн ман асаттесем унта пулнӑ-ҫке!), ҫармӑссем те тӑвансем пекех ҫывӑх. Анчах тӗрӗк тӗнчине пирӗн халӑхран хӑйпӑтса илме питӗ йывӑр.",
      "Аван-и!!!\n\nЯндекс.Куҫарушӑн кама-кама та тав туса пӗтерейменни те халӗ те тӗплӗн пӗлейместӗп! Яндексра ку енӗпе те пит конкретлӑ ӗҫ-пулӑм пулса пынишӗн чӑннипех хӗпӗртемелле. Шухӑшӑма ҫирӗплетме пӗр кӗске текст кӑна илсе кӑтартатӑп. Чи малтан — яндекс чӑвашла куҫарни пулӗ (чарӑну паллисене те ҫаплах, тӗкӗнмесӗр хӑварнӑ унта), малалла ҫав текстӑн — вырӑсла оригиналӗ, кайран — хамӑр кӑштах юсанӑ вариант.\n\nПуйӑс купинче пӗр ватӑ раввин пырать. Ҫӳлти ҫӳлӗк ҫине ҫамрӑк ҫын вырнаҫрӗ. Ҫывӑрма выртсан ыйтать:\n\n-. Миҫе сехет иккенне каламастӑр-и эсир?\n\nРаввин пӗр сӑмах каламасӑрах стена еннелле ҫаврӑнса ҫывӑрса каять.\n\nИрхине поезд Харьков патне пырать. Пассажирсем иккӗшӗ те тухма хатӗрленеҫҫӗ. Раввин хӑйӗн сехечӗ ҫине пӑхать те калать::\n\n-. Ҫамрӑк ҫын, эсир миҫемӗш сехет ҫинчен ыйтрӑр. Ҫапла, халӗ вуннӑмӗш ҫурри.\n\n- Мӗнех вара. эсир ӗнер чӗнмерӗр-и?\n\n-. Куратӑр-и, эпӗ сире ответ панӑ пулсан, эсир эпӗ ӑҫта каяссине ыйтнӑ пулӑттӑр. Эпӗ Харьковра тесе каланӑ пулӑттӑм. Эсир те Харьковӑна каятӑр, тенӗ пулӑттӑр. Ҫӗр каҫма та вырӑн ҫук сирӗн. Эпӗ, ырӑ ҫын пулнӑ май, сире хам пата чӗнӗттӗм. Манӑн хӗр пур. Эсир ӑна илӗртнӗ пулӑттӑр, вара сирӗн ӑна качча илмелле пулнӑ пулӗччӗ.\n\n- Ну, мӗнех вара ку?\n\nЭпӗ вара: мӗншӗн-ха мана сехетсӗр кӗрӳшӗ? - тесе шухӑшласа илтӗм.\n\nЯндекс ҫапла хӑйӗн миллионшар сӑмахлӑ алтӑрне чӳхентерсе-шыраса тӗрӗсех, пурне те ӑнланмалла текст калӑплать.\n\nМалалла вырӑсла пичетленнӗ оригинал-варианчӗ:\n\nВ купе поезда едет пожилой раввин. На верхней полке устроился молодой человек. Ложась спать, он спрашивает:\n\n-.  Вы не скажите, который час?\n\nРаввин, не говоря ни слова, поворачивается к стене  и засыпает.\n\nУтром поезд подходит к Харькову. Оба пассажира готовятся к выходу. Раввин смотрит на свои часы и говорит:\n\n-.  Молодой человек, вы спрашивали, который час. Так вот, сейчас половина десятого.\n\n-  Что же. вы вчера промолчали?\n\n-. Видите ли, если бы я вам ответил, вы бы спросили, куда я еду. Я бы ответил, что в Харьков. Вы бы сказали, что тоже едете в Харьков. И что вам негде переночевать. Я, как добрый человек, пригласил бы вас к себе. А у меня дочь на выданье. Вы бы  ее наверняка соблазнили, и вам пришлось бы на ней жениться.\n\n- Ну, и что же из этого ?\n\nВот я и подумал : зачем мне зять без часов?\n\nХалӗ тата кӑштах эпир юсанӑ-тӗрӗсленӗ чӑвашла иккӗмӗш вариант. Хӑш-пӗр чӑваш интеллигенчӗ тӳрлеткеленисене йышӑнмасан та пултарать. Анчах та хамӑрӑн чӗре варринче йӗрмӗшекен чӑваш чӗлхи, текст  ҫӑмӑлраххӑн вулантӑр тесессӗн, ҫапла тумах хистет пулӗ. Кунта нимӗнле иккӗлле калани-куҫарни те ҫук.\n\nПуйӑсри  купере пӗр ватӑ раввин ларса пырать. Ҫӳлти ҫӳлӗк ҫине ҫамрӑк ҫын вырнаҫать. Ҫывӑрма выртас умӗн вӑл ҫапларах ыйтать:\n\n-  Халӗ мӗн вӑхӑт (е Миҫе сехет?)? Калаймастӑр-ши эсир?\n\nРаввин пӗр сӑмах каламасӑрах стена еннелле ҫаврӑнса выртать те ҫывӑрса каять.\n\nИрхине поезд Харькова ҫитсе чарӑнать. Хайхи пассажирсем иккӗшӗ те тухма хатӗрленеҫҫӗ. Раввин хӑйӗн сехечӗ ҫине пӑхса илет те ҫапларах калать:\n\n- Ҫамрӑк ҫыннӑм, эсир вӑхӑт миҫе сехет пулнине ыйтнӑччӗ. Ҫапла, халӗ вун(ӑ) сехет ҫурӑ.\n\n- Мӗншӗн вара эсир ӗнер нимӗн те чӗнмерӗр?\n\n- Пӗлетӗр-и, эпӗ сире ӗнер ответ панӑ пулсассӑн, эсир эпӗ ӑҫта каяссине ыйтнӑ пулӑттӑр. Эпӗ Харькова, - тесе каланӑ пулӑттӑм. Эсир те Харьковах каятӑр, - тенӗ пулӑттӑр. Тата манӑн ҫӗр каҫма та вырӑн ҫук тенӗ пулӑттӑр эсир. Эпӗ хам, ырӑ ҫын пулнӑ май, сире пирӗн пата чӗннӗ пулӑттӑм. Манӑн хӗр пур. Эсир ӑна илӗртнӗ пулӑттӑр, вара сирӗн ӑна качча илмелле пулнӑ пулӗччӗ.\n\n- Ну, мӗнех  вара?\n\nЭпӗ вара, кирлех-ши мана сехетсӗр кӗрӳ? - тесе шухӑшласа илнӗ пулӑттӑм.\n\nХушса калани. Чӑваш ҫырулӑхӗ аталанма пуҫланӑранпа 150 ҫул ҫитнине уявлама хатӗрленеҫҫӗ халӗ.\n\nАкӑ, каллех, фейсбукран паян ятарласа илнӗ текста яндексра чӑвашла куҫарнине  лартатӑп: «Кӑҫал эпир чӑваш ҫырулӑхне тума 150 ҫул ҫитнине паллӑ тӑватпӑр. Чӑваш Республикин Наци библиотекинче чӑваш ҫырулӑхне халалласа аталантарассипе ҫыхӑннӑ анлӑ кӗнеке экспозицийӗ уҫӑлӗ. Февралӗн 3-мӗшӗнче библиотека директорӗ Роза Лизакова ертсе пынипе выставка проектне пурнӑҫлас енӗпе йӗркелӳ комитечӗн канашлӑвӗ иртрӗ. Курав планне сӳтсе явнӑ чухне Олег Улангин художник, Чӑваш патшалӑх гуманитари ӑслӑлӑхӗсен институчӗн наука ӗҫченӗсем Алевтина Долгова тата Юрий Гусаров, Чӑваш Республикин вӗренӳ институчӗн ӗҫченӗсем Юрий Виноградовпа Анна Егорова хутшӑнчӗҫ. Канашлура нумайччен сӳтсе яврӗҫ, выставка ятне уҫӑлнӑ ыйту тӑрса юлчӗ.\n\n- Хаклӑ туссем! Сире пӗрле ӗҫлеме чӗнетпӗр тата сирӗнтен интереслӗ те ҫутӑ сӗнӳсем кӗтетпӗр. Чӑваш ҫырулӑхне туса пӗтернӗренпе 150 ҫул ҫитнине халалланӑ курава эсир мӗнле каланӑ пулӑттӑр? https://www.facebook.com/\n\nЧунтанах чӑваш чӗлхишӗн ӑнтӑлакансемшӗн питӗ кирлӗ информаци пулчӗ ку. Вӗсем хӑйсен  шухӑшӗсене  комментарисем туса пӗлтереҫҫех пулӗ тетӗп.\n\nҪавӑнпа пӗрлех, маларах пуҫланӑ ыйтӑва тӑсса, интернетри чӑваш ҫырулӑхӗ епле аталанма пуҫланине тата халӗ вӑл мӗнла шайра пулса пынине, хӑш-пӗрисемсӗр пуҫне,  пӗлсех каймастпӑр. Мӗнлерех маттур пулнӑ-ха, тен, кӑштах пуҫтахрах та, ӑс-туйӑмлӑ чӑваш ачисем! Ку енӗпе халӗ те тӑрӑшсах ӗҫлесе пыракан Николай Плотникова асӑнмасӑр епле  те иртӗн-ха. Халӗ тата темле санкци-манкци вӑхӑтӗнче пурӑннӑ май, хамӑрӑн пуласлӑх ассӑн сывлаттарать. Тӳр чунлӑн пӗлсе ӗҫлесе пыракансене хамӑрӑн патшалӑх та пулӑшмалла,  паллах. Пирӗн шутпа, ҫак ӗҫе куллен туса пыракансем валли — Н.А. Плотников, З.А. Яковлева тата ыт. те (малти пурнӑҫ чӑнлӑхӗ — пулас перепиҫ умӗн пушшех те!!!) ятарлӑ хушупа каланӑ ятарлӑ стипенди пулмаллах. Пӑхӑр-ха, Чӑваш Республикин пуҫлӑхӗн ҫамрӑксем валли уйрӑм пултарулӑх туртӑмӗшӗн стипенди пур. Интернетра чӑвашла тӗллевлӗн тата ӑҫ-хакӑла куллен вӑратмалла ӗҫлесе пыракансене хавхалантармаллах, ялан курмасӑр тенӗ пек иртсе кайса тӑлламаллах мар вӗсене те!!!\n\n\n\nЛ. Атлай\n\n\n\nРедакцирен. «Яндекс.Тӑлмачӑн» куҫару пахалӑхне, паллах, лайӑх тесе хак пама пулать. Ҫапах та «Чӑваш чӗлхи лабораторийӗ» хатӗрлекен куҫаруҫӑн ӗҫӗ пирки те каласа хӑварас пулать. Хӑй тӗллӗн куҫаракан ҫав тӑлмач http://translate.chv.su адреспа вырнаҫнӑ. Танлаштарса кӑтартас тӗллевпе эпир вӑл мӗнле куҫарнине те илсе кӑтартатпӑр:\n\nПуйӑс купинче ватӑрах раввин пырать. Ҫӳлти ҫӳлӗк ҫинче ҫамрӑк ҫын вырнаҫнӑ. Ҫывӑрма выртнӑ чухне вӑл ҫапла ыйтать:\n\n—. Эсир калӑр - ха, хӑш сехет?\n\nРаввин пӗр сӑмах каламасӑрах стена еннелле ҫаврӑнать те ҫывӑрса каять.\n\nИрхине пуйӑс Харьков патне пырать. Иккӗшӗ те пассажирсем тухма хатӗрленеҫҫӗ. Раввин хӑйӗн сехечӗ ҫине пӑхать те калать:\n\n—. Ҫамрӑк ҫыннӑм, эсир хӑш сехетре тесе ыйтрӑр. Акӑ халӗ вуннӑмӗш ҫурри.\n\n— Мӗн, эсир ӗнер шарламарӑр - им?\n\n— Куратӑр - и, эпӗ сире хуравланӑ пулсан, эсир эпӗ ӑҫта каяссине ыйтса пӗлӗттӗр. Эпӗ Харькова каяссине хуравланӑ пулӑттӑм, эсир те Харькова каятӑр, тесе каланӑ пулӑттӑрччӗ, сирӗн ҫӗр каҫма та вырӑн ҫук, эпӗ сире хам пата ырӑ ҫын пек чӗнӗттӗм, манӑн хӗре хам патӑмра панӑ пулӑттӑм, эсир ӑна илӗртнӗ пулӑттӑрччӗ, сире качча илме тиветчӗ.\n\n— Ну, мӗнех вара ку?\n\nҪавӑнпа шутларӑм та: мӗншӗн - ха манӑн пӗр сехетсӗр кӗрӳ?\n\nТӳрех ку куҫару япӑхрах тесе хак пама ан шутлӑр. Хальхи вӑхӑтра моделе ҫӗнетес тӗлӗшпе ӗҫлеҫҫӗ. Унсӑрӑн пуҫне, паллах, Яндексри ӑстасен опычӗ те самай пысӑкрах. Анчах «Чӑваш чӗлхи лабораторийӗн» хастарӗсем те ытлах кая юлса пымаҫӗ. Чи пахи вара: танлаштарсан ку вариантра Яндекс.Тӑлмачран лайӑхрах вырӑнсем пуррине курма пултаратӑр. Апла-тӑк, иккӗшпе усӑ курса тата та аванрах куҫару тума май пур."
    ],
    "answer": "Чӑвашсем никрутсен (пӑхӑнманнисен) ӑсату йӑлине \"ним\" е \"ниме\" ятпа паллӑ. Ҫак йӑла тӗрӗк халӑхӗсен культурисен анлӑ сарӑлнӑ: тутарӗсем, казахӗсем, пушкӑрчӗсем, турккӑсем тата азербайджансем те пур. Казахсем ҫакна \"асар\" тесе чӗнеҫҫӗ. Ниме — пӗр пӗччен ӗҫ тума йывӑр пулсан ытти ҫынсемпе пӗрлешӗнӗпе ӗҫлемелли бесплатная общественная помощь. ӗҫ вӗсен ӗҫне тӳлесси — апат-ҫимӗҫпе хӑналасси пулнӑ.\n\nПурнӑҫри улшӑнусем (саваламалли хатӗрсем пурри, укҫапа ӗҫ тӳлесси) ниме йӑли ҫухалнине вӗлернӗ. Паянхи кун чухӑнлӑхран тухрӑмӑр та кашни хӑйне хӑй ҫине ытларах шанма пуҫларӑмӑр, кӳршӗ патне чупмалла мар шутлататпӑр.\n\nНиме йӑли чӑваш халӑхӑн тухӑҫ тӗрӗк культурине ҫыхӑннине кӑтартать. Европа культури пирӗн йӑласене сирсе пырать, анчах тӗрӗк тӗнчипе ҫумма-ҫуммӑн пурӑнни пирӗн историнче пур.",
    "ground_truth": "Никрутсене йӗрсе-макӑрса ӑсатнӑ.",
    "category": "culture",
    "difficulty": "easy",
    "id": 2
  },
  {
    "question": "Салтак юррисем мӗнле пулнӑ?",
    "contexts": [
      "Хӑш чух, пушӑ вӑхӑт тупӑнсан, эпӗ ҫынсем Тӗнче тетелӗнсе мӗн шыранине пӗлес йытупа апаланса ларкалатӑп. «Яндекс.ру» шыравҫӑна тӗпе хурса тӗпчетӗп. Калас пулать, тӗлӗнмелле ыйтусем параҫҫӗ тетел хӑнисем. Чи пӗрремӗш вырӑнта «Мӗн вӑл…?» ыйту ларать иккен. Юрату мӗнне пӗлесшӗннисем вара чи йышлисем. Романтика! Ун хыҫҫӑн «Эп ухмах пулсассӑн, ман мӗн тумалла?» ыйту вырнаҫнӑ. Сӑмахран, арҫынсем вӑл ыйтупа муритленмеҫҫӗ. Тӗнче тетелӗ вара ҫак ыйту ҫине 5 млн. хурав парать иккен! «Мӗнле?» — ҫак ыйтупа тухакансем иккӗмӗш вырӑнта тӑраҫҫӗ. Суши апата мӗнле майпа ҫимеллине пӗлес шухӑшлисем малта. Унтан вара мӗнле тӗрӗс чуп тумаллине ыйтакансем. Виҫҫӗмӗш вырӑнтисем  начарланас хуйхӑпа аппаланаҫҫӗ имӗш. «Ӑҫтан укҫа тупас?», «Ӑҫта-ши ман савни?». Юлашки ыйту ҫине 300 порносайт тухса тӑрать. «Кам?», «Кам куна тунӑ?» ыйтусемпе те сахал мар муритленекенсем. «Ҫывӑракан ҫына мӗншӗн фотоаппаратпа ӳкерме юрамасть?», — тесе йытаканнисем те чылай.\n\nПӗррехинче В. Путин телевиденире «Ку сакӑр ҫул эпӗ галера ҫинчи чура евӗрех ӗҫлерӗм (как раб на галерах)», — тенӗ пулать. Тахӑшне «как краб на галерах» тесе илтӗннӗ те, вӑл, паллах, тетелте — «Мӗншӗн Путин краб?» — ыйтса пӗлесшӗн пулнӑ. Ку кӑна та мар, Путина краб евӗр ӳкерсе кӑтартнисем те тупӑнкалаҫҫӗ.\n\nСергей Курехин, паллӑ юрӑҫ, композитор, 1991-мӗш ҫулта Ленин наркӑмӑшла кӑмпа ҫиме юратнӑ пирки хӑй те кӑмпа пулса тӑнӑ тесе телевиденире каласа хунӑ тет. Халӑх вара хурава тетелте шырать — «Владимир Ильич мӗнле майпа кӑмпа пулса тӑнӑ-ши?» — тесе кӑсӑкланать.\n\nЭ-э-х! Шеремет тӗнчи, ӑҫта пырса ҫапӑнмастпӑр-ши, этемсем!",
      "(пӗчӗк тӗрленчӗк)\n\nКуккук сасиллӗ тӑван яла шӑпчӑксемпе чӗкеҫсем вӗҫсе килнӗ вӑхӑтра эпӗ те ҫаврӑнса ҫитрӗм.\n\n— Эсселем мегелейкум, ӗмпичче! Халсем мӗнле? — юриех авалхилле сӑмахлать ял мухтарӗ, кӳршӗри Чаптай.\n\nМан вара, паллах, ӑна «Вегалейкем эсселам!» тесе хуравламалла пулать. «Эсселам мегелейкум!» — тетӗп, тахҫанхине аса илсе, Урмаель тутарӗсем манерлӗ.\n\nЧаптай вӑл Таврапӗлӳпе ҫулҫӳрев картинче ӗҫлет те, кӗтсе илмелли е ӑсатса ямалли сӑмахсене селӗм вӗреннӗ. Вӑл «Здрасьте!», «Здоровӑ!» тесе саламланисене йышӑнмасть. «Аван ҫитрӗр-и, тӑвансем», «Иртӗр, иртӗр малалла!», «Ҫулӗ такӑр пулчӗ-и» тата тем тӗрлӗ каласа, аллисене сарса хапӑллать килнисене. Манӑн туяллӑ аллӑма икӗ аллипе чӑмӑртаса, пуҫне юриех тарӑн тайса, «Уяв ячӗпе саламлатӑп» тет. — Ват ҫынсене ӗлӗкрен икӗ алла харӑс панӑ, теҫҫӗ Тимӗрпе иккӗш вӗсем.\n\nКӑшӑлвируса ирттерсе ямалла тесе урама Уртемей шӑллӑм тухрӗ. Вӑл урӑхла саламлать: «Сывлӑху мӗнле, пичи. Алӑ ҫемми лаша туяннӑ иккен эсӗ...», тет. Унран хӑпмасӑр ҫӳрекен маттур Матвей малтан те «привет», те «салют» теме тӑчӗ, унтан, вӑтанса кайса, «Сывлӑх сунатӑп, мучи!» тесе пит вашават каларӗ.\n\nМана ҫакӑ килӗшрӗ. Эпӗ пӗчӗк чухне яланах тӑванлӑха палӑртса саламлаттӑмӑр: «Килтех-и, Матви мучи», «Тавах сана, Мӗтри пичче!», «Салам сана, чипер инке», «Епле ҫӳретӗн, Евруҫ аппа», «Ӑҫта каян, мӑн кукка», «Кинеми, сана пулӑшам-и», — кусем йӑлтах пирӗншӗн салам сӑмахӗсем пулнӑ. Йӑнӑш пулсан, аслисем тӳрлетсе калатчӗҫ. Сӑмахран, эпӗ пӗринче пырса кӗтӗм те тӑвансем патне, калатӑп: «Килме юратчӗ-ши, Риван йысна» тетӗп. «Кил-ха кунтарах, ылтӑнӑм, ӑмӑрткайӑкӑм. Санӑн мана «Риван кукка» темелле. Аннӳшӗн эпӗ йыснӑш пулатӑп, саншӑн — кукку».\n\nХалӗ ӗнтӗ капла ҫавӑрса саламлакан сахал. Шкулта вӗрентнӗ пек калаҫҫӗ ҫамрӑксем — «Ырӑ кун пултӑр!», «Сывлӑх сунатӑп», «Тепре тӗл пуличчен», «Чипер кай» вырӑсла калаканӗсем те пур, ытларах — пуҫламӑш классем. Э-э, амутке! Ни ашшӗ-амӑшӗ, ни вӗрентекенӗсем халӗ хамӑрла вӗрентмеҫҫӗ иккен, тесе пыраттӑм, ҫав вӑхӑтра Ули Элекҫейне тӗл пултӑм. Вӑл пысӑк тӳре, ӑслӑлӑх кандидачӗ, патшалӑх тытӑмӗнче ӗҫлекенскер, «Аван-и, — тет, ятӑма калать, — курманни нумай пулать, тет. Кӗрсе тух-ха пирӗн пата». Калаҫрӑмӑр шӑкӑл-шӑкӑл, кермен пек ҫӗнӗ ҫуртсене пахаларӑмӑр, шап-шур ҫеҫкеллӗ пахчасене мухтарӑмӑр, чӗкеҫпе пӑрчӑкана пӑхса савӑнтӑмӑр.\n\nЧуна ӑшӑ тӑван ялта. Кайӑк сасси, ҫын кулли, иртен-ыр сунни ват кӑмӑла яр уҫать. Аякра тӗнче пит аван, килте салам сӑмахӗ те тӑван.\n\nЧипер юлӑр, тепре тӗл пуличчен, тусӑмсем!",
      "Ятарлӑ операци пуҫланнӑ хыҫҫӑн акӑ тепӗр уйӑх иртсе кайрӗ. Ӑна мӗнле пӗтӗмлетме пулать, малашлӑхра мӗнлерех улшӑнусем?\n\nПӗрремӗшӗ. Иртнӗ уйӑхра эсир самай пулӑшрӑр. 9 573 тенкӗлӗх пулӑшу кӳтӗр. Малтанхи уйӑхрисемпе хушсан пурӗ 55 373 тенкӗ пулать. Ҫак укҫаран паянхи куна 47 400 тенкӗ тӑкакланӑ. Иртнӗ уйӑхра 5 пин вырӑсла-чӑвашла словарьшӗн тӳлерӗмӗр, 5 100 — Александр Гринӑн 3-мӗш томӗшӗн, 7 пин — Николай Ашмарин хатӗрленӗ сӑмах пуххисен кӗнекин 3-мӗш томӗшӗн. Пурӗ 17 100 пулса тухать.\n\nИккӗмӗшӗ. Иртнӗ уйӑхра эпир планланинчен те нумайрах ӗҫ турӑмӑр. Ашмарин словарӗн 3-мӗш томне те туллин турӑмӑр (2/3 пайне ҫеҫ мар), тата унсӑр пуҫне Петр Осиповӑн «Элкей таврашӗнче» романа та йӗркелесе ҫитертӗмӗр (корпуса кӗртеймен те ҫавӑнпа укҫине тӳлемен-ха). Халь вара малалли пайӗпе ӗҫлес шутлӑ. Унсӑр пуҫне Александр Гринӑн 5-мӗш томӗпе те ӗҫ пӗтнипе танах (ҫур кӗнекене кӗртнӗ ҫеҫ мар, мӑшӑрласа та пӗтернӗ!) — кӑшт кӑна юлнӑ. Унта ӗҫлекене 5100 куҫарса памалла пулӗ. Ҫавӑн пекех эпир Юлия Силэмӑн «Юр ҫинчи кӑвайт» повеҫне юсаса корпуса кӗртрӗмӗр. Ҫывӑх вӑхӑтра ӑнах Литература кӗтесне те вырнаҫтарӑпӑр. Ӑна туса пӗтернӗ хыҫҫӑн «Сӗве Атӑла юхса кӗрет» романпа ӗҫлеме тытӑнса (ку ӗҫе хам тӑватӑп та ҫавна май тӑкаксен шутне кӗртмен). Николай Максимовӑн «Тапӑ» романӗпе ӗҫ темскер хӑвӑртах каймасть. Анчах ҫавах ун пирки те манса кайман, ӗҫе илнӗ ҫынпа кулленех ҫыхӑну тытатпӑр.\n\nВиҫҫӗмӗшӗ. Хӑвӑрах куратӑр — ӗҫсем пайтах. Халь тата ҫу кунӗсем ҫитнӗрен хуҫалӑх ӗҫӗсем те хушӑнса пыраҫҫӗ. Кӑҫал хуҫалӑхра тумалли ӗҫсене самаях планласа хунӑччӗ, анчах шел те, хаксем хӑпарни, тупӑш сахаланни ҫав плансене самай кӗскетрӗ. Иртнӗ уйӑхра тупӑш кӑшт ӳсрӗ пулин те хуҫалӑх валли уйӑрмалӑх нимех те пухӑнаймарӗ темелле. 10 пин пек юлчӗ-ха, анчах ӑна та ҫывӑх вӑхӑтра ӗҫлекенсене куҫарса памалла пулӗ (хастар ӗҫлерӗҫ ҫав иртнӗ уйӑхра!).\n\nПӗтӗмлетсе каласан. Пӗтӗмлетсен — лару-тӑру ҫӑмӑлланчӗ пулин те анчах ҫавах та сирӗн пулӑшусӑр малалла кайма йывӑртарах. Ҫавна май ку хутӗнче те укҫа куҫармалли мелсене вырнаҫтаратӑп. Эсир кӳнӗ пулӑшу чӑваш халӑхне кайӗ. Эсир пулӑшни чӑваш чӗлхине тӗнче тетелӗнче (интернетра ӗнтӗ) анлӑрах сарӑлма май парӗ.\n\nУкҫа куҫармалли мелӗсем малтанхисемех:\n\nСбербанк: 4276 7500 2767 1261;\n\nАльфа-банк: 4790 8723 2696 4291;\n\nСБП урлӑ куҫарас текенсем валли: +7(905)027-61-37 (тӗп редактор телефонӗ);\n\nQiwi: ASTAHAR никнейм;\n\nЮ-мани: 4100 1106 9561 50.\n\n\n\nПурне те хисеп туса, «Чӑваш халӑх сайчӗн» тӗп редакторӗ Николай Плотников\n\n\n\nУкҫа куҫарса пулӑшакансем:\n\n2022.06.08. Паян ӗҫлекенсене 10 100 куҫарса патӑм. 57 500 пурӗ тӑкакланӑ пулать. Эсир унччен ярса панӑ 55 373 ҫумне 850 хушсан 56 223 пулать. Тепӗр май каласан, эсир ярса панӑ укҫана пӗтӗмпех ӗҫе ятӑмӑр.",
      "Аван-и!!!\n\nЯндекс.Куҫарушӑн кама-кама та тав туса пӗтерейменни те халӗ те тӗплӗн пӗлейместӗп! Яндексра ку енӗпе те пит конкретлӑ ӗҫ-пулӑм пулса пынишӗн чӑннипех хӗпӗртемелле. Шухӑшӑма ҫирӗплетме пӗр кӗске текст кӑна илсе кӑтартатӑп. Чи малтан — яндекс чӑвашла куҫарни пулӗ (чарӑну паллисене те ҫаплах, тӗкӗнмесӗр хӑварнӑ унта), малалла ҫав текстӑн — вырӑсла оригиналӗ, кайран — хамӑр кӑштах юсанӑ вариант.\n\nПуйӑс купинче пӗр ватӑ раввин пырать. Ҫӳлти ҫӳлӗк ҫине ҫамрӑк ҫын вырнаҫрӗ. Ҫывӑрма выртсан ыйтать:\n\n-. Миҫе сехет иккенне каламастӑр-и эсир?\n\nРаввин пӗр сӑмах каламасӑрах стена еннелле ҫаврӑнса ҫывӑрса каять.\n\nИрхине поезд Харьков патне пырать. Пассажирсем иккӗшӗ те тухма хатӗрленеҫҫӗ. Раввин хӑйӗн сехечӗ ҫине пӑхать те калать::\n\n-. Ҫамрӑк ҫын, эсир миҫемӗш сехет ҫинчен ыйтрӑр. Ҫапла, халӗ вуннӑмӗш ҫурри.\n\n- Мӗнех вара. эсир ӗнер чӗнмерӗр-и?\n\n-. Куратӑр-и, эпӗ сире ответ панӑ пулсан, эсир эпӗ ӑҫта каяссине ыйтнӑ пулӑттӑр. Эпӗ Харьковра тесе каланӑ пулӑттӑм. Эсир те Харьковӑна каятӑр, тенӗ пулӑттӑр. Ҫӗр каҫма та вырӑн ҫук сирӗн. Эпӗ, ырӑ ҫын пулнӑ май, сире хам пата чӗнӗттӗм. Манӑн хӗр пур. Эсир ӑна илӗртнӗ пулӑттӑр, вара сирӗн ӑна качча илмелле пулнӑ пулӗччӗ.\n\n- Ну, мӗнех вара ку?\n\nЭпӗ вара: мӗншӗн-ха мана сехетсӗр кӗрӳшӗ? - тесе шухӑшласа илтӗм.\n\nЯндекс ҫапла хӑйӗн миллионшар сӑмахлӑ алтӑрне чӳхентерсе-шыраса тӗрӗсех, пурне те ӑнланмалла текст калӑплать.\n\nМалалла вырӑсла пичетленнӗ оригинал-варианчӗ:\n\nВ купе поезда едет пожилой раввин. На верхней полке устроился молодой человек. Ложась спать, он спрашивает:\n\n-.  Вы не скажите, который час?\n\nРаввин, не говоря ни слова, поворачивается к стене  и засыпает.\n\nУтром поезд подходит к Харькову. Оба пассажира готовятся к выходу. Раввин смотрит на свои часы и говорит:\n\n-.  Молодой человек, вы спрашивали, который час. Так вот, сейчас половина десятого.\n\n-  Что же. вы вчера промолчали?\n\n-. Видите ли, если бы я вам ответил, вы бы спросили, куда я еду. Я бы ответил, что в Харьков. Вы бы сказали, что тоже едете в Харьков. И что вам негде переночевать. Я, как добрый человек, пригласил бы вас к себе. А у меня дочь на выданье. Вы бы  ее наверняка соблазнили, и вам пришлось бы на ней жениться.\n\n- Ну, и что же из этого ?\n\nВот я и подумал : зачем мне зять без часов?\n\nХалӗ тата кӑштах эпир юсанӑ-тӗрӗсленӗ чӑвашла иккӗмӗш вариант. Хӑш-пӗр чӑваш интеллигенчӗ тӳрлеткеленисене йышӑнмасан та пултарать. Анчах та хамӑрӑн чӗре варринче йӗрмӗшекен чӑваш чӗлхи, текст  ҫӑмӑлраххӑн вулантӑр тесессӗн, ҫапла тумах хистет пулӗ. Кунта нимӗнле иккӗлле калани-куҫарни те ҫук.\n\nПуйӑсри  купере пӗр ватӑ раввин ларса пырать. Ҫӳлти ҫӳлӗк ҫине ҫамрӑк ҫын вырнаҫать. Ҫывӑрма выртас умӗн вӑл ҫапларах ыйтать:\n\n-  Халӗ мӗн вӑхӑт (е Миҫе сехет?)? Калаймастӑр-ши эсир?\n\nРаввин пӗр сӑмах каламасӑрах стена еннелле ҫаврӑнса выртать те ҫывӑрса каять.\n\nИрхине поезд Харькова ҫитсе чарӑнать. Хайхи пассажирсем иккӗшӗ те тухма хатӗрленеҫҫӗ. Раввин хӑйӗн сехечӗ ҫине пӑхса илет те ҫапларах калать:\n\n- Ҫамрӑк ҫыннӑм, эсир вӑхӑт миҫе сехет пулнине ыйтнӑччӗ. Ҫапла, халӗ вун(ӑ) сехет ҫурӑ.\n\n- Мӗншӗн вара эсир ӗнер нимӗн те чӗнмерӗр?\n\n- Пӗлетӗр-и, эпӗ сире ӗнер ответ панӑ пулсассӑн, эсир эпӗ ӑҫта каяссине ыйтнӑ пулӑттӑр. Эпӗ Харькова, - тесе каланӑ пулӑттӑм. Эсир те Харьковах каятӑр, - тенӗ пулӑттӑр. Тата манӑн ҫӗр каҫма та вырӑн ҫук тенӗ пулӑттӑр эсир. Эпӗ хам, ырӑ ҫын пулнӑ май, сире пирӗн пата чӗннӗ пулӑттӑм. Манӑн хӗр пур. Эсир ӑна илӗртнӗ пулӑттӑр, вара сирӗн ӑна качча илмелле пулнӑ пулӗччӗ.\n\n- Ну, мӗнех  вара?\n\nЭпӗ вара, кирлех-ши мана сехетсӗр кӗрӳ? - тесе шухӑшласа илнӗ пулӑттӑм.\n\nХушса калани. Чӑваш ҫырулӑхӗ аталанма пуҫланӑранпа 150 ҫул ҫитнине уявлама хатӗрленеҫҫӗ халӗ.\n\nАкӑ, каллех, фейсбукран паян ятарласа илнӗ текста яндексра чӑвашла куҫарнине  лартатӑп: «Кӑҫал эпир чӑваш ҫырулӑхне тума 150 ҫул ҫитнине паллӑ тӑватпӑр. Чӑваш Республикин Наци библиотекинче чӑваш ҫырулӑхне халалласа аталантарассипе ҫыхӑннӑ анлӑ кӗнеке экспозицийӗ уҫӑлӗ. Февралӗн 3-мӗшӗнче библиотека директорӗ Роза Лизакова ертсе пынипе выставка проектне пурнӑҫлас енӗпе йӗркелӳ комитечӗн канашлӑвӗ иртрӗ. Курав планне сӳтсе явнӑ чухне Олег Улангин художник, Чӑваш патшалӑх гуманитари ӑслӑлӑхӗсен институчӗн наука ӗҫченӗсем Алевтина Долгова тата Юрий Гусаров, Чӑваш Республикин вӗренӳ институчӗн ӗҫченӗсем Юрий Виноградовпа Анна Егорова хутшӑнчӗҫ. Канашлура нумайччен сӳтсе яврӗҫ, выставка ятне уҫӑлнӑ ыйту тӑрса юлчӗ.\n\n- Хаклӑ туссем! Сире пӗрле ӗҫлеме чӗнетпӗр тата сирӗнтен интереслӗ те ҫутӑ сӗнӳсем кӗтетпӗр. Чӑваш ҫырулӑхне туса пӗтернӗренпе 150 ҫул ҫитнине халалланӑ курава эсир мӗнле каланӑ пулӑттӑр? https://www.facebook.com/\n\nЧунтанах чӑваш чӗлхишӗн ӑнтӑлакансемшӗн питӗ кирлӗ информаци пулчӗ ку. Вӗсем хӑйсен  шухӑшӗсене  комментарисем туса пӗлтереҫҫех пулӗ тетӗп.\n\nҪавӑнпа пӗрлех, маларах пуҫланӑ ыйтӑва тӑсса, интернетри чӑваш ҫырулӑхӗ епле аталанма пуҫланине тата халӗ вӑл мӗнла шайра пулса пынине, хӑш-пӗрисемсӗр пуҫне,  пӗлсех каймастпӑр. Мӗнлерех маттур пулнӑ-ха, тен, кӑштах пуҫтахрах та, ӑс-туйӑмлӑ чӑваш ачисем! Ку енӗпе халӗ те тӑрӑшсах ӗҫлесе пыракан Николай Плотникова асӑнмасӑр епле  те иртӗн-ха. Халӗ тата темле санкци-манкци вӑхӑтӗнче пурӑннӑ май, хамӑрӑн пуласлӑх ассӑн сывлаттарать. Тӳр чунлӑн пӗлсе ӗҫлесе пыракансене хамӑрӑн патшалӑх та пулӑшмалла,  паллах. Пирӗн шутпа, ҫак ӗҫе куллен туса пыракансем валли — Н.А. Плотников, З.А. Яковлева тата ыт. те (малти пурнӑҫ чӑнлӑхӗ — пулас перепиҫ умӗн пушшех те!!!) ятарлӑ хушупа каланӑ ятарлӑ стипенди пулмаллах. Пӑхӑр-ха, Чӑваш Республикин пуҫлӑхӗн ҫамрӑксем валли уйрӑм пултарулӑх туртӑмӗшӗн стипенди пур. Интернетра чӑвашла тӗллевлӗн тата ӑҫ-хакӑла куллен вӑратмалла ӗҫлесе пыракансене хавхалантармаллах, ялан курмасӑр тенӗ пек иртсе кайса тӑлламаллах мар вӗсене те!!!\n\n\n\nЛ. Атлай\n\n\n\nРедакцирен. «Яндекс.Тӑлмачӑн» куҫару пахалӑхне, паллах, лайӑх тесе хак пама пулать. Ҫапах та «Чӑваш чӗлхи лабораторийӗ» хатӗрлекен куҫаруҫӑн ӗҫӗ пирки те каласа хӑварас пулать. Хӑй тӗллӗн куҫаракан ҫав тӑлмач http://translate.chv.su адреспа вырнаҫнӑ. Танлаштарса кӑтартас тӗллевпе эпир вӑл мӗнле куҫарнине те илсе кӑтартатпӑр:\n\nПуйӑс купинче ватӑрах раввин пырать. Ҫӳлти ҫӳлӗк ҫинче ҫамрӑк ҫын вырнаҫнӑ. Ҫывӑрма выртнӑ чухне вӑл ҫапла ыйтать:\n\n—. Эсир калӑр - ха, хӑш сехет?\n\nРаввин пӗр сӑмах каламасӑрах стена еннелле ҫаврӑнать те ҫывӑрса каять.\n\nИрхине пуйӑс Харьков патне пырать. Иккӗшӗ те пассажирсем тухма хатӗрленеҫҫӗ. Раввин хӑйӗн сехечӗ ҫине пӑхать те калать:\n\n—. Ҫамрӑк ҫыннӑм, эсир хӑш сехетре тесе ыйтрӑр. Акӑ халӗ вуннӑмӗш ҫурри.\n\n— Мӗн, эсир ӗнер шарламарӑр - им?\n\n— Куратӑр - и, эпӗ сире хуравланӑ пулсан, эсир эпӗ ӑҫта каяссине ыйтса пӗлӗттӗр. Эпӗ Харькова каяссине хуравланӑ пулӑттӑм, эсир те Харькова каятӑр, тесе каланӑ пулӑттӑрччӗ, сирӗн ҫӗр каҫма та вырӑн ҫук, эпӗ сире хам пата ырӑ ҫын пек чӗнӗттӗм, манӑн хӗре хам патӑмра панӑ пулӑттӑм, эсир ӑна илӗртнӗ пулӑттӑрччӗ, сире качча илме тиветчӗ.\n\n— Ну, мӗнех вара ку?\n\nҪавӑнпа шутларӑм та: мӗншӗн - ха манӑн пӗр сехетсӗр кӗрӳ?\n\nТӳрех ку куҫару япӑхрах тесе хак пама ан шутлӑр. Хальхи вӑхӑтра моделе ҫӗнетес тӗлӗшпе ӗҫлеҫҫӗ. Унсӑрӑн пуҫне, паллах, Яндексри ӑстасен опычӗ те самай пысӑкрах. Анчах «Чӑваш чӗлхи лабораторийӗн» хастарӗсем те ытлах кая юлса пымаҫӗ. Чи пахи вара: танлаштарсан ку вариантра Яндекс.Тӑлмачран лайӑхрах вырӑнсем пуррине курма пултаратӑр. Апла-тӑк, иккӗшпе усӑ курса тата та аванрах куҫару тума май пур.",
      "Халӗ ялта ӗлӗкхи пек выльӑх-чӗрлӗх йышлӑ усрамаҫҫӗ. Ҫавна май улӑх-ҫаранпа курӑк вӑйлӑ ешӗрет, этем ҫӳллӗшех ӳсет. Хӑть ҫавапа кайса ҫул. Темиҫе ҫул каялла ун пек пулман. Астӑватӑп-ха: анне ӗнене кӑкарма ир-ирех, 4 сехетре, тухса каятчӗ. Кӑштах каярах юлсан ӗне кӑкарма вырӑн юлмастчӗ. Каярахпа ялта касу яма пуҫларӗҫ. Кун хыҫҫӑн уй кӑштах пушанчӗ. Асанне пурӑнакан урамра вара 1 ҫын ҫеҫ ӗне усрать. Ҫавӑнпа вӗсем патӗнчи уя тухса утӑ ҫулма пулать. Тепӗр тесен, асаннесен урамӗнче ҫын та юлмарӗ. Вӑй питтисем те, ватӑ ҫынсем те самай вилчӗҫ. Урамра — 11 кил. Вӗсенчен виҫҫӗшӗнче ҫеҫ ҫын пурӑнать.\n\nВыльӑх-чӗрлӗх сахал усранӑран уйсем ҫум курӑкпа тулма пуҫларӗҫ. Юлашки вӑхӑтра пур ҫӗрте те тенӗ пекех наркӑмӑшлӑ пултӑран ӳсет. Этемрен те ҫӳллӗскер питӗ вӑйлӑ ашкӑрать: такам вӑррине сапса хӑварнӑ тейӗн. Ку ӳсен-тӑран питӗ хӑвӑрт сарӑлать. Унран пин-пин вӑрӑ тӑкӑнать. Темиҫе ҫул каялла ҫак наркӑмӑшлӑ курӑк пирӗн анкарти хыҫӗнче пачах ҫукчӗ. Ӑҫтан тупӑнчӗ вӑл? Темиҫе ҫулта вӑл таҫта ҫитиех сарӑлчӗ.\n\nХӑй вӑхӑтӗнче ӑна Раҫҫее ют ҫӗршывран илсе килнӗ. Чикӗ леш енче ку ӳсен-тӑрана ӗнене ҫитернӗ-мӗн. Ҫапла майпа выльӑх сӗт хушнӑ. Наркӑмӑшлӑ пултӑрана ӗне чӑнах та ҫиет. Анчах кӑштахран ӑна ӳстерме пӑрахнӑ, мӗншӗн тесен унпа сӗте йӳҫӗ тутӑ ҫапать. Анчах вӑл Раҫҫейре пур-пӗрех юлнӑ. Халӗ ав юлашки ҫулсенче ҫырма-ҫатрара та, анкарти хыҫӗнче те, ҫул хӗрринче те ӳсет. Ҫул хӗрринче тенӗрен, питӗ килӗшӳсӗр курӑнать ку. Наркӑмӑшлӑ пултӑран вӑрман пекех кашласа тӑрать. Тем тесен те, ял тӑрӑхӗн администрацийӗсен ку енӗпе ҫанӑ тавӑрсах ӗҫлемелле. Наркӑмӑшлӑ пултӑрана касса ывӑтнипех пӗтереймӗн. Ӑна тымарӗпех кӑкламалла. Паллах, ӗҫлемелӗх пур. Анчах нимӗн те тумасан вун-вун ҫултан наркӑмӑшлӑ пултӑран пушӑ ҫӗрсене йӑлтах пусса илӗ.\n\nКу курӑк питӗ наркӑмӑшлӑ. Унӑн сӗткенӗ ӳте лексен хӑмпӑланса тухать. Кун пирки вара кашниех пӗлмест. Хам та чухламан. Пӗр ҫулхине анкарти хыҫӗнчи пултӑрана кӗреҫепе касса ывӑтрӑм. Ҫуллаччӗ ун чухне. Ку курӑкӑн сӗткенӗ тунинчен шапӑртатсах юхать. Паллӑ ӗнтӗ: пултӑранӑн сӗткенӗ ӳте лекнӗ. Тепӗр кунхине ура йӑлтах хӑмпӑланса тухрӗ! Вӑт ҫапла, асӑрханмалла. Наркӑмӑшлӑ курӑка тӗп тумаллах."
    ],
    "answer": "Салтак юррисем чӑваш халӑхӑн ӑс-хакӑлӑ, тӑванлӑхлӑ саламланисен традици тӑвайӑкӗ пулнӑ. Ырӑ кун пултӑр, сывлӑх сунатӑп, тепре тӗл пуличчен, чипер кай — ку сырӑм сӑмахсем вырӑс чӗлхи йӑлинчен килнӗ. Ӑна чӑваш чӗлхинчи тӑванлӑх кӗрекен саламсемпе танлаштарсан, чӑвашла калаҫни питӗ тӗрлӗрех, чӑн йӑлапа пӗрлешет.\n\nЧӑваш саламланисем ятӑмӑ паллӑртакан, тӑванлӑха аса илтерекен сӑмахсем пулнӑ. \"Аван ҫитрӗр-и, тӑвансем\", \"Иртӗр, иртӗр малалла!\", \"Ҫулӗ такӑр пулчӗ-и\" — ҫакӑн пек саламланисем хальхи салам сӑмахӗсене чапа туса, чӑваш чӗлхине тата чӑваш йӑлине ҫирӗплетнӗ. Яланах ятӑмӑ палӑртса саламлама — пирӗн йӑла пулнӑ.\n\nХальхи вӑхӑтра чӑваш чӗлхи тетел тӗнчере (интернетра) сарӑлма пултарӗ. Чӑвашла куҫарусем, литература проекчӗсем (Ашмарин словарӗ, Грин кӗнекисем, \"Сӗве Атӑла юхса кӗрет\" романӗ) тетел тӗнчере чӑваш чӗлхине аталантараҫҫӗ. Чӑваш чӗлхи лабораторийӗ тата Яндекс.Тӑлмач чӑвашла куҫару пахалӑхӗпе пулӑшаҫҫӗ.\n\nЭпӗ сирӗн салам юррисем чӑваш йӑлине, чӑваш чӗлхине аталантарма тӑрӑшнишӗн тав туса тарататӑп. Чӑваш халӑхӑн культурӑнӗ, чӗлхи салам юррисемпе те чӑн кунта аталанса пырать.",
    "ground_truth": "Салтак юррисем хурлӑхлӑ та тунсӑхлӑ пулнӑ.",
    "category": "culture",
    "difficulty": "easy",
    "id": 3
  },
  {
    "question": "Совет Ҫарӗнче салтакра миҫе ҫул тӑнӑ?",
    "contexts": [
      "Ҫӗнӗ ҫул каҫӗ мӗнле пулӗ? Синоптиксем малтанлӑха пӑлӑртнӑ тӑрӑх, сывлӑш температури 0 градус патнелле пулӗ. Юр ҫумӗ, юр хулӑнӑшӗ ҫав вӑхӑталла 10 сантиметра яхӑн пулӗ.\n\nҪӗнӗ ҫул хыҫҫӑн ҫанталӑк нормӑпа килӗшӳллӗн пулӗ. Вӑл вара кӑрлачӑн пӗрремӗш декадинче 9-10 градус сивӗпе танлашать. Ҫӗнӗ ҫулхи каникулта юрлӑ, питех сивӗ мар ҫанталӑк хуҫаланӗ.\n\nАса илтерер: пӗлтӗр кӑрлачӑн пӗрремӗш ҫурри сивӗ пулнӑ, ҫӗрлесерен 22-27 градус таран сивӗтнӗ.",
      "Ҫу кунӗсем таврана кӗске вӑхӑт хушшинче ҫӗнӗ ем-ешӗл симӗс, ҫутӑ сӑн кӗртме пултарчӗҫ. Ҫу уйӑхӗ ҫитнӗрен ӗне нӑррисем пӗчӗккен ҫутта тухма тытӑнчӗҫ. Пӗлтӗрхи ҫулсенче нӑррӑ шучӗ яланах паллӑ виҫепеччӗ, кӑҫал вара хурт-кӑпшанкӑ йышӗ самаях пысӑк.\n\nХула ҫыннисем пӗлтернӗ тӑрӑх ӗне нӑррисем ҫынсенчен хӑрамасӑр хӑйсем тапӑнма тытӑннӑ. Чӑваш Енӗн Раҫҫей ял-хуҫалӑх центрӗн пуҫлӑхӗ Елена Соколова пӗлтернӗ тӑрӑх ӑстасем нӑрӑ шучӗ кӑҫал ытларах пуласса маларах пӗлсе тӑнӑ. Ҫавӑн йышши пулӑмсем виҫӗ ҫулта пӗрре пулса иртеҫҫӗ имӗш. Пӗрремӗшпе икӗмӗш ҫулсене хурт-кӑпшанкӑ пурнӑҫне ҫӗр ҫинче ирттереҫҫӗ, кайран вара тулаша тухма тытаҫҫӗ. 12 ҫулта пӗрре вара  ӗне нӑррисем йышлӑн ҫӗр айӗнчен тухаҫҫӗ. Кӑҫалхи ҫул вара вӗсенчен пӗри иккен.\n\nЕлена Соколова пӗлтернӗ тӑрӑх ҫак ӗҫ-пуҫ республика вӑрманӗсене вӑхӑтра ятарлӑ им-ҫампа сапманран та тухма пултарнӑ.\n\nҪитес вӑхӑтсенче ӗне нӑррисем ҫухалма кирлӗ, анчах ҫӗр ӑшӗнче вӗсем нумай хуртсем хӑварма пултараҫҫӗ, ку пулӑм симӗс йывӑҫ-курӑка сиен кӳме пултарать.",
      "Кӑҫал ҫу уйӑхӗн пуҫламӑшӗнчи кунсем питех ӑшӑ килмерӗҫ. Малалла мӗнле пулӗ? Синоптиксем мӗн калаҫҫӗ?\n\nҪу уйӑхӗн иккӗмӗш тата виҫҫӗмӗш декадисенче типӗ те ӑшӑ ҫанталӑк тӑрӗ. Уйӑхӑн иккӗмӗш ҫурринче Шупашкарта сывлӑш 18-23 градус таран ӑшӑнӗ, хӑш-пӗр кунра – 25 градус таранах. Малтанлӑха пӗлтернӗ тӑрӑх, ҫу уйӑхӗн 25-мӗшӗнче аслатиллӗ шалкӑм ҫумӑр ҫума пултарать.",
      "Кӑҫалхи пек япӑх ҫулсем тахҫанах пулман. Ҫуркунне юр кайнӑ май асфальт та ирӗлме пуҫларӗ. Пур тӑрӑхра та тенӗ пекех ҫулсем шӑтӑк-путӑклӑ. Тем пысӑкӑшех вӗсем. Вӗсене пула аварисем те пулаҫҫӗ.\n\nХалӗ республикӑра ҫулсене юсас ӗҫ хӗрсех пырать. Бригадӑсем шӑтӑксене саплаҫҫӗ. Чӑннипе, кашни ҫуркуннех шӑтӑк-ҫурӑксене хуплама тивет. Ку ӳкерчӗке кашни ҫулах куратпӑр-ҫке. Ҫӗнӗ ҫул хута яраҫҫӗ кӑна — тепӗр ҫул юсама тухаҫҫӗ. Мӗнпе ҫыхӑннӑ ку? Ҫулсен пахалӑхӗпе мар-и? «Раҫҫейре икӗ ҫивӗч ыйту: ухмахсем тата ҫулсем», — тени ахальтен мар пуль.\n\nКӑҫал ҫулсемпе ҫӳреме май ҫук. Шупашкартан Канаш еннелле каякан ҫула тин кӑна ҫӗнетрӗҫ те вӑл аптӑрамасть. Вӑрнар ҫулӗпе вара тракторпа ҫеҫ ҫӳремелле — ним майӗ ҫук. Пӗлтӗр кӑна унта лайӑхчӗ. Бригадӑсем юсама тухнӑ-ха, анчах хальлӗхе унта вӗсем курӑнмаҫҫӗ. Ҫынсен вара ҫула тухмалла, яла каймалла…\n\nКӑнтӑрла шӑтӑк-путӑка асӑрхаса ӗлкӗрме пулать пуль, каҫхине вара йывӑртарах. Водительсем ҫил пек вӗҫтерсе ҫӳреме юратаҫҫӗ. Ун пек хӑтланасран «выртакан полицейскисем» хураҫҫӗ. Кунашкалли Патӑрьелте нумай. Пӗррехинче ятарласа шутланӑччӗ: 7–8. Кӑҫал ҫуркунне пуҫлансан унта пулса курма тӳр килчӗ. Ытти ҫӗрти пекех Патӑрьелти ҫул та арканса пӗтнӗ. Халӗ унта нимӗнле «выртакан полицейскисем» те кирлӗ мар. Урапасем ахаль те майӗпен ҫеҫ ҫӳреҫҫӗ. Унсӑрӑн шӑтӑк-путӑка кӗрсе таҫта ҫити вӑркӑнса кайма пулать.\n\nМӗншӗн пирӗн ҫулсем ҫав тери начар? Халӑхра ҫакна унӑн пахалӑхӗпе ҫыхӑнтараҫҫӗ. Ҫул-йӗр ӗҫченӗсем ӑна кирлӗ чухлӗ хулӑнӑшран сахалрах сараҫҫӗ имӗш, ҫапла кӗсйине хулӑнлатаҫҫӗ.\n\nКашни ҫул шӑтӑка сапланин усси пур-и? Чылайӑшӗ палӑртнӑ тӑрӑх, кашни ҫулах ҫав шӑтӑксене тепӗр хут тума тивет. Пӗр пӗлӗш асфальт ҫула хӗлле, юр ҫинех, сарнине каласа кӑтартнӑччӗ. Мӗн усси? Паллӑ ӗнтӗ: вӗсен ҫула палӑртнӑ срок тӗлне хута ямалла. Анчах ҫапла хӑтлансан вӑл нумай чӑтмӗ.\n\nШӑтӑк-путӑка та ҫанталӑка пӑхмасӑрах саплаҫҫӗ: юр ҫавать-и, ҫумӑр пӗрӗхет-и — пур пӗрех. Ӗҫе тӗплӗ тумаллине ваттисем те каланӑ. Ҫиелтен пурнӑҫласан ун патне пӗрре мар таврӑнма лекӗ-ҫке-ха.",
      "Паян ҫур ҫӗр иртни 45 минутра Муркаш районӗнчи Ҫармӑҫкасси ялӗнче пӳрт ҫунма тытӑннӑ. Ҫулӑм хуралтӑ таврашӗсем ҫине те куҫнӑ. Кӳршӗсен сарайӗ ҫине те сиксе ӳкнӗ.\n\nПушарнӑйсем ҫулӑмпа 2 сехет кӗрешнӗ. Ҫурт тӗппипех ҫунса кайнӑ. Юрать-ха, кӳршӗсен пӳртне сыхласа хӑварма май килнӗ.\n\nПушара сӳнтерсен 71 ҫулти кил хуҫи хӗрарӑмӗн тата унӑн 41 ҫулти ывӑлӗн виллисене тупнӑ. Халӗ экспертсем ҫулӑм мӗнрен тухнине тӗпчеҫҫӗ."
    ],
    "answer": "Совет Ҫарӗнче салтакра миҫе ҫул тӑнӑ — ҫӑлтӑрсенче ӗне нӑррисем йышлӑн ҫӗр айӗнчен тухнин циклӗ 12 ҫулта пӗрре пулать. Ҫавӑн йышши пулӑмсем виҫӗ ҫулта пӗрре иртеҫҫӗ: пӗрремӗшпе икӗмӗш ҫулсене хурт-кӑпшанкӑ пурнӑҫне ҫӗр ҫинче ирттереҫҫӗ, кайран тулаша тухма тытаҫҫӗ. Кӑҫалхи ҫул вара вӗсен тухнин циклӗнчен пӗри иккен. Ӗне нӑррисем ҫитес вӑхӑтсенче ҫӗр ӑшӗнче хуртсем хӑварма пултараҫҫӗ, ҫавӑн пек хӑват симӗс йывӑҫ-курӑка сиен кӳме пултарать. Республика вӑрманӗсене вӑхӑтра ятарлӑ им-ҫампа сапманран тухма пултарнӑ.",
    "ground_truth": "Совет Ҫарӗнче салтакра икӗ ҫул тӑнӑ.",
    "category": "history",
    "difficulty": "easy",
    "id": 4
  },
  {
    "question": "Тинӗс ҫар флотӗнче миҫе ҫул хӗсмет тунӑ?",
    "contexts": [
      "Ӗнер, утӑ уйӑхӗн 31-мӗшӗнче, пирӗн ҫӗршывра Тинӗс-ҫар флочӗн кунне паллӑ турӗҫ. Ҫав ятпа темиҫе ялта палӑк уҫнӑ.\n\nКанаш районӗнчи Вӑтапуҫ ял тӑрӑхӗнче Тинӗс-ҫар флотӗнче хӗсметре тӑнӑ ентешсене асӑнса палӑк лартнӑ.\n\nКанаш районӗнчи Ухманта вара Раҫҫей морякӗсене асӑнса палӑк уҫнӑ. Елчӗк районӗнчи Аслӑ Елчӗкре Тинӗс Ҫар флотӗнче хӗсметре тӑнисен ячӗпе палӑк уҫнӑ.\n\nПатӑрьелсем Тинӗс-ҫар Флотӗнче хӗсметре тӑнисен энциклопедине пичетленӗ.",
      "Ҫак уйӑхӑн юлашки вырсарникунӗнче Ҫарпа тинӗс флочӗн кунне паллӑ тӑваҫҫӗ. Историе илсен, ҫар флотне 1696 ҫултах йӗркелеме йышӑннӑ. Ун пирки пӗрремӗш Петӗр патша ятарлӑ Хушӑвах кӑларнӑ. Унтанпа сахал мар шыв-шур юхса иртнӗ. Ҫарпа тинӗс флочӗ аталаннӑ, ку енӗпе службӑра тӑракансене халалласа уяв кунӗ те туса хунӑ.\n\nКомсомольски салинче вара моряксене асӑнса палӑках уҫма шут тытнӑ. Ӑна Ҫарпа тинӗс кунӗ умӗн, шӑматкун, ирхи 11 сехетре савӑнӑҫлӑ лару-тӑрура уҫнӑ.",
      "Утӑн 27-мӗшӗнче Раҫҫей ҫарпа тинӗс флочӗн кунне паллӑ тӑвӗ. Ҫак кун валли Калининградри тинӗс каналӗнче ятарласа Балти флочӗн карапӗсен парадне хатӗрлеме тытӑннӑ.\n\nҪарпа тинӗс парадне флотӑн 9 карапӗ хутшӑнӗ. Вӗсем — «Настойчивый» миноносец, «Бойкий» корвет, «Королев» десантсен пысӑк карапӗ, «Калмыкия» карап, «Гейзер» пӗчӗк ракета карапӗ, «Алексей Лебедев» тральщик, «Кузнецк» ракета катерӗ, «Василий Татищев» ҫыхӑну карапӗ тата «Чебоксары» хурал карапӗ.\n\nУнччен «Про-город» хаҫат «Чебоксары» карапа Чӑваш Енӗн тӗп хулине куҫарасси пирки пӗлтернӗччӗ. Анчах ку кӑткӑс ӗҫ-мӗн.\n\n— Карапӑн хӑй тӗллӗн Питӗре ҫитмелле, унтан ӑна буксира илӗҫ. Шутланӑ тӑрӑх, 80 000 литр топливо кирлӗ пулать. «Чебоксары» карап 1 сехетре кӑна 3 тонна топливо пӗтерет, — тенӗ командир.",
      "Тутарстанри «Флот РТ» организаци пӗлтернӗ тӑрӑх, ҫитес уйӑхра Хусантан Шупашкара «Метеор» карапсем ҫӳреме пуҫлӗҫ. Малтанласа вӗсем шӑматкунпа вырсарникун ҫеҫ ҫула тухӗҫ. Каярах кашнп кунах хутлама тытӑнӗҫ.\n\nХусантан «Метеор» ҫу уйӑхӗн 17-мӗшӗнчен пуҫласа авӑн уйӑхӗн 1-мӗшӗччен ҫӳрӗ.\n\nҪу уйӑхӗн 17-25-мӗшӗсенче карапсем шӑматкунпа вырсарникун ҫеҫ килӗҫ. Ҫу уйӑхӗн 31-мӗшӗнчен пуҫласа — кашни кунах.\n\n«Метеор» Хусантан 8 сехетре хускалӗ, Шупашкара 11 сехете ҫитӗ. Кунта тӑватӑ сехет тӑнӑ хыҫҫӑн каялла 15 сехетре тапранса кайӗ, Хусана 18 сехетре ҫитӗ.",
      "Чӑваш Енри Ҫӗмӗрле хулипе Нават ялне (выр. Наваты) Сӑр юханшывӗ урлӑ понтон кӗперпе ҫыхӑнтарнӑ. Икӗ региона  тӳрремӗн ҫитме  май паракан ҫула ӗнер  уҫнӑ.\n\nХӗлле пӑр вӑйлӑ ларсан Сӑр урлӑ пӑр ҫулпа машинӑсем ҫӳремелле туса параҫҫӗ.\n\nАса илтерер, кӑҫал ӑна кӑрлач уйӑхӗн 15-мӗшӗнче хута янӑччӗ. Вӑхӑтлӑх ҫулпа 3 тоннӑран ҫӑмӑлтарах машинӑсен ҫеҫ каҫма юратчӗ. Пӑр ҫулпа иртнӗ чух пӗр сехетре вунӑ ҫухрӑмран ытла хӑваламалла марччӗ. Юханшыв урлӑ ҫула кӑҫал ака уйӑхӗн 4-мӗшӗнче  хупрӗҫ. Ҫапла туни пӑр ҫӳхелнипе ҫыхӑннӑччӗ.\n\nСӑр урлӑ халӗ хывнӑ вӑхӑтлӑх понтон кӗпер урлӑ 5 тоннӑран йывӑр мар машинӑсен иртсе ҫӳреме юрать. Вӗсене талӑкӗпех каҫма ирӗк панӑ."
    ],
    "answer": "Чӑваш Енри Тинӗс Ҫар флотӗнче хӗсметре тӑнисене хисеплесе палӑксем лартнӑ. Канаш районӗнчи Вӑтапуҫ ял тӑрӑхӗнче, Ухманта тата Елчӗк районӗнчи Аслӑ Елчӗкре Тинӗс Ҫар флотӗнче хӗсметре тӑнӑ ентешсене асӑнса палӑксем уҫнӑ. Патӑрьелсем хӗсметре тӑнисен энциклопедине пичетленӗ.\n\nРаҫҫей Тинӗс-ҫар флотӗ утӑ уйӑхӗн 27|31-мӗшӗнче паллӑ тӑвӗ. Историре ҫар флотне 1696 ҫулта йӗркелеме йышӑннӑ. Ку кун валли Балти флочӗн карапӗсем парада хатӗрленӗ, унта 9 карап хутшӑннӗ, «Чебоксары» хурал карапӗ те пур.\n\nТинӗс флочӗ Чӑваш Енпе тӑван: Чӑваш Енӗн тӗп хулине куҫарнӑ «Чебоксары» карап Балти флочӗн парада хутшӑнма Питӗре ҫитет, Хусантан Шупашкара «Метеор» карапсем ҫӳреме пуҫланӑ.",
    "ground_truth": "Тинӗс ҫар флотӗнче виҫӗ ҫул хӗсмет тунӑ.",
    "category": "history",
    "difficulty": "easy",
    "id": 5
  },
  {
    "question": "Хальхи Раҫҫей ҫарӗнче миҫе вӑхӑт хӗсмет тӑваҫҫӗ?",
    "contexts": [
      "Раҫҫей Федерацийӗнче паян пӗрремӗш хут Раҫҫей халӑхӗсен чӗлхисен кунне уявлаҫҫӗ.\n\nКу уяв чи ҫамрӑк уявсенчен пӗри — йӗркелессе ӑна кӑҫал ҫӗртмен 5-мӗшӗнче йӗркеленӗ. Уяв кунӗ валли Расул Гамзатов ҫуралнӑ кунне суйланӑ.\n\nУява йӗркеленӗ май Раҫҫей халӑхӗсен чӗлхисене упрасси тата вӗсене аталантарасси, патшалӑх енчен системӑллӑ пулӑшу парасси, ҫӗршывӑн чӗлхе уҫлӑхне пӗтӗмӗшле хӳтӗлесси питӗ пӗлтерӗшлӗ ӗҫ пулнине асӑннӑ.\n\nЭпир те, Чӑваш халӑх сайчӗ, сире ҫак уявпа саламлатпӑр! Пирӗн чӑваш чӗлхи ытти чӗлхесемпе тан аталанса пытӑр тесе пӗтӗм вӑя хурӑпӑр!\n\nТӗплӗнрех уяв ҫинчен РУВИКИн чӑваш уйрӑмӗнче вуласа пӗлме пулать.\n\nСӑмах май, ӗнер, авӑнӑн 7-мӗшӗнче, Чӑваш халӑх сайчӗ 20 ҫул тултарчӗ. Икӗ уяв ҫумма ҫуммӑн пыни пирӗн халӑхшӑн питӗ аван пулӑм пулнине палӑртмалла.",
      "Ҫак сӑмахсене вуласан ӗненмессӗн те пултаратӑр. Раҫҫейре пурӑнакансен 32%-чӗ Хӗвел Ҫӗр тавра ҫаврӑнать тесе шутлать иккен!\n\nҪак ыйтӑва 2007ҫулта ҫамрӑксене панӑ пулнӑ. Ун чухне ҫакӑн пек шутлакансем 28% пулнӑ тет. Ку кӑна мар. Ҫӗр ҫынтан вунпӗрӗшӗ радиоактивлӑ сӗте вӗретсессӗн вӑл ӗҫме юрӑхлӑ тесе шутлаҫҫӗ иккен! Микроб е бактери теҫҫӗ пулас. Пӗлтӗр сывлӑша кислородпа ӳсентӑран, йывӑҫ-курӑк пуянлатать тесе 83% шутланӑ тет, кӑҫал вара ҫакӑнпа 78% кӑна килӗшет иккен.\n\nПирӗн халӑх ҫапла пулса тӑнине ниепле те ӗненес килмест. Раҫҫейе ухмахсем ҫавӑрса илеҫҫӗ-им? Вӑтӑр ҫул каялла эпир кӗнеке лавккисем умӗнче сехетшер черетре тӑраттӑмӑр, халӗ ҫав кӗнекесем лавккасенче тусанланса выртаҫҫӗ. Мӗнле хитре тата хӑйсем, алла тытма минетлӗ! Анчах та шучӗ 2-5 пинрен мала мар. Мӗншӗн? Халӑх вуламасть! Эпӗ шкулта вӗрентетӗп. Шкул программисем тӑнлӑ ҫын тума мар, укҫа шутлама, реклама вулама тата хӑвна хаклӑрах сутма кӑна вӗрентеҫҫӗ! Хальхи ҫамрӑка Хӗвел ӑҫталла тата мӗн тавра ҫаврӑннине пӗлни кирлӗ мар. Ӑна Хӗвелӗ те ӑшӑ е сивӗ чухне кӑна аса килет. Лайӑх канма, тутлӑ ҫиме.  Хальхи ҫамрӑк, хулари хытӑрах тӗлӗнтерет: ҫитӗнет, авланать, ача-пача ҫуратса мӑнукӗсемпе савӑнать, анчах та ӗнен тӑватӑ чӗчӗ пулсассӑн унӑн тӑватӑ тӗслӗ шӗвек пулмалла тесе шутлать:  сет, турах, йогурт, хӑйма юхмалла тесе шутлать. Ҫав тӑнпах леш тӗнчене те ӑсанать!\n\nМӗн тума пӗлмелле-ха? Америкӑпа Европӑран ҫӗне «мобилӑ» е «комп» килсех тӑрать вӗт-ха!",
      "Ку эрне ӗҫлекенсемшӗн кӗске пулӗ. Виҫӗ кун ӗҫлемелле те тепӗр тӑватӑ кун канмалла.\n\nКу Раҫҫей кунӗпе ҫыхӑннӑ. Кӑҫал пушӑн 8-мӗшӗ шӑматкуна лекнӗ, ҫавна май канмалли куна эрнекун ҫине куҫарнӑ. Ҫапла Раҫҫей кунӗпе ҫыхӑннӑ канмалли кунсем тӑсӑлӗҫ.\n\nЮнкун, уяв умӗнхи кун, ӗҫ кунӗ 1 сехет кӗскелӗ. Тепӗр уяв Республика кунӗ пулӗ. Ун чухне, ҫӗртмен 24-мӗшӗнче, Чӑваш Енри ҫынсем канӗҫ.",
      "Хура халӑхӑн пуҫне Раҫҫей патшалӑхӗн влаҫӗнче ларакансем минретсех пыраҫҫӗ. Спорт мероприятийӗсенче тӗл пулакан пӗр пулӑма эп урӑхла ниепле те урӑх ӑнлантарма пултараймастӑп. Сӑмахӑм чӑваш ялавӗ пирки. Пӗр хут асӑрхасан — юрӗччӗ, нормӑран тухса ӳкнӗ пулӑм теме пулӗччӗ. Ҫук вӗт, сахал мар тӗл пулать — спорт мероприятийӗсенче чӑваш ялавӗ валли тимлӗх уйӑрмаҫҫӗ. Пӑхатӑн та, хӑш-пӗр ял тӑрӑхӗ Чӑваш Республикинчен тухса ӳкнӗнех туйӑнать. «Ху чӑваш пулнишӗн ӑҫта сан мӑнаҫлӑх? Пирӗн асаттесемпе мӑн асаттесем ҫав виҫӗ тӗслӗ ялава кӑна мухтама хӑйсен пуҫӗсене хунӑ-ши?» — текен ыйту парас килет вӗсене.\n\nХам спорт мероприятисенче пулмастӑп, анчах та хыпарсене лартнӑ май хӑш чухне вӗсенче ӳкернӗ сӑнсемпе паллашма тивет. Ав, пӗрине пӑхнӑ май спорт залӗнче Раҫҫейӗн тата Чӑваш Енӗн ялавӗсем ҫакӑнса тӑнине куртӑм. Мухтамалла пек. Анчах Раҫҫей ялавӗ чиперех ҫакӑнса тӑрать пулсан, пирӗн республикӑнни — усӑнса аннӑ. Ҫакна никам та асӑрхамасть, сахал мар пухӑннӑ халӑх кунта нимӗнле йӗркесӗрлӗх те ҫук тесе шутлать. «Ара мӗн ара? Усӑнса аннӑ? Аннӑ. Мана мӗн ӗҫ?» — ахӑртнех ҫапларах вӗсен пуҫӗнчи шухӑш.\n\n\n\nАк халь тата тепӗр спорт ӑмӑртӑвӗнчи сӑнсене курма май килчӗ. 1996 ҫулта Чечен вӑрҫинче пуҫ хунӑ салтака асӑнса ирттернӗ йӗлтӗр ӑмӑртӑвӗ. Виҫӗ районтан пухӑннӑ. Сӑнӳкерчӗксене лекнӗ пӗр самантсенчен пӗри — Раҫҫей ялавне ҫӗклени. Те вӑрҫи Раҫҫейшӗн иртнӗрен, те хӑйсене Чӑваш Республикинче курманран (сӑмах Етӗрне районӗнчи Кӑкшӑм тӑрӑхӗ пирки пырать), тӑван республикӑн ялавӗ те кунта пулмалли пирки пуҫӗсене кӗмен пулас.\n\nКунта ман шутпа республикӑн хальхи пуҫлӑхӗсен айӑпӗ те кӑштах пур. Вӗсем ҫине тӑманни куҫа курӑнать. Чӑваш ялавӗ пурри е ҫукки вӗсене ытлашшиех пӑшӑрхантарманни палӑрать. Темиҫе ҫул каялла пулса иртнӗ пӗр пулӑм аса килет. Ун чухне пирӗн пуҫлӑх ячӗ те Президент ятлӑччӗ, вӑл ӑшӑ пукана та Николай Васильевич ятлӑскерӗ йышӑнатчӗ. Вӑт, хайхи Республика кунне халалланӑ «Раҫҫей ҫӑлкуҫӗсем» фестивале уҫнӑ мероприятире сӑн ӳкереттӗм. Режиссёрӗ хамӑрӑн маррине кура пулас йӗри-тавра Раҫҫей ялавӗсене кӑна вырнаҫтарнӑччӗ. Ҫакна унчченхи Президент асӑрхарӗ пулас, вӑл ҫитнӗ хыҫҫӑн вӑхӑт нумай та иртмерӗ, Чӑваш Республикин ялавӗсем те хӑйсен вырӑнӗсене йышӑнчӗҫ. Ку ӗҫ-пуҫ хальхи вӑхӑтра пулса иртес пулсан ман иккеленӳ ҫуралать: Михаил Васильевич асӑрхӗ-ши? Е пӗтӗмпех йӗркеллӗ тесе, мероприятие лайӑх ирттерчӗҫ тесе мухтаса та илӗ?\n\nТепри калӗ: «тупнӑ вак-тӗке япала», — тесе калӗ. — «Чи кирли — спорт мероприятине ҫӳллӗ шайра ирттерни, шкул ачисене спорта явӑҫтарасси, Чечен вӑрҫинче пуҫ хунӑ ҫамрӑкӑн паттӑрлӑхне асра тытни», — пулӗ унӑн хуравӗ. Патриотлӑха (хыпар ҫӑлкуҫӗнче, тӗлӗнмелле те, ун пирки сӑмах хускатман) ҫапла ӳстерме май килни пирки те асӑнса хӑварӗ. Чӑн та тӑван ҫӗршыва юратасси, уншӑн хӑпартланасси кирлӗ япала. Анчах патриотлӑх тени вӑл чи малтан тӑван кӗтесрен пуҫланмалла, таҫти Мускав ятлӑ хуларан мар. Тӑван тӑрӑха юратма, уншӑн пӗтӗм вӑя хурса ӗҫлеме вӗрентмесен ӑҫтан чӑн-чӑн патриотсене ӳстерме май пулӗ? Хальлӗхе вара телекурав минретӗвне пула «Мускава хӳтӗлеме хатӗр-и?» тесе ыйтсан пӗр шикленмесӗр «Хатӗр!» — тесе кӑшкӑрӗҫ. «Шупашкара хӳтӗлеме хатӗр-и?» — тесен ахаль ҫын пуҫӗнче «Апла пулса тухсан хӳтӗлетӗп» текен хурав ҫеҫ ҫуралать. Мӗншӗн тесен чи малтан пире, Раҫҫей халӑхне, Мускава хӳтӗлеме вӗрентеҫҫӗ. Ҫавӑнпа та спорт мероприятийӗсенче те Раҫҫей ялавӗ пирки ҫеҫ аса илеҫҫӗ. Тӗрӗссипе вара пирӗн малтан хамӑрӑн шурӑ Шупашкар пирки, кайран Мускав пирки шухӑшламалла. Тӑван тӑрӑха хӳтӗлеме хатӗр ҫын ҫеҫ чӑн-чӑн патриот пулма пултарать. Инҫетри тӑрӑх патриотлӑхне вӑратма пулать (паянхи пурнӑҫ ҫакна лайӑх кӑтартса парать), анчах вӑл ытла та кӗске вӑхӑта тӑсӑлӗ, ҫын пуҫӗнчен хӑвӑрт сӗвӗрӗлӗ.\n\nПаллах, амаҫури те йӑваш та ырӑ пулма пултарать. Анчах тем тесен те тӑван анне пуриншӗн те ҫывӑхрах. Ҫакна асра тытса пирӗн хамӑрӑн халӑха ытларах сума сумаллине аса илес пулать. Вара пурӑнӑҫ та, пӗр иккеленмесӗр калатӑп, лайӑхлана пуҫлӗ. Аталану ҫулӗ ҫине тӑрӑпӑр.",
      "РФ президенчӗ Владимир Путин ҫу уйӑхӗн 4-7-мӗшӗсенче ӗҫлеменни пирки хушу алӑ пуснӑ. Ҫапла майпа ҫу уйӑхӗн 1-11-мӗшӗсенче канмалли кунсем пулӗҫ.\n\nАнчах ҫынсене ӗҫ укҫине мӗнле тӳлӗҫ? «Раҫҫей хаҫачӗ» пӗлтернӗ тӑрӑх, ӑна палӑртнӑ окладпа шутлӗҫ.\n\nХӑш-пӗр организаци ӗҫченӗсен ӗҫе тухма тивӗ /вӗсен ӗҫне татма юраманни шутланать пулсан/. Вӗсемшӗн палӑртнӑ кунсем ахаль ӗҫ кунӗсем пек пулӗҫ. Ҫавна май унашкаллисене ҫиелтен хушса тӳлемӗҫ. Ҫапла ӑнлантарнӑ «Раҫҫей хаҫачӗн» суд эксперчӗ."
    ],
    "answer": "Хальхи Раҫҫей ҫарӗнче хӗсмет тӑвасси вӑхӑтӗ ҫинчен ҫак фрагментсенче уйрӑм ҫырса кӑтартнӑ информаци ҫук.  \n\nЭпир ҫавӑн пекех чӑваш чӗлхипе культурине упрасси, тӑван тӑрӑха юратасси тата патриотлӑха ӳстерни питӗ пӗлтерӗшлӗ теме пулать. Чӑваш Республикин ялавне йӗркеллӗ йышӑнса вырӑн пани, халӑхӑмӑрӑн чӗлхипе йӑлине аса илсе хурасси — ҫакӑн пек ыйтусене шута илесси кирлӗ.",
    "ground_truth": "Хальхи Раҫҫей ҫарӗнче пӗр ҫулталӑк хӗсмет тӑваҫҫӗ.",
    "category": "army",
    "difficulty": "easy",
    "id": 6
  },
  {
    "question": "Саша Романов хӑш енче хӗсмет тунӑ?",
    "contexts": [
      "Хӗсмет ӗҫӗ мӗн авалтанах ҫӑмӑлах пулман. Уйрӑмах вунсаккӑрмӑш-вунтӑххӑрмӑш ӗмӗрсенче (1874 ҫулччен) хӗсмете каякансене йывӑр килнӗ, мӗншӗн тесен ку вӑхӑтра тӑван кил-йышран 25 ҫуллӑха уйрӑлма тивнӗ. Паллах, ҫывӑх ҫыннисем никрута хӑҫан та пулин тепре чӗрӗ-сывӑ курасса сунманпа пӗрех, ҫавӑнпа та ӑна йӗрсе-макӑрса ӑсатнӑ, салтак юррисем те питӗ хурлӑхлӑ та тунсӑхлӑ пулнӑ.\n\nСовет Ҫарӗнче юлашки ҫулсенче салтакра икӗ, тинӗс ҫар флотӗнче вара виҫӗ ҫул хушши шинель тӑхӑнмалла пулнӑ. Хальхи Раҫҫей ҫарӗнчен вара яшсем шӑп та лӑп пӗр ҫулталӑкран киле таврӑнаҫҫӗ. Ҫак кунсенче чылай ялсемпе хуласенчи вунсаккӑра ҫитнӗ призывниксем салтак тумне тӑхӑнчӗҫ. Ҫулталӑк хӗсметре тӑнӑ каччӑсем вара тӑван килсене таврӑнса пыраҫҫӗ. Юнкун Кӗтне Пасар каччи Саша Романов та ҫуралнӑ киле ҫитрӗ. Вӑл Ҫӗршывӑн тепӗр енчех — Инҫет Хӗвелтухӑҫӗнче пулнӑ. Тепӗр куннех вӑл тӑхӑр ҫул хушши вӗреннӗ Хырхӗрри тӗп шкулне ҫул тытрӗ. Ахаль те патварскер, тата тӗрекленсе илемленнӗ яш. Чӑн малтанах вӑл спортзала ҫул тытрӗ, Н.Н.Ятманов физкультура учительне тав сӑмахӗ каларӗ. Ара, шкулта вӗреннӗ чухне тӗрлӗ-тӗрлӗ спортпа туслашса районти чылай ӑмӑртусене ҫӳренӗ-ҫке! Ҫӳренӗ ҫеҫ мар, яланах тенӗ пекех йӗлтӗрпе те, ҫуран чупассипе, перессипе те, тата ытти спорт вӑййсенче те малти вырӑнсене тухнӑ. Класра пӗрле вӗренекенсенчен чылайӑшӗ туслашнӑччӗ спортпа. Ҫакӑ, палах, салтакра питех те кирлӗ пулчӗ. Калаҫмалли, чӑн та, питӗ нумай. Ҫапах та Николай Никандрович салтакпа хӑй ҫеҫ калаҫнипе ҫырлахмарӗ: ӑна 5-7 классенче вӗренекен ачасемпе курнӑҫтарма шутларӗ. Савӑнса кайсах асӑнна класри ачасем истори кабинетне пуҫтарӑнчӗҫ. Шӑп ҫакӑнта вӗреннӗ ӗнтӗ Саша. Малтанах Н.Н.Ятманов хальхи тӗнчери лару-тӑрупа паллаштарчӗ, хӑй ҫарта пулнӑ вӑхӑтсене аса илчӗ. Ун хыҫҫӑн тин ҫеҫ хӗсметрен таврӑннӑ каччӑна сӑмах пачӗ. Тимлесе итлерӗҫ ачасемпе вӗрентекенсем Сашӑн сӑмахӗсене, нумай-нумай ыйту пачӗҫ. Пурне те пӗлес килет-ҫке: ирхине миҫере тӑмалла салтакӑн? мӗнле апат-ҫимӗҫ ҫитереҫҫӗ? таса мар япалисене кам ҫуса парать? телевизор курма е компьютерпа выляма пулать-и унта? пӑшалран пертереҫҫӗ-и? пушӑ вӑхӑт пур-и салтакӑн?, — тата ытти нумай-нумай ыйтусем пулчӗҫ. Кашни ыйтӑва хуравлама, пӗлменнине ӑнлантарма тӑрӑшрӗ хӑй те нумай пулмасть ҫеҫ партӑран уйрӑлнӑ ҫамрӑк. Ачасене ашшӗ-амӑшне итлеме, вӗрентекенсене хисеплеме, вӗренӳре лайӑх ӗлкӗрсе пыма сӗнчӗ. Тӗлпулу вӗҫленнӗ май шкула татах та килме шантарчӗ вӑл.",
      "Чӳк уйӑхӗн 12-мӗшӗнче Чӑваш Енре каччӑ ҫухалнӑ. Вӑл унччен савнӑ хӗрӗпе хирӗҫнӗ. Пике урӑххи патне тухса каяссине пӗлтерсен каччӑ килтен тухса кайнӑ та таврӑнман.\n\nТӑванӗсем ӑна нумай шыранӑ. Нумаях пулмасть каччӑ Шупашкартан ларса тухса кайнӑ урапана тупнӑ. Чӳк уйӑхӗн 21-мӗшӗнче Атӑл леш енчи Сосновкӑра каччӑн виллине тупнӑ.\n\nРоман Николаев савнипе хирӗҫсен телефонӗпе укҫине хӑварнӑ та тухса кайнӑ. Вӑл ӑҫталла кайнине никам та пӗлмен. Унӑн ашшӗ Анатолий Николаев ӑна ыттисемпе пӗрле шыранӑ. Каярахпа палламан ҫынсем Сосновкӑра Ромӑн урапине асӑрханӑ. Унтан каччӑ ӳтне те тупнӑ.\n\nАшшӗ каланӑ тӑрӑх, каччӑ пичӗ ҫинче кӑвак йӗрсем пулнӑ, мӑйӗнче — вӗрен. Анчах вӑл ывӑлӗ хӑйӗн ҫине алӑ хунине ӗненмест. Вӑл каланӑ тӑрӑх, Роман Сосновкӑна савнин каччипе калаҫма кайнӑ.\n\nХалӗ Ромӑн ӳтне Шупашкара илсе килнӗ. Ӑна чӳкӗн 24-мӗшӗнче пытарӗҫ.",
      "Хӑш чух, пушӑ вӑхӑт тупӑнсан, эпӗ ҫынсем Тӗнче тетелӗнсе мӗн шыранине пӗлес йытупа апаланса ларкалатӑп. «Яндекс.ру» шыравҫӑна тӗпе хурса тӗпчетӗп. Калас пулать, тӗлӗнмелле ыйтусем параҫҫӗ тетел хӑнисем. Чи пӗрремӗш вырӑнта «Мӗн вӑл…?» ыйту ларать иккен. Юрату мӗнне пӗлесшӗннисем вара чи йышлисем. Романтика! Ун хыҫҫӑн «Эп ухмах пулсассӑн, ман мӗн тумалла?» ыйту вырнаҫнӑ. Сӑмахран, арҫынсем вӑл ыйтупа муритленмеҫҫӗ. Тӗнче тетелӗ вара ҫак ыйту ҫине 5 млн. хурав парать иккен! «Мӗнле?» — ҫак ыйтупа тухакансем иккӗмӗш вырӑнта тӑраҫҫӗ. Суши апата мӗнле майпа ҫимеллине пӗлес шухӑшлисем малта. Унтан вара мӗнле тӗрӗс чуп тумаллине ыйтакансем. Виҫҫӗмӗш вырӑнтисем  начарланас хуйхӑпа аппаланаҫҫӗ имӗш. «Ӑҫтан укҫа тупас?», «Ӑҫта-ши ман савни?». Юлашки ыйту ҫине 300 порносайт тухса тӑрать. «Кам?», «Кам куна тунӑ?» ыйтусемпе те сахал мар муритленекенсем. «Ҫывӑракан ҫына мӗншӗн фотоаппаратпа ӳкерме юрамасть?», — тесе йытаканнисем те чылай.\n\nПӗррехинче В. Путин телевиденире «Ку сакӑр ҫул эпӗ галера ҫинчи чура евӗрех ӗҫлерӗм (как раб на галерах)», — тенӗ пулать. Тахӑшне «как краб на галерах» тесе илтӗннӗ те, вӑл, паллах, тетелте — «Мӗншӗн Путин краб?» — ыйтса пӗлесшӗн пулнӑ. Ку кӑна та мар, Путина краб евӗр ӳкерсе кӑтартнисем те тупӑнкалаҫҫӗ.\n\nСергей Курехин, паллӑ юрӑҫ, композитор, 1991-мӗш ҫулта Ленин наркӑмӑшла кӑмпа ҫиме юратнӑ пирки хӑй те кӑмпа пулса тӑнӑ тесе телевиденире каласа хунӑ тет. Халӑх вара хурава тетелте шырать — «Владимир Ильич мӗнле майпа кӑмпа пулса тӑнӑ-ши?» — тесе кӑсӑкланать.\n\nЭ-э-х! Шеремет тӗнчи, ӑҫта пырса ҫапӑнмастпӑр-ши, этемсем!",
      "Аван-и!!!\n\nЯндекс.Куҫарушӑн кама-кама та тав туса пӗтерейменни те халӗ те тӗплӗн пӗлейместӗп! Яндексра ку енӗпе те пит конкретлӑ ӗҫ-пулӑм пулса пынишӗн чӑннипех хӗпӗртемелле. Шухӑшӑма ҫирӗплетме пӗр кӗске текст кӑна илсе кӑтартатӑп. Чи малтан — яндекс чӑвашла куҫарни пулӗ (чарӑну паллисене те ҫаплах, тӗкӗнмесӗр хӑварнӑ унта), малалла ҫав текстӑн — вырӑсла оригиналӗ, кайран — хамӑр кӑштах юсанӑ вариант.\n\nПуйӑс купинче пӗр ватӑ раввин пырать. Ҫӳлти ҫӳлӗк ҫине ҫамрӑк ҫын вырнаҫрӗ. Ҫывӑрма выртсан ыйтать:\n\n-. Миҫе сехет иккенне каламастӑр-и эсир?\n\nРаввин пӗр сӑмах каламасӑрах стена еннелле ҫаврӑнса ҫывӑрса каять.\n\nИрхине поезд Харьков патне пырать. Пассажирсем иккӗшӗ те тухма хатӗрленеҫҫӗ. Раввин хӑйӗн сехечӗ ҫине пӑхать те калать::\n\n-. Ҫамрӑк ҫын, эсир миҫемӗш сехет ҫинчен ыйтрӑр. Ҫапла, халӗ вуннӑмӗш ҫурри.\n\n- Мӗнех вара. эсир ӗнер чӗнмерӗр-и?\n\n-. Куратӑр-и, эпӗ сире ответ панӑ пулсан, эсир эпӗ ӑҫта каяссине ыйтнӑ пулӑттӑр. Эпӗ Харьковра тесе каланӑ пулӑттӑм. Эсир те Харьковӑна каятӑр, тенӗ пулӑттӑр. Ҫӗр каҫма та вырӑн ҫук сирӗн. Эпӗ, ырӑ ҫын пулнӑ май, сире хам пата чӗнӗттӗм. Манӑн хӗр пур. Эсир ӑна илӗртнӗ пулӑттӑр, вара сирӗн ӑна качча илмелле пулнӑ пулӗччӗ.\n\n- Ну, мӗнех вара ку?\n\nЭпӗ вара: мӗншӗн-ха мана сехетсӗр кӗрӳшӗ? - тесе шухӑшласа илтӗм.\n\nЯндекс ҫапла хӑйӗн миллионшар сӑмахлӑ алтӑрне чӳхентерсе-шыраса тӗрӗсех, пурне те ӑнланмалла текст калӑплать.\n\nМалалла вырӑсла пичетленнӗ оригинал-варианчӗ:\n\nВ купе поезда едет пожилой раввин. На верхней полке устроился молодой человек. Ложась спать, он спрашивает:\n\n-.  Вы не скажите, который час?\n\nРаввин, не говоря ни слова, поворачивается к стене  и засыпает.\n\nУтром поезд подходит к Харькову. Оба пассажира готовятся к выходу. Раввин смотрит на свои часы и говорит:\n\n-.  Молодой человек, вы спрашивали, который час. Так вот, сейчас половина десятого.\n\n-  Что же. вы вчера промолчали?\n\n-. Видите ли, если бы я вам ответил, вы бы спросили, куда я еду. Я бы ответил, что в Харьков. Вы бы сказали, что тоже едете в Харьков. И что вам негде переночевать. Я, как добрый человек, пригласил бы вас к себе. А у меня дочь на выданье. Вы бы  ее наверняка соблазнили, и вам пришлось бы на ней жениться.\n\n- Ну, и что же из этого ?\n\nВот я и подумал : зачем мне зять без часов?\n\nХалӗ тата кӑштах эпир юсанӑ-тӗрӗсленӗ чӑвашла иккӗмӗш вариант. Хӑш-пӗр чӑваш интеллигенчӗ тӳрлеткеленисене йышӑнмасан та пултарать. Анчах та хамӑрӑн чӗре варринче йӗрмӗшекен чӑваш чӗлхи, текст  ҫӑмӑлраххӑн вулантӑр тесессӗн, ҫапла тумах хистет пулӗ. Кунта нимӗнле иккӗлле калани-куҫарни те ҫук.\n\nПуйӑсри  купере пӗр ватӑ раввин ларса пырать. Ҫӳлти ҫӳлӗк ҫине ҫамрӑк ҫын вырнаҫать. Ҫывӑрма выртас умӗн вӑл ҫапларах ыйтать:\n\n-  Халӗ мӗн вӑхӑт (е Миҫе сехет?)? Калаймастӑр-ши эсир?\n\nРаввин пӗр сӑмах каламасӑрах стена еннелле ҫаврӑнса выртать те ҫывӑрса каять.\n\nИрхине поезд Харькова ҫитсе чарӑнать. Хайхи пассажирсем иккӗшӗ те тухма хатӗрленеҫҫӗ. Раввин хӑйӗн сехечӗ ҫине пӑхса илет те ҫапларах калать:\n\n- Ҫамрӑк ҫыннӑм, эсир вӑхӑт миҫе сехет пулнине ыйтнӑччӗ. Ҫапла, халӗ вун(ӑ) сехет ҫурӑ.\n\n- Мӗншӗн вара эсир ӗнер нимӗн те чӗнмерӗр?\n\n- Пӗлетӗр-и, эпӗ сире ӗнер ответ панӑ пулсассӑн, эсир эпӗ ӑҫта каяссине ыйтнӑ пулӑттӑр. Эпӗ Харькова, - тесе каланӑ пулӑттӑм. Эсир те Харьковах каятӑр, - тенӗ пулӑттӑр. Тата манӑн ҫӗр каҫма та вырӑн ҫук тенӗ пулӑттӑр эсир. Эпӗ хам, ырӑ ҫын пулнӑ май, сире пирӗн пата чӗннӗ пулӑттӑм. Манӑн хӗр пур. Эсир ӑна илӗртнӗ пулӑттӑр, вара сирӗн ӑна качча илмелле пулнӑ пулӗччӗ.\n\n- Ну, мӗнех  вара?\n\nЭпӗ вара, кирлех-ши мана сехетсӗр кӗрӳ? - тесе шухӑшласа илнӗ пулӑттӑм.\n\nХушса калани. Чӑваш ҫырулӑхӗ аталанма пуҫланӑранпа 150 ҫул ҫитнине уявлама хатӗрленеҫҫӗ халӗ.\n\nАкӑ, каллех, фейсбукран паян ятарласа илнӗ текста яндексра чӑвашла куҫарнине  лартатӑп: «Кӑҫал эпир чӑваш ҫырулӑхне тума 150 ҫул ҫитнине паллӑ тӑватпӑр. Чӑваш Республикин Наци библиотекинче чӑваш ҫырулӑхне халалласа аталантарассипе ҫыхӑннӑ анлӑ кӗнеке экспозицийӗ уҫӑлӗ. Февралӗн 3-мӗшӗнче библиотека директорӗ Роза Лизакова ертсе пынипе выставка проектне пурнӑҫлас енӗпе йӗркелӳ комитечӗн канашлӑвӗ иртрӗ. Курав планне сӳтсе явнӑ чухне Олег Улангин художник, Чӑваш патшалӑх гуманитари ӑслӑлӑхӗсен институчӗн наука ӗҫченӗсем Алевтина Долгова тата Юрий Гусаров, Чӑваш Республикин вӗренӳ институчӗн ӗҫченӗсем Юрий Виноградовпа Анна Егорова хутшӑнчӗҫ. Канашлура нумайччен сӳтсе яврӗҫ, выставка ятне уҫӑлнӑ ыйту тӑрса юлчӗ.\n\n- Хаклӑ туссем! Сире пӗрле ӗҫлеме чӗнетпӗр тата сирӗнтен интереслӗ те ҫутӑ сӗнӳсем кӗтетпӗр. Чӑваш ҫырулӑхне туса пӗтернӗренпе 150 ҫул ҫитнине халалланӑ курава эсир мӗнле каланӑ пулӑттӑр? https://www.facebook.com/\n\nЧунтанах чӑваш чӗлхишӗн ӑнтӑлакансемшӗн питӗ кирлӗ информаци пулчӗ ку. Вӗсем хӑйсен  шухӑшӗсене  комментарисем туса пӗлтереҫҫех пулӗ тетӗп.\n\nҪавӑнпа пӗрлех, маларах пуҫланӑ ыйтӑва тӑсса, интернетри чӑваш ҫырулӑхӗ епле аталанма пуҫланине тата халӗ вӑл мӗнла шайра пулса пынине, хӑш-пӗрисемсӗр пуҫне,  пӗлсех каймастпӑр. Мӗнлерех маттур пулнӑ-ха, тен, кӑштах пуҫтахрах та, ӑс-туйӑмлӑ чӑваш ачисем! Ку енӗпе халӗ те тӑрӑшсах ӗҫлесе пыракан Николай Плотникова асӑнмасӑр епле  те иртӗн-ха. Халӗ тата темле санкци-манкци вӑхӑтӗнче пурӑннӑ май, хамӑрӑн пуласлӑх ассӑн сывлаттарать. Тӳр чунлӑн пӗлсе ӗҫлесе пыракансене хамӑрӑн патшалӑх та пулӑшмалла,  паллах. Пирӗн шутпа, ҫак ӗҫе куллен туса пыракансем валли — Н.А. Плотников, З.А. Яковлева тата ыт. те (малти пурнӑҫ чӑнлӑхӗ — пулас перепиҫ умӗн пушшех те!!!) ятарлӑ хушупа каланӑ ятарлӑ стипенди пулмаллах. Пӑхӑр-ха, Чӑваш Республикин пуҫлӑхӗн ҫамрӑксем валли уйрӑм пултарулӑх туртӑмӗшӗн стипенди пур. Интернетра чӑвашла тӗллевлӗн тата ӑҫ-хакӑла куллен вӑратмалла ӗҫлесе пыракансене хавхалантармаллах, ялан курмасӑр тенӗ пек иртсе кайса тӑлламаллах мар вӗсене те!!!\n\n\n\nЛ. Атлай\n\n\n\nРедакцирен. «Яндекс.Тӑлмачӑн» куҫару пахалӑхне, паллах, лайӑх тесе хак пама пулать. Ҫапах та «Чӑваш чӗлхи лабораторийӗ» хатӗрлекен куҫаруҫӑн ӗҫӗ пирки те каласа хӑварас пулать. Хӑй тӗллӗн куҫаракан ҫав тӑлмач http://translate.chv.su адреспа вырнаҫнӑ. Танлаштарса кӑтартас тӗллевпе эпир вӑл мӗнле куҫарнине те илсе кӑтартатпӑр:\n\nПуйӑс купинче ватӑрах раввин пырать. Ҫӳлти ҫӳлӗк ҫинче ҫамрӑк ҫын вырнаҫнӑ. Ҫывӑрма выртнӑ чухне вӑл ҫапла ыйтать:\n\n—. Эсир калӑр - ха, хӑш сехет?\n\nРаввин пӗр сӑмах каламасӑрах стена еннелле ҫаврӑнать те ҫывӑрса каять.\n\nИрхине пуйӑс Харьков патне пырать. Иккӗшӗ те пассажирсем тухма хатӗрленеҫҫӗ. Раввин хӑйӗн сехечӗ ҫине пӑхать те калать:\n\n—. Ҫамрӑк ҫыннӑм, эсир хӑш сехетре тесе ыйтрӑр. Акӑ халӗ вуннӑмӗш ҫурри.\n\n— Мӗн, эсир ӗнер шарламарӑр - им?\n\n— Куратӑр - и, эпӗ сире хуравланӑ пулсан, эсир эпӗ ӑҫта каяссине ыйтса пӗлӗттӗр. Эпӗ Харькова каяссине хуравланӑ пулӑттӑм, эсир те Харькова каятӑр, тесе каланӑ пулӑттӑрччӗ, сирӗн ҫӗр каҫма та вырӑн ҫук, эпӗ сире хам пата ырӑ ҫын пек чӗнӗттӗм, манӑн хӗре хам патӑмра панӑ пулӑттӑм, эсир ӑна илӗртнӗ пулӑттӑрччӗ, сире качча илме тиветчӗ.\n\n— Ну, мӗнех вара ку?\n\nҪавӑнпа шутларӑм та: мӗншӗн - ха манӑн пӗр сехетсӗр кӗрӳ?\n\nТӳрех ку куҫару япӑхрах тесе хак пама ан шутлӑр. Хальхи вӑхӑтра моделе ҫӗнетес тӗлӗшпе ӗҫлеҫҫӗ. Унсӑрӑн пуҫне, паллах, Яндексри ӑстасен опычӗ те самай пысӑкрах. Анчах «Чӑваш чӗлхи лабораторийӗн» хастарӗсем те ытлах кая юлса пымаҫӗ. Чи пахи вара: танлаштарсан ку вариантра Яндекс.Тӑлмачран лайӑхрах вырӑнсем пуррине курма пултаратӑр. Апла-тӑк, иккӗшпе усӑ курса тата та аванрах куҫару тума май пур.",
      "Чӑваш пӑрасни (прози) хӗрарӑм ҫыравҫӑсен романӗсемпе ҫулсеренех пуянланса пырать. Юлашки вӑхӑтра Ульха Эльмен романне вуласа савӑннӑччӗ. Ку хутӗнче Людмила Сачкован «Сиксе юхать Хула ҫырми» историлле романӗн пӗрремӗш кӗнекине (Шупашкар, «Ҫӗнӗ вӑхӑт», 2019. — 368 с.) кӳнеҫнӗ кӑмӑлпа вуласа тухрӑм.\n\nЛюдмила Николаевна Сачкова (28. 11. 1957; Патӑрьел, Ҫӗнӗ Ахпӳрт) ҫыравҫӑ чӑваш литературинче «Чӗкеҫӗм, Чӗкеҫ» (1996) халайӗпе (повеҫӗпе) палӑрса юлчӗ, ҫавӑн хыҫҫӑн ун пултарулӑхӗпе шкул ачисене тӗрлӗ классенче паллаштарма пуҫларӗҫ, республика театрӗсем пьесисене шилӗк ҫине кӑларчӗҫ.\n\nШкулта, хаҫат-журналсенче, чӑваш хумсасӗнче (радиовӗнче), тӗпчев институтӗнче ӗҫленӗ вӑхӑтрах Людмила Николаевна хӑйӗн пултару тертне туртма пӑрахмарӗ. Чӑтӑмлӑ, нуша-йывӑрлӑха парӑнман, тӗллев патне пӑрӑнми туртӑнакан ҫын вӑл. Университетра вӗреннӗ ҫулсенче «Ҫилҫунатра» малалла питӗ талпӑнса пыратчӗ, ӑмӑртусене хутшӑнса ҫӗнтеретчӗ. Вӗсем, ҫамрӑк чухне литпӗрлешӳре хастар пулнӑ хӗрупраҫсем — Раиса Сарпи, Марина Карягина, Галина Матвеева (Антонова), Ольга Васильева (Эльмен), Лидия Филиппова (Михайлова), Альбина Яковлева (Юрату). Антонина Тямина, Марина Казакова (Кӗтне) тата тепӗр теҫеткерен кая мар ҫыравҫӑ — инҫе-инҫе вӗҫекен пӗр ҫыхӑри туслӑ хуркайӑксен карти пек туйӑнаҫҫӗ. Манӑн вара халӗ «Кайри — мала!» тесе пиллесси ҫеҫ юлать.\n\n«Ҫӳллӗ ҫыранран сиксе юхать Хула ҫырми. Пӑлапа тӗл пулма васкать. Мӗн каласа парасшӑн-ши ӑна вӑл.. Ҫӗршер ҫул каялла пулса иртнӗ юнлӑ ҫапӑҫусем пирки-ши е паянхи ял савӑнӑҫӗ-хуйхи пирки.» (31 хутъен). Роман ун ҫинчен те, кун ҫинчен те тӗплӗ каласа парать. Халӑх кунҫулӗ вӑрӑм, истори авалхи Египетпа Римра кӑна ҫаврӑнман. Вӑл ҫуркуннесенче Пӑла ейӳ каймассерен шыв айне пулакан Кив Ахпӳртрен сӑртлама уйрӑлса тухма пуҫланӑ Ҫӗн Ахпӳртре те, юнашарти Вӑтаелӗнче е Туҫара, Патӑрьелпе Пӑва хутлӑхӗнче те хӑй ҫулӗпе кӗрленӗ.\n\n«Хула ҫырми теҫҫӗ. Пӗлетӗр-и мӗн пулнӑ унта. Хулаш пулнӑ. Вырӑс ҫарӗн крепоҫӗ. Кунта салтаксем хӗсметре тӑнӑ». Ӗмӗрхи аваллӑхран Пӑла ҫинче Нухай каҫҫи юлнӑ, ваттисем каласа хӑварнӑ халап-юмах упраннӑ, архисенче те чӑнлавсем ҫук мар.\n\n«...1392–1395 ҫулсем... Нухай тракӗпе хӑпарнӑ эшкер шуйханнӑ кӑткӑ йӑви пек ҫурҫӗрелле талпӑннӑ. Кукӑр та кӗске хӗҫҫисене хӗвел ҫинче йӑлтӑртаттарса, нухайккисемпе учӗсене ҫунтарса нухай ҫарӗн хиравулӗ Хула ҫырми патне пырса ҫитнӗ...»\n\nЮнлӑ хаяр ҫапӑҫусеем кӗрленӗ вырӑнта темиҫе ӗмӗртен те ҫапӑҫма пӑрахман. Вӑтаельсем Аслӑ Пӑла улӑхӗсене Ахпӳртсене кӗтӳ кӗтме парасшӑн мар. Каллех тытӑҫу кунта! Выртмана тухнӑ ачасем камӑн чышки вӑйлӑрахне юн тӑкса виҫеҫҫӗ. Пӗрре ҫапсан нимӗр тӑвакан сехре хӑппи Киспуҫа хирӗҫ тӑма тивет Миккулӗн кӗҫӗнни умӗнӗн — шӑхлич калакан Элекҫейӗн. Маттур ача, анчах телейсӗр унӑн малалли ӗмӗрӗ. Элекҫей салтакран курма-сывалма килсен селӗп калаҫакан, анчах хӗвел пек ӑшӑ Апикепе пӗрлешет те, казаксен полкне таврӑннӑ ҫӗртен каялла тарса килет. Сакӑр ҫул хӗсметре пулни ӑна мӑй таран тӑрантарнӑ. Унӑн 25 ҫул ҫынсен пуҫне касса пурӑнас килмест, унӑн пурнӑҫ тӑвас килет. Пиччӗшӗсен шӑллӗне таркӑн ятне кӑларттарас темеҫҫӗ. Писӑре тухнӑ шӑллӗ ӑна чирлӗ пулнӑ тесе хут туса парса калле хӗсмете ӑсатасшӑн. Парӑнман шӑллӗне вӗсем ҫын пӗлмелле мар пуҫтарса хураҫҫӗ. Салтака пӗрле кайнӑ Якрав 25 ҫултан тӑван яла тӗкелех таврӑнать, ӑна савнийӗ Ухиме чӗрӗк ӗмӗр кӗтсе пурӑнни ватлӑх енне кайсан та пулин телей кӳрет. Маттур Алексей Николаев кавалерист тепӗр 12 ҫултан киле, тен, йӗркеллӗ ҫаврӑнса килейретчӗ те ывӑлне Хӗветӗре чипер пӑхса ӳстеретчӗ пулӗ. Ҫук, вӑл ку ҫулпа кайма килӗшмерӗ. Ҫӗпӗр ҫулӗ те ӑна хӑратмарӗ.\n\nАшшӗ сӑмахӗнчен иртеймен чиперккен, амӑшӗ пекех ӗҫчен, кайӑк пек юрӑллӑ, ҫӗлен сӑнни илеймен Чӗкеҫӗн те пурнӑҫӗ инкеклӗ вӗҫленет. Юратнӑ ҫынпа, чӑваш килне ывӑллӑха илнӗ ҫӑматӑ ӑсти Пантелей вырӑспа пӗрлешме ирӗк памасть ӑна ашшӗ. Вара Чӗкеҫ — ӑнсӑртран мар пулӗ — шурлӑхра мӑк кӑларнӑ чухне путса ҫухалать.\n\nАнтуни арӑмӗ Хреҫҫук вара хастар кӑмӑлӗпе Чӗкеҫ пек мар. Вӑл хӗр чухнех ҫав тери ҫирӗп. Хӑтана пынӑ нӗрсӗр Пибик умӗнче хӑйне лӑскакан амӑшне тӳрех калать: «Анне! Пибика качча каиччен Пӑлари авӑра пуҫхӗрлӗ сиксе вилем. Пӗр ҫӳҫ пӗрчи юлмиччен тӑпӑлтарсан та каймастӑп!» Пурте Хреҫҫук мар ҫав. Иртнӗ ӗмӗрсенче мӗн чухлӗ хӗр юратӑвӗ Нарспинни пек ҫаврӑнса тухман-ши! Хӗрарӑма тем пек йӗркеллӗ кил-йышра та хӑйӗн пуҫӗпе пурӑнма паман. Мӗн тӑвас тетӗн, самана саккинчен эпир никам та, нихҫан та (халӗ те!) синкерсӗр сиксе каҫаймастпӑр!\n\nХӗрарӑмсен ҫутӑ сӑнарӗсене лайӑх тупма пултарнӑ ҫыравҫӑ. Чӗкеҫӗн шӑпи пӳкле пулчӗ пулсан, питӗ ҫирӗп, чӑтӑмлӑ Ухимен вара пурнӑҫӗ декабристсен арӑмӗсенни пекех — нушаллӑ, ҫапах — телейлӗ.\n\nАпике вара упӑшкине Ухиме пек тӳрӗ кӗтсе пурнасси иккӗлентерет. Ывӑлне кукашшӗ патне пӑрахса хӑварса, вӑл пӗччен пуҫҫӑн туххӑмрах тепӗр арҫын патне тухса вӗҫтерет. Апикене те айӑплама май ҫук. Элекҫее те ӑнланма пулать — унӑн пӑлханакан халӑх ҫинче хаяр казак пулса ҫӳреме хал ҫитмест. Патша тӗрӗслӗхӗ ашшӗ вӗрентнӗ тӳрӗлӗхпе пӗр маррине вӑл хӑй тӳссе курнӑ, Романра чӑваш салтакӗ ҫар хӗсметӗнчен мар, казак ӗҫӗнчен сивӗннине иккӗмӗш кӗнекере уҫҫӑнрах каласа хӑварсан аванччӗ.\n\nАшшӗ, Миккуль, Ҫӗн Ахпӳрт ялне пуҫарса янӑ ӑслӑ та паттӑр ҫын, хӑй пекех маттур Алтынке мӑшӑрӗпе тӑватӑ ывӑлпа (Антуни, Ҫимун, Элекҫей, Лявкка) виҫӗ хӗр (Чӗкеҫ, Васса, Виркка) ӳстерет. Пӗри тепринчен ирттереҫҫӗ вӑй-халлӑ та ункайлӑ ывӑлӗсем, пӗри тепринчен сапӑртарах та теветлӗрех хӗрӗсем. Кашнин сӑн-сӑпатне ҫыравҫӑ сӑнтӗкӗр ҫинчи пекех кӑтартать.\n\nСӳрет (портрет) ӑсти Людмила Сачкова. Мухтамалла ӑста ӳкерет вӑл ҫынсен пит-куҫне, чун-чӗри вылявне! Виҫӗ ӑру сӑнӗ пур кӗнекере.\n\n«Чӗкеҫ ҫинче — шурӑ пиртен ҫӗленӗ кӗпе. Уринче — ҫӑпата. Умне хӗрлӗ-кӗрен кӑвак ҫиппе ҫӗклесе тӗртнӗ чӗрҫитти ҫакнӑ. Сӑнӗ-пичӗпе вӑл чӑнахах чӗкеҫе аса илтерет: чӗкеҫ ҫуначӗ пек куҫ харшийӗсем эреветлӗ-теветлӗ пит-куҫне витӗмлетсе тӑраҫҫӗ...Унӑн янӑравлӑ кулли хӑй хыҫҫӑн шӑрҫа пек тӑкӑнса юлать. Кулнӑ чухне вӑл вӗҫекен кайӑк пекех ярӑнса каять... утти-тӑрӑвӗпе те, калаҫу-юптарӑвӗпе те йӑлтах асламӑшне хывнӑ. Чӗкеҫ чупса ҫӳресе ӗҫлет». Кашни сӑнарӑн ҫапла курӑмлӑ сӳрет. Вулакан вӗсене асӑрхамасӑр, асра хӑвармасӑр юлмастех. Акӑ «Миккуль арӑмӗ, Алтынке, начар-им. Сухапуҫ кӳлсе талпӑнса туртса пымалли хӗрарӑм. Сар тутлӑскер, хӗрлӗ ҫӳҫлӗскер, хӑй те вут пек вӗри. Ӗҫре ӑна ӗлкӗрсе пыракаани ҫук, ӗҫкӗ-ҫикӗре — ташласа ҫитекенни, тавлашма тытӑнсан тавлашса ҫӗнтерекенни ҫук. Харсӑр, арҫын ҫӳллӗшскер, арҫынран пӗрре те ӳксе юлмасть» (39 ен). «Коня на скаку остановит, в горящую избу войдет»,— тенӗ вырӑс поэчӗ Некрасов ун пек паттӑр хӗрарӑмсем ҫинчен. Алтынке ҫав ӗретрен. Вӑл вута та кӗрет (икӗ хут вӗсен килне лаша вӑрри Шаккум хурах тӗртсе ҫунтарать). «Вӑр-вар хӗрарӑм. Ялӗпе те ун пекки урӑх ҫук. Чупса ҫӳресе ӗҫлет. Хӑрах аллинче — ача, тепӗр аллинче — хутӑрчӑ, урипе пир тапать, куҫӗпе чӗп сӑвать. Маттур та патвар хӗр ҫакланчӗ Миккуле. Телее пулчӗ» (44 ен). Ылтӑн кин тесе хаклать ӑна Миккуль амӑшӗ Шашук карчӑк.\n\nМиккулӗн иккӗмӗш ывӑлӗ «Ҫимун, стайлӑ та ҫирӗпскер, ҫӳллӗ ҫитӗннӗскер, ашшӗне аса илтерет. Кӑвак куҫӗ ҫил ҫинче хумханакан кӳлӗ евӗр — йӗкӗт калас шухӑша сӑмахсӑр пӗлтерет е савӑнса та тӗлӗнсе пӑхаҫҫӗ сана ҫав хумхануллӑ кӑвак куҫсем, е куларах, тӑрӑхлавлӑн, е ҫиҫӗм ҫиҫтерсе ӑмӑр пӗлӗт пек тӗксӗмленсе тинкереҫҫӗ сан ҫине. Савса пӑхнӑ чухне, чӑнах та, кӳлӗ евӗрех — илӗртеҫҫӗ, хумханаҫҫӗ, ӑса ҫухаттарсах хӑй хыҫҫӑн илсе каяҫҫӗ. Пӑхӑнтаракан илемлӗх» (37 ен). «Ӳсме ярӑннӑскер, сарӑ яхтӑ пекех чанк! каҫӑрӑлса тӑрпать вӑл. Уссийӗ те шӑтман-ха. Хӗр пек хитрен кулса шурӑ та тикӗс шӑлӗсене кӑтартать». Ку сӑн та — Ҫимунӑннах. Унӑн арӑмӗ Сахвине те ял ӑмсанмалла ҫын. «Сахвине юратмалла хӗр. Пурте ҫыпӑҫуллӑ ун ҫийӗнче. Пӗвӗ-сийӗ те татуллӑ, пичӗ-куҫӗ те ӗлккен. Шырасан та пӗр кӑлтӑк та тупаймӑн. Ай, ытла та вӑтанма пӗлет-ҫке, куҫне те ҫӗклесе пӑхаймасть. Ҫакӑ ӑна пушшех чиперлетет. Чечекрен те чечек. Хӑш вӑрманти уҫланкӑран татса килнӗ-ши ӑна Ҫимун.. Кӑна йӗкӗт хӑй ҫеҫ пӗлет!» (124 ен).\n\nҪеменпе Сахвине туйне Сачкова ытахалех тепӗр туйпа тӗл пултарса юнлӑ ҫапӑҫӑва кӗртет, хӑранӑ Сахвинене чӗлхине ҫухаттарать.. «Авалхи чӑваш йӑлипе икӗ туй хире-хирӗҫ тӗл пулсан ҫапӑҫусӑр иртмелле мар, юн кӑлармасӑр пӗр-пӗринчен уйрӑлмалла мар имӗш» (129). Пулнӑ авалах хирӗҫекен йӑхсем туйра та, кирек хӑҫан та ҫапӑҫни. Х1Х ӗмӗрте чӑваш харкашакан йӑхсемпе пурӑнман. Эппин, ку ҫапӑҫӑва мереккешӗн тунӑ пулинех. Туйсенче ҫапӑҫасси манӑн яш вӑхӑтра та пулатчӗ. Анчах сӑлтавӗсем «авалхи йӑлара» марччӗ. Ҫук ун пек йӑла! Ахаль мар туй умӗнче малта чи сумлӑ-хисеплӗ, ӑслӑ та пӗлӳллӗ туйпуҫсем пыраҫҫӗ!\n\nТӗп сӑнарсемсӗр пуҫне сӑсканра (романра) ытти ҫынсем те нумай: Кашта Хветӗрӗ, Кӑста Керӗмӗ, Сӗней, Ҫпирак, Сымкка, Мартти, Мӑлтӑкпа Миҫук ват хусахсем, Утеш мӑчавӑр, сӳпӗлти Мӑлюк... Вӗсен тыткаларӑшӗ, калаҫӑвӗ кашнин расна. Пӗрин «хэх-хэх», терин «эп сан тӑвану мар-и», Антунин «каламанни пултӑр».\n\nКашни сӑнарӑн ҫул-йӗрӗ вулама кӑсӑк. Тӳрӗлӗхе мала хуракан Антуни хӑй юратӑвӗшӗн те, килти ӗҫшӗн те, ял-йышшӑн тӑма пултарать. Хӑй чавнӑ ҫӗрпӳртре ҫемье ҫавӑрса, ура ҫине тӑрать, хӗрӳ ӗҫпе армансем лартать, лаша виҫ вите тытма пуҫлать.\n\nЙӑпӑлти те кӗвӗҫ, сутӑнчӑк Мӑлюк намӑс-симӗсе пӗлмест. Алтынкене сӗмсӗррӗн ҫулӑхнӑ Мӑлюка Миккул ӗнсерен йӑтса картишне кӑларса перет. Ҫапах та вӑл ҫак «тӑванӑн» ачисене пулӑшма пӑрахмасть.\n\nРоман темиҫе хирӗҫтӑру йӗрӗпе пырать. Пуянпа чухӑн уйрӑлать, влаҫпа халӑх хушшшинче хирӗҫӳ тӗвӗленет, ухмахсемпе элекҫӗсем, куштансем яла пӑтратаҫҫӗ. Лаша вӑрри Шаккум хурах Миккул йӑмӑкне мӑшкӑллас тесе хӗнесе вӗлерет, яла вут тӗртет, лашисене вӑрлать. Антунин арман кӗлечӗсене ҫӗмӗрекен вӗлтренкайӑк-ӗҫкӗҫ Пибик арман айӗнчи чӳк парни пулса юлать, ҫынсене усал ӗҫ тума хӗтӗртсе пурӑнакан Яншан шӑпи кӗҫех тулмалла.\n\nЯл пурнӑҫӗ хӗрсе пырать. Ялта шкул уҫӑлать, лекарь килет, чиркӳ лартас теҫҫӗ. Малашне, иккӗмӗш кӗнекере, кӗрешӳ татах хаяртарах пуласси куҫ кӗрет. Йывӑр лару-тӑрура аталанать халӑх. Тӑшманӗсем тулашра та нумай, шалта та тупӑнсах пыраҫҫӗ. Ҫапах та, роман ҫӗкленӳллӗ туйӑм, ҫутӑ шухӑш-кӑмӑл ҫуратать, тӗрӗслӗхпе тасалӑх вӑйне мухтать. Ку ӑнӑҫлӑ хайлав юлашки вӑхӑтра ӗрчесе кайнӑ «хура та ясар хайлавсене» чӑваш литературин айккине тӑратса хӑварать,\n\nҪӗкленӳллӗ чӗрӗлӗх Людмила Сачкова ҫутҫанталӑка ӳкерсе пама пӗлнинчен те килет. «Вӑрман ытамӗнче» сыпӑка вулӑр-ха. Унта эсир улатаккапа чакака е куккука кӑна илтетӗр-и. Сачкова вӑрманӗнче шӑкӑлчи, вӗлтрен кайӑк, чӗпчен, шӑпчӑк ҫынна савӑнтарса, ҫут тӗнчене мухтаса юрлаҫҫӗ. Пӑла улӑхӗнчи утҫие сӑнӑр-ха тата! Ман пек ватӑрах вулакан хӑй те улӑха ҫава йӑтса каяс тейӗ. Ҫамрӑксем, паллах, ҫава-ҫурла мӗнне пӗлмеҫҫӗ. Вӗсене тринкки-тринкки пулӑмсем кирлӗ. Пур вӗсем сӑсканра. Ӗртӗ (сюжет) ӑсти Людмила Сачкова. Таймӑк-шаймӑк (детектив) манирлех ҫаврӑнать ӗҫ-пуҫ, анчах роман шаймӑк шайӗнчи хайлав мар — чӑн чӑваш ялӗн иртнӗ ӗмӗрсенчи вутри-шыври пурнӑҫӗ сӑнланнӑ унта.\n\nМасар, пасар, туй-ҫуй, акатуй, вӑйӑ-кулӑ, киремет-экремет, «тимӗр карта», ҫӗр хапхи, имлӗх-юмлӑх, улах ларни, тырӑ акни-вырни, вӑрман касни-хӑртни, ҫурт хӑпартни, пир тӗртни, мунча кӗни, пӑлан та упа тытни-тытайманни, хӗрпе ар юратни-курайманни, ашшӗн нухайкка пилӗ — пӗтӗм пурнӑҫ юхса пырать романра. Йӑлӑхтармасӑр, йӗрки йӗркипе, шухӑша вӑратса, чуна хускатса пулса иртет кӗнекери истори.\n\nВуласа пӑхӑр ӑна. Вӑл сире те килӗшессе шанатӑп. Иккӗмӗш кӑларӑм тата иккӗмӗш кӗнеки валли хӑвӑр сӗнӳсене парсан селӗм пулӗ."
    ],
    "answer": "Саша Романов хӗсметре Раҫҫейӗн Инҫет Хӗвелтухӑҫӗнче тӑнӑ. Хӗсмет вӗçленсен вӑл тӑван ялне — Чӑваш Енри Кӗтне Пасарта — таврӑннӑ. \n\nХӗсметри ӗҫ ятарлӑ та йывӑр пулнӑ, анчах Саша унта тӑрӑшса тӑнӑ, хӑйӗн спорт пӗлӗвӗпе тата физика енчен лайӑх хатӗрленнипе пулӑшнӑ. Ялта таврӑнсан, вӑл хӗсмет пирки калаçу ирттермешкӗн шкула çитрӗ, унта вӑл хӗсметри пурнӑç пирки çутта кӑларнӑ, вӗренекенсене тӑванӑсене хисеплеме, вӗренӳре ӑнӑçулли пулма сӗнӳ панӑ.\n\nҪавӑн хыҫҫӑн çухалса кайнӑ пирки хыпарсем сарӑлнӑ. Вӑл чӳк уйӑхӗнче Шупашкартан тухса кайнӑ урапана тупнӑ, кайран Атӑл леш енчи Сосновкӑра виллине тупнӑ. Пытарнӑ вырӑнта, япаласем çине çавӑрнӑ хыпарсем тата йывӑр ӗҫ-пулӑм унӑн пурнӑҫӗнчи тӗлпулу ярса панине кӗртнӗ. \n\nСаша Романов хӗсметре хӑйӗн тивӗҫне таса тытса çӳренӗ маттур çын пулнӑ, анчах пурнӑҫӗ трагедипе вӗçленни яланах астӑвӑмра юлӗ.",
    "ground_truth": "Саша Романов Инҫет Хӗвелтухӑҫӗнче хӗсмет тунӑ.",
    "category": "army",
    "difficulty": "medium",
    "id": 7
  },
  {
    "question": "Саша Романов хӑҫан киле таврӑннӑ?",
    "contexts": [
      "Чӳк уйӑхӗн 12-мӗшӗнче Чӑваш Енре каччӑ ҫухалнӑ. Вӑл унччен савнӑ хӗрӗпе хирӗҫнӗ. Пике урӑххи патне тухса каяссине пӗлтерсен каччӑ килтен тухса кайнӑ та таврӑнман.\n\nТӑванӗсем ӑна нумай шыранӑ. Нумаях пулмасть каччӑ Шупашкартан ларса тухса кайнӑ урапана тупнӑ. Чӳк уйӑхӗн 21-мӗшӗнче Атӑл леш енчи Сосновкӑра каччӑн виллине тупнӑ.\n\nРоман Николаев савнипе хирӗҫсен телефонӗпе укҫине хӑварнӑ та тухса кайнӑ. Вӑл ӑҫталла кайнине никам та пӗлмен. Унӑн ашшӗ Анатолий Николаев ӑна ыттисемпе пӗрле шыранӑ. Каярахпа палламан ҫынсем Сосновкӑра Ромӑн урапине асӑрханӑ. Унтан каччӑ ӳтне те тупнӑ.\n\nАшшӗ каланӑ тӑрӑх, каччӑ пичӗ ҫинче кӑвак йӗрсем пулнӑ, мӑйӗнче — вӗрен. Анчах вӑл ывӑлӗ хӑйӗн ҫине алӑ хунине ӗненмест. Вӑл каланӑ тӑрӑх, Роман Сосновкӑна савнин каччипе калаҫма кайнӑ.\n\nХалӗ Ромӑн ӳтне Шупашкара илсе килнӗ. Ӑна чӳкӗн 24-мӗшӗнче пытарӗҫ.",
      "«Чеб.ру» форум сайт пӗлтернӗ тӑрӑх, Чӑваш Енри ҫынсен прависене хӳтӗлекен уполномоченный Сергей Романов пурнӑҫран уйрӑлнӑ. Вӑл 46 ҫулта пулнӑ.\n\nСергей Романов 1978 ҫулта Кӳкеҫре ҫуралнӑ. Аслӑ шкултан вӗренсе тухсан, салтакран таврӑнсан вӑл ЧР шалти органӗсенче тата Юстици министерствин управленийӗнче ӗҫленӗ. Унтан прокуратура органӗсенче те вӑй хунӑ.2020 ҫулта вӑд тивӗҫлӗ канӑва тухнӑ.  Ҫав ҫулах ӑна ҫынсен прависене хӳтелекен уполномоченнӑй пулма шаннӑ.",
      "Ҫӗнӗ Шупашкарта кӑнтӑр вӑхӑтӗнчех… депутата ларма хатӗрленекен кандидата тапӑннӑ. 26-ри Роман Васильев Строительсен урамӗпе 11 сехетре утнӑ. Унччен те пулман — ӑна палламан арҫын тапӑннӑ.\n\nРоман Васильев — кандидат, депутата ларасшӑн. Вӑл ҫав вӑхӑтрах «Битва за Новоюжку» фильм сопродюсерӗ. Роман Васильев каланӑ тӑрӑх, вӑл телефон ҫине йӑпӑртлӑха кӑна пӑхса илнӗ. Ҫав вӑхӑтра ӑна тапӑннӑ, палламан арҫын Романа пӑвма пуҫланӑ. Ку кӑна мар — хӑратнӑ та. Роман суйлава хутшӑнсан унпа мӗн те пулин тӑвӗҫ-мӗн.\n\nМӑйне чӗрсе пӗтернӗрен Роман Васильев кун хыҫҫӑн травмпункта кайнӑ, унтан йӗрке хуралне ҫитнӗ. ЧР ШӖМӗ ку ӗҫ пулнине ҫирӗплетет. Ҫав вырӑнта халӗ оперативлӑ следстви ушкӑнӗ тата Следстви комитечӗ ӗҫлет.",
      "Кӑҫал ҫӗртме уйӑхӗн 10-мӗшӗнче Шупашкарти ҫулҫӳревҫӗ байдаркӑпа Каспи тинӗсне кайнӑ. Кун пирки Чӑваш халӑх сайтӗнче хыпарланӑччӗ. Чӳк уйӑхӗн 9-мӗшӗнче Роман Андреев Шупашкара таврӑннӑ. Ҫапла майпа вӑл шывра 127 кун ишнӗ.\n\nРоман Чӑваш Енрен Астрахань облаҫӗ еннелле ишнӗ. Хӑйӗнпе пӗрле вӑл 16 пин тенкӗ илнӗ. Ҫулҫӳревҫӗ шывра йывӑрлӑхсем сиксе тухнине пытармасть. Пӗрре мар вӑл каялла таврӑнма та шутланӑ, анчах тӗллевне пурнӑҫланах.\n\nПалӑртмалла: Роман ҫула тухма юратать. Ку унӑн пӗрремӗш ҫулҫӳревӗ мар. Вӑл малашне те ҫула тухма палӑртнӑ.",
      "Хусанта пурӑнакан, Инстаграмра «Чӑваш пики» аккаунта чӑн чӑвашла тытса пыракан Ксения Романова хаҫат-журнал сайра вуланине пытарман. Вӑл шухӑшланӑ тӑрӑх, вӗсен чӗлхи йывӑр. Хӑй вара  ансат чӗлхепе ҫырма тӑрӑшать.\n\nКсения Романова  —«Тутарстанри чӑваш пики  — 2016» и «Раҫҫей чӑваш пики — 2016» ятсене тивӗҫнӗ. Чӑваш ҫамрӑкӗсен «Аталан» юхӑмне йӗркелеме те хутшӑннӑ.\n\nИнстаграмри аккаунта чӑвашла тытса пыма пуҫличчен вӑл тӗнче тетелӗнче чӑваш чӗлхи сахаллинне асӑрханӑ. Тӗнче тетелӗнчи халӑх ушкӑнӗсенче туссем пӗр-пӗринпе тӑван мар чӗлхепе ҫыру ҫӳретни пирки шухӑша кайнӑ.\n\nТутарсен блогерӗпе Ринат Галиахметовпа паллашнӑ хыҫҫӑн хавхаланса кайса чӑвашла аккаунт йӗркеленӗ.\n\n«Чӑваш пики» страницӑна тытса пырассине блогер ӗҫ вырӑнне хурса йышӑнать."
    ],
    "answer": "Саша Романов киле чӳк уйӑхӗн 9-мӗшӗнче таврӑннӑ. Вӑл Шупашкартан байдаркӑпа каялла Каспи тинӗсне тухса ишнӗ, унтах 127 кун ирттернӗ. Ҫулҫӳревҫӗ Астрахань облаҫӗ таран кайнӑ, ҫав вӑхӑтра йывӑрлӑхсене те тӗл пулнӑ, анчах та тӗллевне пурнӑҫланӑ. Роман ҫулҫӳревӗ тӗлӗнмелле пулнӑ, вӑл малашне те ҫӳле тухма шутлать.",
    "ground_truth": "Юнкун Саша Романов ҫуралнӑ киле таврӑннӑ.",
    "category": "society",
    "difficulty": "easy",
    "id": 8
  },
  {
    "question": "Саша хӑш шкулта вӗреннӗ?",
    "contexts": [
      "Хаклӑ шкул ачисемпе студентсем, педагогсем тата вӗренекенсен ашшӗ-амӑшӗ! Хисеплӗ ентешсем!\n\n\n\nПӗлӳ кунӗ ячӗпе чун-чӗререн саламлатӑп!\n\n\n\nЙӑлана кӗнӗ тӑрӑх пуян кӗрекеллӗ кӗркуннен пӗрремӗш кунӗнче эпир ҫӗнӗ вӗренӳ ҫулне пуҫлатпӑр. Шкул шӑнкӑравӗн янравлӑ сасси Чӑваш Енри пилӗк ҫӗр шкулти партӑсем хушшине ларакан ҫӗр ҫирӗм ҫичӗ пин те пилӗкҫӗр вӗренекене ырӑ сунса саламлӗ.\n\nШкула пуҫласа каякан ачасене — кӑҫал вӗсен хисепӗ вуникӗ пин те ултҫӗр пепке — уйрӑммӑн ырӑ сунса хӑварас тетӗп. Паян эсир аслӑ пӗлӳ тӗнчине кӗретӗр, хӑвӑршӑн ҫӗнӗ, шкул пулӑмӗсемпе пуян пурнӑҫ тапхӑрне пуҫлатӑр. Шкул ҫулӗсем сире ҫӗнӗ пӗлӳ парнелеччӗр тата тӗлӗнмелле тӗпчевсемпе ҫитӗнӳсем тума хавхалантарччӑр!\n\nЮлашки вӑхӑтра пирӗн республикӑра пӗлӳ тытӑмӗнче палӑрмаллах улшӑнусем пулса иртрӗҫ. Шкултан вӗренсе тухакан ҫамрӑксен иккӗ виҫҫӗмӗш пайӗ хӑйсен пӗлӗвне аслӑ вӗренӳ заведенийӗсенче малалла туптать. Ҫакӑ ҫитӗнекен ӑру пурнӑҫ ҫулӗпе малалла ӑнӑҫлӑ утассине ҫирӗплетет.\n\nПаян Чӑваш Ен яш-кӗрӗмӗ хӑйӗн ҫинчен  экономикӑра та, политикӑра та, ӑслӑлӑхпа вӗренӳре те, сывлӑх сыхлавӗпе культурӑра тата спортра та тивӗҫлипе пӗлтерет. Эпир ҫак кунсенче Китайра иртнӗ Пӗтӗм тӗнчери ҫуллахи 26-мӗш универсиада паттӑрӗсемпе тивӗҫлипе мухтанатпӑр. Раҫҫейӗн пӗрлеш¬тернӗ команди йышӗнчи Чӑваш Ен спортсменӗсем ҫав ӑмӑртусенче 6 медаль ҫӗнсе илнӗ.\n\nҪак савӑнӑҫлӑ уяв кунӗнче педагогсене ӑшшӑн тав тӑватӑп. Эсир — ҫут тӗнчери чи пархатарлӑ професси ҫыннисем, чӗресенче ырӑ ҫулӑм чӗртсе ӑс-хал парнелетӗр, пултарулӑха аталантаратӑр, тӑван ҫӗре тата наци культурине юратма вӗрентетӗр. Эпӗ «Вӗренӳ» наци проекчӗ шайӗнче вӗрентекенсем хушшинче ҫулсерен иртекен конкурсра пирӗн вун пӗр вӗрентекен ҫӗнтерни ҫинчен тулли кӑмӑлпа аса илтеретӗп.\n\nХаклӑ шкул ачисемпе студентсем, педагогсем тата вӗренекенсен ашшӗ-амӑшӗ!\n\nПӗр-пӗрне ӑнланма тата пӗр-пӗрин шухӑш-кӑмӑлне туйма пӗлни питӗ пӗлтерӗшлӗ. Пирӗншӗн нимрен хаклӑ тӗнчене, Чӑваш Енпе Раҫҫее,  шанчӑклӑн упрӑр.\n\nПурсӑра та телей, ҫирӗп сывлӑх тата ӑнӑҫусем сунатӑп!\n\nУяв ячӗпе сире!\n\n\n\nЧӑваш Республикин Президенчӗ, М. Игнатьев.",
      "Паян урамра кунӗпех ҫил тӑман алхасрӗ. Эх, вӗҫтерет! Ҫак ҫанталӑка пӑхмасӑр Шупашкарти 37-мӗш шкул ачисемпе вӗрентекенӗсем, ачасен ашшӗ–амӑшӗсем шкул умӗнче Хӗле ӑсатрӗҫ.\n\nКашни класс ачисем сӗтел тулли апат-ҫимӗҫ лартса тултарнӑ. Кунтах сӑмаварсенче чей пӑсланать. Ачасем хӑйсен ашшӗ-амӑшӗсемпе пӗрле тем тӗрлӗ икерчӗ хатӗрленӗ: пылпа, варенипе, тӑпӑрчӑпа, какайпа, кӑмпапа, пулӑпа. Ачасем савӑнсах пӗр-пӗрне кӑна мар, хӑнасене те, иртен ҫӳрене те хӑналаҫҫӗ.\n\nУяв питӗ хаваслӑ та интереслӗ иртрӗ. Малтанах ачасем сӑвӑсем каласа, юрӑсем юрласа Хӗле ӑсатрӗҫ. Вӗрентекенсем чӑваш халӑх юррисене юрласа савӑнтарчӗҫ. Унтан капӑрлатнӑ ҫунапа Ҫӑварни хӑй килсе ҫитрӗ. Вӑл уяв ячӗпе саламларӗ, ырлӑх, сывлӑх, ӑнӑҫусем сунчӗ. Пурте пӗрле юрӑсем юрларӗҫ, вӑйӑсем вылярӗҫ, ҫунасемпе ярӑнчӗҫ.\n\nАкӑ Ҫӑварни Карчӑккин кӗлеткине ҫунтарма та вӑхӑт.  Пӗтӗм усал- тӗсел, чир-чӗр, хаяр хӗл кая юлтӑр! «Гори, гори ясно, чтобы не погасло!» — тесе, Ҫӑварни Карчӑкки кӗлленсе пынине сӑнарӗҫ.\n\nҪакӑн пек уявсем ашшӗ-амӑшӗсемпе ачисем тата вӗрентекенсемпе администрации хушшинчи ҫыхӑнӑва ҫирӗплетет. Уяв ячӗпе сире, тӑвансем!",
      "Хӗсмет ӗҫӗ мӗн авалтанах ҫӑмӑлах пулман. Уйрӑмах вунсаккӑрмӑш-вунтӑххӑрмӑш ӗмӗрсенче (1874 ҫулччен) хӗсмете каякансене йывӑр килнӗ, мӗншӗн тесен ку вӑхӑтра тӑван кил-йышран 25 ҫуллӑха уйрӑлма тивнӗ. Паллах, ҫывӑх ҫыннисем никрута хӑҫан та пулин тепре чӗрӗ-сывӑ курасса сунманпа пӗрех, ҫавӑнпа та ӑна йӗрсе-макӑрса ӑсатнӑ, салтак юррисем те питӗ хурлӑхлӑ та тунсӑхлӑ пулнӑ.\n\nСовет Ҫарӗнче юлашки ҫулсенче салтакра икӗ, тинӗс ҫар флотӗнче вара виҫӗ ҫул хушши шинель тӑхӑнмалла пулнӑ. Хальхи Раҫҫей ҫарӗнчен вара яшсем шӑп та лӑп пӗр ҫулталӑкран киле таврӑнаҫҫӗ. Ҫак кунсенче чылай ялсемпе хуласенчи вунсаккӑра ҫитнӗ призывниксем салтак тумне тӑхӑнчӗҫ. Ҫулталӑк хӗсметре тӑнӑ каччӑсем вара тӑван килсене таврӑнса пыраҫҫӗ. Юнкун Кӗтне Пасар каччи Саша Романов та ҫуралнӑ киле ҫитрӗ. Вӑл Ҫӗршывӑн тепӗр енчех — Инҫет Хӗвелтухӑҫӗнче пулнӑ. Тепӗр куннех вӑл тӑхӑр ҫул хушши вӗреннӗ Хырхӗрри тӗп шкулне ҫул тытрӗ. Ахаль те патварскер, тата тӗрекленсе илемленнӗ яш. Чӑн малтанах вӑл спортзала ҫул тытрӗ, Н.Н.Ятманов физкультура учительне тав сӑмахӗ каларӗ. Ара, шкулта вӗреннӗ чухне тӗрлӗ-тӗрлӗ спортпа туслашса районти чылай ӑмӑртусене ҫӳренӗ-ҫке! Ҫӳренӗ ҫеҫ мар, яланах тенӗ пекех йӗлтӗрпе те, ҫуран чупассипе, перессипе те, тата ытти спорт вӑййсенче те малти вырӑнсене тухнӑ. Класра пӗрле вӗренекенсенчен чылайӑшӗ туслашнӑччӗ спортпа. Ҫакӑ, палах, салтакра питех те кирлӗ пулчӗ. Калаҫмалли, чӑн та, питӗ нумай. Ҫапах та Николай Никандрович салтакпа хӑй ҫеҫ калаҫнипе ҫырлахмарӗ: ӑна 5-7 классенче вӗренекен ачасемпе курнӑҫтарма шутларӗ. Савӑнса кайсах асӑнна класри ачасем истори кабинетне пуҫтарӑнчӗҫ. Шӑп ҫакӑнта вӗреннӗ ӗнтӗ Саша. Малтанах Н.Н.Ятманов хальхи тӗнчери лару-тӑрупа паллаштарчӗ, хӑй ҫарта пулнӑ вӑхӑтсене аса илчӗ. Ун хыҫҫӑн тин ҫеҫ хӗсметрен таврӑннӑ каччӑна сӑмах пачӗ. Тимлесе итлерӗҫ ачасемпе вӗрентекенсем Сашӑн сӑмахӗсене, нумай-нумай ыйту пачӗҫ. Пурне те пӗлес килет-ҫке: ирхине миҫере тӑмалла салтакӑн? мӗнле апат-ҫимӗҫ ҫитереҫҫӗ? таса мар япалисене кам ҫуса парать? телевизор курма е компьютерпа выляма пулать-и унта? пӑшалран пертереҫҫӗ-и? пушӑ вӑхӑт пур-и салтакӑн?, — тата ытти нумай-нумай ыйтусем пулчӗҫ. Кашни ыйтӑва хуравлама, пӗлменнине ӑнлантарма тӑрӑшрӗ хӑй те нумай пулмасть ҫеҫ партӑран уйрӑлнӑ ҫамрӑк. Ачасене ашшӗ-амӑшне итлеме, вӗрентекенсене хисеплеме, вӗренӳре лайӑх ӗлкӗрсе пыма сӗнчӗ. Тӗлпулу вӗҫленнӗ май шкула татах та килме шантарчӗ вӑл.",
      "Енчен те эсир кунта, ҫак статьяра эп сире шкулта мӗнле ачасем вӗренни пирки ҫырса парӑп тесе шутлатӑр пулсан — йӑнӑшатӑр. Паллах, пуян ачасем е чухӑнраххисем, ӑслӑ ачасем е айвансем вӗреннине тишкерме пулӗччӗ, тӗпчев те ирттерме май пур, анчах калаҫӑвӗ урӑххи пирки. Хушма ыйтӑвӗ ҫакнашкал: ачисем хӑйсем е вӗсен ашшӗ-амӑшӗ?\n\nМан пуҫра ку ыйту ӗнер ҫуралчӗ. Кӳршӗри пӗр амӑшӗ килчӗ те унӑн шкула ҫӳрекен ачи валли тӗпчев ӗҫне хатӗрлесе пама ыйтрӗ. Шкулта ыйтаҫҫӗ имӗш. Класс ертӳҫи хушнӑ тет-и... Юрӗ, тейӗпӗр, шкул ыйтма пултарать — вӗрентнине тӗрӗслемелле-ҫке, пӗлӳ ача ӑсне мӗнле вырнаҫнине пӗлмелле-ҫке. Анчах ҫак тӗпчев ӗҫне... пӗлетӗр-и, хӑш класс ачи валли туса памалла? 1-мӗш класа ҫӳрекенскер валли! Тӗпчев ӗҫӗ те ахаль пулмалла мар, презентаци таврашӗпе хатӗрленӗскер кирлӗ. Тепӗр хут калатӑп: ҫакна 1-мӗш класс ачинчен ыйтаҫҫӗ.\n\nЭпир вӗреннӗ чухне те рефератсем ҫыркалаттӑмӑр. Хам та ҫырнӑ. Пӗрре ҫапла реферат хатӗрлес тесе Наци вулавӑшнех (вӑл вӑхӑтра ун ячӗ урӑхлаччӗ-ха) ҫитнӗччӗ. Апи (литература чӗлхенче «анне» пулать) илсе кайнӑччӗ мана унта. Халь астумастӑп, те вырӑнти вулавӑшра Пржевальский пирки кӗнеке ҫукччӗ, те урӑх сӑлтава пула апи мана унта илсе кайрӗ. Паян та астӑватӑп, унта мана мӗнле йышӑннине. Ман пек пӗчӗкскерсен аслисен вулавӑшне мар, ача-пӑча библиотекине каймалла ӗнтӗ тесе каласаччӗ пулас. Ҫавах вӑл вӑхӑтра та мана хӑваласа ямарӗҫ — совет энциклопедине тупса панӑччӗ те эп унтан ҫырса илсе реферат хатӗрленӗччӗ. Ку вӑл вара эпӗ 5-мӗш класра вӗреннӗ чухне пулсаччӗ пулас. Ытти ачасен ӗҫӗсене ун чухне ашшӗ-амӑшӗ ҫырнӑччӗ-и, е хӑйсем — калама пултараймастӑп. Хамӑнне вара хамах ҫырса. Хам алӑпах. М. Горький ячӗллӗ вулавӑша та мана апи ҫулне кӑна кӑтартсаччӗ, киле хамах таврӑнсаччӗ (эп ҫырса пӗтерессе кӗтсе лармасть ӗнтӗ).\n\nЮрӗ, тейӗпӗр, 1-мӗш класс ачинчен реферат пек япала, тен, хальхи вӗренӳ стандарчӗпе ыйтма та юрать. Анчах та презентаци таврашне ҫав-ҫавах 7 ҫулхи ача пурнӑҫлаймасть-ҫке! Эп пӗлетӗп, вӗсем халь питӗ хӑварт аталанаҫҫӗ, пӗчӗкренех, вулама вӗреничченех, смартфонсемпе тата планшетсемпе паллашаҫҫӗ. Ав, ман, йӑмӑкӑн хӗрӗ, ҫулталӑк тултарман пулин те халех смартфон патне аллине тӑсать тет! Аслӑ ачи пирки калама та кирлӗ мар — шкула кайма вӑхӑчӗ ҫитмен пулин те компьютерӗнче хӑш-чух ашшӗ-амӑшӗнчен те (асламӑшӗпе аслашшӗ пирки калаҫу та ҫук!) лайӑхрах пӗлет. Ҫавах та шкултан презентаци е тӗпчев ӗҫӗ тума килти ӗҫ параҫҫӗ пулсан — тем тесен те ӑна ача тӑваймастех! Унашкал ӗҫе тума пани — ашшӗ-амӑшне килти ӗҫ тума хушнипе танах.\n\nТӗрӗссипе, сӑнатӑп та, чылай чухне халь килти ӗҫе ашшӗ-амӑшӗ тӑвать. Пирӗн вӑхӑтра та вӑл пулнӑ пуль те, анчах ҫав териех анлӑ сарӑлманччӗ. Ун чухне япӑх вӗренекен ачасем ыттисенчен ҫырса илетчӗҫ. Тӗслӗхрен, манран. Суйса тӑмӑп, киле парса янӑ ӗҫе хамӑн та пӗр-икӗ хут ҫырса илме тивсеччӗ. Ҫавах та килти ӗҫе хам тӑваттӑм. Апи те, атти те пулӑшман. Халь вара ачана пулӑшасси, ун вырӑнне килти ӗҫе тӑвасси — йӑлана кӗнӗ ӗнтӗ. Ку вара, ман шутпа, ашшӗ-амӑшӗ хӑйӗн ачине ыттисенчен катӑкрах курасшӑн маррипе ҫыхӑннӑ. Пурте ӑслӑ мар вӗт-ха, пурте тӑрӑшуллӑ мар. Анчах хальхи ашшӗ-амӑшӗ хӑйсен тӗпренчӗкне чӑн та ӑслисенчен нимпе те кая мар курасшӑн. Совет саманинче ҫакӑн ҫине ытлашши тимлӗх уйӑрман пулсан, паянхи ашшӗ-амӑшӗшӗн ку питӗ пӗлтерӗшлӗ. Ҫавӑнпах ӗнтӗ халь вӗсем хӑйсен ачисемшӗн тем тума та хатӗр. Пӗлместӗп, тен презентаци таврашӗ хатӗрлеме, Ворд-ра документ хатӗрлеме 1-мӗш класа ҫӳрекен ача тума та пултарать пуль. Унашкал вундеркинд класра пулма та пултарать пуль. Анчах пурте унашкал ӑслӑ пулма пултараймаҫҫӗ-ҫке. Чи ӑсли, чи пултарулли ҫине пӑхса килти ӗҫ парса яни вара, тепӗр хут калатӑп, ман шутпа ашшӗ-амӑшне ӗҫ панипе танах.\n\nЧи интересли вара — ашшӗ-амӑшӗ те вӑл ӗҫе хӑш-чухне тӑваймасть. Ак, ман кӳршӗсенех илес. Ман пата мӗншӗн чупса пычӗҫ? Хӑйсем тӑвайманнипе. Ачи мар, ашшӗ-амӑшӗ тӑваймасть! Юрӗ, пӗри штукатур-малярта ӗҫлет тейӗпӗр. Анчах тепри — аслӑ пӗлӳ илнӗскер вӗт! Уншӑн та пӗрремӗш класра вӗренекен ачана парса янӑ ӗҫ йывӑрлӑх кӑларса тӑратнӑ.\n\nШкулта кам вара вӗренет? Ачи е ашшӗ-амӑшӗ? Ман шутпа, хальхи вӑхӑтра — ачи мар.",
      "«Эрех ӗҫме ҫынсен ӑҫтан укҫа тупӑнать кӑна тульккӑш? Манӑн хӗрӗме ыран шкула парса яма 100 тенкӗ ҫук», — кӑмӑлӗ пӑсӑккине кура чунне уҫрӗ пӗлӗшӗм. Виҫӗ ача амӑшӗ вӑл. Аслисем шкула ҫӳреҫҫӗ, кӗҫӗнни кӑҫал ача пахчине кайма пуҫларӗ.\n\nШкул валли укҫа пухни йӗркеллӗ пулӑм мар тесе вӗренӳ тытӑмӗнчи пур пуҫлӑх та калать-тӗр. Ун пек фактсем пирки пӗлтерме ытйаҫҫӗ вӗсем. Вӗренӳ кӗнеки илме, классене юсама ашшӗ-амӑшӗнчен укҫа пухмалла маррине ӗнентереҫҫӗ. Пурнӑҫра вара пачах урӑхла пулса пырать. Манӑн пӗлӗшӗм каланӑ тӑрӑх, вӗренӳ ҫулӗ пуҫланас умӗн вӗсем шкула 2-шер пин тенкӗ пухса панӑ. «Кӗнекесене илмелле мар темеҫҫӗ-и вара?» — шалт аптӑрарӑм пӗлӗшӗм кӑмӑлсӑрланса пӗлтернине кура. «Вӗренӳ тетрачӗсем илме», — хуравларӗ виҫӗ ача амӑшӗ. «Икӗ пин тенкӗлӗх вӗренӳ тетрачӗсем мӗнле хутран вара?» — ӑнланаймасӑр тӗпчетӗп малалла.\n\nТетрадь туянса йӑлтах пӗтермен иккен-ха. Юлнӑ укҫапа куллер туянмалла тет. Ачасем шыв ӗҫесшӗн аптӑраҫҫӗ имӗш. Ахаль-махаль шыв ӗҫмеҫҫӗ пулать. Эпир ӳснӗ чух ҫӗрулми пуҫтарма аннесемпе хире ана ҫинчи кӳлленчӗкренех е тата кӳршӗ яла лавккана кайсан таврӑннӑ чух ҫырмари шыва тутӑр витӗр сӑрӑхтарса ӗҫеттӗмӗр те 21-мӗш ӗмӗр пуҫламӑшӗнче ҫуралнисем, ав, кранран юхаканнине те тиркеҫҫӗ. Сывӑрах пулаҫҫӗ пулинех. Тепӗр тесен, эпир те, кӳлленчӗкри шыва тутӑр витӗр сӑрӑхтарса ӗҫнисем вар пӑсӑлнипе аптӑранине астумастӑп. Ӑш ыратать-и е пуҫ-и, кукамай тӳрех темле курӑк шывӗ вӗретсе ӗҫтеретчӗ те, тен, ҫав пулӑшнӑ-ши?\n\n21-мӗш ӗмӗрти ачасем кулертан шыв ӗҫеҫҫӗ кӑна мар, вӗсем ахаль чӳрече карриллӗ класра те вӗренесшӗн мар пулмалла. Тепӗр тесен, хӑйсем, пӗрремӗш класа каякансем, каламан-ха кун пирки. Паҫӑрхи пӗлӗшӗм пӗлтернӗ тӑрӑх, класс ертӳҫи хушнӑ. Ытти класра пурин те жалюзи ҫакӑнса тӑрать-мӗн те уннӑ та вӗсенчен кая юлмасть иккен. Вӑт, ун валли ашшӗ-амӑшӗн укҫа пухса памалла.\n\n«Кирлӗ ҫӗре мӗншӗн ҫӑхавламастӑн?» — хуравӗ епле пулассине пӗлсе тӑрсах ыйтатӑп пӗлӗшӗмрен. Эсир те тӗрӗсех тавҫӑртӑр: ачан ҫав шкултах вӗренмелле-ҫке..."
    ],
    "answer": "**Саша Хырхӗрти тӗп шкулта вӗреннӗ.**\n\nПайланӑ фрагментсенчен ку паллӑ пулать: Саша Романов, Ҫӗршывӑн Хӗсметӗнчен таврӑннӗ хыҫҫӑн, тӑхӑр ҫул хушши вӗреннӗ \"**Хырхӗрри тӗп шкула**\" кайса килнӗ. Унта вӑл истори кабинетӗнче вӗрентекен Н.Н. Ятмановпа тата класри пӗрле вӗренекен ачасемпе тӗл пулнӑ, хӗсмет пирки каласа панипе хальхи тӗнчери лару-тӑру пирки калаҫнӑ.\n\nШкулта вӗреннӗ чухне Саша спортпа, ун шутра йӗлтӗрпе, ҫуран чупассипе тата ытти вӑййӑсемпе тӑранса, районти ӑмӑртусенче лайӑх кӑтартнӑ. Вӗренӳ вӑхӑтӗнче вӑл шкул пурнӑҫне актив хутшӑннӑ, вӑл хӑй вӗренсе тухнӑ шкула тивӗҫлӗн хисеплет.\n\nҪавӑн пекех, текстрӗн малтанхи пайӗ Пӗлӳ кунӗ пирки каласа, Чӑваш Енри шкулсем ҫинчен тата вӗренекенсен шучӗ пирки пӗлтерӗшлӗ информаци парать.",
    "ground_truth": "Саша Хырхӗрри тӗп шкулӗнче вӗреннӗ.",
    "category": "education",
    "difficulty": "easy",
    "id": 9
  },
  {
    "question": "Саша шкулта миҫе ҫул вӗреннӗ?",
    "contexts": [
      "Ҫӗнӗ ҫул ҫывхарать. Хӗл мучи вара ачасене хӑйӗн патне хӑнана чӗнет. Шупашкар ачисем Ҫӗнӗ ҫул уявӗн хуҫи патӗнче нумаях пулмасть пулса курнӑ.\n\nТӗп хулари пӗр шкулта 5-мӗш класра ӑс пухакан ачасем тӗнче шайӗнче ирттернӗ  «Мӗн вӑл — туслӑх?» конкурсра ҫӗнтернӗ. Кун хыҫҫӑн вӗсене Хӗл мучин ҫӗршывне официаллӑ майпа чӗннӗ.\n\n5-мӗш класс ачисем Аслӑ Устюг хулинче темиҫе кун пурӑннӑ. Вӗсем хӗл мучине саламлӑ юрӑ шӑрантарса панӑ. Вӗсем ӑна видео ҫине ӳкернӗ. Ҫавӑн пекех ачасем Хӗл мучипе калаҫнӑ, ӑна тӗрлӗ ыйту панӑ.\n\nЧӳкӗн 18-мӗшӗнче уяв иртнӗ. Ачасем Асамлӑх шкулӗнче вӗренме пултарнӑ, унта асамҫӑн сертификатне илнӗ. Ун чухне Хӗл мучи ҫӗршыври пӗрремӗш чӑрӑша ҫутнӑ.",
      "Шупашкар Ҫӗнӗ ҫул уявне хатӗрленет. Урамсем каҫсерен йӑлтӑртатаҫҫӗ, чӑрӑшсем ҫуталаҫҫӗ. Ҫитес ҫул — качака ҫулӗ.\n\nКӑҫал Ленин проспектӗнче качакана, флисран тунӑскере, пӑрлӑ трон ҫине лартӗҫ. Кун пирки Шупашкарти Ленин район администрацийӗн официаллӑ порталӗнче пӗлтереҫҫӗ.\n\nҪӗнӗ ҫул паллине Александр Жигарев ӑста хатӗрлӗ. Малтанлӑха палӑртнӑ тӑрӑх, ӑна раштав уйӑхӗн 20-мӗшӗ валли хатӗрлӗҫ.",
      "(хӳхлев)\n\n\n\nҪаврӑнса пӑхсан кашни ҫыннӑн савӑнмалли те, хурланмалли те курӑнать. Сӑнӳкерчӗксене сӑнаса шутлатӑп.\n\n\n\n... Студент ҫулӗсенчи йывӑр вӑхӑтра, иртнӗ ӗмӗрӗн аллӑмӗш ҫулӗсенче, пиччесемпе аппана чӑрмантарма тивнӗччӗ манӑн. Аппапа йысна Шупашкарта хӑйсен йӑвине ҫавӑрчӗҫ те, вӗсем патне кайса нушана ирттереттӗм вара.\n\nАппан хӗрачи пӗчӗккӗччӗ. Ӑна чӑвашла «хӗрчче» теттӗм те, йышӑнмастчӗ: «Мӗнле хӗрчче? Эпӗ Лена ятлӑ» тетчӗ. Ялтан килнӗ чӑвашсен Шупашкарта вырӑсланма тивнӗ вӑхӑтчӗ. Ӗҫре вырӑсла, ача пахчинче, шкулта, урамра - вырӑсла. Хӗрпултӑр, улпултӑр, ывӑлсем (шӑллӑм ывӑлӗ), хӗрсем (арӑмӑн йӑмӑкӗ), ӗмпиччепе ӗмпике, мучейпе мӑнаки йышши тӑвансен чӗнӗмӗсене хулара маннӑччӗ ӗнтӗ. Лена, чӑваш хӗрачи, чӑвашла чӗвӗлтетекенскер, хутла вырӑсла вӗренсе пычӗ.\n\nАтӑлӑн чӑнкӑ ҫыранӗнче, Пулӑҫсен Виҫҫӗмӗш (Третья Рыбацкая) урамӗнче, ашшӗпе юташӗсем хӑма татӑкӗсенчен ҫапса тунӑ хуралтӑра (засыпушкӑра) пурӑнатчӗҫ. Пир-авӑр комбиначӗ ӗҫлекен ыйтать. ялтан тапса килнисен хваттер ҫук. Аптраман чӑваш вӗршӗн чӗкеҫ пекех пулнӑ: чӗкле ҫыранрах йӑва ҫавӑрма вырӑн тупнӑ вӑл. Тӑм тӑвайккире, нуша ҫамкинче, каскӑн тӑман айӗнче ачалӑхӗ иртрӗ Ленӑн. Эпӗ те, общежитире вырӑн паман студент, сивӗ чухне вӗсем патне ҫитетттӗм ҫав. Ҫав йывӑр вӑхӑтри нушана чӑтса ирттерме аппа ӑшши пайтах пулӑшрӗ. Ҫакна нихҫан та манмарӑм. Пин-пин ҫын манман пулӗ Атӑл ҫыранӗнчи шӑкӑрттин «шӑнкӑрч вӗллисене»!\n\nЛена лайӑх вӗренсе пычӗ. Тӑрӑшуллӑ ӳсрӗ. Вӑтам шкулта чухнех ӑна вулавӑшра ӗҫ хушма пуҫларӗҫ. Техникум пӗтерчӗ, унтан Хусанти культура институтӗнчен вӗренсе тухрӗ. Вара ӗмӗрӗпех Кӳкеҫри тӗп вулавӑшра, Шупашкар районӗнчи вулавӑшсен тытӑмне ертсе пычӗ.\n\nРайон вулавӑшне таврапӗлӳҫӗсемпе е вулакансемпе тӗл пулма темиҫе те ҫитме тӳр килнӗччӗ. Хутлӑх энциклопедине библиотекӑра калӑпларӗҫ. Ун чухне калаҫмалли нумай тупӑнатчӗ вара.\n\nКилйышлӑ пулчӗ Елена Сергеевна, хӗрӗсемпе, кӗрӳшӗсемпе, мӑнукӗсемпе савӑнса курчӗ. Тавах мӑшӑрне, Юрий Александрович Васильев адвоката. Шанчӑклӑ ҫын пулчӗ вӑл. Килйыш хӑчӗ кил пуҫӗнчен нумай килет ҫав!\n\nКӑҫал Елена Сергеевна пурнӑҫран вӑхӑтсӑр уйрӑлса кайрӗ. Ӑна Ҫӗрпӳ тӑрӑхӗнчи Кӑнар енче, Чӑрӑш Туса (Вторые Тойси) масарӗнче хуньама-пӑянам (свекровь) тата хуньаҫа-пӑятампа (свекорпа) юнашар пытарчӗҫ. Туҫа ҫыннисем Елена Сергеевнӑшӑн ют марччӗ ҫав. Кунтах вӑл лайӑх пӗлнӗ учительница, фольклорҫӑ, юрӑҫ Ираида Вдовина выртать. Патшалӑх ӗҫтешӗсен Ефимпа Прокопий Семенов фронтовиксен, Григорий Савгай писатель кенотафийӗ пур. Яштак хырсемпе ешӗл чӑрӑшсем масар канӑҫне хурал тӑраҫҫӗ.\n\nЭтем пурнӑҫӗ кӗске, хакӗ виҫеллӗ. Чуна хурса, пурнӑҫа йӗркелес, ҫынсене ырӑ тӑвас тесе ирттерчӗ Елена Сергеевна хӑй ӗмӗрне. Пурӑннӑ чухне ҫавна курма пӗлместпӗр пулинех эпир. Халӗ вара нумай пулӑм аса килсе тӑрать.\n\n... Аппапа хӗрчче сӑнӳкерчӗксене пӑхса ларатӑп. Пӗччен калаҫатӑп иртнӗ вӑхӑтпа. Пӗрле пекех туйӑнать. Ман тӑвансен кӑна-и ҫакнашкал пурнӑҫ? Пирӗн ӑру шӑпи ҫӑмӑл пулмарӗ. Чӑтма пултарнӑ, кӗрешсе ҫӗнтерме вӑй ҫитернӗ ҫынсене мухтатӑп.\n\n«Вӗҫсе кил вӗршӗн кайӑк пулса, Аслӑ Атӑл ҫыранӗ ҫине. Кунта ирӗк, тӗнчемӗр таса, Итлесемӗр кунҫул сассине...».\n\nАнтив, ҫӗнӗ ӑру тулӑх телейпе сапӑрлантӑр. Манминччӗ ҫеҫ кайнӑ тӑвансен паттӑрлӑхне, вӗсен чӑтӑмлӑхне, пархатарлӑ ӗҫне, ҫутӑ ӗмӗтне. Ахаллӗн мӗн усси эпир ҫӗр ҫинче пурӑнни?\n\n\n\nӲкерчӗксенче: Елена хӗрччепе иксӗмӗр вӗренӳ ҫулӗ вӗҫленнине паллӑ тунӑ самант (1972). Тепринче - аппа, Лена амӑшӗ Фаина Петровна Мясникова пенсионерка, пир-авӑр комбиначӗн ҫип арлакан ударници, чечексен ытамӗнче (2006).\n\n\n\nВиталий Станьял, таврапӗлӳҫӗ",
      "Александр Каратев кӑҫал ҫулла темиҫе уйӑхлӑха савнипе вӑрҫӑнса кайнӑ. Хайхискер «Давай, поженимся» кӑларӑма заявка янӑ. Ӑна унта ӳкерӗнме 2-3 уйӑх чӗннӗ. Раштав уйӑхӗнче Саша тинех килӗшнӗ.\n\nПирӗн ентешӗн Питӗрти, Челепири арҫынсемпе тупӑшма тивнӗ. Анчах савни пӑхма килнӗ хӗрарӑм Сашӑна суйланӑ. Вӑл кӑларӑмра купӑс каласа, ташласа тӗлӗнтернӗ.\n\nАлександр Лариса Гузеевӑпа, Роза Сябитовӑпа куҫа-куҫӑн курса калаҫнӑ. «Кӑларӑмра чылай япалана ҫавӑрттарса хураҫҫӗ. Тӗслӗхрен, унчченхи хутшӑнусене тата хӗртен уйрӑлнине ытлашши вӑйлӑ «хитрелетрӗҫ». Халӗ савни умӗнче те аван мар», - тенӗ Саша. Ара, вӗсем мирлешнӗ вӗт.\n\nСавни суйлама килнӗ хӗрарам – Питӗртен. Сашӑпа иккӗшӗн хутшӑну йӗркеленеймен. Хӗр унчченхи каччипе мирлешнӗ. Халӗ пирӗн ентешпе вӗсем туслӑ.\n\nПирӗн ентеш ӳкерӗннӗ кӑларӑм кӑрлач уйӑхӗнче эфира тухӗ. Хӑш кунӗ хальлӗхе паллӑ мар.",
      "Кӑҫалхи пек япӑх ҫулсем тахҫанах пулман. Ҫуркунне юр кайнӑ май асфальт та ирӗлме пуҫларӗ. Пур тӑрӑхра та тенӗ пекех ҫулсем шӑтӑк-путӑклӑ. Тем пысӑкӑшех вӗсем. Вӗсене пула аварисем те пулаҫҫӗ.\n\nХалӗ республикӑра ҫулсене юсас ӗҫ хӗрсех пырать. Бригадӑсем шӑтӑксене саплаҫҫӗ. Чӑннипе, кашни ҫуркуннех шӑтӑк-ҫурӑксене хуплама тивет. Ку ӳкерчӗке кашни ҫулах куратпӑр-ҫке. Ҫӗнӗ ҫул хута яраҫҫӗ кӑна — тепӗр ҫул юсама тухаҫҫӗ. Мӗнпе ҫыхӑннӑ ку? Ҫулсен пахалӑхӗпе мар-и? «Раҫҫейре икӗ ҫивӗч ыйту: ухмахсем тата ҫулсем», — тени ахальтен мар пуль.\n\nКӑҫал ҫулсемпе ҫӳреме май ҫук. Шупашкартан Канаш еннелле каякан ҫула тин кӑна ҫӗнетрӗҫ те вӑл аптӑрамасть. Вӑрнар ҫулӗпе вара тракторпа ҫеҫ ҫӳремелле — ним майӗ ҫук. Пӗлтӗр кӑна унта лайӑхчӗ. Бригадӑсем юсама тухнӑ-ха, анчах хальлӗхе унта вӗсем курӑнмаҫҫӗ. Ҫынсен вара ҫула тухмалла, яла каймалла…\n\nКӑнтӑрла шӑтӑк-путӑка асӑрхаса ӗлкӗрме пулать пуль, каҫхине вара йывӑртарах. Водительсем ҫил пек вӗҫтерсе ҫӳреме юратаҫҫӗ. Ун пек хӑтланасран «выртакан полицейскисем» хураҫҫӗ. Кунашкалли Патӑрьелте нумай. Пӗррехинче ятарласа шутланӑччӗ: 7–8. Кӑҫал ҫуркунне пуҫлансан унта пулса курма тӳр килчӗ. Ытти ҫӗрти пекех Патӑрьелти ҫул та арканса пӗтнӗ. Халӗ унта нимӗнле «выртакан полицейскисем» те кирлӗ мар. Урапасем ахаль те майӗпен ҫеҫ ҫӳреҫҫӗ. Унсӑрӑн шӑтӑк-путӑка кӗрсе таҫта ҫити вӑркӑнса кайма пулать.\n\nМӗншӗн пирӗн ҫулсем ҫав тери начар? Халӑхра ҫакна унӑн пахалӑхӗпе ҫыхӑнтараҫҫӗ. Ҫул-йӗр ӗҫченӗсем ӑна кирлӗ чухлӗ хулӑнӑшран сахалрах сараҫҫӗ имӗш, ҫапла кӗсйине хулӑнлатаҫҫӗ.\n\nКашни ҫул шӑтӑка сапланин усси пур-и? Чылайӑшӗ палӑртнӑ тӑрӑх, кашни ҫулах ҫав шӑтӑксене тепӗр хут тума тивет. Пӗр пӗлӗш асфальт ҫула хӗлле, юр ҫинех, сарнине каласа кӑтартнӑччӗ. Мӗн усси? Паллӑ ӗнтӗ: вӗсен ҫула палӑртнӑ срок тӗлне хута ямалла. Анчах ҫапла хӑтлансан вӑл нумай чӑтмӗ.\n\nШӑтӑк-путӑка та ҫанталӑка пӑхмасӑрах саплаҫҫӗ: юр ҫавать-и, ҫумӑр пӗрӗхет-и — пур пӗрех. Ӗҫе тӗплӗ тумаллине ваттисем те каланӑ. Ҫиелтен пурнӑҫласан ун патне пӗрре мар таврӑнма лекӗ-ҫке-ха."
    ],
    "answer": "Хастар Саша шкулта вӗреннӗ ҫулсен йышӗ пирки тексчӗсенче хаклӑ хыпар ҫук. Пурнӑҫран илнӗ фрагментсем тӑваш культурипе ҫырулӑхӗ, пурнӑҫ йӗрки тата чӑваш чӗлхине упрасси ҫинчен каласа параҫҫӗ.\n\nПаллах, хайхи текстсенче шкул пурнӑҫӗ пирки паллӑ тӑватпӑр:\n- 5-мӗш класра вӗренекен ачасем тӗнче шайӗнчи конкурсра ҫӗнтерни тата Хӗл мучи патне чӗни;\n- Шупашкарти ачасем Асамлӑх шкулӗнче Ҫӗнӗ ҫул умӗн вӗренни;\n- хулари шкулсенче чӑваш чӗлхипе литературине аталантарас ӗҫе хисеп парасси.\n\nҪавӑн пекех, хутшӑнакан текстрӗн шкул темелли фрагменчӗ Елена Сергеевна хушшинчи пурнӑҫ кӗнекине аса илет: вӑл Шупашкарти шкулта вӗреннӗ, кайран Хусанри культура институтӗнче пӗлӳ илнӗ, вӗренӳ хыҫҫӑн вӑл ӗмӗрӗпех вулавӑшра тӑрӑшнӑ, чӑваш кӗнекисене тата чӗлхене упраса хӑварнӑ.\n\nШкул — пӗлӳ тата наци культурин тӗп йӗркелӗхӗ шутланать. Чӑваш чӗлхипе литератури шкулта вӗренмелле, ҫапла вара ӑру аталанӑвӗ тата йӑла-йӗрке упранса юлать.",
    "ground_truth": "Саша шкулта тӑхӑр ҫул вӗреннӗ.",
    "category": "education",
    "difficulty": "easy",
    "id": 10
  }
]