{
  "timestamp": "2026-05-14T22:13:43.606988",
  "total_questions_evaluated": 10,
  "llm_model": "deepseek/deepseek-v3.2",
  "embedding_model": "qwen/qwen3-embedding-8b",
  "chunking_config": {
    "chunk_size": 3,
    "overlap": 1
  },
  "summary": {
    "faithfulness": {
      "mean": 0.6042,
      "std": 0.5316,
      "min": 0.0,
      "max": 1.0,
      "count": 3
    },
    "context_precision": {
      "mean": 0.5789,
      "std": 0.4391,
      "min": 0.0,
      "max": 1.0,
      "count": 10
    },
    "context_recall": {
      "mean": 0.5,
      "std": 0.527,
      "min": 0.0,
      "max": 1.0,
      "count": 10
    },
    "answer_relevancy": {
      "mean": 0.3976,
      "std": 0.1523,
      "min": 0.0,
      "max": 0.5597,
      "count": 10
    }
  },
  "per_question": [
    {
      "question": "Чӑваш патшалӑх ял хуҫалӑх академийӗнче мӗн пулнӑ?",
      "user_input": "Чӑваш патшалӑх ял хуҫалӑх академийӗнче мӗн пулнӑ?",
      "retrieved_contexts": [
        "Кӑҫал пирӗн республикӑри аслӑ шкулсенче 10 918 бюджет вырӑнӗ пӑхса хӑварнӑ. Пӗлтӗр ҫак хисеп 11 292-пе танлашнӑ. Ҫав шутран аслӑ пӗлӳ илес текенсем валли 3 375 бюджет вырӑнӗ пулнӑ. Аслӑ шкулсене кӗме пурӗ 25 пин ытла ача заявлени панӑ. Апла пулсан ҫакӑ пӗр вырӑна 4 ача лекнине пӗлтерет.\n\nЧӑваш патшалӑх университетне тӳлевсӗр майпа вӗренме кӗрес текенсем пӗр вырӑн пуҫне 7 ача тивнӗ, Ял хуҫалӑх академине — 6,6-ӑн, Чӑваш патшалӑх педагогика университетне — 5,6-ӑн. Абитуриентсенчен ытларахӑшӗ ҫӗр йӗркелӗвӗ тата кадастр енӗпе, электроэнергетика тата электротехника, строительство, сиплев ӗҫӗ, стоматологи, клиника психологийӗ, экономика тата юриспруденци енӗпе ӗҫлекен специалист пуласшӑн.\n\nШкул пӗтернисене республикӑрах хӑварас тесе математикӑпа тата физикӑпа пысӑк балл (70-тен ытларах) пухнисене пӗлтӗртенпе Чӑваш Енре ятарлӑ стипенди пама тытӑнчӗҫ. Ӑна ҫулталӑк хушши тӳлесе тӑрӗҫ. Уйӑхсеренхи унӑн виҫи 2 пин тенкӗпе танлашать. Кӑҫал ун пек баллисем 80 ача Чӑваш Енри аслӑ шкулсене суйланӑ. 70 балтан илнисем вара пӗтӗмпе 408-ӑн пулнӑ.\n\nРабочи профессийӗ илес текенсем 2 741 ача тупӑннӑ. Ку вӑл техникумсем, професси училищисем тата колледжсем  планпа илмелли хисепрен 83,8 проценчӗ пулать. Техникумсемпе колледжсене заявлени панисене илсен, пӗр бюджет вырӑнӗшӗн икӗ ача тупӑшать.",
        "Чӑваш патшалӑх ял хуҫалӑх академине университет статусне пама пултараҫҫӗ.\n\nПаян, пуш уйӑхӗн 20-мӗшӗнче, Чӑваш Ен Министрсен Кабинечӗн Ертӳҫин ҫумӗ — ял хуҫалӑх министрӗ Сергей Артамонов аслӑ шкулӑн ректорӗпе Андрей Макушевпа тӗл пулнӑ. Енсем аграри аслӑ шкулӗн аталанӑвне сӳтсе явнӑ.\n\nСергей Артамонов Фейсбукра пӗлтернӗ тӑрӑх, пуш уйӑхӗн 18-мӗшӗнче Чӑваш Ен Элтеперӗн тивӗҫӗсене вӑхӑтлӑх пурнӑҫлакан Олег Николаев Раҫҫей ял хуҫалӑх министрӗпе Дмитрий Патрушевпа курнӑҫнӑ. Ҫавӑн чухне ял хуҫалӑх академине университет статусне парас ыйтӑва хускатнӑ.\n\nСергей Артамонов палӑртнӑ тӑрӑх, аслӑ шкул аграри валли пысӑк шайри специалистсем хатӗрлет. Академи статусӗ улшӑнсан унӑн сумӗ тӗрлӗ шайра тата ӳсӗ.",
        "Чӑваш патшалӑх ял хуҫалӑх академийӗн 1-мӗш вӗренӳ корпусне юсаса ҫӗнетме палӑртнӑ. Патшалӑх закупкисен сайтӗнче проектпа смета документцине хатӗрлеме аукцион ирттересси пирки пӗлтернӗ. Хакӗ – 4 748 423 тенкӗ.\n\nКу ҫурт – истори пӗлтерӗшлӗ, ӑна 1957 ҫулта хӑпартнӑ. Корпусӑн фасадне сӑрламалла, карнизсене, колоннӑсене, скульптурӑсене ҫӗнетмелле. Корпуса кӗмелли тӗп тата хушма алӑксене те ҫӗнетмелле, никӗсне ҫирӗплетмелле. Тӑррине йӑлтах улӑштарма палӑртнӑ. Кивӗ чӳречесене те ҫӗнетӗҫ, кӑритурта тата хӑш-пӗр аудиторире косметика юсавӗ тӑвӗҫ. Пурнӑҫламалли ытти ӗҫ тата пур.\n\nЗаявкӑсене ака уйӑхӗн 22-мӗшӗччен йышӑнаҫҫӗ, пӗтӗмлетӗве акан 25-мӗшӗнче тӑвӗҫ.",
        "Паян, ҫурла уйӑхӗн 18-мӗшӗнче, Чӑваш патшалӑх гуманитари ӑслӑлӑхӗсен институчӗ, 95 ҫул тултарнӑ.\n\nВӑл — Раҫҫейри хӑйне евӗр академи учрежденийӗсенчен пӗри. Унта литературӑна, чӗлхе пӗлӗвне, ӳнере тата чӑваш халӑхӗн историйӗпе этнологине тӗпчеҫҫӗ. Археологи енӗпе те нумай ӗҫлет.\n\nИнститут пуян наука архивӗпе тата библиотекӑпа мӑнаҫланама пултарать. Фондра 152 пин ытла единица пуянлӑх.",
        "Чӑваш патшалӑх ял хуҫалӑх академийӗ 85 ҫулхи юбилейне паллӑ тунӑ. Шӑпах 85 ҫул каялла Чӑваш автономийӗ ял хуҫалӑх институчӗ уҫӑлнӑ наци республикисенчен пӗри пулса тӑнӑ.\n\nҪӗнӗ аслӑ шкулта малтанах 106 ҫын вӗреннӗ. Ун чухне икӗ уйрӑм ӗҫленӗ. 1934 ҫулта вара зоотехнологи тата агрономи факультечӗсем йӗркеленнӗ.\n\nМайӗпен институт аталанса пынӑ, ятарлӑ лабораторисем уҫӑлнӑ. Вӑл пурнӑҫпа тан утнӑ. Унтан инженерсем, ветеринари тухтӑрӗсем, экономистсем вӗренсе тухнӑ.\n\nХалӗ вӑл вӗренӳ инноваци комплексӗ шутланать. Унта пысӑк квалификациллӗ специалистсене хатӗрлеҫҫӗ. Ҫак тапхӑрта академирен 30 пин ытла специалист вӗренсе тухнӑ. Паян унта 3 пин студент вӗренет."
      ],
      "response": "Чӑваш патшалӑх ял хуҫалӑх академийӗ хальхи вӑхӑтра пысӑк аталанӑв тата улшӑну тӗлӗшӗнче пулса иртнӗ. Унӑн тӗп пулӑмӗсем тата ӗҫӗ-хӗлӗ ҫинчен литературлӑ чӑваш чӗлхипе каласа пама пулать.\n\nАкадемие университет статусне куҫмалли пирки калаҫу тапхӑрӗ пуҫланнӑ. Пуш уйӑхӗнче Чӑваш Ен ял хуҫалӑх министрӗ Сергей Артамонов академи ректорӗпе тӗл пулнӑ, аграри шайӗнчи аслӑ шкулӑн аталанӑвӗ тӗлӗшпе сӳтсе явнӑ. Раҫҫей ял хуҫалӑх министрӗпе Олег Николаев хушшинчи тӗлпулура вара ку ыйту хускатнӑ. Статус улшӑнсан, академи сумӗ ӳсӗ те, вӑл пысӑк шайри аграри специалистсене хатӗрлеме пултарать.\n\nАкадемие ҫутӗҫан хӑпартнӑ 1-мӗш вӗренӳ корпусне тата тивӗҫлӗ юсӑм ӗҫӗсем ирттермелли план тӑвӑннӑ. Истори пӗлтерӗшлӗ 1957 ҫулта хӑпартнӑ ку ҫурта ҫӗнетме, фадачӗне, архитектура элементӗсене, никӗсне ҫирӗплетме, тӑррине улӑштарма тата чӳречесене ҫӗнетме палӑртнӑ. Вӗсен хакӗ 4,75 миллион тенкӗ патнелле пулать.\n\nВӗренӳ енӗпе, академие ятарлӑ стипенди илмелли ӑнӑҫлӑ абитуриентсене пултарнӑ. Тӳлевсӗр майпа вӗренме кӗрес текенсем хушшинче пӗр вырӑншӑн 6,6 ача тивнӗ, вӑл республикӑри аслӑ шкулсенчен чи лайӑх кӑтартӑвсенчен пӗри шутланать. Халӗ академире 3 пин ытла студент вӗрент.\n\nАкадеми ӑслӑлӑхпа тата историпе те мӑнаҫланать. Унӑн йӗркеленӗвӗнчен 85 ҫул ҫитнӗ юбилейне паллӑ тунӑ. 1934 ҫултанпа унта зоотехнологи тата агрономи факультечӗсем ӗҫлеме пуҫланӑ. Ҫак тапхӑрта академирен 30 пин ытла квалификациллӗ специалист вӗренсе тухнӑ, халь вара вӑл вӗренӳ инноваци комплексӗ шутланать.",
      "reference": "Академире каллех улшӑнусем пулнӑ.",
      "faithfulness": NaN,
      "context_precision": 0.5888888888692593,
      "context_recall": 1.0,
      "answer_relevancy": 0.423584474375875
    },
    {
      "question": "Ректор тивӗҫне вӑхӑтлӑха кам пурнӑҫлӗ?",
      "user_input": "Ректор тивӗҫне вӑхӑтлӑха кам пурнӑҫлӗ?",
      "retrieved_contexts": [
        "Чӑваш патшалӑх ял хуҫалӑх академийӗнче паян ректор суйлассине эпир пӗлтернӗччӗ. Пуҫлӑх пуканне ректор тивӗҫне халӗ пурнӑҫлакан Людмила Линика шанса панӑ иккен. Уншӑн 118 ҫынтан 90-шӗ сасӑланӑ. Пӗлекенсем каланӑ тӑрӑх, суйлава академи алӑкне шал енчен питӗрсех ирттернӗ-мӗн. Унта журналистсем ҫеҫ мар, ректор пулма кандидат пулнӑ Семеновӑн шаннӑ ҫынни те кӗреймен иккен.\n\nВладимир Семенов кадидатуришӗн 25-ӗн сасӑланӑ-мӗн, Николай Кирилловшӑн — 2-ӗн.",
        "Чӑваш патшалӑх ял хуҫалӑх академийӗнче пӗр уйӑхра ректор тивӗҫне пурнӑҫлакана виҫӗ хутчен ылмаштарнӑ. Хальхинче ҫак должноҫе вӑхӑтлӑх пурнӑҫлама Андрей Макушева лартнӑ. Вӑл ҫын Шупашкар районӗнче вырнаҫнӑ «Приволжское» (чӑв. Атӑлҫум) вӗренӳ хуҫалӑхӗнче пуҫлӑхра ӗҫлетчӗ. Пуҫлӑх пуканне ӑна учхоза унччен ертсе пынӑ Георгий Егоров Шупашкар район администрацине ертсе пыма тытӑннӑ хыҫҫӑн шанса пачӗҫ.\n\n«Приволжское» акционерсен уҫӑ обществи (паян унӑн харпӑрлӑх форми ҫавнашкал-мӗн. Хӑй вӑхӑтӗнче вӑл федерацин унитарлӑ предприятийӗ шутланатчӗ) — Ял хуҫалӑх академийӗн вӗренӳ хуҫалӑхӗ. Вӗренӳ заведенийӗнче ректор тивӗҫне пурнӑҫлакана иртнӗ уйӑхӑн 23-мӗшӗнчен тытӑнса виҫӗ хутчен ылмаштарнӑ.\n\nАса илтеретпӗр, ректор тивӗҫне пурнӑҫлама уйӑх каярах Александр Акимова лартнӑ, темиҫе кун каялла —  Илья Царевскине.",
        "И.Н. Ульянов ячӗллӗ Чӑваш патшалӑх университечӗн ректорӗ Всеволод Агаков тӗлӗшпе пуҫиле ӗҫ пуҫарнӑ. Аса илтеретпӗр, иртнӗ уйӑх вӗҫӗнче унта ректор суйлас процедура пуҫланса кайнӑччӗ. Кандидачӗсем камсем пирки эпир маларах пӗлтернӗччӗ. Халӗ ҫав аслӑ шкулпа ҫыхӑннӑ тата тепӗр хыпар пӗлме май килчӗ. ЧПУн паянхи ректорне Всеволод Агакова хирӗҫле пуҫиле ӗҫ пуҫарнӑ иккен.\n\nПӗлтерер, маларах пуҫиле ӗҫе асӑннӑ аслӑ шкулӑн икӗ ӗҫченӗ тӗлӗшпе пуҫарнӑ пулнӑ. Вӗсем ӗҫленӗ вӑхӑтра пурӑнма тесе панӑ хваттерсене приватизацилеме пӑхнӑ-мӗн. Анчах суя ҫиеле тухнмне пула ӗҫе вӗҫне ҫитерме май килмен — кӗҫех пӑтӑрмахӗ (ҫуркунне пулса иртнӗ) вӗсем тӗлӗшпе пуҫиле ӗҫ пуҫарнӑ. Ҫак кунсенче вара вӑл ӗҫ фигуранчӗсен йышне аслӑ шкулӑн ректорӗпе пӗр проректорӗ лекнӗ.",
        "Чӑваш патшалӑх ял хуҫалӑх академийӗнче тӑрӑшакансемшӗн ыран хумхануллӑ кун пулӗ тесен те йӑнӑш мар-тӑр. Унта ыран вӗренӳ заведенийӗн ректорне суйлӗҫ.\n\nАса илтеретпӗр, иртнӗ ҫулхи раштавӑн 12-мӗшӗнче ӑсчахсен канашӗн ларӑвӗнче академи ректорне Николай Васильева кӗтмен-туман ҫӗртен ӗҫлеме пӑрахтарнӑччӗ. Яваплӑ тивӗҫе пурнӑҫлама Людмила Линик юриста шаннӑччӗ. Сӑмах май, хӑй вӑхӑтӗнче Людмила Линик Чӑваш Енӗн суйлав комиссийӗн председателӗ пулнӑччӗ. Ректора сасартӑк ылмаштарнине ун чух Раҫҫейӗн Ял хуҫалӑх министерстви аслӑ шкул (академи асӑннӑ ведомствӑна пӑхӑнать) тухӑҫсӑр ӗҫлет тесе ӑнлантарнӑччӗ. Николай Васильев вара капла хаклавпа килӗшменнине, аслӑ шкулсен тухӑҫлӑхне 2011 ҫулхи ӗҫ кӑтартӑвне кура йӗркеленине, академине вара вӑл 2012 ҫулхи ҫуркунне кӑна ертсе пыма пуҫӑннине палӑртнӑччӗ. Ректора хӳтӗлесе студентсем митинга та тухса пӑхнӑччӗ.\n\nЫран вара академин ректора суйлама тивет. Маларах, ҫӗртмен 7-мӗшӗнче, Раҫҫейӗн Ял хуҫалӑх министерствинче ректор пулма тивӗҫ кандидатурӑсене аттестацилемелли лару иртнӗ. Пирӗн республикӑран сакӑр кандидат тӑратнӑ иккен, федераци министерстви вӗсенчен виҫҫӗшне — вӗсем кашниех академире ӗҫлеҫҫӗ — суйласа илнӗ. Ҫапла вара Мускавра ырланӑ кандидатсен списокне ректор тивӗҫне халӗ пурнӑҫлакан Людмила Линик тата биологи ӑслӑлӑхӗсен докторӗсем — пӗри морфологи, физиологи тата зоогигиена кафедрин профессорӗ Владимир Семенов, тепри ҫӗр ӗҫӗпе агрохими кафедрин профессорӗ Николай Кириллов — кӗнӗ.",
        "ЧР Вӗрентӳ институчӗн ректорӗ пулнӑ Елизавета Казакова пурнӑҫран уйрӑлнӑ. Вӑл 61 ҫулта пулнӑ.\n\nЕлизавета Васльевна пурнӑҫне вӗрентӗве халалланӑ. Малтан вӑл вӗрентекенре ӗҫленӗ, унтан шкул директорӗн ҫумӗ пулнӑ. Кун хыҫҫӑн квалификацие ӳстерекен тытӑма ӗҫлеме куҫнӑ, республика валли управлени кадрӗсем хатӗрленӗ.\n\nПӗр ҫул вӑл Вӗренӳ министерствинче министр ҫумӗнче ӗҫленӗ. Ун хыҫҫӑн Вӗренӳ инситутнех таврӑннӑ, пенсие тухичченех ректор пулнӑ. Вӑл – ЧР тава тивӗҫлӗ вӗрентекенӗ. Унӑн педагогика ӑслӑлӑхӗсен кандидачӗн степенӗ пур.\n\nЕлизавета Казаковӑпа ыран 8.30-100 сехетсенче сыв пуллашӗҫ: Шупашкар урамӗ, Граждан урамӗ, 19-мӗш ҫурт."
      ],
      "response": "Чӑваш патшалӑх ял хуҫалӑх академийӗнче ректор тивӗҫне хальхи вӑхӑтра **Людмила Линика** вӑхӑтлӑх пурнӑҫлать. Вӑл академин ӑсчахсен канашӗн ларӑвӗнче суйланипе тата Раҫҫейӗн Ял хуҫалӑх министерствин аттестациленӗ кандидатсен шутне кӗнипе ҫак должноҫа ларӑннӑ.\n\nДетальсем:\n1. **Суйлав процесчӗ:** Иртнӗ ҫулхи раштав уйӑхӗнче ректор Николай Васильева ӗҫлеме пӑрахтарнӑ хыҫҫӑн, тивӗҫе вӑхӑтлӑха пурнӑҫлама Людмила Линик суйланӑ. Академи алӑкне шал енчен питӗрсе ирттернӗ суйлавра уншӑн 118 ҫынран 90-шӗ сасӑланӑ.\n2. **Кандидатсем:** Федераци министерстви суйласа илнӗ виҫӗ кандидат шутне Людмила Линикпе пӗрле академи профессорӗсем Владимир Семенов тата Николай Кириллов кӗнӗ. Суйлавра Семеновшӑн 25, Кирилловшӑн 2 сасӑ пулнӑ.\n3. **Малтанхи вӑхӑтлӑх пулнӑ ректорсем:** Ректор тивӗҫне пурнӑҫлакансене кун хушшипех ылмаштарнӑ: Александр Акимова, кайран Илья Царевски, хальхине - Андрей Макушева.\n4. **Ыранти хӑтлану:** Студентсем ректора хӳтӗлесе митинг ирттернӗ, анчах федераци министерстви академие тухӑҫсӑр ӗҫлет тесе шутланипе ректора улăштарнă.\n\nҪапла вара, Чӑваш ял хуҫалӑх академийӗн ректор пуканӗнче халӗ Людмила Линик тӑрать, вӑл федераци шайӗнче те ҫирӗплетнӗ кандидатура шутланать.",
      "reference": "Ректор тивӗҫне вӑхӑтлӑха Илья Царевский пурнӑҫлӗ.",
      "faithfulness": NaN,
      "context_precision": 0.49999999995,
      "context_recall": 0.0,
      "answer_relevancy": 0.37666025344549553
    },
    {
      "question": "Илья Царевский миҫе ҫулта?",
      "user_input": "Илья Царевский миҫе ҫулта?",
      "retrieved_contexts": [
        "Ҫӗнӗ Шупашкар каччи, Илья Фёдоров, воллейбол енӗпе Раҫҫей чемпиоантӗнче ҫӗнтернӗ. Каччӑ Хусанти «Зенит» командӑра вылять. Хусанти команда Мускаври «Динамӑна» ҫӗнтернӗ.\n\nИлья — 21 ҫулта. Хусанти «Зенит» йышӗнче вӑл 2017 ҫултанпа вылять. Унччен маларах каччӑ командӑпа пӗрлРаҫсей кубокӗнче ҫӗнтернӗ кӑна мар, Ҫамрӑксен хушшинче Европа чемпионӗ пулса тӑнӑ.",
        "Хӗветӗр Уярӑн повӗҫӗсемпе калавӗсене, очеркӗсемпе статьйисене, асаилӗвӗсене  тӑватӑ тома пуҫтарса хатӗрленӗ  май ҫыравҫӑн пултарулӑх ҫулӗ мӗн тери тертлӗ пулни куҫ умне уҫҫӑн тухса тӑрать (халиччен 3 томӗ тухнӑ). Чи малтан кунта пултарулӑх уйрӑмлӑхӗ (йывӑрпа ҫырӑнни) пирки калас пулать. Анчах идеологи сӗрӗмӗпе минренӗ хаяр критиксем «тӳпине»  те манса хӑварас марччӗ. Вӗсем Уяр повӗҫӗсемпе калавӗсене силлесе шакканӑ хыҫҫӑн «тӑнкӗртӳ кампанийӗсем» кӗрленӗ, ун хыҫҫӑн «ҫынсем пек ҫырма вӗренеймен» ӑстана хаҫат-журнал, издательство редакцийӗсенче хӑраса кӗтсе илнӗ,  ытла та асӑрхануллӑ редакторсемпе унӑн тавлашӑва кӗме тивнӗ, «лайӑх тӳрлетнӗ» алҫырусене вӑл пӗрре  мар каялла илсе таврӑннӑ.  Уярӑн литературӑри кун-ҫулӗ пӗлӗтлӗ анчах мар, йӗпе-сапаллӑ пулнӑ теме те пулать, ҫакна ҫырнисен пуххин  хуплашки ҫинче кӑтартса хӑварни вырӑнлӑ пулассӑн туйӑнчӗ.\n\n«Уяра хӗстерни пирки халь  ӳстерсе калаҫаҫҫӗ, – терӗ мана пӗррехинче тем те пӗлекен пӗр паллӑ прозаик, хӑй вӑхӑтӗнче парти шкулӗ пӗтернӗскер. – Пур-и ун тухмасӑр юлнӑ пӗр алҫыру? Унне пурне те пичетленӗ».\n\n…Пӗр 5-6 ҫул каялла Чӑваш кӗнеке издательствин складӗнчен пӑрахӑҫланӑ алҫырусен купи айӗнчен кӗрен хуплашкаллӑ самай хулӑн папка тупса таврӑнтӑм. Ун хуплашки ҫине штамп лартса хӑҫан килсе панине палӑртнӑ – 1996 ҫулхи февралӗн 12-мӗшӗ; 15,0 пичет листи, 54-мӗш номерпе шута илнӗ. Кӗнеке ятне авторӗ тӳрех тупайман курӑнать: «Пичетлеме чарнӑ» тенине туртса хурса «Репрессиленӗ калавсем» тесе тӳрлетнӗ. «Заявки пур» тесе палӑртнӑ хуплашка ҫине. Автор уйрӑм хут ҫине ҫырса ҫӗнӗ вариантсем сӗннӗ: «Айӑпа лекнӗ калавсем», «Репрессине лекнӗ калавсем», «Репресси ҫулӗсенче айӑпланнӑ калавсем»… Тата «Кун ҫути кӑтартман калавсем», «Пичетлеме чарнӑ калавсем  тесе хитре почеркпа ҫырса хуни те пур. Ку – редактор алли пулас, вӑл та кӗнеке ятне шыраса аппаланнӑ иккен.\n\nКӗнекене мӗн хыҫҫӑн мӗн лартмаллине автор хӑй аллипе ҫапларах кӑтартса панӑ:\n\nАттене мӗнле вӗлерчӗҫ.\n\nПӗр кӗнеке шӑпи ҫинчен.\n\nВиҫӗ кун та виҫӗ каҫ.\n\n«Сынсем пек ҫырма вӗренеймерӗм».\n\nТелейлӗ Палюк.\n\n«Ӑҫта эс, тинӗс?» калав историйӗ.\n\nКалавӗ хӑй.\n\nӐҫта ҫитсе тухрӑмӑр эпӗр?\n\nЧӑвашсене – вуласа тухма, шухӑшлама.\n\nНим пытармасӑр каласан.\n\nП. Хусанкай кӗнеке вулать.\n\nИртнипе пуласси.\n\nШупашкарта пичетленнӗ А.С. Пушкин кӗнеки\n\nХура кушак.\n\nТемшӗн-ҫке, «Тупмаллинче» «Кӗрхи ҫумӑр» повӗҫ, «Пӗр ачан пурнӑҫӗпе вилӗмӗ» калав, «Кӗрхи сӑнсем», «Тусӑмӑр ҫинчен» статьясем ҫук, унта палӑртнӑ «Хура кушак» (те калав ӗнтӗ вӑл?) таҫта ҫухалса юлнӑ. Статьясемпе асаилӳсенчен хӑшне-пӗрне автор «Ялав» журнала парса пӑхнӑ, ҫакна Аристарх Дмитриев (тӗп редактор ҫумӗ) тата Юрий Семенов (тӗп редактор) алӑ пусса паллӑ тунинчен пӗлме пулать. Каярахпа вӗсене «Коммунизм ялавӗ» («Хыпар) пичетлесе кӑларнӑ.\n\nКуратпӑр ӗнтӗ, тупӑннӑ папкӑра пичетленнӗ калавсем чылай. Публицистика япалисем хушшинче халиччен тухманнисем те пулма пултарассӑн туйӑнчӗ. Кӗнекене автор «ҫӗнетӳ тапхӑрӗпе» ҫунатланса хатӗрлени сисӗнет, кашни япалинех чунпа-юнпа ҫырнӑ, кашниншӗнех сӑмах тивнӗ, хӑш-хӑш кӗнекипе калавне сутма кӑларсан каялла пуҫтарса илнӗ. Ман хамӑн та пур ун пек шӑпаллӑ «Писательпе паллашни» кӗнеке (1972), ӑна студент ҫулӗсенченпех упратӑп. Титул ҫине нумай ҫул иртсен авторӗ ҫапла ҫапла ҫырса пачӗ: «Ҫак сайра тӗл пулакан кӗнеке хуҫине Валерий Николаевича сума суса, тав туса. Хв. Уяр. 28.- IV. – 94». Ҫав кун Хӗветӗр пиччепе Етӗрне районӗнчи Урапакасси ялне Алексей Медведев ҫыравҫӑ патне хӑнана кайса килнӗччӗ.\n\n\n\n«Мӗншӗн Хӗветӗр Уярӑн ҫак кӗнекине пичете паман?» – ыйтрӑм эпӗ алҫыру шӑпине пӗлес тесе издательствӑра чылай ҫул тӗп редакторта ӗҫленӗ П.Е. Дмитриев-Эйзинран. Йӑлтах маннӑ иккен иккен мӗн пулни-иртнине Петр Егорович.\n\nАванах ас тӑватпӑр, «ҫӗнетӳ» хӗвелӗ ансах ҫитнӗччӗ. Ман шутпала, «Уярсен вӑхӑчӗ иртет иккен-ха, каллех йӗпе-сапаллӑ тапхӑр килсен мӗн калӑпӑр», – тесе асӑннӑ кӗнекене «вырӑн ҫитменнипе» плана кӗртмен.\n\nПӗлтӗр ҫак папкӑри «Ӑҫта эс, тинӗс?» калав историйӗ» асаилӗве «Тӑван Атӑл» тата «Халӑх шкулӗ» журналсене сӗнсе пӑхнӑччӗ. «Пирӗн кун пекки каймасть», – тесе хытӑ тарӑхса каялла персе панӑччӗ ӑна.  Буддӑсем пек пуҫӗсене каҫӑртса ларакан главный редакторсене  ӳкӗте кӗртме хамӑн вӑй ҫитменнипе Юрий Артемьев профессора та хутшӑнтарса пӑхнӑччӗ ҫак ӗҫе, усси пулмарӗ. Кайран ку асаилӗве «Чӑваш халах сайчӗ» пичетлерӗ (4 пин ытла ҫын пӑхнӑ). Кӑҫал вара ӑна сайтран илсе «Тӑван Атӑл» журналта чип-чипер кӑларчӗҫ (5-мӗш номер, 43 – 54 стр.).\n\nЧӑваш наци библиотекинчен пӗлтернӗ тӑрӑх, ҫӳлерех асӑннӑ папкӑри «Иртнипе пуласси» статья тата «Ним пытармасӑр каласан» уҫӑ ҫыру  ниҫта та пичетленмен. Вӗсенчен пӗрне «Чӑваш халӑх сайтне» сӗнсе пӑхасшӑн.\n\n«Иртнипе пуласси» статьяна автор икӗ тапхӑрта ҫырни паллӑ (вӗҫӗ, юлашки страници, таҫта ӳксе юлнӑ пек туйӑнать). Пӗрремӗш пайне хӑҫан ҫырни паллӑ мар, иккӗмӗш пайне вара 1969 ҫулта ҫырнӑ тесе кӑтартса хӑварнӑ. Статьяна издательствӑпа журналсен редакцийӗсем мӗншӗн сивленине ӑнланса илме йывӑр мар: унта  тӗне кӗмен чӑвашсен пурнӑҫӗ пирки самах пырать. Ун чухне питӗ «юраман» тема пулнӑ ку. Ӑна мӗнле уҫса панине идеологи ертӳҫисем анчах мар, Патшалӑх хӑрушсӑрлӑх комитечӗ пӑхса тӑнӑ. Ҫавна пулах «язычниксем» пирки историксем революцичченхи авторсене кӑш-кашт асӑнса иртнипех ҫырлахнӑ. Ман шутпала, ҫакна пулах Хветӗр Уяр  тӗне кӗмен чӑвашсен пурнӑҫне ытларах чухне хурласа ҫырать.\n\n\n\nВалерий Алексин.\n\n\n\nТе тӑшман вӑл ҫав этем - ӑнланма ҫук. Ячӗ те тутарла ун - Идрис. Хӑй чӑваш. Ахаль чӑваш ҫеҫ те мар тата - «чӑн чӑваш». Тӗне кӗменни! Икҫӗр ҫула яхӑн ҫӑкӑр унанӑ пек унасан та тӗне кӗмесӗр юлма хал ҫитернӗ ҫын ачи. Хӑй тахҫанах ача ашшӗ ӗнтӗ, ватлӑхӗ те инҫе мар. Ячӗ пирки калас пулсан, сӑмах нумай. «Ӑна вӗсем патша чиновникӗсемпе пупсем хӑпчӑр тесе ҫапла хунӑ», - терӗ мана пӗр юлташ. Лешсем хӗсӗрле пуҫласан эпир мӑсӑльмансем тенӗ-мӗн те – ӗҫ те пӗтнӗ. Хӑйсем ҫаплах киремете пуҫҫапнӑ-ха, аслӑ ырра парне панӑ, кил-тӗш пӑтти пӗҫернӗ.\n\nИдриса эпӗ яла пырсан виҫҫӗмӗш кунне асӑрхарӑм. Лутра вӑл, чирлӗ сӑнлӑ. Хырӑмне сулахай аллипе тытса, ушкӑна пырса ларать те ҫынсем ҫине кӗтевлӗн, ӑшпиллӗн пӑхать, кӗхӗм-кӗххӗм! ӳсӗрет.\n\nТепӗр ҫӗрте сӑмах-юмах тапранчӗ - унта та Идрис Искакович Ильдиаров курӑнса кайрӗ. Питне-куҫне асаплӑн пӗркелентерсе ҫынсем патне майӗпен ҫывхарчӗ вӑл, итлекелесе тӑчӗ. Аллипе хырӑмне тытнӑ хӑй. Сурчӑкне те темшӗн аран-аран ҫеҫ, мӑйне хур пек тӑсса кӑна ҫӑтать. Куҫӗнче хӑйӗн пурнӑҫ хӗлхемӗ тӗлкӗшсе ҫунать.\n\n- Мӗн пулнӑ ӑна? - ыйтрӑм эп, Идрис кайсан.\n\n- Рак, - терӗҫ мана кӗскен.\n\n- Рак?!\n\n- Рак. Йӗпе пырӗ питӗрӗнсе ларнӑ. Апат ҫӑтаймасть. Ӑна халь тӳрех хырӑмӗнчен тӑрантараҫҫӗ.\n\nУнпа ҫынсем ҫине тӗмсӗлсе пӑхать-ҫке вӑл! Мӗнле те пулин тӗлӗнтермӗш япала чир танатинчен хӑтармӗ-ши тет ӗнтӗ, мӗскӗн. Ку хӑрушӑ инкек тӗлӗкре те курӑнмарӗ-ши тесе, тен, ыйхӑ тӗлӗшпе пырне тыта-тыта пӑхать пуль. Лешӗ иртме мар, йывӑрлансах пырать ав.\n\nТепре курсан, Идрис мана хӑй ҫапла каларӗ:\n\n- Больницӑра пӗрле выртнӑ ачана пытарнӑ. Унӑн та манни пек чирччӗ.\n\nИдрис хӑйне ӑҫта пытармаллине кӑтартса хунӑ-мӗн. Ҫакӑнта анне ҫывӑхне вырттарӑр тенӗ.\n\nТепӗр уйӑхран Идрис яла та тухса ҫӳрейми пулнӑччӗ. Хӑй ҫапах шанма пӑрахманччӗ-ха?\n\n- Тухтӑртан ыратнине чармалли укол тума ыйтрӑм та - килӗшмест. Укол тутарма хӑнӑхса кайӑн та сывалсан чарӑнаймӑн. Усала вӗренесси часах, - тенӗ пулать, тарӑхмасть, савӑнса каласа парать.\n\nПриговор ҫырнӑ, алӑ пусса ҫирӗплетнӗ тенешкел, халь тин ним те тӑваймӑн ҫав. Нумаях та пулмасть-ха кам та пулин пурӑнассипе вилесси Идрисран хӑйӗнчен килнӗ. Калама ҫук чӑрсӑр, пуҫтах, чарусӑр пулнӑ вӑл. Вӑйне ниҫта кайса чикейменнипе шартлама сивӗ хӗл кунӗнче юр ҫине ҫаппа-ҫарамас выртса кустӑрма пек кусса ҫӳренӗ, ҫӗрле урам варрине сике-сике тухса арҫурилле кӑшкӑрнӑ.\n\n- У-у-у! Ы-ы! Уа-а!.. Ай-яй-яй! И-ха-ха! Мяу! Ме-а!\n\n- Тур ҫырлахтӑрах, каллех Идрис кашкӑрсене йыхӑрать, выльӑхсене тухса астӑвас, - тенӗ шарт сиксе тӑрса ларнӑ ватӑсем.\n\nПуҫхӗрлӗ ҫӳресси ҫеҫ юлнӑ Идрисӑн. Ашкӑннӑ вӑл. Эрех ӗҫнӗ. Никама ним вырӑнне хуман. Пурнӑҫ пирки шухӑшламан. Ма пуҫа усӑсӑр ватмалла, йӑлтах хӑй ӑссӗн пулса пырать пулсан. Килте ун пиҫнӗ-хуҫнӑ, ӗҫре ӑна пурте куҫран пӑхаҫҫӗ. Ялта ун пеккинчен никам тӗлӗнмест. Ҫемйи сывӑ ун, хӑй туртсан тимӗр татмалла. Ӗҫӗ килӗшнӗ ӑна - шофер вӑл. Ялӑн тепӗр вӗҫне мар, карта хыҫне те машинӑпа ӗрӗхтерсе кайса килнӗ. Укҫаран татӑлман. Вутӑ кирлӗ сана (вӑрман ҫукран кунти ҫынсене хир енчисем теҫҫӗ), укҫа пулсан, мӗнле вутӑ кирлине ҫеҫ кала, хӑть те тупӑлха вутти пултӑр, ҫӗр айӗнчен чавса кӑларать те - тупса килсе парать-паратех. Ӑҫтан вӑрласа килет вӑл. Таҫтан.\n\nУҫҫа ятлӑ йӗкӗте вӑл ҫапла вӗлернӗ. Идрис шофер терӗмӗр. Ҫамрӑк Уҫҫа ун машини ҫинче грузчикра ӗҫленӗ. Пӗррехинче хулара вӗсем патне «шабашкӑран» таврӑнакан кӳршӗ ял ҫынни пырса тӑнӑ.\n\n- Киле лартса каймастӑр-и?\n\n- Ыйтса тӑрать тата! Лар хӑпарса!\n\nУнччен те хӗрӗнкӗскер, ӗнтӗ киле ҫитнӗпе пӗрех тесе, «шабашник» тата ӗҫнӗ. Унтан тата. Тата. Идриспа Уҫҫана та ӗҫтернӗ. Юлашкинчен тӳнсех кайнӑ.\n\nТытса пӑхать Идрис ун кӗсйине - туллиех укҫа лекет. Шутлаҫҫӗ те - икӗ пин тенкӗ ытла.\n\nМалтан вунӑ тенкӗ ҫеҫ илеҫҫӗ-ха вӗсем. Пӗрре ӗҫмелӗх. «Лартса килнӗшӗн». Унтан ҫирӗм...\n\nТата темиҫе ҫамрӑк пырса хутшӑнать.\n\nӖҫсен-ӗҫсен, юлашки укҫине те «ахаль» хӑварас килмест вӗсен. Пайлаҫҫӗ пӗр-пӗрин хушшинче. Идриса - «аслине» - ытларах параҫҫӗ, ыттисене - хӑюлӑхне кура. Укҫа хуҫине ҫӗре илсе пӑрахаҫҫӗ. Иртен-ҫӳренсем ҫаратса кайнӑ пек пултӑр тесе. Идрис ун кӗсйине тавӑрса хӑварма та манмасть. Сӑмах халӑх хушшине тухасран хӑрамаҫҫӗ. Халӑх хушшине тухсан та, ялтан тухмасть кунта сӑмах. Пӗр-пӗрне хӳтӗлеме пӗлеҫҫӗ ку ялти ҫынсем.\n\nШӑп килӗсене саланмалла тенӗ чух кӗтмен харкашу тапранса каять. Пӑлхав пуҫлать Уҫҫа. Хӑйӗн тӳпине вӑл сӗтел ҫине кӑларса вӑркӑнтарать: кирлӗ мар мана вӑрланӑ укҫа! Килӗшеҫҫӗ унпа. Юрать, теҫҫӗ. Тархасшӑн. Вӑл укҫана та вӑр-вар ҫеҫ пайласа яраҫҫӗ. Каламасӑрах паллӑ пулсан та, сых ятне асӑрхаттаран пекки тӑваҫҫӗ.\n\n- Эсӗ никама та шарламастӑн, паллах.\n\nСовет шкулӗнче вӗреннӗ, совет ҫарӗнче пулнӑ ҫамрӑк ним хӑрамасӑр хуравлать:\n\n- Укҫине пӗр пус юлмиччен пуҫтарса каялла ҫын кӗсйине чиксе хумасан, ыранах милицине пӗлтеретӗп, - тет.\n\nВӑйлӑ Идрис ӑна пӗрре ҫапнипех ҫӗре ыткӑнтарса ярать.\n\n- Ну, мӗнле, халӗ те калатни-ха?\n\n- Ҫитсенех... телефонпа... пӗлтереп, - тет Уҫҫа, ҫӗртен аран тӑрса.\n\nТепре ҫапса ӳкереҫҫӗ ӑна. Тапаҫҫӗ, чышаҫҫӗ.\n\n- Халӗ мӗнле? - тет урса кайнӑ Идрис.\n\n- Пурпӗр... алап (калап), - хӑйӗннех перет чӗп-чӗрӗ юн пулнӑ Уҫҫа.\n\n...Ку инкекӗн вӗҫӗ ҫакӑн пек. Хӗненӗ ҫӗртех вилсе кайнӑ Уҫҫана Идрис машина кабинине лартать те ҫав тери хытӑ пынӑ ҫӗртен ял варрине вӑркӑнтарса хӑварать. Уҫҫа мӗнле вилнине пурте пӗлеҫҫӗ, пӗлменнисем - туяҫҫӗ пулсан та, ют ял ҫыннисемшӗн вӑл машина ҫинчен тухса ӳксе вилнӗ пулать. Ваттисен сӑмахӗ кунта ҫавӑн пек: вилни - вилнӗ, пирӗн чӗррисемпе пурӑнмалла.\n\nУҫҫана пытарма Идрис та пырать. Уҫҫан ҫамрӑк арӑмӗпе, пӗчӗк хӗрачипе пӗрле вӑл та татӑлсах йӗрет. Анчах темшӗн йӗрет-ҫке - те хӑйне айӑпласран хӑранипе, те ӳкӗннипе...\n\nҪук, айӑпламаҫҫӗ ӑна. Тивмеҫҫӗ.\n\nЯл ӳчӗ ҫинчи ҫак вӗри суран паян кунчченех уҫҫӑн тӗлкӗшсе тӑрать. Тепӗр тесен, вӑл кӑна-и унта...\n\nҪапла, тӗлӗнмеҫҫӗ ку ялта Идрис пеккинчен. Кирек мӗн пултӑр та, сасси-хури часах йӑмтӑр теҫҫӗ. Ютта кӑларма юрамасть - \"ваттисем хушман\". Алӑ хуҫӑлсан, алса ӑшне чикнӗ, пуҫ ҫурӑлсан, ҫӗлӗк ӑшне. Ҫынни ытла тарӑхтарса ҫитерсен ҫеҫ ӑна ушкӑнпа тытса вӗтнӗ. Е ялтан кӑларса янӑ. Ку чи йывӑр айӑплав пулнӑ. Тӳре-шарана пӗлтермен. Нихҫан та. Ним пулсан та. Тӳре-шарапа пӗр хутчен ҫеҫ калаҫнӑ вӗсем яла мӗн те пулин илме, мӗн те пулин тӑпӑлтарма килсен. Ытти чухне ял-йыш вӗсене «асӑрхаман», ҫук пекех шутланӑ.\n\nКам та пулин нушана кӗрсе ӳксен, ӑна халӑхпа пулӑшнӑ - ниме тунӑ, укҫа е тырӑ пуҫтарса панӑ (паллах, пуринчен ытла хӑй пеккисем), вӑрӑпа тытӑнсан, йышпа пуҫтарӑнса ҫӑлӑнмалли май шыранӑ. Кашни этем ял халӑхӗшӗн ответлӑ пулнӑ, ял халӑхӗ кашни уйрӑм ҫыншӑн ответ тытнӑ.\n\nПурнӑҫ ҫапла вӗрентнӗ вӗсене. Пӗрне-пӗри хӳтӗленипе ҫеҫ вӗсем пуҫӗпех пӗтмен. Хӑйсен йӑли-йӗркисене, чӗлхине, культурине сыхласа хӑварма пултарнӑ. Сахал-и ку? Уншӑн вара, тӑшманӗнчен хӳтӗленсе, пуҫне ҫунатти айне чикекен страус евӗр пулнине те, ытти хӑш-пӗр айӑпсене те каҫарма юрать, тесе ҫыртӑм та эпӗ шухӑша кайрӑм. Юрать-и каҫарма? Ҫынна вӗлернине, сӑмахран. Е вӑрӑ тунине. Ӗлӗк, тен, юранӑ та пуль, халӗ, пирӗн саманара, юрамасть!\n\nКу ял мӗн Октябрь революцичченех тӗне кӗмесӗр тытӑнса тӑма пултарнӑ сайра чӑваш ялӗсенчен пӗри. Ячӗ те ун хӑйне майлӑ - Тӑванкасси. Пысӑк, пуян ял. Темиҫе урам... Шоссерен пӗр ҫухрӑмра курӑнса ларать. Юнашарах тата темиҫе чӑваш ялӗ - Ҫӗн Пукаш, Кив Пукаш, Мӑрсиел...\n\n1871 ҫулта пуҫласа Тӑванкассине пырса курни чӑваш халӑхне ҫутта кӑларакан И.Я. Яковлева - ун чухне Хусан университечӗн студентне - Колумб Америкӑна уҫнинчен те кая мар тӗлӗнтерсе янӑ: «Сделал важное открытие, которое, как я полагаю, немногим менее удивило и поразило меня, чем открытие Америки Колумбом», - тенӗ И.Я. Яковлев. Малалла вӑл ҫапла ҫырса кайнӑ*: \"Я открыл (впрочем, не излишне наперед вас предупредить, что открытие это скорее было, так сказать, субъективное, открытие собственно по отношению ко мне), - я открыл, говорю, целую деревню, числом до 400 душ, где от мала до велика отпали от христианства** и присоединились к магометанству*** Деревня эта... населена чисто чувашами и находится на весьма важном пункте... Отсюда происходит вся пропаганда и антихристианское влияние на другие чувашские местности двух уездов. Чуваши здесь весьма богаты, многие в этой деревне имеют по нескольку тысяч. Чуваши Туванкасов, крещенные насильственно в 1851 году по распоряжению тогдашнего удельного управляющего Глинки, сделались в настоящее время отъявленными врагами христианства. Спустя несколько лет после крещения они, прежде мирные, мало-помалу переменили свой национальный костюм на татарский и на головы надели чаплашки. Местное духовенство отступилось от них совершенно и игнорирует их отпадение, - поэтому, я думаю, что даже архиерей едва ли знает об этом факте. Впрочем, что они в состоянии сделать. Священник не имеет права в этой деревне показаться. Я был в гостях у одного богатого чувашенина****, который считается нововодом в деле отпадения. Он принял меня сначала весьма радушно, но потом, когда разговор коснулся религии, беседа наша сделалась натянутою, и я поспешил удалиться. Под конец чувашенин принял меня за подосланного чиновника, только их приводило в сильное недоумение то, что я хорошо говорю по-чувашски\".\n\nКу - ҫӗр ҫул ӗлӗкхи Тӑванкасси. Халӗ мӗнле-ши вӑл.\n\nЭ, чимӗр-ха. Тӑванкассинче И.Я. Яковлев мӗнрен тӗлӗнсе хытнине пӗлтӗр-и эсир? Ҫук, ҫырман вӑл ун пирки. Халапҫӑсен пулать ун пекки час-час. Ахлатаҫҫ вӗсем, хӑлаҫланаҫҫӗ, анчах итлесе ларакан нӳ те тумасть, курмасть тӗлӗнмеллине. Хӑй мӗнрен тӗлӗннине каласа, кӑтартса параймасть халапҫӑ. Тепӗр чухне тӗлӗнмелли ҫукран та килет пуль вӑл. Анчах Иван Яковлевичӑн пулнӑ, пулнӑ каласа памалли. Вӑл чӑнах та тӗлӗнсе хытса тӑнӑ, сисӗнет ҫакӑ. Кӗске ҫырура вырӑн ҫитмен пулас. Ҫыру тӗллевӗ те урӑх пулнӑ ун.\n\nЭп пӗлекен ытти ялсенчен нумай енӗпе уйрӑм Тӑванкасси. Пӗр пекки ҫинчен каламастпӑр - паллӑ вӑл. Пӗтӗм ҫӗрти пекех, кунта та колхоз. (Чӑн, кӑштах каярах юлса чӑмӑртаннӑ, ҫапах - чӑмӑртаннӑ, ҫирӗпленсе ҫитнӗ). Машинӑсем ӗҫлеҫҫӗ. Электричество пур. Радио. Телевидени. Телефон...\n\nЫтти енчен ялсен, ҫынсен ячӗсенчен пуҫласа йӑла-йӗркесем таранчченех урӑхла кунта. Урӑх тӗнче. Хӑйсен ял пуҫӗсем, хӑйсен саккунӗсем пулнӑ вӗсен. Пуҫлӑхӗсем, «патшисем» халь ҫук. Анчах йӑлисем, хут ҫине ҫырӑнман саккунӗсем тӑрса юлнӑ. Хӑш-пӗр йӑлисем тепӗр чухне йӑларан та ҫирӗпрех-и тен...\n\nКунти ҫынсен хӑйсен паттӑрӗсем, хӑйсен тӑшманӗсем пулнӑ. Юман ятлӑ ҫын ҫинчен, сӑмахран, ватти-ветти те пӗлет. Халӑха ирӗксӗрлесе тӗне кӳртме пынӑ пупа вӑл шывлӑ стайкка (шетник) тӑхӑнтарса янӑ, тет. Патихан карчӑк та хӑюлӑхӗпе арҫынсенчен ирттеретчӗ теҫҫӗ.\n\nКу ялта пӑртак пурӑнсан, эпӗ чӑваш ячӗ историре мӗншӗн хут ҫине час ҫырӑнса юлманнине ӑнлана пуҫларӑм. Ача ҫуралать-и кунта, вилет-и - тӗнчери халӑх шутне ӳстермен те вӑл, чакарман та. Ҫыртарман ӑна хут ҫине. Пӗр енчен, «чаплах мар» пулнӑ чӑваш ячӗ. Саккунпа килӗшсе тӑман ят. Тепӗр енчен, чӑвашӗсем хӑйсем те тӳре-шарасене «асӑрхасшӑн» пулман. Эсир - хӑвӑр, эпир - хамӑр, тенӗ майлӑ пурӑннӑ. Ку вӑл сӳрӗк хирӗҫӳ пулнӑ.\n\nЯтсем тӗне кӗмен чӑвашсен темиҫе пин - кирек хӑшне суйласа ил. Пур ашшӗ-амӑшсем пекех, Тӑванкассисем те хӑйсен ачисене «хитре» ятсем пама тӑрӑшнӑ. Пӗр сӑвӑҫӑн амӑшӗ, сӑмахран, Шеркун ятлӑ пулнӑ. Виҫпӳрте вӑл Тӑванкассинчен качча пынӑ. Унӑн аппӑшӗ те, сӑвӑҫӑн мӑнаккӑшӗ, ҫав майлах - Шеверпи ятлӑ пулнӑ. Ӗнчӗпексем кунта ик-виҫҫӗн - хӗрсем, арӑмсем. Кӗмӗшпе Сӗверхине пӗрер ҫеҫ.\n\nАкӑ арҫын ячӗсем - Сарука, Мӑрси, Элентюк, Имет, Велюш, Лискав... (Вунӑ ҫынтан пӗри мар пулсан та, нумай кунта Лискавсем, - вырӑссем хушшинчи Ивансем пекех. Григорий Григорьевич Лисков композитор хушамачӗ те ҫав ятран пулнӑ. Ялти тӗп ячӗ ун - Хемит.\n\nЯт хума ҫӑмӑл пулнӑ. Килӗшнӗ ята туп та тӑванусене пӗлтер, ӗҫкӗ ӗҫ - ял ҫине кайрӗ те. Анчах ӳссен хут тутарасси темрен те йывӑр пулнӑ.\n\n- Эсӗ кам? - тӑрахланӑ йӗкӗтрен кантуртисем. Яланхи пек «шӳт» пуҫланасса кӗтсе вӗсем малтанах шӑлӗсене йӗрсе ларнӑ.\n\nҪамрӑк хӑйӗн ятне каланӑ.\n\n- Эптюш, плхарути. Ӗҫлеме кайма хут кирлӗ.\n\n- Эсӗ кам теҫҫӗ сана. Кам эсӗ?\n\n- Ну, ӗнтӗ ара... Этем ӗнтӗ, хӑвӑр куратӑр.\n\n- Этем. Нимле этем те мар эс, мӗлке кӑна. Суя кӗлетке. Катемпи! Этемсене пурне те хут ҫине ҫырнӑ. Вӗсем ӑҫта ҫурални, миҫери, ашшӗ-амӑш кам иккенни паллӑ. Санӑн нимӗн те ҫук. Пфу кӑна эс. Сывлӑш! Вӗрсе кӑларнӑ та вӗҫсе кайнӑ. Ҫук эсӗ тӗнчере! Сана ҫак самантра ҫапса пӑрахсан та ним пулмасть.\n\nСурӑх е укҫа парсан ҫеҫ чӑваша «ҫын шутне» кӗртнӗ: хут ҫине ҫырса хунӑ. Анчах хӑйӗн ячӗпе мар, тӗне кӗнӗ ятпа: Ильмук вырӑнне пӗр-пӗр Илле е Иван, Яшмул вырӑнне Якку. Манпа халь пӗве хӗрринче калаҫса ларакан урасӑр Ухливанов Пиппав та паспорт тӑрӑх Петр Леонтьевич шутланать. Хушамачӗ ҫеҫ ун улшӑнман. Уншӑн та пулин тавтапуҫ тет кӑмӑллӑ Пиппав Ликович.\n\nСовет ҫулӗсенче Тӑванкасси ҫыннисен паспорт илес тесен медицина комиссине кӗме тивнӗ. Салтака илнӗ чух та ҫын миҫерине ҫапла пӗлнӗ.\n\nТакам та йӑнӑшма пултарать. Тухтӑрсем те йӑнӑшкаланӑ: шӑллӗ пиччӗшӗнчен маларах салтака ӑсаннӑ* теприсем салтака кайма вӑхӑт иртиччен те \"ҫитӗнсе ҫитеймен\"...\n\nТӗне кӗмен чӑвашсем... (Ку пуплеве икӗ тӗрлӗ ӑнланма пулать: тӗне кӗмесӗр юлнӑ чӑвашсем тесе те, чӑвашсем тӗне кӗме килӗшмен тесе те. Апла та, капла та тӗрӗс. Хальхинче сӑмах тӗне кӗмесӗр юлнисем пирки пырать).\n\nХалӑхсем тӗрлӗ чӗлхепе калаҫни, тӗрлӗ турра пуҫҫапни, тӗрлӗрен шухӑшлани патша тытӑмӗшӗн карланкӑ патӗнчи ҫӗҫӗрен те хӑрушрах туйӑннӑ. Патша йыттисен ӗмӗчӗ ҫапла пулнӑ: пурин те пӗр чӗлхепе калаҫмалла - вырӑсла, пӗр евӗрлӗ шухӑшламалла - православи хушнӑ пек, пуҫа пӗксе ҫӳремелле. Акӑ лайӑх ҫын: ӗҫлетӗр вӑл, анчах ан шухӑшлатӑр. Шухӑшласси, тур хӑтартӑр та, мӗн те пулин сӳтсе явасси - ятарласа хушнӑ е уйӑрса лартнӑ ҫынсен ӗҫӗ. Ытах, шухӑшлама та юрӗ, чарӑнаймастех пулсан, атя, урлӑ-пирлӗ шухӑшласа пӑхтӑр, анчах хуллен, хӑй ӑшӗнче, ҫын илтмелле мар. Паллах, тӳлеккӗн калаҫма та юрать, анчах тӳре-шарасем ӑнланмалла - вырӑсла.\n\nТӗне кӗртес, халӑхри хирӗҫӳ туйӑмне пӗтерес, антарса хурас тесе мӗнле кӑна асаплантарман пуль чӑвашсене! Штраф ҫине штраф хунӑ - выльӑх мурӗ пуҫланнӑшӑн, ҫын пӳкле вилӗмпе вилнӗшӗн, каланине вӑхӑтра итлеменшӗн, киремете парне кӳнӗшӗн... темшӗн те, темшӗн те. Суха тӑвакана лашисене тӑварттарса лава янӑ. Тӗне кӗнӗ кӳршӗ ялсен куланайне, туймаккине, чиркӳ укҫине вӗсем ҫине хурса юлашки тырӑ пӗрчи юлмиччен шӑлса кайнӑ, пур-ҫук выльӑхне туртса илнӗ, кӳршӗ ялсемпе вӑрҫтарнӑ. Упшур командисем пырса, киремет йывӑҫӗсене касса пӗтернӗ, чӳк тумалли вырӑнсене вараланӑ. Хӑюллӑ ҫынсене Ҫӗпӗре тыта-тыта ӑсатнӑ...\n\nАкӑ 1749 ҫулхи пӗр документра мӗн каланӑ: «Многие обыватели от двойного платежа, во-первых, - настоящих подушных денег, рекрутских и складных денег, а потом - второго расположения за новокрещен подушного сбора, которого забирается с них малым менее того положенного настоящего (основного) в год подушного оклада, а паче от платежа за тех, всех старых от взяться Казани и новых новокрещен рекрут - пришли в самую крайнюю скудость и разорение, ибо вышеозначенный двойной платеж за себя и за новокрещен подушных денег и рекрут и в рекрутские складки складных денег едва не все те обыватели, отстающие в неверии, все свое имение, скот и хлеб, токмо наличный, заготовленный себе впредь на пропитание, но и многие же и в земле посеянной уже продали* многие ж, распродав хоромное строение, домов своих лишились и за взятием взаем денег пошли многие ратных чинов к людям в работы, а другие детей своих заложили. К тому и ныне рогатый скот едва не весь выпал и за тем осталось скота в редких деревнях по малому числу и от такого великого изнеможения некоторые разбежались и пропали безвестно, и из тех иноверцев, пришедших в крайнее изнеможение и скудость, также многие иноверцы из написанных по нынешней ревизии померли»...*****\n\nЯланах пӗр юрӑ илтӗннӗ: «Юлашкисем те вилсе пӗтиччен парӑнӑр, христиан тӗнне йышӑнӑр, хӑвӑрӑн пурнӑҫ йӗркине, уявӑрсене, чӗлхӗре манӑр, вара сире сӑвап пулӗ, пӗр-ик ҫул хушши куланай илмӗпӗр, ҫиелтен укҫа та парӑпӑр».\n\nСлонпа кӑткӑ «кӗрешни» пулнӑ вӑл. Вӑйли вӑйсӑррине пусмӑрлани. Патша тытӑмӗ - слон, тӗне кӗменни - пӗчӗкҫӗ кӑткӑ.\n\nКам ҫӗнтересси, таптаса лапчӑтса каясси куҫкӗретӗнех курӑнсан та, харсӑр кӑткӑ парӑнман. Тӑванкасси ҫыннисем тӗне кӗме килӗшмен, хӑйсен йӑли-йӗркисене те пӑрахӑҫламан, чӗлхине те манман. «Эпир атте-аннене хисеплетпӗр, ҫавӑнпа вӗсем вӗрентнӗ чӗлхене те, вӗсем панӑ ятсене те манмастпӑр», – тенӗ. Пысӑк инкек пӗчӗк инкекрен, пысӑк ултав пӗчӗк ултавран пуҫланать. Паян ҫын хӑйӗн тӑванӗсене, ашшӗ-амӑшне хисеплеми пултӑр, вӗсен ячӗсене улӑштартӑр, унтан тӑван тавралӑхне, тӑван халӑхне, унӑн чӗлхине тиркеме тытӑнтӑр. Малашне мӗн пулӗ ун пек ҫынран.\n\nХӑйсен ятне ҫухатас марччӗ, хӑйсем тӗллӗн пурӑнасчӗ тесе, тем те хӑтланнӑ кунти чӑвашсем. Кӗрешнӗ. Кантуртисене, ҫӑткӑн пупсене ялтан хӳтере-хӳтере кӑларса янӑ. Тӑванкасси ҫыннисен тӑхӑмӗсем ӗлӗк Пугачев ҫарне те хутшӑннӑ пулас. Сехре хӑпартмӑш хура юпана революциччен Тӑванкасси хапхи умне ахальтен лартман пуль ӗнтӗ. Астӑвӑр, кунта вӑрӑ-хурахсем пурӑнаҫҫӗ, тенине пӗлтернӗ вӑл. (Ун чухне пӑлхавҫӑсене ҫапла каланӑ).\n\nАнчах чул тӑва ҫамкапа ҫапса ишме ҫук. Пурӑнасси вилессинчен йывӑр пулсан та, камӑн та пулин ачасене пӑхса ҫитӗнтерсе вӗсене халӑхӑн чунне, ун культурине памалла пулнӑ. Сӑмахран, тӗррине. Каярахпа пӗтӗм культурӑллӑ тӗнчене тӗлӗнтерсе пӑрахнӑ вилӗмсӗр пуянлӑха. (Чӑваш тӗрри пирки пӗр вырӑс писателӗ ҫапла ҫырнӑ: «Это - огненно-южные узоры, похожие на древние орнаменты, бессмертные, известные во всем мире чувашские вышивки «терэ», которые, подобно произведениям египетских мастеров, рассчитаны на то, чтобы прожить века».\n\nТата чӑвашсен вӑййи-юррине илӗр. Ӑна килес ӑрусем валли усрамалла мар-и? «Чӑвашсен юрри те, вӑййи те тӗлӗнмелле илемлӗ-мӗн, ун пеккине эпӗ тӗнче тавра темиҫе хут ҫаврӑнса та урӑх ниҫта та илтмен те, курман та. Ну, ӗнтӗ сцена ҫинче, балетра, оперӑра куркаланӑ. Анчах ку балет та, опера та мар-ҫке, ку вӑл чӑн пурнӑҫ»Ӗ – тесе ҫырнӑ иртнӗ ӗмӗр вӗҫӗнче чӑвашсен ҫывӑхӗнче пурӑнакан Н.Г. Гарин-Михайловский писатель.\n\nПирӗн юмах-халап тата. Чӗнтӗрсем. Халӑхӑн ыр кӑмӑлӗ, ӗҫченлӗхӗ, кӳршӗ халӑхсемпе туслӑ пурӑнма тӑрӑшни... Э, темӗн те пулнӑ пирӗн пулас ӑрусем валли упрамалли. Ҫавӑнпа урнӑ упана хирӗҫ ҫара алӑпа хӑлаҫланнипе ҫеҫ юраман ҫав. Вӑхӑт-вӑхӑт чееленме, ухмаха пеме, пуҫа чиксе ҫӳреме те тивнӗ. Ютта тухнӑ чух чӑваш ҫынни тӗрӗллӗ кӗпи-тумтирне тӑхӑнман. Вӑййи-юррисене те ҫӗрле ҫеҫ ирттернӗ. Ӗҫме-ҫиме пур ҫӗртех хытса пурӑнма хӑнӑхнӑ - ыран тем пулас-килесрен асӑрханнӑ. Савӑнӑҫне ҫынна кӑтартман. Ытларах аслӑ ҫулпа мар, вӑрттӑн сукмаксемпе утнӑ. Тӳре-шарине часрах ҫырлахтарас тесе мӗн ыйтнӑ - ҫавна панӑ. Ӗҫтернӗ, ҫитернӗ. Атя, кӳп, анчах часрах тухса кай... Ырӑ сунса сӑйланӑ пек пултӑр тесе, «хӑнапа» пӗрле хӑй те ӗҫнӗ. Паян та ӗҫнӗ, тепӗр кун та. Пӗлтӗр те, кӑҫал та. Ашшӗ те ӗҫнӗ, кайран ывӑлӗ те тиркесе тӑман. Тен, эпир эрех-сӑрана ҫӑвар умӗнчен тӗксе яманнин сӑлтавӗсенчен пӗри ҫавӑнта.\n\nЧӑвашра усаллине ҫеҫ шыракансем вара савӑнсах элекленӗ. Вӗсен нимӗн те ҫук тенӗ - ни пуянлӑх, ни культура. Иртни - мӗн те пулин пулнӑ пулсан та - истори сӗмлӗхӗнче ҫухалнӑ-мӗн. Пуласлӑх - ҫук вӗсен...\n\nТӑванкасси ялне пуҫласа яракансем кунта пирӗн хальхи Комсомольски районӗнчи Асанкассипе таҫти темӗнле Хӑвай ялӗнчен куҫса килсе ларнӑ теҫҫӗ. (Хӑвай ялӗ тени Тӑвай пулма пултарнӑ). Виҫӗ кил... Кив вырӑнта пурнӑҫ хӗсӗнсе ҫитсен, кил-йышӗпех тухнӑ та тарнӑ ялтан ҫӗрле. Патӑрьел, Шӑмӑршӑ урлӑ ҫакӑнти хура тӑпраллӑ ҫӗр ҫине килсе тымар янӑ. Тӑванкасси историне тӗпчекен пӗр журналист каланӑ тӑрӑх, ку ял вунҫиччӗмӗш ӗмӗрте (пин те ултҫӗр темиҫемӗш ҫулсенче, тен, ӗмӗр вӗҫнерех.) пуҫланнӑ-мӗн.\n\nХалӗ Тӑванкассинче икҫӗре яхӑн кил, пине яхӑн ҫын пурӑнать теҫҫӗ.\n\nТӗне кӗме ӳкӗтлени, илӗртни, хӑратни, хырҫӑ-марҫӑсемпе штрафсем тӳлеттерсе тинке кӑларнисем т. ыт. те, пулӑшманнине кура, удельнӑй кантурӑн управляющийӗ Глинка 1851 ҫулта Тӑванкассине ҫар командипе хупӑрласа илнӗ пулнӑ. Халӑха татӑклӑнах ҫапла пӗлтернӗ: «Е тӗне кӗме килӗшетӗр, е сирӗн тӑршшӗпех салтаксене тӑрантарса пурӑнма тивет, мӗншӗн тесен, сире тӗне кӗртсе пӗтермесӗр эпир ниҫта та каймастпӑр»...\n\nПӗр эрне иртнӗ ҫапла. Вунӑ кун. Ик эрне! Ӗҫсӗр аптранӑ салтаксем ял тӑрӑх сулланса ҫӳренӗ, чӑх йӑвисене, нӳхрепсене тасатнӑ. Ӑна пар, кӑна пар, тенӗ. Паманнине туртса илнӗ.\n\nӖҫҫи вӑхӑчӗ ҫитнипе ҫеҫ ялти ватӑсем канашлӑва пуҫтарӑннӑ.\n\n...Ял халӑхӗ Хӗрҫырми хӗрринче кӗпӗрленсе тӑрать. Вӗсенчен инҫе мар - салтаксен ушкӑнӗ. Старостӑпа темиҫе салтак килӗрен киле чупаҫҫӗ. Анчах усси ҫук пулас - пытанса ларнисене пӗрне те тупаймаҫҫӗ. Вӗсене тупма мар, ушкӑнти халӑх та чакнӑҫем чакса пырать.\n\n- Тытӑн! - теҫҫӗ вара пупа. Лешӗн йӑлтах хатӗр. Чӑвашсем еннелле шикленсе пӑхкаласа вӑл ӗҫе пикенет. Ик-виҫӗ ҫынна кӑларать те сире Иван ят хутӑм, тет, теприсене Василий, Петӗр, Ҫитӑр, Варсонофий... Такӑнкаласа, сӑмахсене сиктере-сиктере хӑварса, пуп требник тӑрӑх кӗлӗ мӑкӑртатса вулать:\n\n\"- Изжены... изжени то-есть... из него... лукавого... по наущению диаволю!..\"\n\nТиечӳкӗ ҫӗнӗрен тӗне кӗртнисене ҫырса пырать.\n\nИрхине ҫӑткӑн команда аранах ялтан тухса каять. Вӗсем курӑнми пулнӑ-пулман ял ҫыннисем пупа хваттерӗнчен сӗтӗрсе кӑлараҫҫӗ. Пӗр тирӗк хӗрес - ӗнер хӑйсен мӑйне ҫакнӑ хӗрессене пуҫтарса тыттараҫҫӗ те ӑна, урам варрине майлаштарса тӑратса, ҫӑпаталлӑ урапа кутӗнчен тапса сиктереҫҫӗ. Тепре килсен, хӑвна шыва чӑмтаратпӑр, теҫҫӗ.\n\nТӗне кӗресси ҫапла вӗҫленет тӑванкассисен. Кайран та нумай сӗтӗреҫҫӗ вӗсене, анчах ним туса та парӑнтараймаҫҫӗ.\n\n…Идрис вӗлернӗ иккӗмӗш ҫын Микулай ятлӑ пулнӑ. Ку та ҫамрӑк ҫын, хальтерех ҫеҫ авланнӑскер.\n\nВутӑ вӑррине Идрис урӑх ҫынпа кайма калаҫса хунӑ-мӗн те, лешӗ, Идрис ӳсӗррине кура (вӑл ӳсӗр чух мӗнлине кунта пурте пӗлеҫҫӗ), тата вӑхӑт та каҫа хирӗҫ тесе, унпа ҫула тухма хӑранӑ. Ҫук, пымастӑп санпа тесе пат татса каламан вӑл, темӗнле урӑх сӑлтав тупнӑ.\n\nТалӑрса ҫитнӗ Идрисӑн вара ирӗксӗрех ун юлташӗпе Микулайпа кайма тивнӗ. (Вӗсен пӗр ҫын валли вутӑ кӳрсе килмеле пулнӑ). Вутӑ ыйтакан ҫыннӑн хӗрне кабинӑна, Микулая кузова лартнӑ та вӑл (тепӗр вариантпа - вырттарнӑ) машинине кӗрлеттерсе хускатнӑ. (Микулай пирки ял ҫынисем икӗ тӗрлӗ калаҫҫӗ: пӗрисем вӑл хӗрӗнкӗччӗ теҫҫӗ, теприсем ӳсӗрех пулнӑ теҫҫӗ. Ҫавӑнпа ун арӑмӗ Идриса ҫапла ӗнентернӗ пулать: вӑрмана ҫитиччен урӑлать вӑл, тенӗ тет.)\n\nУрӑ чух та урнӑ пек ҫӳрекенскер, халӗ тарӑхнӑ Идрис машинине мӗнле чуптарнине каламасӑрах чухлама пулать...\n\nМалалли ӗҫсене эпӗ икӗ ҫӗрте икӗ тӗрлӗ илтрӗм. Пӗри ҫакӑн пек. Ҫул ҫинче машинӑн хыҫалти борчӗ уҫӑлса кайнӑ-мӗн. Кузовра ҫапӑнса пырса тӑнсӑр пулнӑ Микулай машина хӗррине шуса ҫитнӗ те ҫӗре персе аннӑ...\n\nТепӗр вариант. Тӗттӗм уя вӗри машина йӗтре пек ҫурса пынӑ. Е ӗнтӗ вӑл пӗр-пӗр йывӑҫ ҫине пырса тӑрӑнать е хир варринчех сӗлӗ пӗрчи пек саланса ыткӑнать. Апла та, капла та вилӗм тесе, ҫул ҫинче тӑна кӗнӗ Микулай хыҫалти бортне уҫать те сике парать...\n\nСинкерлӗ ӗҫӗн юлашки пайӗ пурин те пӗр пек. Ӗҫ ырӑ маррине сиссе, машинине чарнӑ иккен Идрис. Пӑхнӑ - ҫук Микулай. Ҫӗрти-ҫӳлтине каласа вӑрҫса, машинине каялла ҫавӑрнӑ. Инҫе те каяйман - ҫын ҫине пырса кӗнӗ. Те курмасӑр, те курсах. Чылайӑшӗ курса теҫҫӗ. Хӑех вӑл ӑна больницӑна хурса кайнӑӗ Микулай тӑна кӗмесӗрех вилсе кайнӑ. Ҫаксене пурне те курса тӑнӑ кабинӑри хӗр килне ни чӗрӗ, ни вилӗ таврӑннӑ.\n\nВӗҫӗнче ҫакна каламалла. Чӑвашра халӑх ҫинче саспа макӑракан ҫук та пулӗ. Вӑтанаҫҫӗ. Ик-виҫӗ ҫын хуйхипе пӗтӗм халӑха хурлантарни ырӑ мар теҫҫӗ. Хӑйсен инкекне вӗсем хӑйсен чӑтса ирттермелле. Тепӗр енчен тата вилнӗ ҫынна асӑннӑ каҫ макӑрма та хушман. Вӑл йӑлана ӗлӗкхи чӑвашсем юпа ҫинче ларни, тенӗ. Тӑванӗсем макӑрсан, вилнӗ ҫын та макӑрать, тенӗ. Ҫавӑнпа чӑваш ҫынни пуҫне чикнӗ те шӑпӑрт пулнӑ. Пӗлменни ӑна сисӗм-туйӑмсӑр ҫын теме пултарать.\n\nМикулая пытарнӑ чухне Идрис пӗтӗм халӑх илтмелле кӑшкӑрса макӑрчӗ тет. Тӗнчере пӗр вӑл ҫеҫ шелленӗ тейӗн мӗскӗн йӗкӗте.\n\n\n\nТахҫантанпах эпӗ тӗне кӗмен чӑвашсен ӑҫ-пуҫне (психологине) ӑнланса илме тӑрӑшаттӑм. Христос тӗнне йышӑнас мар тесе кӑна Тӑванкасси ҫыннисем икҫӗр ҫула яхӑн асап чӑтса пурӑннӑ. Мӗншӗн. Мӗне курса. Мӗн хӑратнӑ вӗсене ҫав териех. Мӗн панӑ вӗсене вӑй ҫавна тӳссе ирттерме. Мӗн хавхалантарса тӑнӑ. Хӑйсем тӗрӗс тунине ӗненни-и? Ачисем кӑмӑллӑ ӳснине курни-и? Тен, мӗне те пулин ӗненни тӗне кӗме чарнӑ вӗсене.\n\nВӗсем «ҫӗнтернӗ) - христиан тӗнне йышӑнман.\n\nТӑванкассине кайнӑ чухне мана тепӗр ыйту та интереслентернӗччӗ. Нумай асап тӳснӗ ҫын ялан тенӗ пек хаяр, кутӑн, кӗске турталлӑ пулать теҫҫӗ. Кунти ҫынсем - сакӑрвун тӑватӑ ҫулхи Улентей мучи, унӑн ашшӗ Ухваньтюк, Ухваньтюк ашшӗ Ситул тата ыттисем курман хӗн-хур тӗнчере те юлман пуль. Апла вӗсем пурте пурнӑҫ таптаса кайнӑ ҫынсем пулнӑ-ши. Кашни суярах - пин пайӗнчен пӗр пайӗ те пулин - чӑнни пур тенӗ. Эппин ҫак ҫӳлерех асӑннӑ «теорире» те кӑштах тӗрӗсси пур-тӑр. Ӑна эпӗ пуҫтах Идрис историйӗнче те туйса илнӗччӗ.\n\nТӑванкасси ҫыннисем ӗлӗк мӗнле пулнине хальхи стариксем ҫине пӑхса та чухлама пулать. Акӑ вӗсем, ялти хисеплӗ ватӑсем: Сидулов Улентей, Кузнецов Идрис, Улендеев Туктамӑш, Абдульменова Арихве, Аюгов Питтимӗр, Эндиаров Метер, Иеливанов Тимӗр, Сайдяшев Элентюк. (Ятсене Улендей, Медер, Элендюк тесе вуламалла. Ҫамрӑксем хӑйсем пӗлмен «Таната», «эпи карчӑк» сӑмахсене вырӑслатса «танатта», «эппи карчӑк» тесе вуланине эпӗ темиҫе те илтнӗ).\n\nУлентей мучи эп пынӑ чух пахчара тӑрмашатчӗ. Карта тулашӗнче пӗр кӗтӳ ача тӗмсӗлсе пӑхса тӑрать - ачин ачисем, вӗсен тусӗсем. Ячӗшӗн ҫум курӑксене таткаласан, старик вӑрӑм арки ҫине кишӗрпе ҫарӑк тултарчӗ те карта патне пырса тӑсрӗ. Ачасем пӗр самантра тасатрӗҫ ун кипке аркине...\n\nПӳртелле утнӑ чухне те Улентей мучи хыҫҫӑн чӑх-чӗп, йытӑпа кушак кӗпӗрленсе пычӗҫ. Ахӑртнех, ача-пӑчапа та, кайӑк-кӗшӗкпе те, ӳсен-тӑранпа та ватти пӗр чӗлхе тупма пӗлет пулас. Темӗн пӗрлештерсе тӑраканни пур вӗсене.\n\nПӳртре вӑл сӗтел патне пуканпа ларчӗ, мана хӑйне хирӗҫ лартрӗ. Кӳпшекрех питлӗ ҫирӗп ватӑ вӑл. Ҫаплах чӗрӗ пӑхкалать-ха. Иван Яковлевич Тванкасси шкулне пырса кайнине аса илет. Хура тумтирлӗ ҫӳллӗ старикчӗ, тет. Хӑй калаҫнӑ май йӑл та йӑл кулать, вӑтанса ӳсӗркелесе илет.\n\nПӗрерӗн-икшерӗн кӗре-кӗрех кӗҫ пӗр пӳрт тулли ача пуҫтарӑнчӗ.\n\nИдрис Искендерович Кузнецов вара йӑлтах урӑхла. Вӑл тӑр-пӗччен пурӑнать. Шухӑшлама пӗлекен ҫын. Екки кайнӑ чух калаҫма ӑста. Тепӗр чухне ыйтнине хирӗҫ пӗрер сӑмахӑн ҫеҫ хуравлать. Хура-шур нумай тӳснӗ. Тен, ун тӳпине ытлашширех те лекнӗ пуль. Анчах ҫынсене нимӗн те систермест. Виҫӗ вӑрҫӑ витӗр тухнӑ вӑл! Пӗрне-пӗри кӑмӑлласах тахҫанччен калаҫса лартӑмӑр эпир Идрис Искендеровичпа унӑн пӗчӗк пӳртӗнче, юлашки вӑрҫӑри ӗҫӗсемшӗн вӑл орден илнине мана хӑй мар, колхозри парти организацин секретарӗ Николай Иванович Кураков пӗлтерчӗ. Килӗнче калама ҫук пысӑк инкек пулнине те эпӗ Идрис Искендеровичран мар, ял ҫыннисенчен илтрӗм. Шӑкӑл-шӑкӑл пурӑннӑ карчӑкӗ кӗрхи йӗпе-сапара ял вӗҫӗнчи тарӑн ҫырана кайса вилнӗ-мӗн ун.\n\nИнкек - иккӗн, усал - улттӑн килет тет. Малюк аппа вилни ҫитмен, унӑн йӑмӑкӗ Матря Хӗрҫырминче путса вилнӗ. Унтан Малюкпа Матря йӑмӑкӗ Мерчук хӑйне хӑй пӗтернӗ.\n\nКу иккӗшӗ килти ҫынсем мар, ҫапах ҫывӑх тӑвансем-ҫке.\n\nПурнать халь старик пӗр-пӗччен, шухӑш шухӑшлать, пуҫламӑшӗ те, вӗҫӗ ун ҫук, пӗр чӑвашла кӗнекене ҫӗр те пӗрремӗш хут вулать, ман пек ӑнсӑртран пырса кӗнӗ ҫынпа калаҫать, район хаҫатне... статьясем ҫыркаласа ярать. Ҫапла, мӗн те пулин савӑнтарсан е тарӑхтарсан хаҫата ҫырать. Пурнӑҫран ним чухлӗ те сивӗнмен вӑл. Пурӑнса та йӑлӑхман. Тахҫан колхозра ветеринари фельдщерӗнче ӗҫленӗ. Хӑй ӑссӗн вӗреннипе. Халӗ пенсионер. Чӗрчунсене юратать. Хӑйсен лаши пирки вӑл мана поэма пек каласа пачӗ. Ҫынсемпе туслӑ.\n\nТен, ку ватӑсем совет ҫулӗсенче \"тӳрленнӗ\". Апла та пулӗ. Анчах пур енчен те мар пуль. Малтан та \"пӑсӑк\" этемсемех пулман-тӑр вӗсем.\n\nТӗне кӗме мӗнтен хӑранӑ-ши вӗсем тесе, эпӗ темиҫе ҫынпа та калаҫса пӑхрӑм. Пурнӑҫ курнисемпе. Акӑ вӗсен хуравӗсем.\n\n- Колхоза кӗме хӑраттӑмӑр-и? - ыйтрӗ манран лавкка хуралҫи Эптюш Велитович, вара хӑех хуравларӗ: - Хӑраттӑмӑр. Тӗне кӗме те ҫавӑн пек хӑранӑ.\n\n- Ухмах пулнӑ ҫав! - терӗ Йӑкӑш Имуллин. Хӑй вӑл «шыва кӗнӗ» ҫын. Вӑтам ҫулсенче. Вӑрҫӑран хӑрах урине ҫухатса таврӑннӑ. Сӑмахсене пат татса калаҫать.\n\n- Ытла ирӗксӗрлетчӗҫ те, ара... Мӗн кирлине ҫын хӑех ӑнланать... Ку Улентей мучи хуравӗ. Историре те ун пирки ҫакӑн пек каланӑ: «Самодержавие проводило политику насильственной русификации народов Поволжья». (\"История Чувашской АССР\" кӗнекерен). «Чуваши» кӗнекере патша правительстви вак халӑхсем тӗлӗшпе тытнӑ политикӑна тата кӗскереххӗн ӑнлантарса панӑ: «Насильственная русификация через православие»...\n\n«Русификация» сӑмаха В.Г. Егоров профессор словарӗнче «ирӗксӗрлесе вырӑслантарни (патша чухне вырӑнти нацисен культурине пусарса, вырӑс культурине (вырӑс чӗлхине, вырӑс тӗнне) сарса пыни», тесе куҫарнӑ.\n\nКунти чӑвашсем мӗншӗн тӗне кӗмесӗр юлнӑ тенине хирӗҫ шкул урамӗнчи карчӑксем мана кулкаласа ҫапла хуравларӗҫ:\n\n- Эпир вырӑссем хӑйсем те тӗне пӑрахасса кӗтсе пурӑннӑ, - терӗҫ.\n\nЧӑнах та ара. Халӗ ҫӗр ҫынран пӗри ачине тӗне кӗртет-и е ҫук-и: чӑрмавӗ те чӑрмав, тӑкакӗ те тӑкак. Ыттисем ачи ячӗсене хулара пулсан ЗАГСра, колхозра ял Советӗнче ҫыртараҫҫӗ. Тутарсен темле те, чӑвашсемпе вырӑссен ячӗсем те пӗр пек: Валерий, Светлана, Владимир... Тӗне кӗмен ятсене Тӑванкассинче халь никам та хумасть ӗнтӗ. Хуласенче ҫеҫ Нарсписем, Сетнерсем, Атнерсем тӗл пулкалаҫҫӗ. Чӑваш интеллегенчӗсен ачисем. Анчах ни Нарспийӗ, ни Сетнерӗ чӑвашла пӗлмеҫҫӗ. Ятсемсӗр пуҫне вӗсенче урӑх нимле «чӑвашлӑх» та ҫук.\n\nИртнӗ самана... Хальхи ҫамрӑксемшӗн вӑл япала юмахла ҫӗршыв пек туйӑнса тӑрать пулмалла. Ҫавӑнпа хӑш-пӗр йӗкӗтсем, йӑрӑраххисем, иртерех «ӗлкӗрнисем», вӑтам шкул пӗтернӗ-пӗтермен ӗлӗкхи пурнӑҫ ҫинчен эрешлӗ повеҫ-калавсем хывма тытӑнаҫҫӗ. Пӗлӳ «такмакӗ» хӑйсен - вырӑс авторӗсене вуласа тухнӑ ик-виҫӗ историллӗ роман. Вӗсенче хӑшӗнче те пулин чӑваша кӑтартнӑ пулсан, ҫамрӑк автор ӑна хут ҫине тумлатнӑ ҫу тумламӗ пек сарса ярса «пуянлатать». Чӑвашла вариант тӑвать. Тӗрлӗ кӗслеҫӗсем, юрӑҫӑсем, йывӑҫ ураллӑ «паттӑрсем» сике-сике тухаҫҫӗ вара. Ҫав сӑхӑ авторсенчен илтме пулать: пирӗн ахалех чӳк тума, киреметсем парне кӳме пӑрахнӑ иккен. Чӳксем, ӗлӗкхи уявсем, вӗсен шухӑшӗпе, чӑваш халӑхӗн уйрӑмлӑхне палӑртса тӑраҫҫӗ.\n\nПурнӑҫ националист пеккисем сӳпӗлтетнине те, сӳпӗлтисем ситрелнине те пӑхмасть, малаллах шӑвать. Юлашки хут аслӑ ырра хӑҫан асӑннине Тӑванкассинчи ватӑсем халь хӑйсем те астумаҫҫӗ. Ялти ачасем, шкула чупаканнисем, вӑл йӑласене пӗлме мар, сӑмахӗсене те илтмен.\n\nӖлӗкхи саманара халӑхпа халӑх хушши мар, пӑхса курӑнакан ялпа ял хушши те халӗ Шупашкарпа Владивосток хушшинчен инҫерех пулнӑ. Виҫӗ ҫухрӑм аяккарах мӗн пулнине пӗлмесӗр, кашни хӑйӗн «тӗнчипе» кӑна ҫӑрӑлса пурӑннӑ чухне ҫынсен ирӗксӗрех кам мӗн пӗлет - ҫавӑнпа ҫырлахма тивнӗ. Юрӑсем юрланӑ, вӑйӑсем вылянӑ. Кӗнчеле арланӑ, пир тӗртнӗ... Хӑйчикки тавра чыхӑна-чыхӑна ҫӑпата шаккаса ларнӑ май, ялти хыпар-хӑнарсене сӳтсе явнӑ. Эхтюк чӑххи автанла авӑтрӗ, ыррра мар пуль, тенӗ. Мӑхит ашшӗне киремет тытнӑ-мӗн - алли шыҫса тухнӑ, юмӑҫ карчӑк пӑру пусса чӳклеме хушать, тет...\n\nПӗр-пӗрин умӗнче Мӑххитсене шеллесе калаҫнӑ, ӗҫлемесӗр ирттерни хӑйне, выльӑх пуҫӗ чакни тепре, тенӗ. Ӑшӗнче хӑйсем савӑннӑ уншӑн. Ҫын ҫур утӑм - пӗр утӑм чакнӑ хушӑра, эпӗ пӑртак та пулин малалла кайӑп, тенӗ.\n\nНумай шыв юхнӑ унтанпа ҫут тӗнчере. Ҫын пурнӑҫне ҫӑмӑллатмалли машинӑсем, электричество, телефон, телеграф, самолет, кино, телевизор тата ытти пин тӗрлӗ япала шухӑшласа кӑларнӑ. Чи пахи вара - 1917 ҫулта Октябрь революцийӗ пулни, халӑхсем хушшинчи танмарлӑха пӗтерни. Ҫынсем халь ытларах та ытларах пӗр-пӗринпе хутшӑнаҫҫӗ. Чӑваш этемми мӑкшӑ, вырӑс тутар мӗнле пурӑннине курать. Мари ҫыннипе тутар, вырӑспа чӑваш пӗр заводра, пӗр стройкӑра ӑмӑртса ӗҫлеҫҫӗ. Вӗсене пӗр-пӗринчен уйрӑлса тӑраканнисем сахалланса, пӗтсе пыраҫҫӗ, лайӑххи, пӗрлештерекенни хутшӑннӑҫем хутшӑнать.\n\nЯлпа хула та тахҫанах икӗ полюс мар ӗнтӗ. Пенза облаҫӗнчипе Чӑваш Республикинчи колхозсен пурнӑҫӗ те нумай уйрӑм мар пуль.\n\nАчана чӑпӑл тунӑ шыва тӑкнӑ чух эпир ачине те кӑларса пӑрахмастпӑр-и? - теҫҫӗ пирӗн хӑш-пӗрисем. (Тахҫан эпӗ те ҫапла шухӑшлаттӑм). Вара чӑвашсен асран кайми вӑййисене аса илеҫҫӗ. Карталанса юрланисене вунӑ-вун икӗ ҫул ӗлӗкрех те курма пулатчӗ-ха. Халӗ ҫук ав. Такам чарнипе мар, хӑйсемех пӗтнӗ. Тӑванкассинче те юрламаҫҫӗ. Кашнин килӗнче радио пур. Телевизор нумай. Кино кӑтартаҫҫӗ - телевизорпа та, ялти клубра та. Филармони артисчӗсем килсе ҫӳреҫҫӗ. Чӑваш театрӗсем те манмаҫҫӗ вӗсене. Ҫавсене пӑрахса, урама тухса карталанса юрламалла-и? Вӑл вӑхӑтра телевизорпа пӗр-пӗр балет иртсе кайсан.!\n\nЧӑваш каччи халь вырӑс хӗрне илет. Чӑваш хӗрӗсем вырӑса качча тухаҫҫӗ. Вӑл тӗлӗшрен Тӑванкасси те ҫичӗ тинӗс уттинчен лармасть.\n\nТӗрлӗ наци чӗлхи халӑхсем хушшинче те чи нумая пыракан уйрӑмлӑх тенӗ. Тӑванкассинчи ватӑ ҫынсемех «войнара пултӑм», «Шемуршана кайса, хорошаях вӗренсе килчӗ», - тесе калаҫаҫҫӗ. Сӑмах май каласан, чӑваш писателӗсен кӗнекисенчи ҫынсем ҫех чӑвашла тӗрӗс калаҫаҫҫӗ пулас, ыттисен, хӑшӗ сахалтарах, хӑшӗ нумайрах, анчах пурин чӗлхинче тенӗ пекех вырӑсла сӑмахсем илтӗнеҫҫӗ.\n\n\n\nПӗррехинче манӑн тӑван республикӑн кӑнтӑр пайӗнче пӗр пуян колхозра темиҫе ҫӗр выртмалла пулчӗ. Кунта колхозӗ ҫеҫ мар, ҫыннисем те ытлӑ-ҫитлӗ пурӑнатчӗҫ, пӳртсем кантур пек ларатчӗҫ. (Пӗр вун пилӗк-вун ултӑ ҫул ӗлӗкрех урӑхла сӑнсем те курма пулатчӗ-ха: ҫыннисем пуянччӗ - колхозӗ чухӑн е колхозӗ пуянччӗ - колхозникӗсем юрлӑччӗ). Эп хваттере кӗнӗ ҫынсен пӳрчӗ, крыльци, сӑрлӑ хапхи, карти-хури - ӗлӗкхи ҫӗрме пуянсен те пулман пуль. Анчахрах ҫеҫ ҫӗр типсе ҫитнӗччӗ те, мана сӗтлӗ пултӑран яшки пӗҫерсе пачӗҫ. Витаминлӑ ҫимӗҫ тесе, савӑнсах ҫирӗмӗр. Кӑнтӑрла ҫав яшкана ӑшӑтса пачӗҫ. Юрать, терӗм. Каҫхине те сӗтлӗ пултӑран яшки пӗҫерме тытӑнчӗҫ. Пырать ара. Май килнӗ чух ытларах витаминлӑ апат ҫисе юлас. Каҫхи хырӑм вӑл тиркешессе те питех тиркешмест.\n\nКӗтӳ кӗртрӗҫ те, пирӗн хуҫасем патне (вӗсем виҫҫӗн пурӑнаҫҫӗ) путеклӗ ҫич-сакӑр сурӑх, ӗне, пушмак пӑру пӑрӑнса юлчӗҫ. Унтан икӗ пуслӑх хур какӑлтатса таврӑнчӗ. Шултӑра кӑвакалсем, апатшӑн кастарса, ҫенӗк алӑкӗ умӗнче нартлатса тӑратчӗҫ.\n\nТепӗр кун ирхине йӑлтах ҫӗнӗрен пуҫланса кайрӗ. Ирхи апат та, кӑнтӑрлахи те, каҫхи те... сӗтлӗ пултӑран яшки ҫирӗмӗр.\n\nВиҫҫӗмӗш кунне те ҫавах. Эпӗ какай пирки сӑмах хускатсан, кил хуҫи арӑмӗ манпа юнашар ларсах калаҫрӗ.\n\n- И-и, ан та кала, ачам. Какайне курманни ӗнтӗ... Килте кӑсӑя пӗҫҫи пек татӑк тупсан та вӑрӑ пулӑп.\n\n- Кӗркунне выльӑх пусаймарӑр пуль ҫав...\n\n- Аре, ман ун пек калан. Сакӑр сурӑх, пӗр сысна, чӑх-чӗп, хур-кӑвакал чылай пусрӑмӑр. Вун икӗ рас хӑна кӗртсе пӑх-ха. Хӗл хырӑмӗ те пысӑк...\n\nКил хуҫи арӑмӗн сӑмахӗ мӗне пӗлтернине эпӗ каярахпа тин ӑнланса илтӗм. Ун чухне ӑшра темле ырӑ мар туйӑм ҫеҫ юлчӗ. Ӗненесех те килмерӗ. Мӗнле вӑл ун чухлӗ какай (эпӗ шутланӑ тӑрӑх, кил хуҫисен сахалтан та 250-300 килограмм таса аш пулнӑ) ҫӑва тухма та ҫитмен. Е ҫӑкӑр вырӑнне аш ҫиеҫҫӗ-и вӗсем?\n\nАнчах тата пӑртак куркаласа ҫӳресен, хамӑр енчи чӑвашсене аса илсен, ҫак колхозницӑн сӑмахне ӑнлантӑм та, ӗненессе те ӗнентӗм. Тӗрӗсех каларӗ-мӗн вӑл.\n\nТӑванкасси ялне пӗрремӗш хут эпӗ 1969 ҫулхи июлӗн варринче пытӑм. Хваттер хуҫисем, тӑлӑх хӗрарӑмпа унӑн ҫитӗннӗ хӗрӗ, ҫӗр улми пӗҫерсе пачӗҫ. (Ҫӗр улмине кунта ҫӗрми теҫҫӗ-мӗн. Пӑва тӑрӑхӗнчи чӑвашсем картахви теҫҫӗ. Пирӗн хамӑрӑн улма текелеҫҫӗ. Таҫта паранкӑ текенсем те пур ав. Тата темле-темле калакансем те пур пулас. Анчах пурте пӗр япаланах - нимпе те улӑштарма ҫук вилӗмсӗр ҫӗр улминех пӗлтереҫҫӗ). Выльӑх апачӗ тума кансӗр тесе, кил хуҫисем ӗне усрамаҫҫӗ. Кӳршӗрен уҫланӑ уйран илсе пычӗҫ, амӑшӗ иртнӗ уйӑхра туянӑ ҫӑкӑра ваткаласа хучӗ. (Лавккара ҫӑкӑр сайра хутра ҫеҫ сутнипе пӗр турттарса килнӗ пек чухне кунта ҫителӗклех илсе хураҫҫӗ). Эпӗ Шупашкар кучченеҫне кӑлартӑм - сырпа кӑлпасси. Чип-чиперех апатлантӑмӑр. Ҫирӗм пилӗк ҫухрӑм утнӑ хыҫҫӑн мана уйранӗ те симпыл пекех туйӑнчӗ, ҫӑкӑрӗ те килӗшрӗ. Ҫӗр улми пирки калама та кирлӗ мар, чӑваш унсӑр пурӑнма та пултараймасть, ҫӗр улми ҫеҫ нихҫан та йӑлӑхтармасть.\n\nВулакан хӑех сисет пуль ӗнтӗ, эпир вӑл кун каҫхине те, тепӗр кун ирхине те умран юличчен ҫӗр улми ҫирӗмӗр. Виҫҫӗмӗш кунне темӗнле хӗрача сӗт пырса пачӗ те, каснӑ салма яшки пӗҫерчӗҫ. Вара каллех ҫӗр улми пуҫланса кайрӗ...\n\nПиллӗкмӗш кунне кил хуҫисенчен ыйтрӑм:\n\n- Кӗркунне сирӗн аш нумайччӗ пулмалла...\n\n- Нумайччӗ, ӑҫтан пӗлен? - терӗ амӑшӗ.\n\n- Ара, халь пурте выльӑх усраҫҫӗ те.\n\n- Чӑнах нумайччӗ. Икӗ сурӑх, ҫирӗм икӗ хур, чӑх-чӗп пусрӑмӑр.\n\n- Хӑнасем чылай пулнӑ пуль ҫав ӗнтӗ.\n\n- Ара... пулнӑ ҫав ӗнтӗ. Хурӑнташсем таҫта та пур пирӗн. Ӗҫкӗ-ҫикӗре унсӑр юрамасть...\n\n- Ашӗ ав хӑвӑра валли те юлман.\n\n- Юлма терӗ!.. Мӗн-и... ҫӗрми ҫакса ярар-и?\n\n- Пырать пуль ҫаксан.\n\nМана мӗн. Эпӗ урӑх ҫынсем патӗнче те ҫикелӗп. Лавккара та консервӑ пур. Ӗҫӗ те ман урам тӑрӑх сулланса ҫӳресси ҫеҫ. Хӗрачине йывӑр тивет. Кунӗ-кунӗпе чӗкӗнтӗр те куккурус ҫумлаҫҫӗ вӗсем. Тепӗр чухне васканипе ирхине те ҫимесӗрех тухса чупать. Амӑшӗ ҫӑмарта пӗҫерсе паркаласа ярать те, ҫӑмарта апат-им вӑл? Пӗр-ик кун ҫинӗ хыҫҫӑн курас та килмест ӑна. Ҫӗр улми тӗшне те тӑмасть. Ҫавӑнпа Люба ӗҫрен йӑлт халран кайса таврӑнать, каҫхи апат та ҫиеймест. Кӑнтӑрла ӗҫре куҫ хурала-хурала килет тет. Сӗт-турӑх, аш-пӑш, ҫу кирлӗ те ӑна - ҫук ав, хура кӗркуннепе хӗлле ӗҫкӗ-ҫикӗре тасатса кайнӑ. Халӗ те хӗллене хатӗрленеҫҫӗ вӗсем. Хӗрӗ ӗҫшӗн укҫа, сахӑр, чӗкӗнтӗр илет. Сахӑрӗпе чӗкӗнтӗрӗ ӑҫта-ӑҫта кайнине пурте пӗлетпӗр. Амӑшӗ пенсионер. Вӑл иртен пуҫласа каҫчен хур-кӑвакалсемпе тӑрмашать: апат парать, курӑк ҫинче кӗтсе ҫӳрет, ҫырма хӗррине хӑваласа анать, хурчкасенчен сыхлать... Кӗркунне каллех ҫирӗм-вӑтӑр хур, темиҫе кӑвакал, чӑх-чӗп, ик-виҫӗ сурӑх пусаҫҫӗ. Ытти юр-варпа пӗрле вӑл какай пысӑкрах ҫемьене пӗр ҫул ҫиме ҫитӗччӗ. Кусем те сая ямаҫҫӗ ӑна. Ӗҫкӗ-ҫикӗре, уявсенче хӑнасем кӳртеҫҫӗ. Ҫынтан юлма ырӑ мар. Ҫынсемпе хутшӑнайми пулнӑ тейӗҫ. Тӑван-хурӑнташ, ял-йыш ҫирӗмӗн-вӑтӑрӑн пуҫтарӑнать. Туй-мӗн пулсан, унран ик-виҫӗ хут ытла. Ун чухлӗ ҫынна пӗрре хӑна кӗртме темиҫе хур кирлӗ. Ун ҫумне ытти апат-ҫимӗҫне хуш. Тата ӗҫмине. Тата мар-ха, чи малтан ӑна хатӗрле. Ӗҫми пулмасан, калаҫу та ӑнмасть. Никам пымасть сан патна. Пӗтӗм сӑмах-юмахӑн, ӗҫӗн, уявӑн пуҫламӑшӗ те, пӗтмӗшӗ те ҫавӑ******).\n\nӐна янтӑла. (Вӑл мӗн-мӗн иккенне пурте пӗлетпӗр - ханша вӑл), тӗрлӗ ҫӗрте ку пакӑҫа ачашласа темле те ят парса пӗтернӗ - аншарли те вӑл, сӑмакун та, лапсӑркки те, ҫӑмламасси те, кӑмӑшка та тата ытти те, анчах хӑй пурте пӗр пулӑ пуҫех, ҫав пӗр йӗрӗнчӗк шӗвекех пӗлтерет. Каҫарӑр та, унӑн «техники» те пӗр вырӑнта тӑмасть-мӗн. Ӗлӗкрех ханша ӗҫетчӗҫ. Халӗ унпа ҫеҫ ҫырлахмаҫҫӗ, ӑна икӗ хут юхтарма вӗренсе ҫитнӗ. Кӑвар ҫине чаш! сапсан, кӗрп! ҫеҫ хыпса илмелле юхтарма пӗлеҫҫӗ. Ҫавна кӑшт сыпсанах этем кӗрхи шӑна пек пулса каять).\n\nКу «сӑмакун-перекенӗ» пулчӗ. Унтан лавккаран туянаҫҫӗ - ҫуттине, хӗрлине. Сӑра тӑваҫҫӗ те ҫапла юрласа ӗҫеҫҫӗ:\n\nХӗрӗх пичке еннелле\n\nЧунӑм туртать.\n\nЭп ӗҫесшӗн каламасп,\n\nАхаль калап.\n\nПӗрин патне кӗрсе тухаҫҫӗ, теприн патне. Хурӑнташ-тӑван, тус-йыш, пӗлӗш-тантӑш, кӳршӗ-аршӑ - ялӗпе. Ӗҫкӗ-ҫикӗ эрнене те, ик эрнене те, пӗр уйӑха та тӑсӑлать...\n\nУявсем пӗте пуҫласан, урӑх сӑлтавсем тупӑнаҫҫӗ: ача ятне хуни унта, ваттисене асӑнни, мӗн те пулин туянни... Укҫа нумай илсен савӑннипе ӗҫеҫҫӗ, сахал илсен хурланнипе...\n\nҪемҫерех кӑмӑллисем, хавшаккисем е юнра пуррисем ӗҫке ерсех каяҫӗ вара. Куна эпӗ пурте Тӑванкассинче пулса иртет тесе каламастӑп, тӗрлӗ ҫӗрте курнисене пӗтӗҫтерсе калатӑп. Ӗҫке ернисене асӑнтӑмӑр пулсан Тӑванкассинче те пур вӗсем - арҫынсем те, хӗрарӑмсем те.\n\nӐҫта ӗҫкӗ - унта ятлаҫу, ҫапӑҫу. Леш пуҫтах Ильдиаров Идрис ӳсӗрпе пӗр хӗрарӑмӑн тутине ҫыртса татса илнӗ пулнӑ. Татса илчӗ те урайне лач сурса пӑрахрӗ тет. Хӗрарӑмӗ мӑшкӑла чӑтса пурӑннӑ-пурӑннӑ та ҫакӑнса вилнӗ.\n\nТӑванкассин икӗ масар. Пӗри кивви, 10-15 ҫул каялла пӑрахӑҫа тухни. Ялтан вӑл самаях инҫетре, Сатуркка ҫырми хӗрринче. Йывӑҫ юписем ҫине ҫын кӗлеткисем каскаласа тунӑ, хушамачӗсене чӗркелесе ҫырнӑ, хӑҫан вилнине палӑртнӑ. Хамӑр ҫӑвасем ҫине мӗнлине асӑрхаман эп. Кунта, ҫын сӑнне тӗпӗ енне туса, йывӑҫ юпасем кашнинчех лартнӑ. Хӑш-пӗр тӑприне арман чулӗпе хупланӑ. Ятарласа тутарнӑ чул юпасем те курӑнкалаҫҫӗ. Анчах пурне те чылайранпа ҫын тирпейлесе тӑманни сисӗнет. Карти те ҫук. Те ватса пӗтернӗ, те пулман та.\n\nАрҫынсене ҫав тери чаплӑн пытаратчӗҫ тет тӗне кӗмен чӑвашсем. Мала ярса кӳлнӗ урапа-ҫунасемпе, шур пир тӑрӑхӗнчен хунӑ тилхепепе. Малти лаша ҫине вилнӗ ҫыннӑн ывӑлӗ утланнӑ. Пирне кайран шӑтӑк алтакансене пайласа панӑ. Масар ҫинчен таврӑннӑ чухне каялла ҫаврӑнса пӑхман, ҫӗнӗ виле тухасран хӑранӑ.\n\nТуй таврашӗнчи пекех, ҫынна пытарнӑ чухнехи йӑла-йӗркесене пӗлсе те, ҫырса та пӗтерес ҫук - ҫав тери кӑткӑс вӑл.\n\nҪӗнӗ масарӗ ял ҫывӑхӗнчех. Йӗри-тавра карта тытнӑ. Йывӑҫсем кӑнч-канч чӗрткеленӗ. Кунта халь кама кирлӗ - ҫавна пытараҫҫӗ: тӗне кӗнине те, кӗменнине те, пӳкле вилӗмпе вилнисем таранчченех... Ку ҫӑва тӑванкассисемшӗн ҫӗнӗ япала. Икӗ ӗмӗр тӑршшӗнче хӑйсен йӑлинчен пӗр утӑм чакман чӑвашсем совет ҫулӗнчи ҫирӗм-вӑтӑр ҫул хушшинче паллайми улшӑнса кайнӑ. Чунӗсем ҫемҫелнӗ вӗсен. Куҫӗсем уҫӑлнӑ. Мӑшкӑл тӳссе пурӑннӑ халӑх ыттисемпе пӗр тан халӑх пулса тӑнӑ-ҫке.\n\nЛавкка хуралҫи Эптюш Пикмендеев ӑнсӑртран персе янӑ сӑмах ман чӗрене ҫӗҫӗ пек касса кайрӗ. Пӗлтӗрпе кӑҫал вилнӗ ҫынсене аса илкелесе ларчӗ-ларчӗ те вӑл хӑй те шалтах тӗлӗнчӗ.\n\n- Э, чимӗр-ха, ҫӗнӗ масар ҫинче пирӗн путлӗ вилӗмпе вилнисем ҫук та мар-и?! - терӗ.\n\nҪапла, аҫа ҫапнӑ евӗрлех туйӑнчӗҫ пулсан та, ку сӑмахсене илтме хатӗрленсе ҫитнӗччӗ эпӗ. Ара, кирек кам ҫинчен калаҫсан та сӑмах пӗр евӗр вӗҫлене пуҫланӑччӗ: шыва сиксе вилнӗ, ҫакӑнса вилнӗ...\n\nЫтла хытӑ тимленипеа хӑратас мар тесе Эптюш Велитовичпа ку ыйтупа урӑх калаҫмарӑм эп. Ыттине урӑх ҫынсенчен ыйтса пӗлӗп терӗм. Пикмендеевӗпех те пӗр-ик кунтан тепре сӑмах хускатма пулать. Ӑнсӑртран пек. Халӗ мана историллӗ пӗр факт кӑсӑклантарчӗ. 1678 ҫулхи пӗр документра Парашев Турасай патӗнче тарҫӑра пурӑннӑ Кинбяхтов Севей хуҫа арӑмӗсенчен пӗринпе, Ӑслӑпике ятлипе, сӑмах пӗтерсе тухса тарни ҫинчен каланӑ. Кайран иккӗшне те тытса хупса лартнӑ иккен. Те икӗ арӑм пулнӑ вара Турасай хуҫан, те ытларах та, ун пирки шарламан документра. \"...подговорил одну из жен Турасая\", тенӗ кӑна. Хальхи ҫынсем астӑвасса ик-виҫӗ арӑмпа пурӑнакансем пулман-им Тӑванкассинче?\n\n- Пулнӑ, - терӗ Имуллин салтакла кӗскен. - Упаҫ. Ҫирӗм темиҫемӗш ҫулсенче. Икӗ арӑмпа пурӑнатчӗ.\n\n- Вара... ӑҫта кайса кӗчӗ вӑл?\n\n- Пӗр арӑмӗпе калаҫса татӑлнӑ та - вилчӗҫ. Пусӑнса.\n\nКу ҫитменччӗ тата.\n\n- Ҫемйисем сывах пуль.\n\n- Ывӑлӗ вилчӗ. Ҫакӑнса. Пӗр виҫӗ-тӑватӑ ҫул каялла...\n\nХӑшӗ-пӗри вилӗме ним вырӑнне те хумасть иккен кунта. Хӑнана кайнӑ пек ҫеҫ шутлаҫҫӗ. Юманов Пикмӑрса, сӑмахран. Ҫӑматӑ пусаканскер. Ӗҫчен ҫынччӗ теҫҫӗ. Тӑванӗ-хурӑнташӗсене курса ҫаврӑнчӗ тет те - ҫакӑнса вилнӗ.\n\n- «Ӗнтӗ пурӑнса ҫитӗ», - терӗ тет.\n\nЮлашки ҫулсенче кӑна Тӑванкассинче 34 ҫын ҫапла хӑйсене хӑйсем пӗтернӗ. Вӑл шутра икӗ ача (мӑннисене курса ҫакланса пӑхнӑ та вӗҫерӗнеймен).\n\nҪав япаласене асӑрхамӑр: пурӑнни, айӑп тума пулӑшни пекех, хӑй те преступлени. Халех ялтипе районти пур организацисене ура ҫине тӑратса, халӑхпа калаҫмалла, килӗрен киле ҫӳремелле, ӑнлантармалла. «Симӗс ҫӗлене» пӗтерни те халӑха нумай енчен ҫӑмӑллӑх кӳрӗччӗ...\n\nКу - урӑх ҫӗрте калаҫмалли сӑмах пултӑр. Хальлӗхе мана ку ыйту наука енӗпе ҫеҫ интереслентерет. Мӗншӗн пӗтет халӑх. Мӗн хирет ӑна мур хирнӗ пек. Ханша-и? Тӗрӗс, вӑл та пулӗ. Тата мӗскер. Тен, йӑх хавшани.\n\nПӗр очеркра ҫырнӑччӗ эпӗ: тӗне кӗмен чӑвашсем хӑйсене ҫеҫ чӑвашсем тенӗ, ыттисем вӗсемшӗн кӗрешӗнсем. Урӑхла каласан, «уйрӑлнисем», «вырӑсланнисем».\n\nПиччӗшӗпе шӑллӗ пулччӑр. Пӗри тӗне кӗнӗ тейӗпӗр, тепри ҫаплипех юлнӑ. Малашне вӗсем хутшӑнма пӑрахнӑ.\n\n«Чӑвашсемпе» кӗрешӗнсем те ҫавах - пӗр-пӗринпе хутшӑнман. Хӗр парса илесси пирки калаҫу та пулма пултарайман. «Чӑвашсем» «чӑвашсене» кӑна илнӗ.\n\nМалтанах аптраман-ха вӗсем. Кашни ялтах тӗне кӗменнисем пулнӑ. Унтан хӗсӗне пуҫланӑ вӗсен «тӗнчи». Ял-ялӗпе пӗр ҫын та юлман вара «чӑвашра». Чи ҫывӑхри «тӑвансем» ҫирӗм пилӗк ҫухрӑмри Виҫпӳртре пурӑннӑ. Вӗсем те пулин ҫур ял ҫеҫ. Унтан - чӗрӗк ял. Юлашкинчен вунӑ кил. Чи ҫирӗпписем. Таҫта аякра та «чӑвашсем» пурри ҫинчен илтӗнкеленӗ те, ӗлӗкхи саманара хӑранӑ инҫе ҫула тухса ҫӳреме.\n\nҪапла вара хӑтана та хӑнана ҫӳремелли ҫул пӗрре тӑрса юлнӑ: Тӑванкассинчен Виҫпӳрте, Виҫпӳртрен Тӑванкассине. Хӗр панӑ та хӗр илнӗ... Пӗр аллӑ-утмӑл ҫул хушшинче пурте пӗр-пӗринпе хурӑнташланса пӗтнӗ.\n\nПурнӑҫ малаллах шунӑ. Татах ҫамрӑксем ҫитӗннӗ. Кусемпе мӗн тумалла ӗнтӗ.\n\nМалтан ют ҫынсемпе пӗрлешнӗ-ха. Халӗ ак аяккарахри тӑвансене шыра пуҫланӑ. Виҫ-тӑват хурӑн тӑрринчисене. Кӑшт ҫывӑхраххисене. Вара тӑван юнӗпе тӑван юнӗ хутӑшса кайнӑ. Чӗрчун ун пек чухне ассиленет. Этем йӑхӗ начарланса пӗтме тытӑнать, тет медицина.\n\nОктябрь революцийӗ ҫеҫ Тӑванкасси халӑхне татӑк ҫултан аслӑ ҫул ҫине кӑларнӑ. Ҫамрӑксем халь кама саваҫҫӗ - \"кӗрешӗн\"-и вӑл, урӑх халӑх ҫынни-и - ҫавна илеҫҫӗ, ҫавна каяҫҫӗ.\n\nЭпӗ Тӑванкасси урамӗнче вылякан ачасене сӑнаса ҫӳрерӗм. Парка вӗсем, хӑюллӑ, уҫӑ кӑмӑллӑ, савӑнӑҫлӑ - пулас уй-хир хуҫисем, рабочисем, летчиксем... Хур кӗтӗвӗсене астунӑ, шӑллӗ-йӑмӑкӗсене пӑхнӑ хушӑрах вӗсем велосипедпа та ярӑнма ӗлкӗреҫҫӗ, волейболла-футболла та перкелешсе илеҫҫӗ.\n\n\"Пирӗн, тӗне кӗмен чӑвашсен, тӗн ҫук, кӗнекесем ҫук, пур пеккисем пире валли мар, кӗрешӗнсем валли\", тесе ӳпкелешнӗ ӗлӗк Тӑванкасси ҫыннисем. Ун чухне миҫе ӑслӑ ҫын ниҫта палӑрмасӑр хӑрса ларнӑ пуль! Халӗ Тӑванкассинче пӗр ача вӗренмесӗр тӑрса юлмасть. Хӑйсен ялӗнче пуҫламӑш шкул, пӗр километрти ялта вӑтам шкул. Таврари хуласенче мӗн чухлӗ ҫамрӑк вӗренет тата. Эпӗ вӗсен пулас профессийӗсене шутласа кӑларма хӑтлантӑм та - шутласа пӗтереймерӗм. Юрӑҫӑ та, тухтӑр та, офицер те - такам та пулать. Вӗсем пӗтӗм ҫӗршыв интересӗпе пурӑнаҫҫӗ, аякрине кураҫҫӗ, тата та ҫутӑрах малашлӑх пирки ӗмӗтленеҫҫӗ. Тӗттӗм кӗтесре ҫӑрӑлса ларса, эрни-эрнипе эрех-ханша пехлеме-и? Э, ҫук, улталаймӑн халь ҫамрӑксене.\n\nЧи йывӑрри вӑл - этем ӑс-тӑнне ҫӗнетсе улӑштарасси. Темиҫе ӗмӗр хушши лайӑх тесе шутланнӑ йӑла-йӗркесем пирӗн саманара юрӑхсӑра тухрӗҫ. Тӗне кӗмен чӑвашсене ӗлӗк нуша пӗрлештерсе тӑнӑ. Кирек мӗн сиксе тухсан та, ял шӑпи пирки шухӑшласа, пӗрне-пӗри хӳтӗлеме тивнӗ. Усал ӗҫсене пытарнӑ вӗсем, тӗрӗссине суя тенӗ. Ҫын вӗлерекенпе тӳрӗ ҫын пӗр кӗрекере ларнӑ. Ҫамрӑксен куҫӗ умӗнче вӗсен хак пӗр пулнӑ...\n\nЧирлӗ ҫын пирки усал шухӑшлама ырӑ мар пулсан та, Идрис пирки эпӗ: пурнӑҫ шайлашуне пӑсакансене ҫынсем мар-тӑк, ҫутҫанталӑк та пулин тавӑрать-тавӑратех-мӗн, тесе шухӑшласа илнӗччӗ - тӳрлетрӗҫ мана. «Хамӑр ял» пулнӑшӑн кӑна пӗрне-пӗри хӳтӗлени тӗрес мар терӗҫӗ Пуринчен ытла ҫамрӑксем хирӗҫлеҫҫӗ-мӗн ӑнаӗ Ильдиаров Идриса тӗрмене хуптарнӑ пулнӑ вӗсем. Нумай ҫулах мар та, хуптарнӑ ҫапах. Кунта срокӗ мар, принципӗ паха. Ӗмӗрхи «триадӑна» каласа ларакансемех, курман, илтмен, пӗлместӗп текенсемех, урӑхла калаҫа пуҫланӑ. Куртӑмӑр, тенӗ. Ашкӑнать, чармалла ӑна, тенӗ.\n\nАрӑмне вӗлернӗ Хамит те тӗрмене лекнӗ...\n\n\n\n* Н.И. Ильминский патне янӑ ҫыру. (А.И. Яковлев профессорӑн «Иван Яковлевич Яковлев» 1848-1939» ятлӑ кӗнекин иккӗмӗш кӑларӑмӗ тӑрӑхӗ Чӑваш патшалӑх издательстви, Шупашкар, 1958 ҫ.)\n\n** Христиансем пулайман ҫав вӗсем. Хв.У.\n\n*** Акӑ ӑҫтан вӑл ялти тутар ячӗсем! Хв.У.\n\n**** И.Я. Яковлев яла час-часах килсе ҫӳренӗ. Килмессерен Нямат Лисков патне хваттере чарӑннӑ. Шыва кӗртнӗ чух ӑна тытнӑ май, унпа туслӑ пулнӑ», – тесе ҫырать Тӑванкасси историне тӗпчекен журналисчӗ.\n\n***** И. Кузнецовӑн \"Очерки по истории чувашского крестьянства\" кӗнекинчен. Чӑваш патшалӑх кӗнеке издательстви. Шупашкар, 1957 ҫ.\n\n****** Ку сыпӑка 1969 ҫулта ҫырнӑ. Авт.\n\n\n\nРедакцирен: текста улӑштармасӑр вырнаҫтарнӑ; электронлӑ варианта Times New Roman Chuv шрифтпа наборланӑран, ӑна курӑмлама юсанӑ чухне кӑлтӑксем юлма пултарнӑ, вӗсемшӗн редакци каҫару ыйтать (курнисене юсанӑ).\n\nСӑнсем ҫинче: «Ҫунман» алҫырусем; Хв. Уярпа А. Медведев; Хв. Уярпа В. Алексин журналист калаҫать; Писатель И.Н. Ульянов ячӗллӗ Чӑваш патшалӑх университечӗн студенчӗсемпе; Хӗветӗр Уяр.",
        "Аван-и!!!\n\nЯндекс.Куҫарушӑн кама-кама та тав туса пӗтерейменни те халӗ те тӗплӗн пӗлейместӗп! Яндексра ку енӗпе те пит конкретлӑ ӗҫ-пулӑм пулса пынишӗн чӑннипех хӗпӗртемелле. Шухӑшӑма ҫирӗплетме пӗр кӗске текст кӑна илсе кӑтартатӑп. Чи малтан — яндекс чӑвашла куҫарни пулӗ (чарӑну паллисене те ҫаплах, тӗкӗнмесӗр хӑварнӑ унта), малалла ҫав текстӑн — вырӑсла оригиналӗ, кайран — хамӑр кӑштах юсанӑ вариант.\n\nПуйӑс купинче пӗр ватӑ раввин пырать. Ҫӳлти ҫӳлӗк ҫине ҫамрӑк ҫын вырнаҫрӗ. Ҫывӑрма выртсан ыйтать:\n\n-. Миҫе сехет иккенне каламастӑр-и эсир?\n\nРаввин пӗр сӑмах каламасӑрах стена еннелле ҫаврӑнса ҫывӑрса каять.\n\nИрхине поезд Харьков патне пырать. Пассажирсем иккӗшӗ те тухма хатӗрленеҫҫӗ. Раввин хӑйӗн сехечӗ ҫине пӑхать те калать::\n\n-. Ҫамрӑк ҫын, эсир миҫемӗш сехет ҫинчен ыйтрӑр. Ҫапла, халӗ вуннӑмӗш ҫурри.\n\n- Мӗнех вара. эсир ӗнер чӗнмерӗр-и?\n\n-. Куратӑр-и, эпӗ сире ответ панӑ пулсан, эсир эпӗ ӑҫта каяссине ыйтнӑ пулӑттӑр. Эпӗ Харьковра тесе каланӑ пулӑттӑм. Эсир те Харьковӑна каятӑр, тенӗ пулӑттӑр. Ҫӗр каҫма та вырӑн ҫук сирӗн. Эпӗ, ырӑ ҫын пулнӑ май, сире хам пата чӗнӗттӗм. Манӑн хӗр пур. Эсир ӑна илӗртнӗ пулӑттӑр, вара сирӗн ӑна качча илмелле пулнӑ пулӗччӗ.\n\n- Ну, мӗнех вара ку?\n\nЭпӗ вара: мӗншӗн-ха мана сехетсӗр кӗрӳшӗ? - тесе шухӑшласа илтӗм.\n\nЯндекс ҫапла хӑйӗн миллионшар сӑмахлӑ алтӑрне чӳхентерсе-шыраса тӗрӗсех, пурне те ӑнланмалла текст калӑплать.\n\nМалалла вырӑсла пичетленнӗ оригинал-варианчӗ:\n\nВ купе поезда едет пожилой раввин. На верхней полке устроился молодой человек. Ложась спать, он спрашивает:\n\n-.  Вы не скажите, который час?\n\nРаввин, не говоря ни слова, поворачивается к стене  и засыпает.\n\nУтром поезд подходит к Харькову. Оба пассажира готовятся к выходу. Раввин смотрит на свои часы и говорит:\n\n-.  Молодой человек, вы спрашивали, который час. Так вот, сейчас половина десятого.\n\n-  Что же. вы вчера промолчали?\n\n-. Видите ли, если бы я вам ответил, вы бы спросили, куда я еду. Я бы ответил, что в Харьков. Вы бы сказали, что тоже едете в Харьков. И что вам негде переночевать. Я, как добрый человек, пригласил бы вас к себе. А у меня дочь на выданье. Вы бы  ее наверняка соблазнили, и вам пришлось бы на ней жениться.\n\n- Ну, и что же из этого ?\n\nВот я и подумал : зачем мне зять без часов?\n\nХалӗ тата кӑштах эпир юсанӑ-тӗрӗсленӗ чӑвашла иккӗмӗш вариант. Хӑш-пӗр чӑваш интеллигенчӗ тӳрлеткеленисене йышӑнмасан та пултарать. Анчах та хамӑрӑн чӗре варринче йӗрмӗшекен чӑваш чӗлхи, текст  ҫӑмӑлраххӑн вулантӑр тесессӗн, ҫапла тумах хистет пулӗ. Кунта нимӗнле иккӗлле калани-куҫарни те ҫук.\n\nПуйӑсри  купере пӗр ватӑ раввин ларса пырать. Ҫӳлти ҫӳлӗк ҫине ҫамрӑк ҫын вырнаҫать. Ҫывӑрма выртас умӗн вӑл ҫапларах ыйтать:\n\n-  Халӗ мӗн вӑхӑт (е Миҫе сехет?)? Калаймастӑр-ши эсир?\n\nРаввин пӗр сӑмах каламасӑрах стена еннелле ҫаврӑнса выртать те ҫывӑрса каять.\n\nИрхине поезд Харькова ҫитсе чарӑнать. Хайхи пассажирсем иккӗшӗ те тухма хатӗрленеҫҫӗ. Раввин хӑйӗн сехечӗ ҫине пӑхса илет те ҫапларах калать:\n\n- Ҫамрӑк ҫыннӑм, эсир вӑхӑт миҫе сехет пулнине ыйтнӑччӗ. Ҫапла, халӗ вун(ӑ) сехет ҫурӑ.\n\n- Мӗншӗн вара эсир ӗнер нимӗн те чӗнмерӗр?\n\n- Пӗлетӗр-и, эпӗ сире ӗнер ответ панӑ пулсассӑн, эсир эпӗ ӑҫта каяссине ыйтнӑ пулӑттӑр. Эпӗ Харькова, - тесе каланӑ пулӑттӑм. Эсир те Харьковах каятӑр, - тенӗ пулӑттӑр. Тата манӑн ҫӗр каҫма та вырӑн ҫук тенӗ пулӑттӑр эсир. Эпӗ хам, ырӑ ҫын пулнӑ май, сире пирӗн пата чӗннӗ пулӑттӑм. Манӑн хӗр пур. Эсир ӑна илӗртнӗ пулӑттӑр, вара сирӗн ӑна качча илмелле пулнӑ пулӗччӗ.\n\n- Ну, мӗнех  вара?\n\nЭпӗ вара, кирлех-ши мана сехетсӗр кӗрӳ? - тесе шухӑшласа илнӗ пулӑттӑм.\n\nХушса калани. Чӑваш ҫырулӑхӗ аталанма пуҫланӑранпа 150 ҫул ҫитнине уявлама хатӗрленеҫҫӗ халӗ.\n\nАкӑ, каллех, фейсбукран паян ятарласа илнӗ текста яндексра чӑвашла куҫарнине  лартатӑп: «Кӑҫал эпир чӑваш ҫырулӑхне тума 150 ҫул ҫитнине паллӑ тӑватпӑр. Чӑваш Республикин Наци библиотекинче чӑваш ҫырулӑхне халалласа аталантарассипе ҫыхӑннӑ анлӑ кӗнеке экспозицийӗ уҫӑлӗ. Февралӗн 3-мӗшӗнче библиотека директорӗ Роза Лизакова ертсе пынипе выставка проектне пурнӑҫлас енӗпе йӗркелӳ комитечӗн канашлӑвӗ иртрӗ. Курав планне сӳтсе явнӑ чухне Олег Улангин художник, Чӑваш патшалӑх гуманитари ӑслӑлӑхӗсен институчӗн наука ӗҫченӗсем Алевтина Долгова тата Юрий Гусаров, Чӑваш Республикин вӗренӳ институчӗн ӗҫченӗсем Юрий Виноградовпа Анна Егорова хутшӑнчӗҫ. Канашлура нумайччен сӳтсе яврӗҫ, выставка ятне уҫӑлнӑ ыйту тӑрса юлчӗ.\n\n- Хаклӑ туссем! Сире пӗрле ӗҫлеме чӗнетпӗр тата сирӗнтен интереслӗ те ҫутӑ сӗнӳсем кӗтетпӗр. Чӑваш ҫырулӑхне туса пӗтернӗренпе 150 ҫул ҫитнине халалланӑ курава эсир мӗнле каланӑ пулӑттӑр? https://www.facebook.com/\n\nЧунтанах чӑваш чӗлхишӗн ӑнтӑлакансемшӗн питӗ кирлӗ информаци пулчӗ ку. Вӗсем хӑйсен  шухӑшӗсене  комментарисем туса пӗлтереҫҫех пулӗ тетӗп.\n\nҪавӑнпа пӗрлех, маларах пуҫланӑ ыйтӑва тӑсса, интернетри чӑваш ҫырулӑхӗ епле аталанма пуҫланине тата халӗ вӑл мӗнла шайра пулса пынине, хӑш-пӗрисемсӗр пуҫне,  пӗлсех каймастпӑр. Мӗнлерех маттур пулнӑ-ха, тен, кӑштах пуҫтахрах та, ӑс-туйӑмлӑ чӑваш ачисем! Ку енӗпе халӗ те тӑрӑшсах ӗҫлесе пыракан Николай Плотникова асӑнмасӑр епле  те иртӗн-ха. Халӗ тата темле санкци-манкци вӑхӑтӗнче пурӑннӑ май, хамӑрӑн пуласлӑх ассӑн сывлаттарать. Тӳр чунлӑн пӗлсе ӗҫлесе пыракансене хамӑрӑн патшалӑх та пулӑшмалла,  паллах. Пирӗн шутпа, ҫак ӗҫе куллен туса пыракансем валли — Н.А. Плотников, З.А. Яковлева тата ыт. те (малти пурнӑҫ чӑнлӑхӗ — пулас перепиҫ умӗн пушшех те!!!) ятарлӑ хушупа каланӑ ятарлӑ стипенди пулмаллах. Пӑхӑр-ха, Чӑваш Республикин пуҫлӑхӗн ҫамрӑксем валли уйрӑм пултарулӑх туртӑмӗшӗн стипенди пур. Интернетра чӑвашла тӗллевлӗн тата ӑҫ-хакӑла куллен вӑратмалла ӗҫлесе пыракансене хавхалантармаллах, ялан курмасӑр тенӗ пек иртсе кайса тӑлламаллах мар вӗсене те!!!\n\n\n\nЛ. Атлай\n\n\n\nРедакцирен. «Яндекс.Тӑлмачӑн» куҫару пахалӑхне, паллах, лайӑх тесе хак пама пулать. Ҫапах та «Чӑваш чӗлхи лабораторийӗ» хатӗрлекен куҫаруҫӑн ӗҫӗ пирки те каласа хӑварас пулать. Хӑй тӗллӗн куҫаракан ҫав тӑлмач http://translate.chv.su адреспа вырнаҫнӑ. Танлаштарса кӑтартас тӗллевпе эпир вӑл мӗнле куҫарнине те илсе кӑтартатпӑр:\n\nПуйӑс купинче ватӑрах раввин пырать. Ҫӳлти ҫӳлӗк ҫинче ҫамрӑк ҫын вырнаҫнӑ. Ҫывӑрма выртнӑ чухне вӑл ҫапла ыйтать:\n\n—. Эсир калӑр - ха, хӑш сехет?\n\nРаввин пӗр сӑмах каламасӑрах стена еннелле ҫаврӑнать те ҫывӑрса каять.\n\nИрхине пуйӑс Харьков патне пырать. Иккӗшӗ те пассажирсем тухма хатӗрленеҫҫӗ. Раввин хӑйӗн сехечӗ ҫине пӑхать те калать:\n\n—. Ҫамрӑк ҫыннӑм, эсир хӑш сехетре тесе ыйтрӑр. Акӑ халӗ вуннӑмӗш ҫурри.\n\n— Мӗн, эсир ӗнер шарламарӑр - им?\n\n— Куратӑр - и, эпӗ сире хуравланӑ пулсан, эсир эпӗ ӑҫта каяссине ыйтса пӗлӗттӗр. Эпӗ Харькова каяссине хуравланӑ пулӑттӑм, эсир те Харькова каятӑр, тесе каланӑ пулӑттӑрччӗ, сирӗн ҫӗр каҫма та вырӑн ҫук, эпӗ сире хам пата ырӑ ҫын пек чӗнӗттӗм, манӑн хӗре хам патӑмра панӑ пулӑттӑм, эсир ӑна илӗртнӗ пулӑттӑрччӗ, сире качча илме тиветчӗ.\n\n— Ну, мӗнех вара ку?\n\nҪавӑнпа шутларӑм та: мӗншӗн - ха манӑн пӗр сехетсӗр кӗрӳ?\n\nТӳрех ку куҫару япӑхрах тесе хак пама ан шутлӑр. Хальхи вӑхӑтра моделе ҫӗнетес тӗлӗшпе ӗҫлеҫҫӗ. Унсӑрӑн пуҫне, паллах, Яндексри ӑстасен опычӗ те самай пысӑкрах. Анчах «Чӑваш чӗлхи лабораторийӗн» хастарӗсем те ытлах кая юлса пымаҫӗ. Чи пахи вара: танлаштарсан ку вариантра Яндекс.Тӑлмачран лайӑхрах вырӑнсем пуррине курма пултаратӑр. Апла-тӑк, иккӗшпе усӑ курса тата та аванрах куҫару тума май пур.",
        "Пӗрре пӑхсан, Васильев хушамат пӗрре те япӑх мар пек. Вӑл хушаматпа пурӑнакансем чӑвашсем хушшинче сахал мар. Паллах, Ивановсем тата та ытларах. Ак, сӑмахран, нумай пулмасть Иванова министра лартрӗҫ тесе пӗлтерсен ман ыйту ҫуралчӗ: киввине е урӑххине? Чулхулара ӗҫленӗ чухне пӗрре пай ертӳҫи те манран ыйтсаччӗ: «Сирӗн унта пурте Иванов хушаматлӑ-им?» Мӗншӗн? Ара, Шупашкарти пирӗн уйрӑмра ӗҫлекенсен йышне курнӑ та... Унта вара пӗр пилӗк хушамат Иванов пулнӑччӗ пулас.\n\nҪакнашкал лару-тӑрӑва пулах ӗнтӗ пирӗн ҫыравҫӑсем чылай чухне псевдоним йышӑнаҫҫӗ. Чылай Яковлев хушаматлӑ ҫынна, сӑмахран, эпир пач урӑх ятсемпе пӗлетпӗр. Тӗслӗхрен, Иван Салампекӑн чӑн хушамачӗ Яковлев пулнине нумай пулмасть ҫеҫ пӗлтӗм.\n\nМалтан хушаматсем мӗнле ҫыртарасси кӑсӑклӑрах пулнӑ пулас. Халь вӑл ашшӗ хушамачӗпе (ытларах чухне) пырать, малтан вара урӑхларах йӗрке пулнӑ. Ман хамӑн хушамат, сӑмахран, Плотников. Аттен хушамачӗпе. Апин — Степанова. Аттен хушамачӗ пирки калас пулсан вӑл ҫаплипех куҫса пынӑ пулас. Ни асатте, ни атте хӑй платник пулман. Апи хушамачӗ вара ашшӗ ятӗнчен. Кукаҫи ман Ҫтаппан пулнӑ та вара хӗрне те Степанова Лидия Степановна тесе ҫыртарнӑ пулас. Кукаҫин хушаматне, шел те, тӳрех калаймастӑп. Ҫапла май ӑру хыҫҫӑн ӑру тӗрлӗрех хушаматпа ҫӳренӗ.\n\nПаянхи саккунсем ҫыннӑн хушаматне ҫеҫ мар, ятне те улӑштарма май параҫҫӗ. Вӑл ҫеҫ мар, ашшӗ ятне те чиперех урӑххине йышӑнма пулать — сӑмахран, Иванович пулас килмесен 2000 тенкӗ тӳле те сана темиҫе кун хушшинче урӑх ашшӗ ятне ҫырса хураҫҫӗ. Паспорт улӑштармалла та — ҫӗнӗ ҫын пулса тӑрӑн.\n\nӖнер Никита Васильев та хӑйӗн хушаматне улӑштарни пирки пӗлтерчӗ. Текех пирӗн паллӑ велоҫулҫӳревҫӗ Васильев мар, Тӗнче хушаматлӑ пулӗ. Никита Тӗнче (хут ҫинче, темшӗн Тенче ҫырса хунӑ-ха...).\n\nЧӑвашлӑх тӗнчинчи ҫынсене сӑнанӑ май мана ку питӗ кӑсӑклантарса ячӗ. Хушаматсене улӑштаракансен йышӗнче Васильевсем питӗ нумай. Эпир пурте паллакан ҫынсем хушшинче унччен Владимир Болгарский пурччӗ, кайран чӑвашлӑх анинче Суварин хушамачӗ тухрӗ. Ак халь ӗнтӗ тепӗр хушамат ҫуралчӗ — Тӗнче. Вӗсене пӗрлештерекенни — пурте вӗсем маларах Васильев хушаматпа ҫӳренӗ: Владимир Васильев, Андрей Васильев тата Никита Васильев. Ивановсем те, Николаевсем те, тата ытти анлӑ сарӑлнӑ хушаматлӑ ҫынсем чӑвашлӑх анинче сахал мар, анчах шӑп та лӑп Васильевсем хӑйсен хушамачӗсенчен «тараҫҫӗ», хӑйсене валли индивидуаллӑхне палӑртаканнине суйлаҫҫӗ.\n\nЯтра-хушаматра чӑвашлӑха палӑртни час-часах тӗл пулать. Юлашки вӑхӑтра, сӑмахран, чӑвашла хушма ятсем йышӑнасси йӑлана кӗчӗ. Ачасене чӑвашла ят парасси темшӗн вӑй илеймест (ман шутпа питӗ сахал), хушма чӑваш ят илесси вара ку тӗлӗшрен вӑйлӑрах палӑрчӗ. Мӗншӗннине те палӑртма йывӑр мар пулӗ. Ята тем тесен те ашшӗ-амӑшӗ парать. Ачи ҫитӗнсен кам пулассине ниепле те пӗлме май ҫук. Ӳссе ҫитсен вара чылайӑшӗ тӑна кӗрет, хӑйӗн чӑвашлӑхне палӑртасшӑн пулса тӑрать. Ҫапла Илтимерсемпе Аҫтахарсем, Юмансемпе Алпарухсем йышланаҫҫӗ. Чӑн ята улӑштарма ҫавах та ҫӑмӑл мар: ӑна тем тесен те ют ҫын мар, тӑван атте-анне панӑ-ҫке! Ҫавӑнпа та хушма ятсем вӑйра. Хӑш-пӗр ҫыннисен хушма чӑваш ячӗсене ҫеҫ пӗлетӗн, чӑн ятне хутшӑннӑ чухне аса та илместӗн.\n\nПаллах, хушаматсене улӑштарнине япӑх хак пама май ҫук. Саккун чармасть пулсан — ку кашни ҫыннӑн хӑйӗн ирӗкӗ. Эпир ӑна ҫакӑншӑн хурлама пултараймастпӑр. Хушаматсен расналӑхӗ ӳсни, ҫӗнӗ хушамат чӑвашлӑхпа кӑсӑклантарма май пани — лайӑх енсем тесе шутлатӑп.\n\n\n\nӲкерчӗк ҫинче: Владимир Болгарский, Андрей Суварин, Никита Тӗнче",
        "Пӗрремӗш ҫавра. Г.Н. Волков: «Яковлев ӳстерсе янӑ ҫын вӑл… Эп айӑплӑ халӑх умӗнче… Эп фальсификатор пултӑм…»\n\n\n\n\n\nЧӑваш наци юхӑмӗ хухса та хухса пыни куҫкӗрет/куҫа кӗрет, куҫа тӑрӑнать… Раҫҫейри вырӑс мар чӗлхесене факультативлӑ вӗрентме пуҫласан чӑваш чӗлхин шӑпи паллӑ – типсе ларасси… Ик ҫул каялла ачана, Айтара, пӗрремӗш класа ӑсатрӑмӑр. Вӗренӳ ҫулӗ пуҫланнӑ ятпа ирттернӗ савӑнӑҫлӑ пуху хавхалантармарӗ. Халӑх кӑмӑлне пӗлес тесе, ачана амӑшӗпе хӑварса, пӗрремӗш хута, расписани-пӗлтерӳсем патне антӑм. Кунта чӑнах та шавлӑ хӗвӗшӳ. Сӑнаса итлеме пуҫларӑм. Пӗрле пуҫтарӑннӑ тӑватӑ чӑваш майри (ҫапла калап эп ытла капӑр тумланнӑ инкесем пирки) расписани умӗнче хыттӑнах хӑйсен кӑмӑлне палӑртаҫҫӗ: «Хӑҫан пӗтереҫҫӗ-ши ӗнтӗ чӑваш чӗлхи урокӗсене?!.» Хулари чӑваша чӑваш чӗлхи тарӑхтарать. Чӑваш пулса ҫуралнӑшӑн вара вӑл хӑй ӑшӗнче ҫут тӗнчене ылханасла тарӑхмаллипех тарӑхать. «Тутар тутара тӗл пулать – савӑнать, пушкӑрт пушкӑрта тӗл пулать те – савӑнать, чӑваш чӑваша тӗл пулать те – тутине тӑсать». Александр Егорович Кириллов экскаваторщик ҫакна пӗрре мар сӑнанӑ, вӑл тӗнче каснӑ ҫын. Эрнест – водитель. Тӗнче курнӑ. Амӑшӗ те ун шкулта акӑлчан чӗлхи вӗрентнӗ. Вӑл чӑнтан (ячӗшӗн мар) ман пурнӑҫпа кӑсӑкланнине кура хамӑн «Хурапа шурӑ» пирки каласа патӑм. («Хурапа шурӑ» Ҫемен Элкерӗн  автобиографиллӗ повеҫӗ). «Тӗнче ачи» хӑй кӑмӑлне пытармарӗ: «Чӑваш вӑл – говно», – терӗ… «Мӗншӗн чӑваш чӑваша юратмасть?» – чӑнтан пӑшӑрханса шухӑшлатчӗ Хветӗр Уяр… Мӗншӗн чӑваш чӑвашран йӗрӗнет?..  Ҫӗр тӗрлӗ «Мӗншӗнсем» шайӗнче шырамалла чӑваш пӗтнин тупсӑмне, чӑн сӑлтавне. Шыракансем, пуҫ  ватакансем шел пулин те, курӑнмаҫҫӗ. Йӑпатакансем, суя шанчӑк паракансем вара – ытлашшипех. «Эпӗ пӗрре те иккӗленместӗп: чӑваш чӗлхи  пӗтмест, – тет В.П. Станьял. –  Тӗнче пӗтмест пулсассӑн чӑваш халӑхӗ те пӗтмест». 21 ҫул хушшинче (1989 – 2010) чӑваш  шучӗ 338 пин чакнӑ. Ҫӗр ҫинче (тен, таҫта тӗнче уҫлӑхӗнче, инҫет космосра чӑвашла калаҫаҫҫӗ)  пӗр чӑваш шкулӗ ҫук, Шупашкарта пӗр  чӑваш ача пахчи ҫук, хулара чӑвашлӑх палли-сӗмӗ ҫукпа пӗрех… –  Станьял: «Эпӗ пӗрре те иккӗленместӗп: чӑваш чӗлхи  пӗтмест»… Виталий Петровичӑн 60 ҫулне Правительство ҫурчӗ ҫумӗнчи «Тӗлпулу» кафере паллӑ  тунӑччӗ. Станьялӑн икӗ хӗрӗ юратнӑ ашшӗне саламласа плакатсем ҫырса тултарнӑччӗ. «Пӗрне те чӑвашла ҫырман-ҫке», – наци ертӳҫин ачисем чӑваш чӗлхине пач вырӑна хуманнишӗн кӑмӑлсӑр пулнине пытармарӗ манпа ҫуммӑн ларакан Александр Николаевич Тимуков. Чӑваш чӗлхишӗн Станьял чӑнтан ҫунать-ши?.. Пит иккӗленетӗп. Конгресс Путин патне ҫыру ҫырмасӑр Иуда ӗҫне турӗ (30 кӗмӗл тенкӗпе – грантпа – мутанмаллипе мухтанать) – Станьял: «Пил те пехил сана, конгресӑм!» – тет. Чӑваш ҫамрӑкӗсен театрӗ, тӑван чӗлхе умӗнчи тивӗҫе манса, вырӑсла спектакльсем лартать  – Станьял: «Шире шаг, любимый юнак!» – тесе мухтать. Н.И. Ильминскин чӑвашлӑха  вӑрттӑн пӗтермелли хатӗрӗ-механизмӗ пӗр кӑлтӑксӑр ӗҫленине пӗлет, ҫапах та: «Иван Яковлевич Яковлевран ӗмӗрлӗх тӗслӗх илмелле!» – тет… Суя миххи мар – анчах суя хутаҫҫи теме пулать. Чӑн суя миххисем – Станьялтан аслӑраххисем. «Юмах Мишши» тетчӗҫ Юхма Мишшине. Ялан ӑна тӑрӑ шыв ҫине кӑларатчӗҫ. Шутласа кӑлараканни пӗр Юхма кӑна пулман. Ку вӑл 1950, 1960 ҫулсен ачисен (пятидесятники, шестидесятники) палли.  Ӑру  палли. Пурнӑҫ вӗҫӗнче Г.Н. Волков суя вӑрӑсем акса хӑварнине хӑех йышӑнчӗ. ( «Ҫӗр пин юрӑ, ҫӗр пин тӗрӗ» тата ытти те.).  Г.Н. Волков тупсӑмӗ  гибрид (суяпа чӑнлӑха хутӑштарса, пӑтраштарса янтӑланӑ япала) пулнине эп 1990 ҫулсен пуҫламӑшӗнчех палӑртнӑ.  Тӗслӗхрен, «Хыпарта» (1992, раштав, 8) Мӗтри Юманӑн «1905-мӗш ҫул. Чӑвашсен хушшинче пулнӑ ӗҫсене асӑнни» кӗнекин (Шупашкар, 1925) сыпӑкне «Чӑваш шкулӗ мӑнастырь евӗрлӗччӗ» ятпа пичетлерӗм. Г.Н. Волковӑн черетлӗ юмахне фактпа хирӗҫлерӗм. Ум сӑмахӗнче ҫапла ҫыртӑм: «Чысӑм та, сӑвапӑм та – сирӗнпе…» ят панӑ интервьюра («Чавашьен», 1992, 44 №) Г.Н. Волков академик «Чӗмпӗрти чӑваш шкулӗ вӑл – Европӑри Эрфурт, Гетенген университечӗсенчен ҫӳлте тӑнӑ» тесе И.Я. Яковлева мухтать.\n\nТӗнчери чӑваш тивӗҫӗ пирки ӳстерсе каласси пӗр Волковшӑн кӑна мар, аллӑран иртнисемшӗн пуриншӗн те кӑтартуллӑ пек. Тивӗҫлӗ  чӑнлӑх вӗсемшӗн пӗр хӑйсен чун чӑнлӑхӗ кӑна. Хӑйсем те пӗлмен, ӑсласа илмен чун чӑнлӑхӗ.\n\nЧӑнлӑх тепӗр чух йӳҫек кӑмӑл хӑварать, анчах ӑна пӗлесех пулать. Яковлев шкулӗ пирки тӗрӗслӗх ҫапларах пек. Вӑл Европӑран иртме мар, вӑл вӑхӑтри вырӑс шкулӗнчен те чылай юлса пынӑ. Мӗтри  Юман ун ҫинчен мӗн ҫырса хӑварни, ман шутпа, ҫакна ӗнентерет».\n\n«Айхи пулман пулсан эпӗ пулмастӑм», – тенӗччӗ Петӗр Эйзин. Г.Н. Волков пулман пулсан паянхи И.Я. Яковлев пулмастчӗ. Ваҫанкка хӑйӗн сӑввисене хуткупӑс каласа янраттарнӑ пек сӑмах калаймастчӗҫ паянхи ҫулпуҫем, политиксем. К.Г. Яковлев: «Чӑн та паян ҫавӑн пек тӗлӗнмелле кун. 170 ҫул каялла ҫак ҫут тӗнчене тӗлӗнмелли (кунта ораторсен чӗлхине сыхласа хӑварнӑ. – Ю.Я.) чӑваш улӑпӗ ҫуралнӑ: Иван Яковлевич Яковлев. Его величие, его ум, его разум и сегодня продолжает нас восхищать. Действительно был великим человеком, творцом. Спасибо, тавтапуҫ пурне те. Уявпа». Н.Ф. Угаслов: «Чӑваш халӑхне каласа хӑварчӗ: ытти халӑхсемпе туслӑ пурӑнӑр, пӗр-пӗрне савӑр, Раҫҫей ҫӗршывне ӗненӗр, ӑна юратӑр. Ун чухне вӑл сирӗн амӑшӑр пулӗ терӗ. Еще раз вам всем хорошего настроения, вдохновение, чтобы всегда вместе быть и заниматься добрыми делами». О.Н. Мустаев: «Чӑваш чӗлхи ячӗпе пӗр пулар! Яковлев ячӗ вилӗмсер пултӑр! Сывӑ пултӑр тӑван чӑваш чӗлхи. Ҫапла пултӑр!». В.В. Туркай: «Яковлева ҫуратса ӳстернӗ халӑх вӑйсӑр пулма пултараймасть. Иван Яковлевич Яковлева ҫуратса ӳстернӗ халӑх ҫунатсӑр пулма пултараймасть. Иван Яковлевич Яковлева ҫуратса ӳстернӗ халӑх телейсӗр пулма пултараймасть. Сывӑ пултӑр вилӗмсӗр Иван Яковлевич Яковлев! Сывӑ пултӑр аслӑ чӑваш халӑхӗ!».\n\nИнтернет паян такам калаҫнине та курса итлеме май парать. Тӗнче анлӑшӗнче пӑхсан паянхи пирӗн ҫулпуҫсене политикӑри  Ваҫанккасем теме пулать. «Ну кунтан пархатар кӗтместӗп. Ваҫанкка йӗренет пуль тарӑн шухӑшран», – ҫырнӑ Ефрем Васильевич Еллиев кун кӗнекине (1932, ака, 2). Паянхи ҫулпуҫем йӗрӗнеҫҫӗ кӑна мар –  тарӑн шухӑша хӑвалаҫҫӗ чӑваш тӗнчинчен (антиинтеллектуализм). Чӑваш наци конгресӗн 10 съездӗнче А.П.Хусанкая сӑмах паманни – ҫак туртӑма чӑнтан палӑртакан символ. «Вӑл калаҫнине сывламасӑр итлесе лараттӑмӑрччӗ»,  – аса илет Елена Османова («Чӑваш тӗнчи», 2017, ҫурла, 3 (81) №, 5 с.). Юрӑҫ халӑх ҫинчи, халӑх умӗнчи сӑмах хакне шалтан пӗлет.\n\nВолков-Юхма суя миххи пулман пулсан, тен, паянхи Ваҫанккасем те пулмастчӗҫ. «Малалла, Яковлев патнелле!»  – тесе палӑртрӗ В.Г. Родионов чӑваш идейине (Чӑваш халӑх сайчӗ. 22.04.2018.). Паянхи чӑваш ҫулпуҫӗсем чӑнах та Яковлев патнелле ӑнтӑлаҫҫӗ: «…Иван Яковлев чӑвашла ҫырма ӑнкарман, калаҫасса та та чӑвашла-вырӑсла пӑтраштарса калаҫнӑ,  пӗр вӗҫӗмсӗр эдак-идак тесе пакӑлтатнӑ» (Уткин Г. Яковлев трагедийӗ. Очерк. Тӗпчев. Юркин И.Н. Чӑваш тӑшманӗ. Очерк. Шупашкар: «Ҫӗнӗ  Вӑхӑт», 2014, 17 с.). О.Н. Мустаев Л.П. Куракова: «Иккӗмӗш Иван Яковлевич Яковлев», - тесе чыслать. Риторика тӗлӗшӗнчен пӑхсан, пуплевре вӑл хӑйне епле тытнине кура ку чӑнах та ҫапла. Л.П. Кураков ЧНК 10 съездӗнче тухса калаҫнинчен: «…получается 200 народов проживает на территории Чувашской Республики. Всем членам национального конгресса, всему чувашскому народу от имени этих народов хочу передать нашу любовь – хамӑр юратнине. Сире хисепленине, сирӗнпе ялан пӗрле ӗҫлесси ҫинчен хатӗррине сирӗн пата ҫитересшӗн, сире пӗлтересшӗн. Наконец, я хотел бы завершая свою мысль я сказать. Мы не имеем права никогда забывать предыдущих людей, которые для нас много сделали. Сегодня Михаил Васильевич очень хорошо сказал, Николай Федорович, вы очень хорошо сказали о тех людях, которые внесли вклад в укрепление дружбы народов. Это очень важно, это очень нужно. И, конечно же, великий наш патриарх Иван Яковлевич Яковлев мӗн тери вӑл пысӑк ӗҫсем тунӑ. Вӑл ҫӗр ҫул каялла каланӑ туслӑ пурӑнасси ҫинчен пире каласа хӑварнӑ ырӑ сӑмахсем.  Когда я встречался с президентом Академии наук Росии, когда показал завещание чувашского народа Ивана Яковлевича Яковлева, он не поверил. Вы, говорит, почему в секрете держите, держали долгое время это завещание. Вы должны это завещание довести до всех-до всех народов. Хотя одно выражение сегодня хотел бы перед вами озвучить: «Верьте в Россию, любите ее и она станет вам матерью!» Прошло сколько лет, значимость этого завещания, духовность, нравственность, сила этого завещания не только не теряет силу, а, наоборот, приумножается в силу ряда актуальных причин. Ҫавӑнпа национальный конгресс ирттерни халӗ ҫав тери пысӑк, ҫав тери вырӑнлӑ…».\n\n«Заставлять человека учить язык, который для него родным не является, так же недопустимо, как и снижать уровень и время преподавания русского в школах национальных республик РФ. Обращаю на это особое внимание глав субъектов Российской Федерации». Путин 2017 ҫулхи  утӑ уйӑхӗн 20-мӗшӗнче Йошкар-Олара каланӑ сӑмахӗсем хускатнӑ ӗҫ-пуҫ мана ҫынсен (уйрӑмах урӑх халӑх ҫыннисен) шухӑш-кӑмӑлне ыйтса/тӗпчесе пӗлме хавхалантарчӗ. Шупашкарта пурӑнакан вырӑссем чӑвашсене сӑнаҫҫӗ иккен.Чӑвашсем хӑй чӗлхипе таса калаҫайманни – пӗтекен халӑх палли. «Итлеме йӗрӗнмелле, – теҫҫӗ вӗсем. – Ни чӑвашла, ни вырӑсла… Тутарсем ав тап-таса хӑй чӗлхипе калаҫаҫҫӗ. Пӗр вырӑс сӑмахӗ кӑлармаҫҫӗ…».\n\nПирӗн халӑха юратман ҫынсем  паянхи ҫулпуҫӗн Иван Яковлевич Яковлевла «эдак-идакӗсене» илтсен савӑнмаллипех савӑнаҫҫӗ. Ӗлӗк чӑваша  ҫум курӑкпа танлаштарнӑ пулсан, паян – клоунпа: «Россия без чувашей как цирк без клоуна». Ухмаха перекен чӑваш урӑх халӑх куҫӗпе пӑхсан – клоун. Эп хуралта ӗҫлетӗп. Кӳршӗ ҫуртра пурӑнакансене уҫҫисене панӑ, анчах пурӑнма ирӗк паман-ха. Ҫурт управленийӗ пире, хуралҫӑсене, пӑхкалама ыйтрӗ. Каҫ. Юсав ӗҫӗсем пыраҫҫӗ. Хваттер хуҫисем «йӑвисене» хӑйсене кирлӗ пек майлаҫҫӗ, улӑштараҫҫӗ. Хӑшӗ тӗревлӗ мар/тӗп мар стенисене те ишеҫҫӗ. 3 хутри чӗречерен стена ванчӗкӗсене михӗсемпе пӑрахаҫҫӗ. Полиципе хӑратрӑм. «Эпир – чӑвашсем, каҫарӑр пире», – терӗҫ мана.\n\nБорис Чиндыковӑн «Hotel Chuyashia» калавӗнчи юрӑ аса килет: «Мы, чуваши, дураки». Пирӗн ялти (Етӗрне районӗ, Йӗрӗхкасси ялӗ) Колька мочок эрех ӗҫсен-тусан ялан пӗр юрӑ тӑсатчӗ: «Эпӗр охмах кап…сам, пиртан ыр ҫын полас ҫок».\n\nЧӑваш политика сцени ҫинчи Ваҫанккасем ҫак юррах юрламаҫҫӗ-ши, тепӗр тесен?!. «Сидят на детском горшке и пытаются говорить о важных вопросах», – темшӗн вырӑсла палӑртатчӗ  хӑйӗн шухӑш-кӑмӑлне Иосиф Дмитриев. Сӑнаршӑн, ӳстерсе каланӑ пек туйӑнатчӗ мана театр ачин сӑмахӗ. Халь куратӑп: вӑл мантан чылай мал курӑмлӑрах пулнӑ иккен. Айванла пуплев те, какки те (Валери Туркай хӑйне вӗрентекенӗн – Атнер Хусанкайӑн –  пуҫӗ ҫине хӑпарса сысни  мӗне тӑрать!) чӑваш пурнӑҫӗнче тухрӗ мала. Арсений Тарасов савӑнать пулӗ тетӗп. «Охмах кап..алла» чӑваш вӑл – ун проекчӗ. Хоппа хОпларӗ чӑваш тӗнчине. «Хам чӑваш пулнишӗн намӑсланса ларатӑп вӗсен сцена ҫинчи вӑййине курсан», –  тетчӗ Олимпиада Васильевна Таллерова (А.И. Миттов мӑшӑрӗ) чӑваш артисчӗсем пирки. «Эпир хӑюллӑ! Эпир никамран та вӑтанса тӑмастпӑр. Чӑвашӑн ун пек туйӑм пулмалла та мар!» ( Чӑваш халӑх сайчӗ. 08.01.2017). Хоппа юнӗ чупать Кипечре. Чӑвашшӑн  ҫунатӑп теекен Кипеч ҫыравҫӑ чӑвашла кӗнеке хуплашкисем ҫине Кибеч писатель тесе ҫырни вӑл чӑнтан кам пулни пирки систерет – клоун… Анчах кулас килмест ман вӗсен мыскарисене курса. Ваҫанкка Маяковскине тӗлӗнтернӗ. Паянхи Ваҫанккасен вӑййи йӗклентерет, йӗрӗнтерет… «Сделаемся чувашами и послушаем», – тенӗ Л.Н. Толстой А.З. Воинов патне ҫырнӑ ҫырура (1902, чӳк, 11). «Акӑ куҫӑм умӗнче чӑваш ҫӗрӗ… / Тӑван ҫӗршыв тавра чунӑм вӗҫрӗ»…  Ҫеҫпӗлле шухӑшласа илетӗп те – чӑваша ӑс-тӑн тӗлӗшӗнчен пуш хир хупласа илнине куратӑп. Паян никам та: «Сделаемся чувашами и послушаем»  теес ҫук. «Атьӑр-ха ӑслӑ, философилле калаҫар!» – тетчӗ Геннадий Ильич Исаев художник тус-юлташсемпе эрех ӗҫнӗ чух. Паян кӗрекере те, ҫын ҫинче те, халӑх умӗнче те ӑслӑ калаҫакансем ҫухалса пыраҫҫӗ. Урӑхла пулма та пултараймасть. Пур ҫӗрте те монолог. Хаҫат-журналта та, радио-телевиденире те  –  ниҫта та тавлашу-диспут валли вырӑн ҫук. (Чӑн шухӑш, ӗнентерет пире М.М. Бахтин, диалогра кӑна ҫуралма, пурӑнма пултарать.). «Шел, писательсене пӗр союза пӗрлетештереймерӗмӗр», – хут тӑрӑх хурланса вуласа пачӗ пӗрре Н.Ф. Угаслов. Чӑваш литератури, пӗтӗмӗшле илсен, нихҫан та тарӑн шухӑшлӑ пулман (уйрӑм генисем пур, паллах, пирӗн  – кунта пӗтӗмӗшле шай пирки сӑмах пырать). Угаслов политики вӑй илсе кайсан чӑвашри шухӑш таппине мӗн кӗтесси паллӑ – сӳнесси … Угаслов саманинче Кибеч писатель пророка тухни те ӑнсӑртран мар. Кибеч писатель меслетне пӗр сӑмахпа палӑртма пулать – китч. Кибеч – китч. Пысӑк сӑмах каличчен пысӑк чӗле ҫӑкӑр тыт тенешкел – Кибеч писатель пирки хамӑн энциклопедилле пӗтӗмлетӗве илсе парам:\n\n«КИБЕЧ (псевд.; наст. фам. Ефимов)  Анатолий Ильич (р. 10.8.1937, д. Челкумаги Канаш. Р-на) – прозаик, поэт, драматург, один из активных деятелей Третьего чувашского возрождения (1987 – 1997), идеологов национального движения, кандидат пед. наук (1976), член СП Росс. Фед. (1998). Книги К. так или иначе посвящены темам, наиболее близким к непосредственной политической реальности национальной жизни. Освещает эти проблемы в жанре массовой литературы, «легкого чтения». Популярен среди массового читателя. В прозе нередко апеллирует к половому инстинкту и нездоровому любопытству читателя. Причудливое смешение «серьезных» нац. вопросов с «несерьезной» сферой эротики, «низом» литературы в творчестве К. органически вписывается в широкий контекст «продвинутой» чувашской культуры перестроечного времени (1987 – 1997), в частности газеты «Аван-и», стиль которой А.Хузангай определяет следующим образом: «Публикации «Аван-и» были пестры и мозаичны. Чувашская эстрада, психология и поведение чуваш. и сельских маргиналов, умеренный национализм, попытка говорить с молодежью о серьезных вещах – экономике, бизнесе. Политике, культуре – на ее же языке, внедрение эротического направления в литературе». Его кн.: Пурнӑҫ  ҫулӗ такӑр мар (Тернист жизненный путь). Ш., 1995; Юратусӑр телей ҫук (Без любви счастья нет). Ш., 2000; Улӑп таврӑнни (Возвращение Улыпа). Ш., 2001; Шартлама (Стужа). Ш., 2005 и др.»\n\nУлӑп мар тавранать паян Чӑваша – мӑн сӑтӑр тума пултаракан монстр: Шекспирӑн Калибанӗ майлӑ алпастӑ-арҫури-вупӑр-ийе… хӑраххи. (Владимир Степанов ҫыравҫӑн кун пирки тӗлӗнмелле сӗмленӳсем иксӗлми.) «Чӑваш чунӗнчи монстр», – тенӗ пулӗччӗ Карл Густав Юнг. Шалти усал хӑватсене ӑс-тӑн ҫутинче кӑна алла вӗрентме, культура чиккине кӗртме пулать. Кӑна тума пирӗн ӑс-тӑнӗ те, хӑюлӑхӗ те ҫителӗксӗр. Ҫавӑнпа чӑваш наци пурнӑҫӗн сцени ҫинче чӑваш Калибанӗ пӗр намӑссӑр саркаланать пулӗ тетӗп. Тен, Калибан пулса ҫухалӑпӑр, кайӑпӑр эпир, чӑвашсем, ҫут тӗнчерен?!.\n\n«Ирӗклӗх ҫулӗ» тесе ят панӑ Мӗтри Юман хӑйӗн кӗнекине (1924). «Суя ҫулӗ» тесе ҫырма пулать чӑваш наци аталанӑвӗн ҫӗр ҫулхи историй пирки. Паян наци юхӑмӗ типсе ларнин  сӑлтавӗ – ҫав суяра та. «Суеҫ суеҫтерет, пурнӑҫ ҫулне хӗстерет», –  теҫҫӗ ваттисем. Ҫакна пурнӑҫ вӗҫӗнче те пулин ӑнланни Г.Н. Волкова чыс тӑвать. Геннадий Никандрович 2010 ҫулхи ҫу уйӑхен 27-мӗшӗнче: «Чӑваш халӑхӗ умӗнче эп айӑплӑ… Каҫару ыйтатӑп… Иван Яковлевич Яковлев иккен коварный русификатор», –  тени пирки эп ҫырнӑ. Вулӑр: «Суккӑр тата хӑлхасар вӗреннӗ чӑвашсем пирки» (Чӑваш халӑх сайчӗ. 21.06.2017). Икӗ уйӑх маларах (2010, пуш, 4)  Г.Н. Волков ҫав шухӑшах О.М. Цыпленкова панӑ интервьюре те калать иккен. Яра кун ҫывӑхрах аслати шарлаттарнӑ пек янракан Волковӑн  сӑмахӗсене эп анчахрах асӑрхарӑм. Ӑна  халӑх патне  ҫитересшӗн. Пирӗн пурин те хыт шухӑшламалла: И.Я. Яковлев патне малалла каймалла е чӑнлӑх патне ӑнтӑлмалла. «Волков Геннадий Никандрович академик» ятлӑ интервьюшӗн Олег Михайлович Цыпленкова чыс та мухтав!\n\nГ.Н. Волков сӑмахӗсем: «Яковлев ӳстерсе янӑ ҫын вӑл. Эп айӑплӑ халӑх умӗнче. Эп фальсификатор пултӑм».\n\n«Чӑваш шӑпи тата суя» ыйту мана тахҫанах шухӑшлаттарать. 20 ҫул каялла ҫырнӑ ӗҫсенчен пӗрне вулакана сӗнетӗп.  «Ҫӑлӗ-ши чӑваша чеелӗх?» тӗрленчӗк «Ҫамрӑксен хаҫатӗнче» (1998.21.08) кун ҫути курнӑ.\n\n\n\nВӗреннӗ чӑваш хӑй ӑсӗпе пурӑнасшӑн пулманнине асӑрхакансем пулнӑ. Тӗслӗхрен, Юрий Скворцов ҫыравҫӑ ҫак ҫитменлӗхе ак ҫапла палӑртнӑ: «Пӗр-пӗр пархатарлӑ сӑвӑҫ е калавҫӑ пӗр-пӗр илемлӗ танлаштару тупсан, картана пӑрахнӑ ҫӑкӑр татӑкне чӑх чӗпписем хупӑрласа илнӗ пек, кӑпӑрр! тапӑнатчӗҫ. Вара сӑвӑран сӑвва, калавран калава ҫак танлаштарӑва сӗтӗрсе, ҫак илемлӗ танлаштарӑвах йӗклентерекен таватчӗҫ, ҫак танлаштарӑва малтан тупнӑ пархатарлӑ ҫынран та пистеретчӗҫ». «Поэзире пирӗн тахҫанах ҫӗнӗ тырӑ ҫӑкри ҫиме вӑхӑт ҫитнӗ, халӗ те киввинех ҫиетпӗр», – ҫырнӑ вӑл кун кӗнекине (1961).\n\nЧӑваш ҫӗнӗ йӑла кӑларма юратакан халӑх мар, анчах пурнӑҫа ҫӗнетсе тӑма кирлине ӑнланать: «Ытти тӗлӗшрен кунта пайтах ҫӗрте «чӑваш йӑлипе» тенӗ ҫӗрте те аванӗ пур. – ҫырнӑ Григорий Тимофеев «Тӑхӑръялта». – «Ҫӗнӗ курӑк ҫине пуснӑ йӗркепе», «ҫӗнӗ юр ҫине пуснӑ йӗркепе»,  «ҫӗнӗ тырӑ алла илнӗ йӗркепе» тесе, «турра-пулӗхе тав тӑвас» теҫҫӗ».\n\nХалӑх Турра ҫӗнӗ юрӑ юрласа, сӑвӑ-кӗлӗ каласа тав тунӑ, савӑнтарнӑ.\n\nПирӗн интеллигенци чунне, пуҫне вара ҫӗнӗ юрӑ-сӑвӑ кӑна мар, ҫӗнӗ шухӑш-кӑмӑл та, ҫӗнӗ идейӑсем те сайра килеҫҫӗ. Ҫакна, сӑмахран, И.Я. Яковлев ҫуралнӑранпа 150 ҫул ҫитнӗ май ҫырнӑ тӗпчевсем, ӳкернӗ ӳкерчӗксем, фильмсем те кӑтартса пачӗҫ. «Ҫутта кӑларакан», «патриарх», «ырӑ чаваш», «пирӗн Кириллпа Мефодий», «аслӑ Вӗрентекенӗмӗр», «мухтавлӑ ҫыннӑмӑр» тенисем тавра ҫаврӑнчӗ интеллигенци шухӑшӗ. И.Я. Яковлев ӗҫне-хӗлне ҫӗнӗлле хаклас текенсем те тупӑнчӗҫ. Акӑ, Атнер Хусанкай «Обрусение чуваш или чувашское народное дело? (Опыт деконструкции яковлевского дискурса)» статья ҫырчӗ («Республика», 1998, 15 №, 14 с.).\n\n«Пушкина ҫӗнӗлле юратма вӗрентрӗҫ, – тенӗ хӑй вӑхӑтӗнче Александр Блок. – Анчах Брюсов, Щеголев, Морозов т.ыт. те мар – футуристсем. Вӗсем ӑна ҫӗнӗлле вӑрҫаҫҫӗ, ҫапла вара Пушкин пире ҫывӑхрах пулать».\n\nХусанкай Яковлев мифне аркатасшан мар, вӑл ун тупсӑмне, вӑрттӑнне тупасшӑн. «Народ этот дикий и невежественный», «чуваши вообще дичее русских и татар», – чӑваша ҫавӑн пек хурланисем Яковлевӑн пайтах. «Хӗвел ҫинче те пӑнчӑсем пур», – тесе вӗсене курмӑш тума май ҫук. Эпир Яковлевран наци ялавӗ тӑватпар пулсан, пирӗн унӑн ҫитменлӗхӗсене те ӑнланас, йышӑнас пулать.\n\nКарл Густав Юнг ҫын чунӗн ӗмӗлке пурри пирки ҫырнӑ. Чунри усал, аркатуллӑ, хура вӑй-туртӑмсене вӑл ҫапла ят панӑ. «Ӗмӗлкене ӑсласа илес пулать – ҫакӑнта ҫӑлӑнӑҫ», – тенӗ Швейцари психологӗ.\n\nЭтем чунӗ пирки калакан наука ҫул пуҫсен сӑмахӗ-юмахӗсене те асӑранса йышӑнма вӗрентет. Интеллигенци хушшинче юлашки вӑхӑтра И.Я. Яковлев чеелӗх пирки мӗн шухӑшланине халал пек йышӑнасси вӑй илсе пырать.\n\n«Чее пулӑр. Эпӗ ҫамрӑк чухне иезуит Игнатий Лойола вӗрентнине тишкерсе пӗлтӗм. Чӑвашлӑха чеелӗх кӑна ҫӑлать», – тенӗ имӗш Яковлев. (Мӗтри Юман. Хӑватлӑ ӗмӗр.).\n\nҪӑлӗ-ши чӑваша чеелӗх? Укҫа, услам, суту-илӳ енне кайрӗ ҫӗршыври пурнӑҫ. «Суту-илӳ ултавсӑр пулмасть», «суту-илӳре улталайман, хӑй улталаннӑ», «суту-илӳ хушшине ҫылӑх тирӗнет», – тенисем пур халӑх сӑмахлӑхӗнче. (Патмар И.А., Патмар Э.И. Халӑх ӑслӑлӑхӗ. Канаш, 1994, 89 с.).\n\nПолитикӑра та суеҫӗсем мала тухрӗҫ. Вӗсем пиркиех каланӑн туйӑнать Петӗр Эйзин «Вӑтаммисен юррисем» сӑввинче:\n\nСуяҫҫӗ.\n\nЧике тӑршшех лартаҫҫӗ,\n\nпӗр пуссӑрах сутса яраҫҫӗ,\n\nшуҫ тупаньпе те шутараҫҫӗ,\n\nпуртти-аврипеле те тыттараҫҫӗ… –\n\n\n\nАшшӗсемпе амӑшсене,\n\nачи-пӑчисене,\n\nкӳрши-аршисене\n\nирпе те, кӑнтӑрла та, каҫине те,\n\nхӗлле те, ҫуркунне те, кӗркунне те,\n\nпӳртре те, урамра та,\n\nялта та, хулара та…\n\n\n\n«Шӑтман юман кутӗнче\n\nҫуралман мулкач ҫури выртать».\n\nКам ӳркенмест,\n\nАтьӑр\n\nТытма каятпӑр!\n\nСовет влаҫӗ саланнӑ хыҫҫӑнхи тапхӑр самодержави арканнӑ вӑхӑта аса илтерет. «Ман шухӑшпа, – ҫырнӑ И.Д. Никитин-Юркки кун кӗнекинче (1917), – пур суеҫӗ ҫынсене пухса халь тӗрмене хупсан, тӗрмисем ӗлӗкхинчен те тулли пулӗҫ, тӗрмере ларакансене тӑрантарма ҫӑкӑр ҫитереймӗпӗр. Пысӑк айӑплисене анчах тытса хупас пулать».\n\nҪапла, вӑхӑтне кура ҫуралать паян Яковлев-иезуит сӑнарӗ.\n\n«Яковлев – человек с хитрецой, себе на уме, осторожный на словах, в свои признаниях», – вулатпӑр Александр Жиркевич кун кӗнекинче (1917, раштав, 25).\n\n«У Мотовиловых, Зубцовых, в других домах при признании общественных заслуг Яковлева его ругают как хитрого, себе на уме, пронырливого, всюду умевшего пролезть, человека» (1918, кӑрлач, 11).\n\n«Вообще Вальяно-Штейн сделала несколько наглых выпадов против Яковлева, между прочим, сказав ему в глаза: «Вас обвиняют в том, что Вы двуличны» (1919, нарӑс, 7).\n\nЯковлев чее пулса ҫуралман. «Чӑваш час хӗрсе, ҫилленсе каять, чӑкӑлташ камӑллӑ, чунне тивертсен хӑйне хӑй чараймасар ухмахла ӗҫ туса хума та пултарать (чӑвашӑн хӗрсе каясси ман характерта та палӑрать)», – тет И.Я. Яковлев «Моя жизнь» аса илӳре (М., 1977).\n\nУнтах вӑл гимнази юлашки курсӗнче: «Вӗрентме пӗлместӗр!» – тесе Барсов преподователе йӗкӗлтенине те асӑнать. «Ман енчен ку ухмахлӑх пулнӑ», – тесе хак парать вӑл хӑйне (126 с.).\n\n«В жизни моей я вообще не умел угождать, приспосабливаться», – вулатпӑр кӗнекере (327 с.).\n\n«В ту пору я был резок на язык, говорил энергично, любя, не стесняясь, высказывать в глаза свои суждения, не стесняясь тем, нравится это другим или нет», – ку Хусан университетӗнче вӗреннӗ чунехине аса илни (172 с.).\n\nИльминский вилсен, ӑна халалласа Петербургра ирттернӗ съездра вериленнӗ пирки Яковлев ак мӗн асӑнать. Н.А. Бобровников хӑйӗн докладӗнче Ильминский гимнастика пирки мен шухӑшланине калать. Яковлева ку кӑмӑла каймасть. «Я не выдержал и, обращаясь к находившемуся тут же, в заседании, И.А. Износкову громко заявил: «Слышите ли, Илиодор Александрович? Ильминский никогда ничего подобного не мог говорить! Это принадлежит автору программы, а не Ильминскому. Вероятно, Износков нашел мою вставку в доклад неуместной, так как, сильно покраснев, мне не ответил» (432 с.).\n\nЧееленме Яковлев Н.И. Ильминскипе паллашнӑ хыҫҫӑн пуҫланӑ пулас. Вӑлах, тен, ӑна Лойола вӗрентӗвӗпе паллаштарнӑ. «Ильминский вилсен, К.П. Победоносцев ун ҫырӑвӗсене пичетлесе кӑларчӗ, – тет Яковлев, – мулласем Ильминский икӗ питлӗ пулнине, тус пек пулса, чӑннипе, вӗсене хирӗҫ вӑрттӑн кӗрешнине ӑнланса илчӗҫ» (220 с.).\n\n«Ҫыннӑн хӳрисем ахалех пӗтнӗ, – ҫырнӑ Юрий Скворцов кун кӗнекине (1973). – Хӳрисем пулнӑ пулсан, вӗсен кӑмӑлне сӑнама пит лайӑх пулӗччӗ. Сӑмахран, йӑпӑлти ҫын пуҫлӑх умӗнче тӑнӑ чухне эх! мӗнле вылятнӑ пулӗччӗ ӑна! Курма пит кӑсӑк пулмалла».\n\n«Хӳре вылятнине» паян хӑшӗ-пӗри «чӑваш стилӗ» пек курасшӑн. «Халь тӗнче ултавлӑ. Хӑвна ултавлама памалла кӑна мар, тен, хӑвӑн та улталама пӗлмелле. Атьӑр, пурте яка пулса тӑрар та тӗнчене тепӗр ҫӗнӗ стильпе тӗлӗнтерер. Ку – чӑваш стилӗ, чӑваш манерӗ, чӑваш хапи теччӗр». (Сарри Мишши. Яка чӑваш. – «Хыпар», 1977, кӑрлач, 10.).\n\nСарри ҫыравҫӑ шухӑшланӑ пек яка пулма ыйтать-ши вӑхӑт? Паян пирӗн ҫӗршывра капитализм тени шӑнман пӑр ҫине лартса ямалла тенине пӗлтерет-ши? Ҫитмӗлӗш ҫулсен ҫурринчен пуҫласа Анӑҫ социологинче, экономикинче Макс Вебер (1864 – 1920) ӗҫӗсем мала тухрӗҫ. Нимӗҫ социологӗ, историкӗ, экономисчӗ чуна парса ӗҫлеме кирлине вӗрентнӗ, ӗҫе тӗнпе, Турӑ ирӗкӗпе ҫыхнӑ. (Вулӑр: Вебер М. Протестантская этика и дух капитализма.).\n\nТӳрӗлӗх кирлине пирӗн экономистсем те ӑнланаҫҫӗ. «Нимле рынок та хальлӗхе ҫук, – терӗ Чӑваш Республикин вице-президенчӗ Лев Кураков Гуманитари наукисен институчӗн ӗҫченӗсемпе тӗл пулнӑ чух (1998, ака, 16). – Пур ӗҫре те тасалӑх, уҫӑмлӑх пулмалла. Эпӗ сирен пата уҫӑ чунпа, уҫӑ чӗрепе килтӗм».\n\n«Суя сӑмахӑн ырри ҫук», «Икӗ питлӗ ҫынна шанмаҫҫӗ», «Икӗ питлӗ ҫын ҫынна сутать», – тенӗ ваттисем. Капиталистсем пӗр-пӗринпе епле хутшӑнни пирки вулатӑн та – «ырӑ та ухмах чӑваша» (Николай Казаков композитор халӑха хак панинчен) та тӗнчере телей тупӑнасса шанма пуҫлатӑн. Ултавҫӑсене капиталистсем иккен хӑйсен хутлӑхӗнчен пӗр шелсӗр кӑларса пӑрахаҫҫӗ, хӑйсен йышне тек илмеҫҫӗ.\n\nИ.Я. Яковлев та чееленсе хӑйӗн пурнӑҫ ҫулне самай хӗстернӗ. «Про меня постоянно распускалась клевета в том смысле, что я нажил себе незаконными путями состояние, нагрев, так сказать, руки около Чувашской школы», – тет вӑл аса илӳре (544 с.). Пурӑна-киле ӑна та, чӑвашсене те хула ҫыннисем шанми пулнӑ, хирӗҫ тӑра пуҫланӑ.\n\n«Ҫапла шкул ачисене усрамалӑх ҫуртсем ҫавӑрса ҫитернӗ, –   ҫырать М.П. Петров-Тинехпи «Чӗмпӗрти чӑваш шкулӗпе И.Я. Яковлев ҫинчен кӗскен каласа кӑтартни» кӗнекере (Шупашкар, 1928, 55 с.). – Вӗсене тӑвас пирки Иван Яковлевич округра нумай йӗрӗнтернӗ тата нумай ҫынсенчен те пулӑшу кӑларса илме пӗлнӗ. Ҫавӑнпа ӑна «лиса-строительница» теме пуҫланӑ».\n\n«Шкул палӑра пуласанах, кӗвӗҫӳ тата хирӗҫ тару ҫуралчӗ (ку вӑл вырӑс характерӗн палли)», – ҫапла, сӑмахран, ӑнлантарать  Яковлев хӑйӗн пирки ҫӳрекен усал сӑмах-юмаха. Тӗп сӑлтавӗ, ман шутпа, Яковлев чееленме хӑтланнинче.\n\n«Со мной носились, меня ласкали, отмечали», – аса илет вӑл ҫамрӑк чухнехи вӑхӑта 158 с.). Чееленме пӗлмен Яковлева пурте пулӑшма тӑрӑшнӑ. Аса илнинчен: «Пожертвования на общежитие-школку, по мере пробуждения к ней интереса и со строны начальства и  со стороны общества, начали понемногу поступать. Представители симбирского общества – Лазаревы, Языковы, Назарьев и другие, устроив ряд любительских спектаклей, часть доходов отделили на общежитие, что составило сумму в тысячу с лишком рублей, которую я положил в Банк взаимного кредита на мое имя. Это было в первый год пребывания моего в университете. Сумму эту я, по мере надобности расходовал на общежитие» (141 с.).\n\nЧеепе мала каяймӑн, нумай пурӑнаймӑн, тет чӑваш. Ҫакна И.Я. Яковлев букварӗнче пичетленне «Суеҫӗ» калав та ҫирӗплетет:\n\n«Пӗр ача хирте сурӑхсем кӗтсе ҫӳрет тет. Кашкӑр куран пекки туса ҫынсене:\n\n- Килӗр кунта! Кашкӑр пур, кашкӑ-ӑ-ӑр! – тесе  кӑшкӑра пуҫларӗ тет.\n\nҪынсем чупса пычӗҫ тет, кашкӑрӗ ҫук та тет. Ҫапла ку пӗрре улталарӗ тет, тепре те улталарӗ тет. Хай ача ҫынсене чӑн-чӑнах кӑшкӑра пуҫларӗ тет. Каллех суеҫтерни пулӗ тесе ҫынсем пӗри те пыракан ҫук тет кун патне. Никам ҫуккине кура кашкӑр ачанӑн пӗтӗм кӗтӗвне пӑва-пӑва тухре тет.\n\nПӗрре улталӑн, иккӗ улталӑн, виҫҫӗмӗшӗнче макӑран теҫҫҫӗ ваттисем – ҫав ӗнтӗ вӑл».\n\nХӑш-пӗр ӗҫре чееленме пӗлни, тен, кирлӗ те (калӑпӑр, дипломатире), анчах халӑха, уйрӑмах интеллигенцине вал кирлӗ мар. Библи те тӳрӗ ҫулпа ҫуреме вӗрентет: «Тӳрӗ ҫулпа ҫӳрекен Турӑран хӑрать»,  «Камӑн  ҫулӗ кукӑр, ҫав Турра ӗненмест», «Чӑнлӑх ҫулӗ ҫинче – чӗрӗлӗх, кунта вилӗм ҫук»…\n\nЧӑваша ӑс, тӗплӗлӗх, асӑрхануллӑх ҫӑлнӑ.\n\nЧӑвашӑн, ман шутпа, чеелӗхе мар – урӑххине вӗренмелле, аса илмелле. Халӑха ҫапакан е ҫапӑнакан пулӑмсене усса ҫавӑрма. Ку вӑл чеелӗх мар – пурнӑҫ вӑйӗ, вӑййи…\n\nИосиф Дмитриев ҫак шухӑша ҫапла палӑртать:\n\nЭп тӑларан тӑлла ҫавратӑп,\n\nКаҫ хуринчен кӑвайт хуратӑп.\n\n(«Камитҫӗ»)\n\n19 ӗмӗр вӗҫӗнче–20 ӗмӗр пусламӑшенче чаваш ӗҫне тӑвакансем халӑх пуласлӑхне чеелӗхпе мар – ӑспа, тӗплӗлӗхпе ҫыхнӑ. Акӑ мӗн ҫырнӑ, тӗслӗхрен, Кӗркури С. ятлӑ сӑвӑҫ «Хыпар» хаҫатра (1917, 53 №):\n\nМухтав тӗплӗ чӑваша!\n\nМухтав ӑслӑ йӑваша!\n\nПил пултӑрах халӑха,\n\nҪӑмӑллатма пурнӑҫӑ!\n\n(«Халӑх сисрӗ»)\n\nЧӑваш патшалӑх гуманитари ӑслӑлӑхӗсен институт архивӗнче чеелӗх пирки упранакан юрра та (1 уйр., 86 упр. ед.) ҫитерес килет вулакан патне:\n\nАтте пачӗ хура ӑйӑр,\n\nХуса вӗлертӗр терӗ пуль.\n\nЭпир хамӑр чее-ҫке,\n\nҪӑварлӑхламасӑр ҫӳреместпӗр.\n\n\n\nАпи пачӗ хура ӗне,\n\nТӗксе вӗлертӗр, терӗ пуль.\n\nЭпир хамӑр чее-ҫке.\n\nКӑкармасӑр сумастпӑр.\n\n\n\nАнатолий  Миттов ӳкерчӗкӗ. С. Ю. Ювенальев ӳкерсе илнӗ."
      ],
      "response": "Илья Царевский (Илья Фёдоров) 21 çулта. Вăл Çĕнĕ Шупашкартан тухнă волейболçă, Раççей чемпионĕ. Хусанти «Зенит» командинче 2017 çултанпа вылать.",
      "reference": "Илья Царевский 31 ҫулта.",
      "faithfulness": 0.0,
      "context_precision": 0.0,
      "context_recall": 0.0,
      "answer_relevancy": 0.4522025832498497
    },
    {
      "question": "Илья Царевский 2013 ҫултанпа мӗнле тивӗҫре ӗҫленӗ?",
      "user_input": "Илья Царевский 2013 ҫултанпа мӗнле тивӗҫре ӗҫленӗ?",
      "retrieved_contexts": [
        "Ҫӗнӗ Шупашкар каччи, Илья Фёдоров, воллейбол енӗпе Раҫҫей чемпиоантӗнче ҫӗнтернӗ. Каччӑ Хусанти «Зенит» командӑра вылять. Хусанти команда Мускаври «Динамӑна» ҫӗнтернӗ.\n\nИлья — 21 ҫулта. Хусанти «Зенит» йышӗнче вӑл 2017 ҫултанпа вылять. Унччен маларах каччӑ командӑпа пӗрлРаҫсей кубокӗнче ҫӗнтернӗ кӑна мар, Ҫамрӑксен хушшинче Европа чемпионӗ пулса тӑнӑ.",
        "«Ирӗклӗ сӑмах» пӗлтернӗ тарӑх, чӑваш поэчӗ тата журналисчӗ Илле Иванов тӗрӗк культурине пысӑк тӳпе хывнӑшӑн тӗнче премине тивӗҫнӗ. Тӗрӗссипе, чыслав пуш уйӑхӗн вӗсӗнчех иртнӗ-ха. Ун чухне Турцири Эскишехир хулинче, 2013 ҫулта тӗрӗк халӑхӗн культурин тӗп хулин ятне тивӗҫнӗскерте, уяв пулнӑ. Унта Чӑваш Енрен Илле Ивановсӑр пуҫне Олег Цыпленков тата Маргарита Ильина журналистсем, Праски Витти ӳнерҫӗ, Чӑваш патшалӑх юрӑпа ташӑ ансамблӗ те кайнӑ.\n\nИлле Иванова, ытти лауреат пекех, плакетпа (медаль тӗсӗ) чысланӑ, Эскишехир кӗпӗрнаттарӗн тав хутне панӑ. Чыслава ҫавӑн пекех Тӗрӗк культурин пӗтӗм тӗнчери организацийӗн тӗп секретарӗ Дюсен Касеинов, Турци вӗренӳ министрӗ Наби Авчи хутшӑннӑ. Эскишехир тӗрӗк халӑхӗн культурин тӗп хулин ятне Хусана панӑ.\n\nИлле Иванов — ЧР тава тивӗҫлӗ культура ӗҫченӗ, Митта Ваҫлейӗн фондне тата тӗрӗк тӗнчин культурин чӑваш центрне йӗркелекенӗ. 1993 ҫулта вӑл Ҫемен Элкер ячӗллӗ премине тивӗҫнӗ. 2005 ҫулта Абдюльхак Хамид ячӗллӗ премине илнӗ.",
        "Елчӗк районӗнчи Чӑваш Тӑрӑмӗ ялӗнче пурӑнакан Илья Степанович Волков 100 ҫул тултарнӑ. Вӑл юбилейне Илле кунӗнче, ҫурла уйӑхӗн 2-мӗшӗнче, паллӑ тунӑ.\n\nИлья Степанович – Тӑван ҫӗршывӑн Аслӑ вӑрҫин ветеранӗ. Юбилей ячӗпе ун патне РФ Президентӗнчен Владимир Путинтан саламлӑ ҫыру килнӗ. Ҫавӑн пекех ӑна парнесемпе хавхалантарнӑ.\n\nПӗр ӗмӗре хыҫа хӑварнӑ Илья Волков пурне те сывлӑх, 100 ҫула пурӑнса ҫитме суннӑ.",
        "Шупашкарти Ҫӗнӗ хула текен микрорайонти  урамсенчен пӗрне Чӑваш Енри патшалӑхӑн, политикӑн тата обществӑн паллӑ ӗҫченӗн Илья Проко­пьевӑн ятне пама йышӑннӑ. Ӗслӗ хута республикӑн тӗп хулин администрацийӗн пуҫлӑхӗ Алексей Ладыков ака уйӑхӗн 4-мӗшӗнче алӑ пуснӑ.\n\nИлья Прокопьев пӗлтӗрхи нарӑс уйӑхӗн 20-мӗшӗнче пурнӑҫран уйрӑлнӑччӗ. Вӑл ун чухне 91 ҫула кайнӑччӗ. «Пысӑк чун-чӗреллӗ, пултаруллӑ ертӳҫӗн, ячӗ Чӑваш Республикин тата Раҫҫейӗн историйӗнче ылтӑн саспаллисемпе ҫырӑннӑ ҫын», — тесе ҫырнӑччӗ некрологра.\n\nШӑп та лӑп тепӗр ҫулталӑкран Чӑваш Ен Элтеперӗ Михаил Игнатьев Илья Прокпьевӑн ятне асра тытасси ҫинчен калакан указа алӑ пуснӑччӗ. Ҫав хута ӑнлантарнинче Шупашкарти урамсенчен пӗрне Илья Прокопьев ятне парасси пирки те каланӑччӗ.",
        "Ҫитес ҫул Чӑваш Енре мӗнле ҫулталӑк пулӗ? 2018 ҫулта Чӑваш Ҫуттакӑларуҫи Иван Яковлев ҫуралнӑранпа 170 ҫул ҫитет. Ҫавна май Чӑваш Енре ҫитес ҫула Иван Яковлева халаллама йышӑннӑ. Аса илтерер: Яван Яковлевич 1848 ҫулхи ака уйӑхӗн 25-мӗшӗнче ҫуралнӑ.\n\nҪуттакӑларуҫӑн пултарулӑх еткерне асра тытас тесе тата ҫавра ҫула шута илсе ЧР Культура министерстви ҫитес ҫула Иван Яковлев ҫулталӑкӗ пулнине пӗлтерме хушу проектне хатӗрленӗ. Ӑна каярахпа ЧР Элтеперӗ Михаил Игнатьев алӑ пусӗ.\n\nПалӑртса хӑварар: Иван Яковлев Атӑлҫи тата Урал тӑрӑхӗнчи халӑхсене ҫутта кӑларас, вӗрентес тесе нумай тӑрӑшнӑ, наци кадрӗсем хатӗрленӗ.\n\nСӑмах май, Чӑваш Енре 2015 ҫул Константин Иванов ҫулталӑкӗ пулнӑ."
      ],
      "response": "Илья Царевский (или Илья Иванов, поэт тата журналист) 2013 ҫултанпа тӗрӗк культурине пысӑк тӳпе хывнӑшӑн тӗнче премине тивӗҫнӗ. Преми пуш уйӑхӗн вӗсӗнче Турцири Эскишехир хулинче — тӗрӗк халӑхӗн культурин тӗп хулин ятне тивӗҫнӗскерте — иртнӗ.\n\nЧыслава Тӗрӗк культурин пӗтӗм тӗнчери организацийӗн тӗп секретарӗ Дюсен Касеинов тата Турци вӗренӳ министрӗ Наби Авчи хутшӑннӑ. Илле Иванова плакетпа (медаль тӗсӗ) чысланӑ, Эскишехир кӗпӗрнаттарӗн тав хутне панӑ.\n\nИлле Иванов — Чӑваш Республикин тава тивӗҫлӗ культура ӗҫченӗ, Митта Ваҫлейӗн фондне тата тӗрӗк тӗнчин культурин чӑваш центрне йӗркелекенӗ. 1993 ҫулта вӑл Ҫемен Элкер ячӗллӗ премине, 2005 ҫулта Абдюльхак Хамид ячӗллӗ премине илнӗ.",
      "reference": "Вӑл воспитани парас тата социаллӑ ӗҫ енӗпе проректор пулнӑ.",
      "faithfulness": 0.8125,
      "context_precision": 0.0,
      "context_recall": 0.0,
      "answer_relevancy": 0.559730467529205
    },
    {
      "question": "Илья Царевский академине хӑҫан пӗтернӗ?",
      "user_input": "Илья Царевский академине хӑҫан пӗтернӗ?",
      "retrieved_contexts": [
        "Чӑваш патшалӑх ял хуҫалӑх академийӗнче — каллех улшӑнусем. Аслӑ шкула вӑхӑтлӑх урӑх ҫын ертсе пыни пирки сайтра хыпар паян ирех тухнӑ.\n\nРектор тивӗҫне вӑхӑтлӑха 31 ҫулти Илья Царевский пурнӑҫлӗ. Вӑл 2013 ҫултанпа воспитани парас тата социаллӑ ӗҫ енӗпе проректор пулнӑ.\n\nИлья Царевский хӑй те ял хуҫалӑх акдемийӗнчен 2006 ҫулта вӗренсе тухнӑ. Вӑл ветеринари факультетӗнче ӑс пухнӑ.\n\nАса илтерер: чӳк уйӑхӗн вӗҫӗнче Чӑваш патшалӑх ял хуҫалӑх академийӗн ректорӗн тивӗҫӗсене 69 ҫулти Александр Акимов пурнӑҫлама тытӑннӑ. Ун чухне вӑл ку должноҫре ҫӗнӗ ректора суйличчен пулнине каланӑччӗ.",
        "Чӑваш Ене 14 ҫул ертсе пынӑ Илья Прокопьев ӗнер 90 ҫул тултарнӑ. Ҫав ҫынна халалласа республикӑри массӑллӑ информаци хатӗрӗсем ҫине тӑрсах статья ҫине статья шӑрҫаларӗҫ.\n\nӖнер республикӑн наци вулавӑшӗнче Илья Павловичӑн юбилейне паллӑ тунӑ. Унта тӗрлӗ шайри тӳре-шара кӑна мар, РФ Патшалӑх Думин депутачӗ Анатолий Аксаков та хутшӑннӑ.\n\nУнта пухӑннӑ шур сухалсенчен хӑшӗсем хӑйсен иртнӗ ӗмӗрти ӗҫӗ-хӗлӗ пирки аса илнӗ.\n\nИлья Прокопьев Вӑрнар районӗнчи Мӑчамӑш ялӗнче ҫуралнӑ. Малтанхи пӗлӗвӗпе вӑл — педагог: Хабаровскри пединститутра вӗреннӗ. И.Н. Ульянов ячӗллӗ Чӑваш патшалӑх университетӗнче те ӗҫленӗ. Пурнӑҫӑн тӗп пайне вара парти ӗҫ-хӗлне панӑ.\n\nЧӑваш Ен Элтеперӗн йышӑнӑвӗпе ӗнер «Чӑваш Республики умӗнче тунӑ тава тивӗҫлӗ ӗҫсемшӗн» орденпа чысланӑ.",
        "Ҫӗнӗ Шупашкар каччи, Илья Фёдоров, воллейбол енӗпе Раҫҫей чемпиоантӗнче ҫӗнтернӗ. Каччӑ Хусанти «Зенит» командӑра вылять. Хусанти команда Мускаври «Динамӑна» ҫӗнтернӗ.\n\nИлья — 21 ҫулта. Хусанти «Зенит» йышӗнче вӑл 2017 ҫултанпа вылять. Унччен маларах каччӑ командӑпа пӗрлРаҫсей кубокӗнче ҫӗнтернӗ кӑна мар, Ҫамрӑксен хушшинче Европа чемпионӗ пулса тӑнӑ.",
        "Ӗнер, пушӑн 19-мӗшӗнче, Чӑваш наци вулавӑшӗнче академиксем пухӑнчӗҫ. Кун йӗркинчи тӗп ыйту хушшинче академие ҫӗнетни, унӑн ҫӗнӗ уставӗпе паллашни тата пайташсене ҫӗнӗлле регистрацилесси пулчӗ. Академи ячӗ те ҫӗнелнӗ — халӗ вӑл Чӑваш халӑх ӑсхакӑлӗпе ӳнер академийӗ ятлӑ.\n\nАкадемиксен пуш уйӑхӗн ирформациллӗ пухӑвӗнче ытти чылай ыйтӑва сӳтсе яврӗҫ, тунӑ ӗҫӗсемпе паллашрӗҫ. Академипе патшалӑх хушшинчи юлашки вӑхӑтри хутшӑнусем пирки каласа пачӗҫ, обществӑлла пӗрлешӳн ирӗкӗсемпе тивӗҫӗсемпе паллаштарчӗҫ. Уйрӑмах академи ӗҫӗсен шайне ӳстересси пирки тӗплӗ калаҫрӗҫ. Редакци уйрӑмӗ йӗркелесе ун пуҫлӑхне Эдиссон Патмара лартрӗҫ. Хӑш-пӗр кӗнекесен (уйрӑмах Иван Дубановӑн «Географические названия Чувашской Республики» кӗнекене сӳтсе яврӗҫ) шайӗ пӗчӗк пулни хӑш-пӗрисене чӑн та пӑшӑрхантарать. Ӳстерес тӗлӗшпе малашне кӗнеке тухиччен рецензи ҫырмалли пирки калаҫса татӑлчӗҫ. Рецензи ҫыракансем кӗнекешӗн авторпа пӗр тан яваплӑ пуласси пирки пӗлтерчӗҫ.\n\nЧӗмпӗртен килнӗ Фёдор Искандеров («Азбука чувашских орнаментов и эмблем» альбом авторӗ) хӑйӗн манифесчӗпе паллаштарчӗ. Итлекенсем вӑл текста улшӑнусем кӗртсе ҫемҫетме тата халӑх патне ҫитерме сӗнчӗҫ.\n\nПухура 10 ҫӗнӗ пайташа илчӗҫ. Академи пайташӗсен кӑмӑл-сипечӗпе сумлӑхне хӑпартас тӗлӗшпе 11 ҫынна ваттисен канашне суйларӗҫ — Виталий Станьяла, Денис Гордеева, Эдиссон Патмара, Станислав Отрыванова (аттестаци комисси пуҫлӑхӗ) тата ыттисене.\n\nВӗҫленес умӗн «Атӑлпа Урал таврашӗнчи ҫутҫанталӑка тӗпчеҫ ыйтусем» ятпа дискусси иртрӗ. Итлекенсем нумаях пулмарӗҫ пулин те пирӗн тӑрӑхра виноград е груша епле ӳстересси вӗсемшӗн кӑсӑклӑ пулчӗ.\n\nТепӗр пуху чӳкӗн 26-мӗшӗнче иртмелле.\n\n\n\nСӑнсем (23 сӑн, В. Милютин тунисем)",
        "Паян ЧР премьер-министрӗ Иван Моторин Юрий Исаева ЧР Вӗренӳ интститучӗн ректорӗн должноҫне парасси пирки хушу алӑ пуснӑ.\n\nАса илтерер: кӑҫалхи кӑрлач уйӑхӗччен вӑл ЧР вӗренӳ министрӗ пулнӑ. Кайран ЧР Элтеперӗ Михаил Игнатьев ӑна отставкӑна ярса хӑйӗн администрацийӗн ертӳҫин ҫумне лартнӑ. Ҫав вӑхӑталлах ЧР Вӗренӳ институчӗн унчченхи ректорне Сергей Савина ӗҫрен кӑларнӑ.\n\nЮрий Исаев 1969 ҫулхи нарӑсӑн 13-мӗшӗнче Патӑрьел районӗнчи Нӑрваш Шӑхаль ялӗнче ҫуралнӑ. 1995 ҫулта И.Н.Ульянов ячӗллӗ ЧПУ пӗтернӗ, «Чӑваш чӗлхи тата литература» специальноҫе алла илнӗ. Унтан вӑл юриста вӗреннӗ. Юрий Николаевич – филологи ӑслӑлӑхӗсен докторӗ, доцент. Вӑл – 80 ытла вӗренӳпе методика ӗҫӗсен авторӗ. Вӗсенчен 5-шӗ – монографи."
      ],
      "response": "Илья Царевский Чӑваш патшалӑх ял хуҫалӑх академийӗнче 2006 ҫулта вӗренсе тухнӑ. Вӑл ветеринари факультетӗнче ӑс пухнӑ. Аслӑ шкултан тухнӑ хыҫҫӑн вӑл академире воспитани парас тата социаллӑ ӗҫ енӗпе проректор пулса ӗҫленӗ. Ҫӑва 2013 ҫултанпа пурнӑҫланӑ. Паян академире улшӑнусем тухнӑ, ректор тивӗҫне вӑхӑтлӑха Илья Царевский пурнӑҫлама тытӑннӑ. Вӑл 31 ҫулта. Чӳк уйӑхӗн вӗҫӗнче академие Александр Акимов (69 ҫулти) ертсе пынӑ, ҫӑва ректора суйличчен пулнӑ чухнехи тивӗҫӗ пулнӑ. Илья Царевский ҫӗнӗ вӑхӑтлӑх ректор пулса академи ертсе пырать.",
      "reference": "Вӑл академине 2006 ҫулта пӗтернӗ.",
      "faithfulness": NaN,
      "context_precision": 0.9999999999,
      "context_recall": 1.0,
      "answer_relevancy": 0.34035038562341646
    },
    {
      "question": "Илья Царевский хӑш факультетра вӗреннӗ?",
      "user_input": "Илья Царевский хӑш факультетра вӗреннӗ?",
      "retrieved_contexts": [
        "Чӑваш патшалӑх ял хуҫалӑх академийӗнче — каллех улшӑнусем. Аслӑ шкула вӑхӑтлӑх урӑх ҫын ертсе пыни пирки сайтра хыпар паян ирех тухнӑ.\n\nРектор тивӗҫне вӑхӑтлӑха 31 ҫулти Илья Царевский пурнӑҫлӗ. Вӑл 2013 ҫултанпа воспитани парас тата социаллӑ ӗҫ енӗпе проректор пулнӑ.\n\nИлья Царевский хӑй те ял хуҫалӑх акдемийӗнчен 2006 ҫулта вӗренсе тухнӑ. Вӑл ветеринари факультетӗнче ӑс пухнӑ.\n\nАса илтерер: чӳк уйӑхӗн вӗҫӗнче Чӑваш патшалӑх ял хуҫалӑх академийӗн ректорӗн тивӗҫӗсене 69 ҫулти Александр Акимов пурнӑҫлама тытӑннӑ. Ун чухне вӑл ку должноҫре ҫӗнӗ ректора суйличчен пулнине каланӑччӗ.",
        "Сире улталаҫҫӗ тесе ан шутлӑр. Паян кулӑш кунӗ пулин те мероприятисем чӑннипех иртеҫҫӗ.\n\n\n\nЫйтӑвӗсем вара ҫапла:\n\n1. “Я не раз перечитывал книги Ивана Яковлевича Яковлева, чье имя носит ваш университет. И всегда обнаруживал в них важную мысль – образование должно быть построено на духовном просвещении, воспитании и нравственном совершенствовании.”  Ҫак сӑмахсене кам тата хӑҫан каланӑ?\n\n2. Ӳ саспаллипе хӑш ҫултан пуҫласа усӑ курма тытӑннӑ?\n\n3. 1871 ҫулта 2-мӗш Александр патшана И. Я. Яковлев хӑш хулара курнӑ тата асаилӳре ӑна мӗнле хак парать?\n\n4. И.Я. Яковлев ҫырнӑ тӑрах вӑл 1857 ҫулхи юпа уйӑхӗнче комета курать. Икӗ эрне ытла тӳпере курӑнса тӑнӑ кометӑн ячӗ мӗнле-ши?\n\n5. И.Я. Яковлев ҫӗр виҫсе ҫӳренӗ чухне миҫе тенкӗ шалу илнӗ тата чаплӑ кӗрӗк ҫӗлетересси миҫе ҫула тӑсӑлнӑ?\n\n6. И.Я. Яковлева пӗлекенсем вӑл вӑхӑтран вӑхӑт кӑштах уксахланине палӑртаҫҫӗ. Хӑҫан тата мӗн пулнӑ-ши Иван Яколвлевичпа?\n\n7. Чӗмпӗрти ар гимназине кӗме Иван Яковлевич Яковлевӑн миҫе экзамен тытмалла пулнӑ?\n\n8. XIX ӗмӗрти 70-мӗш ҫулсенче Чӗмпӗрте пурӑнакансем ҫулталӑкра пӗрре ик эрнелӗхе хваттер ярса 2-3 ӗне туянма пултарнӑ. Ҫав кунсенче хваттер  ярасси мӗн сӑлтавпа хакланнӑ?\n\n9. Вырӑссен паллӑ писателӗпе Л. Н. Толстойпа И. Я. Яковлев мӗнле пӗр пек ӗҫсем тунӑ, вырӑс классикӗ чӑваш улӑпӗн ӗҫне мӗнле хак панӑ?\n\n10. Иван Яковлевич Яковлев паянхи техучилищӗсем тата ача сачӗсем евӗрлӗ вӗренӳ учрежденийӗсене те пуҫласа йӗркеленӗ. Ӑҫта вырнаҫнӑ-ши чи малтанхисем?\n\n11. Иван Яколевич Яковлева сӑнӳкерчӗксенчи ҫынсемпе кам ҫывӑхлатнӑ-ши? Унӑн, ҫывӑхлатаканӑн, чӑваш шкулӗпе ҫыхӑннӑ пӗлтерӗшлӗ  ӗҫӗ ҫинчен кӗскен каласа парӑр.\n\n12. И.Я. Яковлев венгрсен хӑш ученӑйӗсемпе тӗл пулнӑ?\n\n\n\nХуравсене ака уйӑхӗн 6-мӗшӗччен ярса памалла.\n\n\n\nХуравсене ӑҫта ярса памаллине, епле хуравламаллине Педканаш сайтӗнче тупма пулать: http://pedkanash.chuvash.org",
        "И.Н. Ульянов ячӗллӗ Чӑваш патшалӑх университечӗ Уҫӑ алӑксен кунне онлайн мелпе унччен те ирттернӗ. Хальхинче ун пеккине машиностроени факультечӗ йӗркелӗ. Вӑл паян, ака уйӑхӗн 18-мӗшӗнче, 12 сехет те 30минутра пуҫланӗ.\n\nАслӑ шкулӑн машиностроени факультетӗнчи специальноҫсем, унта вӗренме кӗрес тесен мӗнле экзаменсем тытмалли ҫинчен каласа кӑтартӗҫ. Уҫӑ алӑксен кунне хутшӑнакансем ытти чылай ыйтӑва та уҫӑмлатайӗҫ. Вӗсене факультетӑн деканӗ Виктор Адольфович Гартфельдер профессор хуравлӗ. Унсӑр пуҫне студентсем, аслӑ шкултан вӗренсе тухнисем, партнер-компанин пайташӗсем калаҫӑва хутшӑнӗҫ.\n\nТӳрӗ эфира ЧПУ «Контактра» халӑх ушкӑнӗнче https://vk.com/chuvsu страницӑра ирттерӗ.\n\nЫйтусене ҫакӑнта https://forms.gle/2BrsvGQ2J5BVGK6Q7 йышӑнаҫҫӗ.",
        "Нарӑсӑн 19-мӗшӗнче Чӑваш филологийӗпе культура факультетӗнче «Уҫӑ алӑксен кунӗ» иртрӗ. Факультет преподавателӗсем пулас абитуриентсемпе тӗл пулса калаҫрӗҫ, факультет ӗҫӗ-хӗлӗ ҫинчен каласа пачӗҫ, вӗрентӳ тата йышӑну йӗркипе тӗплӗн паллаштарчӗҫ, абитуриентсен ыйтӑвӗсем ҫине хуравларӗҫ. Хӑнасем факультет ӗҫӗ-хӗлне ҫутатса паракан презентацисене курчӗҫ. Тӗлпулӑва абитуриентсем хамӑр республикӑн районӗсенчен кӑна мар, Тутарстанри Ҫӗпрел районӗнчен те килнӗ. Факультетри студентсем хушшинче кӳршӗлле республикӑсенчен вӗренме килнӗ студентсем сахал мар, вӗсен йышӗ ӳсессе эпир шансах тӑратпӑр! Хапӑл туса кӗтетпӗр!\n\nТӗлпулӑва килейменнисене ҫак адреспа ҫыру ҫырса ыйтусем пама пултараҫҫӗ: irinakir1@mail.ru.",
        "Шӑматкун, ҫӗртмен 14-мӗшӗнче, И.Н. Ульянов ячӗллӗ Чӑваш патшалӑх университечӗн ӑслӑлӑх канашлӑвӗ йышӑннӑ тӑрӑх филологи факультетне, чӑваш филологийӗпе культура факультетне тата журналистика факультетне утӑн 1-мӗшӗнчен пӗрлештерме йышӑнни ҫинчен хыпар тухнӑ пулнӑ.\n\nЧПУ студентсен канашлӑвӗнче пӗлтернӗ тӑрӑх ҫӗнӗ факультетӑн декан ӗҫ-хӗлне филологи ӑслӑлӑхӗсен докторӗ, профессор Корнилов Геннадий Емельянович тытса пырӗ.\n\nВиҫӗ кафедрӑна пӗрлештернӗ майпа йӗркеленнӗ «Журналистика» ҫӗнӗ кафедрӑн ертсе пыраканӗ вара Данилов Анатолий Порфирьевич пулӗ. Вӑлах университетӑн пресс-центр ӗртӳҫи ӗҫне пурнӑҫласа пырӗ.\n\nҪӗнӗ хыпар факультет ӑсчахӗсемпе пӗрлех студентсене те самай тӗлӗнтернӗ. Нумайӑшӗ факультетсене пӗрлештернӗ йышӑнӑва ырласа каймаҫҫӗ. Студентсен канашлӑвӗнче ӑнлантарса панӑ тӑрӑх университетра вӗренсе тухнине ҫирӗплетекен диплом ҫинче факультет ятне палӑртмалла мар тесе йышӑннӑ, алла илнӗ специальноҫе ҫеҫ ҫырса парӗҫ.\n\nҪӗнӗ факультет мӗнле ятпа ҫӳрессине паянхи куна никам та ҫирӗплетсе параймасть. Ҫапах та хӑш-пӗр факультет ӗҫченӗсем пӗлтернӗ тӑрӑх ҫӗнӗ факультет ячӗ — «Вырӑс филологийӗ, чӑваш филологийӗ тата журналистика факультечӗ» (выр. Факультет русской филологии, чувашской филологии и журналистики) пулма пултарӗ."
      ],
      "response": "Илья Царевский Чăваш патшалăх ял хуçалăх академийĕнче ветеринари факультетĕнче вĕренсе тухнă. Вăл 2013 çултанпа воспитани парас тата социаллă ĕç енĕпе проректор пулнă, халь вара ректор тĕрĕсне пурнăçлать.",
      "reference": "Вӑл ветеринари факультетӗнче вӗреннӗ.",
      "faithfulness": 1.0,
      "context_precision": 0.9999999999,
      "context_recall": 1.0,
      "answer_relevancy": 0.49559966117772375
    },
    {
      "question": "Александр Акимов миҫе ҫулта?",
      "user_input": "Александр Акимов миҫе ҫулта?",
      "retrieved_contexts": [
        "Чӑваш патшалӑх ял хуҫалӑх академийӗн ректорӗн тивӗҫӗсене хальлӗхе урӑх ҫын пурнӑҫлать. Вӑл — Александр Акимов.\n\nПаян, чӳк уйӑхӗн 23-мӗшӗнче, ЧР ял хуҫалӑх министрӗ Сергей Артамонов Ял хуҫалӑх академийӗн ректорне вӑхӑтлӑха палӑртнӑ. Вӑл инженери факультетӗнче транспорт технологийӗн машинин тата комплексӗн кафедрине ертсе пырать.\n\nХушу тухсан Сергей Артамонов ҫӗне пуҫлӑхра иккӗленменнине пӗлтернӗ. Ҫавӑн пекех вӑл юлашки ҫулсенче академи Чӑваш Енри ял хуҫалӑх таварӗсене кӑларакан производительсемпе ҫыхӑну тытманнине палӑртнӑ.\n\nАлександр Акимов вара академин тӗллевсене пурнӑҫламалли майсем пуррине палӑртнӑ. ЧР Ял хуҫалӑх министерствинче пӗлтернӗ тӑрӑх, 69 ҫулти Александр Акимов Ял хуҫалӑх академине ҫӗнӗ ректор палӑртиччен ертсе пырӗ.",
        "Шупашкарти политехника институчӗн директорӗ Александр Акимов техника ӑслӑлӑхӗсен докторӗ, профессор Европӑри ӑслӑлӑхпа промышленноҫ палати ҫирӗплетнӗ Пахалӑх дипломне тата ылтӑн медале тивӗҫнӗ. Ҫӳллӗ шайри наградӑна ӑна «педагогикӑри тата ӑслӑлӑхри пысӑк пахалӑхлӑ ӗҫсемшӗн» панӑ. Маларах ун пеккине Л.М. Рошаль тата Л.А. Бокерия, Е.И. Чазов профессорсем тата ҫӗршыври ытти хӑш-пӗр паллӑ ҫын тивӗҫнӗ иккен.\n\nҪӳлерех асӑннӑ палатӑн Раҫҫейри тата СНГри элчелӗхне 1992 ҫултах йӗркеленӗ. Вӑл ӑслӑлӑхри, культурӑри, производствӑри, вӗрентӳри ҫитӗнӳсене палӑртса патшалӑх тата уйрӑм ҫынсем енчен пулӑшассипе ҫине тӑрать иккен.",
        "Хӑш чух, пушӑ вӑхӑт тупӑнсан, эпӗ ҫынсем Тӗнче тетелӗнсе мӗн шыранине пӗлес йытупа апаланса ларкалатӑп. «Яндекс.ру» шыравҫӑна тӗпе хурса тӗпчетӗп. Калас пулать, тӗлӗнмелле ыйтусем параҫҫӗ тетел хӑнисем. Чи пӗрремӗш вырӑнта «Мӗн вӑл…?» ыйту ларать иккен. Юрату мӗнне пӗлесшӗннисем вара чи йышлисем. Романтика! Ун хыҫҫӑн «Эп ухмах пулсассӑн, ман мӗн тумалла?» ыйту вырнаҫнӑ. Сӑмахран, арҫынсем вӑл ыйтупа муритленмеҫҫӗ. Тӗнче тетелӗ вара ҫак ыйту ҫине 5 млн. хурав парать иккен! «Мӗнле?» — ҫак ыйтупа тухакансем иккӗмӗш вырӑнта тӑраҫҫӗ. Суши апата мӗнле майпа ҫимеллине пӗлес шухӑшлисем малта. Унтан вара мӗнле тӗрӗс чуп тумаллине ыйтакансем. Виҫҫӗмӗш вырӑнтисем  начарланас хуйхӑпа аппаланаҫҫӗ имӗш. «Ӑҫтан укҫа тупас?», «Ӑҫта-ши ман савни?». Юлашки ыйту ҫине 300 порносайт тухса тӑрать. «Кам?», «Кам куна тунӑ?» ыйтусемпе те сахал мар муритленекенсем. «Ҫывӑракан ҫына мӗншӗн фотоаппаратпа ӳкерме юрамасть?», — тесе йытаканнисем те чылай.\n\nПӗррехинче В. Путин телевиденире «Ку сакӑр ҫул эпӗ галера ҫинчи чура евӗрех ӗҫлерӗм (как раб на галерах)», — тенӗ пулать. Тахӑшне «как краб на галерах» тесе илтӗннӗ те, вӑл, паллах, тетелте — «Мӗншӗн Путин краб?» — ыйтса пӗлесшӗн пулнӑ. Ку кӑна та мар, Путина краб евӗр ӳкерсе кӑтартнисем те тупӑнкалаҫҫӗ.\n\nСергей Курехин, паллӑ юрӑҫ, композитор, 1991-мӗш ҫулта Ленин наркӑмӑшла кӑмпа ҫиме юратнӑ пирки хӑй те кӑмпа пулса тӑнӑ тесе телевиденире каласа хунӑ тет. Халӑх вара хурава тетелте шырать — «Владимир Ильич мӗнле майпа кӑмпа пулса тӑнӑ-ши?» — тесе кӑсӑкланать.\n\nЭ-э-х! Шеремет тӗнчи, ӑҫта пырса ҫапӑнмастпӑр-ши, этемсем!",
        "Раҫҫейри велоҫулҫӳревҫӗ Алексей Ильмухин Питӗртен Владивостока ҫитме палӑртнӑ. Унӑн 11 пин ҫухрӑма парӑнтармалла. Хӑйӗн ҫулҫӳревне вӑл Ҫӗнтерӳ пулнӑранпа 80 ҫул ҫитнине халалланӑ.\n\nҪула май Алексей Чӑваш Ене кӗрсе тухнӑ. Ахальтен мар. Унӑн ашшӗ тата аслашшӗ – Улатӑр тӑрӑхӗнчи йӑхран.\n\nАлексей Шупашкарта «Ӗҫ мухтавӗн хули» стела патӗнче чарӑнса сӑн ӳкерӗннӗ. Хостелта ҫӗр каҫнӑ хыҫҫӑн вӑл каллех ҫула тухнӑ: Урал, Ҫӗпӗр урлӑ — Инҫет Хӗвелтухӑҫне.",
        "Ямалти ҫулҫӳревҫӗ Алексей Коротков «Ермак ҫулӗ» ҫӗнӗ маршрут хатӗрленӗ. Вӑл Ҫӗпӗр тата ытти юханшыв урлӑ выртӗ.\n\nАлексей ҫулла Чӑвашри Сӑр юханшывпа резина кимӗпе ишме палӑртнӑ. Ҫамрӑкскер ҫулҫӳревре тӑватӑ ҫул пулӗ.\n\nАлексей Коротков палӑртнӑ тӑрӑх, ҫул ҫине вӑл 100 пин тенке яхӑн тӑкаклама палӑртнӑ. Ытларах пайӗ кимӗ туянма кайӗ. Хӑйӗнпе пӗрле апат-ҫимӗҫ илесшӗн. Капла укҫа-тенкӗ сахалрах тӑкакланӗ.\n\nҪулҫӳревҫӗ шӑрӑхран та, йывӑрлӑхран та хӑрамасть. Уншӑн ку манӑҫми экспедици пулӗ. Алексей — ҫар историкӗ. Тӑватӑ ҫул каялла вӑл велосипедпа Салхардран Белгород облаҫне ҫитнӗ. 2013 ҫулта Салехардран Мускава ҫити утнӑ.\n\nСӑмах май, авӑнӑн 1-мӗшӗнче Ҫӗпӗре парӑнтарнӑ Ермак ҫуралнӑранпа 435 ҫул ҫитет."
      ],
      "response": "Александр Акимов — 69 ҫулта.\n\nВӑл хальхи вӑхӑтра Чӑваш патшалӑх ял хуҫалӑх академийӗн вӑхӑтлӑха палӑртнӑ ректорӗ пулса тӑрать. Ку тава тивӗҫлӗ инженер-ӑсчах, техника ӑслӑхӗсен докторӗ, профессор. Вӑл Шупашкарти политехника институчӗн директорӗ пулнӑ, каярахпа ЧР ял хуҫалӑх министрӗ Сергей Артамонов академире ҫӗнӗ ректор палӑртнӑччен академие ертсе пынӑ.\n\nАлександр Акимовӑн тивӗҫлӗ ӗҫӗсене палӑртас тесе Европӑри ӑслӑлӑхпа промышленноҫ палати Пахалӑх дипломне тата ылтӑн медале панӑ. Ҫак наградӑна вал «педагогикӑри тата ӑслӑлӑхри пысӑк пахалӑхлӑ ӗҫсемшӗн» тивӗҫнӗ.",
      "reference": "Александр Акимов 69 ҫулта.",
      "faithfulness": NaN,
      "context_precision": 0.9999999999,
      "context_recall": 1.0,
      "answer_relevancy": 0.4724020911205418
    },
    {
      "question": "Александр Акимов ректор тивӗҫне хӑҫан пурнӑҫлама тытӑннӑ?",
      "user_input": "Александр Акимов ректор тивӗҫне хӑҫан пурнӑҫлама тытӑннӑ?",
      "retrieved_contexts": [
        "Чӑваш патшалӑх ял хуҫалӑх академийӗн ректорӗн тивӗҫӗсене хальлӗхе урӑх ҫын пурнӑҫлать. Вӑл — Александр Акимов.\n\nПаян, чӳк уйӑхӗн 23-мӗшӗнче, ЧР ял хуҫалӑх министрӗ Сергей Артамонов Ял хуҫалӑх академийӗн ректорне вӑхӑтлӑха палӑртнӑ. Вӑл инженери факультетӗнче транспорт технологийӗн машинин тата комплексӗн кафедрине ертсе пырать.\n\nХушу тухсан Сергей Артамонов ҫӗне пуҫлӑхра иккӗленменнине пӗлтернӗ. Ҫавӑн пекех вӑл юлашки ҫулсенче академи Чӑваш Енри ял хуҫалӑх таварӗсене кӑларакан производительсемпе ҫыхӑну тытманнине палӑртнӑ.\n\nАлександр Акимов вара академин тӗллевсене пурнӑҫламалли майсем пуррине палӑртнӑ. ЧР Ял хуҫалӑх министерствинче пӗлтернӗ тӑрӑх, 69 ҫулти Александр Акимов Ял хуҫалӑх академине ҫӗнӗ ректор палӑртиччен ертсе пырӗ.",
        "Чӑваш патшалӑх ял хуҫалӑх академийӗнче пӗр уйӑхра ректор тивӗҫне пурнӑҫлакана виҫӗ хутчен ылмаштарнӑ. Хальхинче ҫак должноҫе вӑхӑтлӑх пурнӑҫлама Андрей Макушева лартнӑ. Вӑл ҫын Шупашкар районӗнче вырнаҫнӑ «Приволжское» (чӑв. Атӑлҫум) вӗренӳ хуҫалӑхӗнче пуҫлӑхра ӗҫлетчӗ. Пуҫлӑх пуканне ӑна учхоза унччен ертсе пынӑ Георгий Егоров Шупашкар район администрацине ертсе пыма тытӑннӑ хыҫҫӑн шанса пачӗҫ.\n\n«Приволжское» акционерсен уҫӑ обществи (паян унӑн харпӑрлӑх форми ҫавнашкал-мӗн. Хӑй вӑхӑтӗнче вӑл федерацин унитарлӑ предприятийӗ шутланатчӗ) — Ял хуҫалӑх академийӗн вӗренӳ хуҫалӑхӗ. Вӗренӳ заведенийӗнче ректор тивӗҫне пурнӑҫлакана иртнӗ уйӑхӑн 23-мӗшӗнчен тытӑнса виҫӗ хутчен ылмаштарнӑ.\n\nАса илтеретпӗр, ректор тивӗҫне пурнӑҫлама уйӑх каярах Александр Акимова лартнӑ, темиҫе кун каялла —  Илья Царевскине.",
        "Чӑваш патшалӑх ял хуҫалӑх академийӗнче паян ректор суйлассине эпир пӗлтернӗччӗ. Пуҫлӑх пуканне ректор тивӗҫне халӗ пурнӑҫлакан Людмила Линика шанса панӑ иккен. Уншӑн 118 ҫынтан 90-шӗ сасӑланӑ. Пӗлекенсем каланӑ тӑрӑх, суйлава академи алӑкне шал енчен питӗрсех ирттернӗ-мӗн. Унта журналистсем ҫеҫ мар, ректор пулма кандидат пулнӑ Семеновӑн шаннӑ ҫынни те кӗреймен иккен.\n\nВладимир Семенов кадидатуришӗн 25-ӗн сасӑланӑ-мӗн, Николай Кирилловшӑн — 2-ӗн.",
        "Чӑваш патшалӑх ял хуҫалӑх академийӗнче тӑрӑшакансемшӗн ыран хумхануллӑ кун пулӗ тесен те йӑнӑш мар-тӑр. Унта ыран вӗренӳ заведенийӗн ректорне суйлӗҫ.\n\nАса илтеретпӗр, иртнӗ ҫулхи раштавӑн 12-мӗшӗнче ӑсчахсен канашӗн ларӑвӗнче академи ректорне Николай Васильева кӗтмен-туман ҫӗртен ӗҫлеме пӑрахтарнӑччӗ. Яваплӑ тивӗҫе пурнӑҫлама Людмила Линик юриста шаннӑччӗ. Сӑмах май, хӑй вӑхӑтӗнче Людмила Линик Чӑваш Енӗн суйлав комиссийӗн председателӗ пулнӑччӗ. Ректора сасартӑк ылмаштарнине ун чух Раҫҫейӗн Ял хуҫалӑх министерстви аслӑ шкул (академи асӑннӑ ведомствӑна пӑхӑнать) тухӑҫсӑр ӗҫлет тесе ӑнлантарнӑччӗ. Николай Васильев вара капла хаклавпа килӗшменнине, аслӑ шкулсен тухӑҫлӑхне 2011 ҫулхи ӗҫ кӑтартӑвне кура йӗркеленине, академине вара вӑл 2012 ҫулхи ҫуркунне кӑна ертсе пыма пуҫӑннине палӑртнӑччӗ. Ректора хӳтӗлесе студентсем митинга та тухса пӑхнӑччӗ.\n\nЫран вара академин ректора суйлама тивет. Маларах, ҫӗртмен 7-мӗшӗнче, Раҫҫейӗн Ял хуҫалӑх министерствинче ректор пулма тивӗҫ кандидатурӑсене аттестацилемелли лару иртнӗ. Пирӗн республикӑран сакӑр кандидат тӑратнӑ иккен, федераци министерстви вӗсенчен виҫҫӗшне — вӗсем кашниех академире ӗҫлеҫҫӗ — суйласа илнӗ. Ҫапла вара Мускавра ырланӑ кандидатсен списокне ректор тивӗҫне халӗ пурнӑҫлакан Людмила Линик тата биологи ӑслӑлӑхӗсен докторӗсем — пӗри морфологи, физиологи тата зоогигиена кафедрин профессорӗ Владимир Семенов, тепри ҫӗр ӗҫӗпе агрохими кафедрин профессорӗ Николай Кириллов — кӗнӗ.",
        "Чӑваш патшалӑх ял хуҫалӑх академийӗнче — каллех улшӑнусем. Аслӑ шкула вӑхӑтлӑх урӑх ҫын ертсе пыни пирки сайтра хыпар паян ирех тухнӑ.\n\nРектор тивӗҫне вӑхӑтлӑха 31 ҫулти Илья Царевский пурнӑҫлӗ. Вӑл 2013 ҫултанпа воспитани парас тата социаллӑ ӗҫ енӗпе проректор пулнӑ.\n\nИлья Царевский хӑй те ял хуҫалӑх акдемийӗнчен 2006 ҫулта вӗренсе тухнӑ. Вӑл ветеринари факультетӗнче ӑс пухнӑ.\n\nАса илтерер: чӳк уйӑхӗн вӗҫӗнче Чӑваш патшалӑх ял хуҫалӑх академийӗн ректорӗн тивӗҫӗсене 69 ҫулти Александр Акимов пурнӑҫлама тытӑннӑ. Ун чухне вӑл ку должноҫре ҫӗнӗ ректора суйличчен пулнине каланӑччӗ."
      ],
      "response": "Александр Акимов Чӑваш патшалӑх ял хуҫалӑх академийӗн ректорӗн тивӗҫӗсене чӳк уйӑхӗн вӗҫӗнче пурнӑҫлама тытӑннӑ. Вӑл 69 ҫулта, ректора суйламаччен, вӑхӑтлӑх пулӑшӑвӗпе академие ертсе пырӗ. Ҫакна Чӑваш Республикин Ял хуҫалӑх министерствинчен палартнӑ.\n\nАкадемире ректор тивӗҫне пурнӑҫлакансене куннех виҫӗ хутчен улшӑннӑ. Акимов чӳк уйӑхӗн 23-мӗшӗнче вӑхӑтлӑха палӑртнӑ Илья Царевский хыҫҫӑн килнӗ. Ку тапранусем хальхи вӑхӑтра академи ертӳҫин суйлавӗпе ҫыхӑннӑ, унта федераци министерстви виҫӗ кандидата суйласа илнӗ: Людмила Линика, Владимир Семенова тата Николай Кириллова.",
      "reference": "Вӑл чӳк уйӑхӗн вӗҫӗнче ректор тивӗҫне пурнӑҫлама тытӑннӑ.",
      "faithfulness": NaN,
      "context_precision": 0.699999999965,
      "context_recall": 1.0,
      "answer_relevancy": 0.42433053189360637
    },
    {
      "question": "Академире ректор тивӗҫӗпе мӗнле улшӑну пулнӑ?",
      "user_input": "Академире ректор тивӗҫӗпе мӗнле улшӑну пулнӑ?",
      "retrieved_contexts": [
        "Чӑваш патшалӑх ял хуҫалӑх академийӗнче тӑрӑшакансемшӗн ыран хумхануллӑ кун пулӗ тесен те йӑнӑш мар-тӑр. Унта ыран вӗренӳ заведенийӗн ректорне суйлӗҫ.\n\nАса илтеретпӗр, иртнӗ ҫулхи раштавӑн 12-мӗшӗнче ӑсчахсен канашӗн ларӑвӗнче академи ректорне Николай Васильева кӗтмен-туман ҫӗртен ӗҫлеме пӑрахтарнӑччӗ. Яваплӑ тивӗҫе пурнӑҫлама Людмила Линик юриста шаннӑччӗ. Сӑмах май, хӑй вӑхӑтӗнче Людмила Линик Чӑваш Енӗн суйлав комиссийӗн председателӗ пулнӑччӗ. Ректора сасартӑк ылмаштарнине ун чух Раҫҫейӗн Ял хуҫалӑх министерстви аслӑ шкул (академи асӑннӑ ведомствӑна пӑхӑнать) тухӑҫсӑр ӗҫлет тесе ӑнлантарнӑччӗ. Николай Васильев вара капла хаклавпа килӗшменнине, аслӑ шкулсен тухӑҫлӑхне 2011 ҫулхи ӗҫ кӑтартӑвне кура йӗркеленине, академине вара вӑл 2012 ҫулхи ҫуркунне кӑна ертсе пыма пуҫӑннине палӑртнӑччӗ. Ректора хӳтӗлесе студентсем митинга та тухса пӑхнӑччӗ.\n\nЫран вара академин ректора суйлама тивет. Маларах, ҫӗртмен 7-мӗшӗнче, Раҫҫейӗн Ял хуҫалӑх министерствинче ректор пулма тивӗҫ кандидатурӑсене аттестацилемелли лару иртнӗ. Пирӗн республикӑран сакӑр кандидат тӑратнӑ иккен, федераци министерстви вӗсенчен виҫҫӗшне — вӗсем кашниех академире ӗҫлеҫҫӗ — суйласа илнӗ. Ҫапла вара Мускавра ырланӑ кандидатсен списокне ректор тивӗҫне халӗ пурнӑҫлакан Людмила Линик тата биологи ӑслӑлӑхӗсен докторӗсем — пӗри морфологи, физиологи тата зоогигиена кафедрин профессорӗ Владимир Семенов, тепри ҫӗр ӗҫӗпе агрохими кафедрин профессорӗ Николай Кириллов — кӗнӗ.",
        "Чӑваш патшалӑх ял хуҫалӑх академийӗнче паян ректор суйлассине эпир пӗлтернӗччӗ. Пуҫлӑх пуканне ректор тивӗҫне халӗ пурнӑҫлакан Людмила Линика шанса панӑ иккен. Уншӑн 118 ҫынтан 90-шӗ сасӑланӑ. Пӗлекенсем каланӑ тӑрӑх, суйлава академи алӑкне шал енчен питӗрсех ирттернӗ-мӗн. Унта журналистсем ҫеҫ мар, ректор пулма кандидат пулнӑ Семеновӑн шаннӑ ҫынни те кӗреймен иккен.\n\nВладимир Семенов кадидатуришӗн 25-ӗн сасӑланӑ-мӗн, Николай Кирилловшӑн — 2-ӗн.",
        "И.Н. Ульянов ячӗллӗ Чӑваш патшалӑх университетне ертсе пыракан Всеволод Агаков ӗҫрен каять. Ҫитес ҫулхи кӑрлачра вӑл 65 ҫул тултарать иккен. Аслӑ шкулсен ертӳҫисен, саккунпа, ҫав ҫула ҫитсен ӗҫе пӑрахмалла. Ҫапах та чылай правилӑра та «анчах» текен самант та пур та, кунта та ҫавӑн пекех — уйрӑмах хисеплӗ ректорсем 70 ҫула ҫитичченех хӑйсен вырӑнӗнче тар тӑкма пултараҫҫӗ.\n\nРектор ӗҫе мӗн шутпа пӑрахас тени пирки халӗ хӑшӗсем хытах пуҫ ватаҫҫӗ иккен. Асӑннӑ аслӑ шкулпа ҫыхӑннӑ коррупцилле хӑш-пӗр фактсем пирки Раҫҫейӗн Аслӑ шкул министерстви хистемен мар-ши тесе пӑшӑлтатакансем те пур-мӗн.\n\nРектор вырӑнне йышӑнма пултаракан кандидатурӑсем пирки те пуҫ ватакансем пур-мӗн. Вӗсен шучӗпе ҫак должноҫе ЧПУн вӗренӳ енӗпе ӗҫлекен проректорӗ Андрей Александров е тата республикӑн вӗренӳ министрӗ Владимир Иванов йышӑнма пултарать-мӗн.",
        "Ака уйӑхӗн 29-мӗшӗнче ЧР Ял хуҫалӑх академийӗн ҫӗнӗ ректорне суйланӑ. Кун тӗлӗшпе академире ӗҫлекенсен тата вӗренекенсен конференцийӗ иртнӗ.\n\nДелегатсем ҫӗр проценчӗпех килнине палӑртнӑ. Мандат комиссийӗ 85 делегатӑн полномочине ҫирӗплетнӗ.\n\nРектор должноҫне виҫӗ ҫынран пӗрине суйлама сӗннӗ. Вӗсем — Рамиль Айзатов, Ҫӗрпӳри аграрипе технологи техникумӗн директорӗ Николай Васильев, «Агро-Инноваци» унитари предприятийӗн директорӗ Андрей Макушев.\n\nСасӑлава пӗтӗмлетӗвӗ тӑрӑх, ректор тивӗҫне Андрей Макушев пилӗк ҫул пурнӑҫлӗ. Вӑл 80 сасӑ пухнӑ. Николай Васильевшӑн 5-ӗн сасӑланӑ. Рамиль Айзатов 0 сасӑ пухнӑ.",
        "Авӑн уйӑхӗн 3-мӗшӗнче Чӑваш патшалӑх университечӗн культура керменӗнче университет ректорӗ В.Г. Агаков профессор ҫӗнӗ корпусра вӗренекен студентсемпе тӗл пулу ирттерчӗ. Ректор зала пухӑннисене, уйрӑмах 1-мӗш курссене, ҫӗнӗ вӗренӳ ҫулӗ пуҫланнӑ ятпа саламларӗ, ҫитӗнӳсем тума сунчӗ. Ҫӗнӗ курпусра юсав ӗҫӗсем пыраҫҫӗ. Тин кӑна филологсемпе историксем вӗренекен 5 хута строительсем илем кӗртсе пӗтерчӗҫ. Ректор ҫакӑн пек юсав ӗҫӗсем ытти хутсенче те пуласса шантарчӗ. Тирпейлӗ те хӑтлӑ пӳлӗмсене ҫӗнӗ техника хатӗрӗсем илем кӳрӗҫ, вӗренӳре пулӑшса пырӗҫ. Ҫавӑн пекех, В.Г. Агаков студентсен пурнӑҫӗпе те кӑсӑкланчӗ, ыйтусем ҫине хуравларӗ. Ятлӑ стипендисене хута ярас, ытти вузсене тӗрлӗ конференцисене тухса ҫӳрес тата ытти ӗҫсенче пулӑшма шантарчӗ. Авӑн уйӑхӗнче пур студента та стипенди парса хавхалантарасси пирки пӗлтерчӗ. Тӗлпулу савӑнӑҫлӑ концерпа вӗҫленчӗ."
      ],
      "response": "Чăваш патшалăх ял хуçалăх академийĕн ректор тивĕçĕпе улшăнусем иртнĕ. Иртнĕ çулхи раштавăн 12-мĕшĕнче Николай Васильев ректора çĕртен ĕçлеме пăрахтарнă, яваплă тивĕçе Людмила Линик пурнăçланă. Ака уйăхĕн 29-мĕшĕнче академире ĕçлекенсем тата вĕренекенсен конференцийĕ иртнĕ, ректора суйлама виçĕ кандидат тухнă — Рамиль Айзатов, Николай Васильев тата Андрей Макушев. Суйлавăн пĕтĕмлетĕвĕ тăрăх, Андрей Макушев 80 сасă пухнă, ректор тивĕçне пиллĕк çул пурнăçлă шанса илнĕ. Николай Васильевшăн 5 сасă, Рамиль Айзатовшăн сасă çук. Улшăнăвăн хыççăн академи ĕçĕ-хĕлĕ çĕнĕ ректор ертсе пырать.",
      "reference": "Малтан ректор тивӗҫне Александр Акимов пурнӑҫланӑ, кайран вара ку тивӗҫе Илья Царевский куҫнӑ.",
      "faithfulness": NaN,
      "context_precision": 0.0,
      "context_recall": 0.0,
      "answer_relevancy": 0.43094308603001513
    },
    {
      "question": "Илья Царевский хӑш хулара ҫуралнӑ?",
      "user_input": "Илья Царевский хӑш хулара ҫуралнӑ?",
      "retrieved_contexts": [
        "Илен (Илем) кунӗнче ҫуралнӑ тусӑма\n\nГ.А. Дегтярёва\n\nВӗри…\n\nКӑвак тӳпеллӗ утӑ кунӗ\n\nКӑмакари пек туйӑнать:\n\nКӑшт сулхӑнта кӑна халь канлӗ,\n\nАхалӗн макӑр: чун тухать.\n\n\n\nПӑчӑ…\n\nКапашсӑр шӑрӑх — ҫумӑр кирлӗ,\n\nТавралӑх шывшӑн антӑхать.\n\nӐҫта-ши халӗ ҫурҫӗр ҫилӗ?\n\nНиҫта пӗр пӗлӗт курӑнмасть.\n\n\n\nАй-ай…\n\nХӗвел хӗртет, ҫӑлсамччӗ Турӑ —\n\nЧӑтма май ҫук-ҫке кунӗпе.\n\nХӑйӑр ҫинче ҫунать ҫан-ҫурӑм,\n\nӲт-тир сурать сӗвӗннипе.\n\n\n\nВӑй ҫук…\n\nШӑм-шак та йывӑр — чирлӗ тейӗн.\n\nСывлӑш ҫитмест, мунчарилле.\n\nТӗнче чӗр тамӑк халь этемшӗн −\n\nТархасшӑн ҫумӑр пар, Илле!\n\n\n\nЛеонид Кевер (Сильвестров)",
        "Ҫӗнӗ Шупашкар каччи, Илья Фёдоров, воллейбол енӗпе Раҫҫей чемпиоантӗнче ҫӗнтернӗ. Каччӑ Хусанти «Зенит» командӑра вылять. Хусанти команда Мускаври «Динамӑна» ҫӗнтернӗ.\n\nИлья — 21 ҫулта. Хусанти «Зенит» йышӗнче вӑл 2017 ҫултанпа вылять. Унччен маларах каччӑ командӑпа пӗрлРаҫсей кубокӗнче ҫӗнтернӗ кӑна мар, Ҫамрӑксен хушшинче Европа чемпионӗ пулса тӑнӑ.",
        "Кӑҫалхи ака уйӑхӗн 25-мӗшӗнче чӑваш халӑхне ҫутта кӑлараканӑмӑр Иван Яковлевич Яковлев ҫуралнӑранпа 160 ҫул ҫитет. Тӑван чӗлхе аталанӑвӗшӗн, чӑваш халӑхӗшӗн ҫав тери пысӑк ӗҫсем туса хӑварнӑ вӑл. Иван Яковлевич кашни чӑвашшӑн Турӑ вырӑнӗнче. «Нарӑсӑн 21-мӗшӗнче Пӗтӗм тӗнчери тӑван чӗлхе кунне паллӑ тунӑ май хамӑр халӑха хут вӗрентес тесе вӑй-халне шеллемен аслӑ ҫыннӑмӑра И.Я.Яковлева халалласа викторина ирттерес терӗмӗр» — тесе палартаҫҫӗ суварҫӑсем. Кӑмӑл тӑвакансем пурте хутшӑнма пултараҫҫӗ унта. Пур ыйту ҫине те тӗп-тӗрӗс хуравланисене «Сувар» хаҫат редакцийӗнчен парнесем кӗтеҫҫӗ. Чи хастар шкула редакцин Тав хучӗпе ятарлӑ парни кӗтеҫҫӗ.\n\n\n\n«Сувар» редакцийӗ викторина хуравӗсене акан 20-мӗшӗччен йышӑнать, И.Я.Яковлев ҫуралнӑ кунӗ тӗлне пӗтӗмлетме шутлать. Хуравсене почта урлӑ ярас пулсан конверт ҫине «Викторинӑна» тесе ҫырма ан манӑр. Хӑвӑрӑн ятӑра, хушаматӑра, адресӑра, хӑш шкулта, миҫемӗш класра вӗреннине (е ӗҫленине) палӑртма ан манӑр. Ҫавӑн пекех викторина хуравӗсене «Суварӑн» электронлӑ адресӗпе те ярса пама пултаратӑр: suvar@mail.ru.\n\n\n\nВикторина пирки тӗплӗнрех: http://suvar.su/913.html",
        "Чӑваш обкомӗн пӗрремӗш секретарӗнче нумай ҫул вӑй хунӑ Илья Прокопьева хисеп туса тата асра тытса вӑл пурӑннӑ ҫурт ҫине асӑну хӑми вырнаҫтарнӑ. Паян ӑна савӑнӑҫлӑ лару-тӑрура уҫнӑ.\n\nИлья Прокопьев пӗлтӗр ҫут тӗнчерен уйрӑлса кайнӑччӗ. Ун чухне вӑл 90 ҫула ҫитнӗччӗ.\n\nАсӑну хӑми Шупашкарти Ленинград урамӗнчи 26-мӗш ҫурт ҫинче тивӗҫлӗ вырӑн тупнӑ. Хӑмана РФ Художниксен союзӗн пайташӗ Игорь Голубев ӑсталанӑ.\n\nХӑмана уҫнӑ ҫӗре тӗрлӗ шайри тӳре-шара хутшӑннӑ. Вӗсем пурте  Илья Прокопьевӑн ырӑ кӑмӑлне пӗр шухӑшлӑн палӑртнӑ. Чӑваш Ен Элтеперӗ Михаил Игнатьев та ҫавнах каланӑ.\n\nПаллӑ ҫынпа пӗрле ӗҫленӗ Валериан Дубинин Чӑваш Енӗн  ял хуҫалӑх министрӗ пулнӑ. Асӑну хӑмине уҫнӑ ҫӗре хутшӑнӑ Андрей Михайлов журналист Дубинин та Илья Прокопьев сӑпайлӑхпа уйрӑлса тӑнине палӑртнине пӗлтернӗ.",
        "Чӑваш ҫамрӑкӗсен «Сӑвар» пӗрлешӗвӗ кӑҫал ҫула 30-мӗш хут тухӗ. Ҫӗнӗ чунҫӳрев ҫурлан 1-мӗшӗнче пуҫланӗ те 12-мӗшӗнче вӗҫленӗ. Чунҫӳревҫӗсем кӑҫал Аслӑ Арапуҫра (Митта Ваҫлейӗн вилтӑпри ҫине кӗрсе тухӗҫ), Турханта (Кокель музейӗпе паллашӗҫ), Ҫӗньялта (Геннадий Айхине сума сӑвӗҫ) чарӑнӗҫ, Тикеш хулашне кӗрсе тухӗҫ. Ун хыҫҫӑн вӗсен ҫулӗ Чӗмпӗр урлӑ Хура тинӗс хӗрринчи Хӑнакур хулине выртӗ. Севастополе ҫитнӗ хыҫҫӑн каялла Шупашкаралла таврӑнӗҫ.\n\nЧунҫӳреве йӗркелекен Олег Михайлович Цыпленков — Ултиар — пӗлтернӗ тӑрӑх автобусра тата тепӗр 10 вырӑн пур. Кӑмӑлӑр пур пулсан ҫул хакӗ — 10-12 пин. Хура тинӗс хӗрринче 1 эрне ирттерӗҫ.\n\nЫйтусем пулсан Ултиарпа 8-927-667-93-23 номерпе ҫыхӑнма пулать."
      ],
      "response": "Илья Царевский ҫуралнӑ хула пирки предоставленнӑ фрагментсенче ҫук. Анчах вӗсенче Илья ятлӑ ытти паллӑ чӑвашсем пирки каланӑ:\n\n1. **Илья Фёдоров (волейболист)** — Ҫӗнӗ Шупашкарта ҫуралнӑ, Хусанти «Зенит» командинче вылять, Раҫҫей чемпионӗ.\n2. **Илья Прокопьев (политик)** — Чӑваш обкомӗн пӗрремӗш секретарӗ пулнӑ, Шупашкарта пурӑннӑ, ун ҫинче асӑну хӑми вырнаҫтарнӑ.\n3. **Иван Яковлевич Яковлев** — чӑваш халӑхне ҫутта кӑларакан, ҫуралнӑ кунӗ (ака, 25) паллӑ.\n\nИлья Царевский ҫинчен информаци ҫук пулсан, суйласа илнӗ фрагментсене тӑрӑх урӑх Илья ятлӑ чӑваш паллӑ ҫыннисен ҫуралнӑ вырӑнӗсене палӑртма пулать.",
      "reference": "Текстра Илья Царевскин ҫуралнӑ вырӑнӗ ҫинчен каланман.",
      "faithfulness": NaN,
      "context_precision": 0.99999999998,
      "context_recall": 0.0,
      "answer_relevancy": 0.0
    }
  ],
  "weak_examples": [
    {
      "question": "Чӑваш патшалӑх ял хуҫалӑх академийӗнче мӗн пулнӑ?",
      "user_input": "Чӑваш патшалӑх ял хуҫалӑх академийӗнче мӗн пулнӑ?",
      "retrieved_contexts": [
        "Кӑҫал пирӗн республикӑри аслӑ шкулсенче 10 918 бюджет вырӑнӗ пӑхса хӑварнӑ. Пӗлтӗр ҫак хисеп 11 292-пе танлашнӑ. Ҫав шутран аслӑ пӗлӳ илес текенсем валли 3 375 бюджет вырӑнӗ пулнӑ. Аслӑ шкулсене кӗме пурӗ 25 пин ытла ача заявлени панӑ. Апла пулсан ҫакӑ пӗр вырӑна 4 ача лекнине пӗлтерет.\n\nЧӑваш патшалӑх университетне тӳлевсӗр майпа вӗренме кӗрес текенсем пӗр вырӑн пуҫне 7 ача тивнӗ, Ял хуҫалӑх академине — 6,6-ӑн, Чӑваш патшалӑх педагогика университетне — 5,6-ӑн. Абитуриентсенчен ытларахӑшӗ ҫӗр йӗркелӗвӗ тата кадастр енӗпе, электроэнергетика тата электротехника, строительство, сиплев ӗҫӗ, стоматологи, клиника психологийӗ, экономика тата юриспруденци енӗпе ӗҫлекен специалист пуласшӑн.\n\nШкул пӗтернисене республикӑрах хӑварас тесе математикӑпа тата физикӑпа пысӑк балл (70-тен ытларах) пухнисене пӗлтӗртенпе Чӑваш Енре ятарлӑ стипенди пама тытӑнчӗҫ. Ӑна ҫулталӑк хушши тӳлесе тӑрӗҫ. Уйӑхсеренхи унӑн виҫи 2 пин тенкӗпе танлашать. Кӑҫал ун пек баллисем 80 ача Чӑваш Енри аслӑ шкулсене суйланӑ. 70 балтан илнисем вара пӗтӗмпе 408-ӑн пулнӑ.\n\nРабочи профессийӗ илес текенсем 2 741 ача тупӑннӑ. Ку вӑл техникумсем, професси училищисем тата колледжсем  планпа илмелли хисепрен 83,8 проценчӗ пулать. Техникумсемпе колледжсене заявлени панисене илсен, пӗр бюджет вырӑнӗшӗн икӗ ача тупӑшать.",
        "Чӑваш патшалӑх ял хуҫалӑх академине университет статусне пама пултараҫҫӗ.\n\nПаян, пуш уйӑхӗн 20-мӗшӗнче, Чӑваш Ен Министрсен Кабинечӗн Ертӳҫин ҫумӗ — ял хуҫалӑх министрӗ Сергей Артамонов аслӑ шкулӑн ректорӗпе Андрей Макушевпа тӗл пулнӑ. Енсем аграри аслӑ шкулӗн аталанӑвне сӳтсе явнӑ.\n\nСергей Артамонов Фейсбукра пӗлтернӗ тӑрӑх, пуш уйӑхӗн 18-мӗшӗнче Чӑваш Ен Элтеперӗн тивӗҫӗсене вӑхӑтлӑх пурнӑҫлакан Олег Николаев Раҫҫей ял хуҫалӑх министрӗпе Дмитрий Патрушевпа курнӑҫнӑ. Ҫавӑн чухне ял хуҫалӑх академине университет статусне парас ыйтӑва хускатнӑ.\n\nСергей Артамонов палӑртнӑ тӑрӑх, аслӑ шкул аграри валли пысӑк шайри специалистсем хатӗрлет. Академи статусӗ улшӑнсан унӑн сумӗ тӗрлӗ шайра тата ӳсӗ.",
        "Чӑваш патшалӑх ял хуҫалӑх академийӗн 1-мӗш вӗренӳ корпусне юсаса ҫӗнетме палӑртнӑ. Патшалӑх закупкисен сайтӗнче проектпа смета документцине хатӗрлеме аукцион ирттересси пирки пӗлтернӗ. Хакӗ – 4 748 423 тенкӗ.\n\nКу ҫурт – истори пӗлтерӗшлӗ, ӑна 1957 ҫулта хӑпартнӑ. Корпусӑн фасадне сӑрламалла, карнизсене, колоннӑсене, скульптурӑсене ҫӗнетмелле. Корпуса кӗмелли тӗп тата хушма алӑксене те ҫӗнетмелле, никӗсне ҫирӗплетмелле. Тӑррине йӑлтах улӑштарма палӑртнӑ. Кивӗ чӳречесене те ҫӗнетӗҫ, кӑритурта тата хӑш-пӗр аудиторире косметика юсавӗ тӑвӗҫ. Пурнӑҫламалли ытти ӗҫ тата пур.\n\nЗаявкӑсене ака уйӑхӗн 22-мӗшӗччен йышӑнаҫҫӗ, пӗтӗмлетӗве акан 25-мӗшӗнче тӑвӗҫ.",
        "Паян, ҫурла уйӑхӗн 18-мӗшӗнче, Чӑваш патшалӑх гуманитари ӑслӑлӑхӗсен институчӗ, 95 ҫул тултарнӑ.\n\nВӑл — Раҫҫейри хӑйне евӗр академи учрежденийӗсенчен пӗри. Унта литературӑна, чӗлхе пӗлӗвне, ӳнере тата чӑваш халӑхӗн историйӗпе этнологине тӗпчеҫҫӗ. Археологи енӗпе те нумай ӗҫлет.\n\nИнститут пуян наука архивӗпе тата библиотекӑпа мӑнаҫланама пултарать. Фондра 152 пин ытла единица пуянлӑх.",
        "Чӑваш патшалӑх ял хуҫалӑх академийӗ 85 ҫулхи юбилейне паллӑ тунӑ. Шӑпах 85 ҫул каялла Чӑваш автономийӗ ял хуҫалӑх институчӗ уҫӑлнӑ наци республикисенчен пӗри пулса тӑнӑ.\n\nҪӗнӗ аслӑ шкулта малтанах 106 ҫын вӗреннӗ. Ун чухне икӗ уйрӑм ӗҫленӗ. 1934 ҫулта вара зоотехнологи тата агрономи факультечӗсем йӗркеленнӗ.\n\nМайӗпен институт аталанса пынӑ, ятарлӑ лабораторисем уҫӑлнӑ. Вӑл пурнӑҫпа тан утнӑ. Унтан инженерсем, ветеринари тухтӑрӗсем, экономистсем вӗренсе тухнӑ.\n\nХалӗ вӑл вӗренӳ инноваци комплексӗ шутланать. Унта пысӑк квалификациллӗ специалистсене хатӗрлеҫҫӗ. Ҫак тапхӑрта академирен 30 пин ытла специалист вӗренсе тухнӑ. Паян унта 3 пин студент вӗренет."
      ],
      "response": "Чӑваш патшалӑх ял хуҫалӑх академийӗ хальхи вӑхӑтра пысӑк аталанӑв тата улшӑну тӗлӗшӗнче пулса иртнӗ. Унӑн тӗп пулӑмӗсем тата ӗҫӗ-хӗлӗ ҫинчен литературлӑ чӑваш чӗлхипе каласа пама пулать.\n\nАкадемие университет статусне куҫмалли пирки калаҫу тапхӑрӗ пуҫланнӑ. Пуш уйӑхӗнче Чӑваш Ен ял хуҫалӑх министрӗ Сергей Артамонов академи ректорӗпе тӗл пулнӑ, аграри шайӗнчи аслӑ шкулӑн аталанӑвӗ тӗлӗшпе сӳтсе явнӑ. Раҫҫей ял хуҫалӑх министрӗпе Олег Николаев хушшинчи тӗлпулура вара ку ыйту хускатнӑ. Статус улшӑнсан, академи сумӗ ӳсӗ те, вӑл пысӑк шайри аграри специалистсене хатӗрлеме пултарать.\n\nАкадемие ҫутӗҫан хӑпартнӑ 1-мӗш вӗренӳ корпусне тата тивӗҫлӗ юсӑм ӗҫӗсем ирттермелли план тӑвӑннӑ. Истори пӗлтерӗшлӗ 1957 ҫулта хӑпартнӑ ку ҫурта ҫӗнетме, фадачӗне, архитектура элементӗсене, никӗсне ҫирӗплетме, тӑррине улӑштарма тата чӳречесене ҫӗнетме палӑртнӑ. Вӗсен хакӗ 4,75 миллион тенкӗ патнелле пулать.\n\nВӗренӳ енӗпе, академие ятарлӑ стипенди илмелли ӑнӑҫлӑ абитуриентсене пултарнӑ. Тӳлевсӗр майпа вӗренме кӗрес текенсем хушшинче пӗр вырӑншӑн 6,6 ача тивнӗ, вӑл республикӑри аслӑ шкулсенчен чи лайӑх кӑтартӑвсенчен пӗри шутланать. Халӗ академире 3 пин ытла студент вӗрент.\n\nАкадеми ӑслӑлӑхпа тата историпе те мӑнаҫланать. Унӑн йӗркеленӗвӗнчен 85 ҫул ҫитнӗ юбилейне паллӑ тунӑ. 1934 ҫултанпа унта зоотехнологи тата агрономи факультечӗсем ӗҫлеме пуҫланӑ. Ҫак тапхӑрта академирен 30 пин ытла квалификациллӗ специалист вӗренсе тухнӑ, халь вара вӑл вӗренӳ инноваци комплексӗ шутланать.",
      "reference": "Академире каллех улшӑнусем пулнӑ.",
      "faithfulness": NaN,
      "context_precision": 0.5888888888692593,
      "context_recall": 1.0,
      "answer_relevancy": 0.423584474375875
    },
    {
      "question": "Ректор тивӗҫне вӑхӑтлӑха кам пурнӑҫлӗ?",
      "user_input": "Ректор тивӗҫне вӑхӑтлӑха кам пурнӑҫлӗ?",
      "retrieved_contexts": [
        "Чӑваш патшалӑх ял хуҫалӑх академийӗнче паян ректор суйлассине эпир пӗлтернӗччӗ. Пуҫлӑх пуканне ректор тивӗҫне халӗ пурнӑҫлакан Людмила Линика шанса панӑ иккен. Уншӑн 118 ҫынтан 90-шӗ сасӑланӑ. Пӗлекенсем каланӑ тӑрӑх, суйлава академи алӑкне шал енчен питӗрсех ирттернӗ-мӗн. Унта журналистсем ҫеҫ мар, ректор пулма кандидат пулнӑ Семеновӑн шаннӑ ҫынни те кӗреймен иккен.\n\nВладимир Семенов кадидатуришӗн 25-ӗн сасӑланӑ-мӗн, Николай Кирилловшӑн — 2-ӗн.",
        "Чӑваш патшалӑх ял хуҫалӑх академийӗнче пӗр уйӑхра ректор тивӗҫне пурнӑҫлакана виҫӗ хутчен ылмаштарнӑ. Хальхинче ҫак должноҫе вӑхӑтлӑх пурнӑҫлама Андрей Макушева лартнӑ. Вӑл ҫын Шупашкар районӗнче вырнаҫнӑ «Приволжское» (чӑв. Атӑлҫум) вӗренӳ хуҫалӑхӗнче пуҫлӑхра ӗҫлетчӗ. Пуҫлӑх пуканне ӑна учхоза унччен ертсе пынӑ Георгий Егоров Шупашкар район администрацине ертсе пыма тытӑннӑ хыҫҫӑн шанса пачӗҫ.\n\n«Приволжское» акционерсен уҫӑ обществи (паян унӑн харпӑрлӑх форми ҫавнашкал-мӗн. Хӑй вӑхӑтӗнче вӑл федерацин унитарлӑ предприятийӗ шутланатчӗ) — Ял хуҫалӑх академийӗн вӗренӳ хуҫалӑхӗ. Вӗренӳ заведенийӗнче ректор тивӗҫне пурнӑҫлакана иртнӗ уйӑхӑн 23-мӗшӗнчен тытӑнса виҫӗ хутчен ылмаштарнӑ.\n\nАса илтеретпӗр, ректор тивӗҫне пурнӑҫлама уйӑх каярах Александр Акимова лартнӑ, темиҫе кун каялла —  Илья Царевскине.",
        "И.Н. Ульянов ячӗллӗ Чӑваш патшалӑх университечӗн ректорӗ Всеволод Агаков тӗлӗшпе пуҫиле ӗҫ пуҫарнӑ. Аса илтеретпӗр, иртнӗ уйӑх вӗҫӗнче унта ректор суйлас процедура пуҫланса кайнӑччӗ. Кандидачӗсем камсем пирки эпир маларах пӗлтернӗччӗ. Халӗ ҫав аслӑ шкулпа ҫыхӑннӑ тата тепӗр хыпар пӗлме май килчӗ. ЧПУн паянхи ректорне Всеволод Агакова хирӗҫле пуҫиле ӗҫ пуҫарнӑ иккен.\n\nПӗлтерер, маларах пуҫиле ӗҫе асӑннӑ аслӑ шкулӑн икӗ ӗҫченӗ тӗлӗшпе пуҫарнӑ пулнӑ. Вӗсем ӗҫленӗ вӑхӑтра пурӑнма тесе панӑ хваттерсене приватизацилеме пӑхнӑ-мӗн. Анчах суя ҫиеле тухнмне пула ӗҫе вӗҫне ҫитерме май килмен — кӗҫех пӑтӑрмахӗ (ҫуркунне пулса иртнӗ) вӗсем тӗлӗшпе пуҫиле ӗҫ пуҫарнӑ. Ҫак кунсенче вара вӑл ӗҫ фигуранчӗсен йышне аслӑ шкулӑн ректорӗпе пӗр проректорӗ лекнӗ.",
        "Чӑваш патшалӑх ял хуҫалӑх академийӗнче тӑрӑшакансемшӗн ыран хумхануллӑ кун пулӗ тесен те йӑнӑш мар-тӑр. Унта ыран вӗренӳ заведенийӗн ректорне суйлӗҫ.\n\nАса илтеретпӗр, иртнӗ ҫулхи раштавӑн 12-мӗшӗнче ӑсчахсен канашӗн ларӑвӗнче академи ректорне Николай Васильева кӗтмен-туман ҫӗртен ӗҫлеме пӑрахтарнӑччӗ. Яваплӑ тивӗҫе пурнӑҫлама Людмила Линик юриста шаннӑччӗ. Сӑмах май, хӑй вӑхӑтӗнче Людмила Линик Чӑваш Енӗн суйлав комиссийӗн председателӗ пулнӑччӗ. Ректора сасартӑк ылмаштарнине ун чух Раҫҫейӗн Ял хуҫалӑх министерстви аслӑ шкул (академи асӑннӑ ведомствӑна пӑхӑнать) тухӑҫсӑр ӗҫлет тесе ӑнлантарнӑччӗ. Николай Васильев вара капла хаклавпа килӗшменнине, аслӑ шкулсен тухӑҫлӑхне 2011 ҫулхи ӗҫ кӑтартӑвне кура йӗркеленине, академине вара вӑл 2012 ҫулхи ҫуркунне кӑна ертсе пыма пуҫӑннине палӑртнӑччӗ. Ректора хӳтӗлесе студентсем митинга та тухса пӑхнӑччӗ.\n\nЫран вара академин ректора суйлама тивет. Маларах, ҫӗртмен 7-мӗшӗнче, Раҫҫейӗн Ял хуҫалӑх министерствинче ректор пулма тивӗҫ кандидатурӑсене аттестацилемелли лару иртнӗ. Пирӗн республикӑран сакӑр кандидат тӑратнӑ иккен, федераци министерстви вӗсенчен виҫҫӗшне — вӗсем кашниех академире ӗҫлеҫҫӗ — суйласа илнӗ. Ҫапла вара Мускавра ырланӑ кандидатсен списокне ректор тивӗҫне халӗ пурнӑҫлакан Людмила Линик тата биологи ӑслӑлӑхӗсен докторӗсем — пӗри морфологи, физиологи тата зоогигиена кафедрин профессорӗ Владимир Семенов, тепри ҫӗр ӗҫӗпе агрохими кафедрин профессорӗ Николай Кириллов — кӗнӗ.",
        "ЧР Вӗрентӳ институчӗн ректорӗ пулнӑ Елизавета Казакова пурнӑҫран уйрӑлнӑ. Вӑл 61 ҫулта пулнӑ.\n\nЕлизавета Васльевна пурнӑҫне вӗрентӗве халалланӑ. Малтан вӑл вӗрентекенре ӗҫленӗ, унтан шкул директорӗн ҫумӗ пулнӑ. Кун хыҫҫӑн квалификацие ӳстерекен тытӑма ӗҫлеме куҫнӑ, республика валли управлени кадрӗсем хатӗрленӗ.\n\nПӗр ҫул вӑл Вӗренӳ министерствинче министр ҫумӗнче ӗҫленӗ. Ун хыҫҫӑн Вӗренӳ инситутнех таврӑннӑ, пенсие тухичченех ректор пулнӑ. Вӑл – ЧР тава тивӗҫлӗ вӗрентекенӗ. Унӑн педагогика ӑслӑлӑхӗсен кандидачӗн степенӗ пур.\n\nЕлизавета Казаковӑпа ыран 8.30-100 сехетсенче сыв пуллашӗҫ: Шупашкар урамӗ, Граждан урамӗ, 19-мӗш ҫурт."
      ],
      "response": "Чӑваш патшалӑх ял хуҫалӑх академийӗнче ректор тивӗҫне хальхи вӑхӑтра **Людмила Линика** вӑхӑтлӑх пурнӑҫлать. Вӑл академин ӑсчахсен канашӗн ларӑвӗнче суйланипе тата Раҫҫейӗн Ял хуҫалӑх министерствин аттестациленӗ кандидатсен шутне кӗнипе ҫак должноҫа ларӑннӑ.\n\nДетальсем:\n1. **Суйлав процесчӗ:** Иртнӗ ҫулхи раштав уйӑхӗнче ректор Николай Васильева ӗҫлеме пӑрахтарнӑ хыҫҫӑн, тивӗҫе вӑхӑтлӑха пурнӑҫлама Людмила Линик суйланӑ. Академи алӑкне шал енчен питӗрсе ирттернӗ суйлавра уншӑн 118 ҫынран 90-шӗ сасӑланӑ.\n2. **Кандидатсем:** Федераци министерстви суйласа илнӗ виҫӗ кандидат шутне Людмила Линикпе пӗрле академи профессорӗсем Владимир Семенов тата Николай Кириллов кӗнӗ. Суйлавра Семеновшӑн 25, Кирилловшӑн 2 сасӑ пулнӑ.\n3. **Малтанхи вӑхӑтлӑх пулнӑ ректорсем:** Ректор тивӗҫне пурнӑҫлакансене кун хушшипех ылмаштарнӑ: Александр Акимова, кайран Илья Царевски, хальхине - Андрей Макушева.\n4. **Ыранти хӑтлану:** Студентсем ректора хӳтӗлесе митинг ирттернӗ, анчах федераци министерстви академие тухӑҫсӑр ӗҫлет тесе шутланипе ректора улăштарнă.\n\nҪапла вара, Чӑваш ял хуҫалӑх академийӗн ректор пуканӗнче халӗ Людмила Линик тӑрать, вӑл федераци шайӗнче те ҫирӗплетнӗ кандидатура шутланать.",
      "reference": "Ректор тивӗҫне вӑхӑтлӑха Илья Царевский пурнӑҫлӗ.",
      "faithfulness": NaN,
      "context_precision": 0.49999999995,
      "context_recall": 0.0,
      "answer_relevancy": 0.37666025344549553
    },
    {
      "question": "Илья Царевский миҫе ҫулта?",
      "user_input": "Илья Царевский миҫе ҫулта?",
      "retrieved_contexts": [
        "Ҫӗнӗ Шупашкар каччи, Илья Фёдоров, воллейбол енӗпе Раҫҫей чемпиоантӗнче ҫӗнтернӗ. Каччӑ Хусанти «Зенит» командӑра вылять. Хусанти команда Мускаври «Динамӑна» ҫӗнтернӗ.\n\nИлья — 21 ҫулта. Хусанти «Зенит» йышӗнче вӑл 2017 ҫултанпа вылять. Унччен маларах каччӑ командӑпа пӗрлРаҫсей кубокӗнче ҫӗнтернӗ кӑна мар, Ҫамрӑксен хушшинче Европа чемпионӗ пулса тӑнӑ.",
        "Хӗветӗр Уярӑн повӗҫӗсемпе калавӗсене, очеркӗсемпе статьйисене, асаилӗвӗсене  тӑватӑ тома пуҫтарса хатӗрленӗ  май ҫыравҫӑн пултарулӑх ҫулӗ мӗн тери тертлӗ пулни куҫ умне уҫҫӑн тухса тӑрать (халиччен 3 томӗ тухнӑ). Чи малтан кунта пултарулӑх уйрӑмлӑхӗ (йывӑрпа ҫырӑнни) пирки калас пулать. Анчах идеологи сӗрӗмӗпе минренӗ хаяр критиксем «тӳпине»  те манса хӑварас марччӗ. Вӗсем Уяр повӗҫӗсемпе калавӗсене силлесе шакканӑ хыҫҫӑн «тӑнкӗртӳ кампанийӗсем» кӗрленӗ, ун хыҫҫӑн «ҫынсем пек ҫырма вӗренеймен» ӑстана хаҫат-журнал, издательство редакцийӗсенче хӑраса кӗтсе илнӗ,  ытла та асӑрхануллӑ редакторсемпе унӑн тавлашӑва кӗме тивнӗ, «лайӑх тӳрлетнӗ» алҫырусене вӑл пӗрре  мар каялла илсе таврӑннӑ.  Уярӑн литературӑри кун-ҫулӗ пӗлӗтлӗ анчах мар, йӗпе-сапаллӑ пулнӑ теме те пулать, ҫакна ҫырнисен пуххин  хуплашки ҫинче кӑтартса хӑварни вырӑнлӑ пулассӑн туйӑнчӗ.\n\n«Уяра хӗстерни пирки халь  ӳстерсе калаҫаҫҫӗ, – терӗ мана пӗррехинче тем те пӗлекен пӗр паллӑ прозаик, хӑй вӑхӑтӗнче парти шкулӗ пӗтернӗскер. – Пур-и ун тухмасӑр юлнӑ пӗр алҫыру? Унне пурне те пичетленӗ».\n\n…Пӗр 5-6 ҫул каялла Чӑваш кӗнеке издательствин складӗнчен пӑрахӑҫланӑ алҫырусен купи айӗнчен кӗрен хуплашкаллӑ самай хулӑн папка тупса таврӑнтӑм. Ун хуплашки ҫине штамп лартса хӑҫан килсе панине палӑртнӑ – 1996 ҫулхи февралӗн 12-мӗшӗ; 15,0 пичет листи, 54-мӗш номерпе шута илнӗ. Кӗнеке ятне авторӗ тӳрех тупайман курӑнать: «Пичетлеме чарнӑ» тенине туртса хурса «Репрессиленӗ калавсем» тесе тӳрлетнӗ. «Заявки пур» тесе палӑртнӑ хуплашка ҫине. Автор уйрӑм хут ҫине ҫырса ҫӗнӗ вариантсем сӗннӗ: «Айӑпа лекнӗ калавсем», «Репрессине лекнӗ калавсем», «Репресси ҫулӗсенче айӑпланнӑ калавсем»… Тата «Кун ҫути кӑтартман калавсем», «Пичетлеме чарнӑ калавсем  тесе хитре почеркпа ҫырса хуни те пур. Ку – редактор алли пулас, вӑл та кӗнеке ятне шыраса аппаланнӑ иккен.\n\nКӗнекене мӗн хыҫҫӑн мӗн лартмаллине автор хӑй аллипе ҫапларах кӑтартса панӑ:\n\nАттене мӗнле вӗлерчӗҫ.\n\nПӗр кӗнеке шӑпи ҫинчен.\n\nВиҫӗ кун та виҫӗ каҫ.\n\n«Сынсем пек ҫырма вӗренеймерӗм».\n\nТелейлӗ Палюк.\n\n«Ӑҫта эс, тинӗс?» калав историйӗ.\n\nКалавӗ хӑй.\n\nӐҫта ҫитсе тухрӑмӑр эпӗр?\n\nЧӑвашсене – вуласа тухма, шухӑшлама.\n\nНим пытармасӑр каласан.\n\nП. Хусанкай кӗнеке вулать.\n\nИртнипе пуласси.\n\nШупашкарта пичетленнӗ А.С. Пушкин кӗнеки\n\nХура кушак.\n\nТемшӗн-ҫке, «Тупмаллинче» «Кӗрхи ҫумӑр» повӗҫ, «Пӗр ачан пурнӑҫӗпе вилӗмӗ» калав, «Кӗрхи сӑнсем», «Тусӑмӑр ҫинчен» статьясем ҫук, унта палӑртнӑ «Хура кушак» (те калав ӗнтӗ вӑл?) таҫта ҫухалса юлнӑ. Статьясемпе асаилӳсенчен хӑшне-пӗрне автор «Ялав» журнала парса пӑхнӑ, ҫакна Аристарх Дмитриев (тӗп редактор ҫумӗ) тата Юрий Семенов (тӗп редактор) алӑ пусса паллӑ тунинчен пӗлме пулать. Каярахпа вӗсене «Коммунизм ялавӗ» («Хыпар) пичетлесе кӑларнӑ.\n\nКуратпӑр ӗнтӗ, тупӑннӑ папкӑра пичетленнӗ калавсем чылай. Публицистика япалисем хушшинче халиччен тухманнисем те пулма пултарассӑн туйӑнчӗ. Кӗнекене автор «ҫӗнетӳ тапхӑрӗпе» ҫунатланса хатӗрлени сисӗнет, кашни япалинех чунпа-юнпа ҫырнӑ, кашниншӗнех сӑмах тивнӗ, хӑш-хӑш кӗнекипе калавне сутма кӑларсан каялла пуҫтарса илнӗ. Ман хамӑн та пур ун пек шӑпаллӑ «Писательпе паллашни» кӗнеке (1972), ӑна студент ҫулӗсенченпех упратӑп. Титул ҫине нумай ҫул иртсен авторӗ ҫапла ҫапла ҫырса пачӗ: «Ҫак сайра тӗл пулакан кӗнеке хуҫине Валерий Николаевича сума суса, тав туса. Хв. Уяр. 28.- IV. – 94». Ҫав кун Хӗветӗр пиччепе Етӗрне районӗнчи Урапакасси ялне Алексей Медведев ҫыравҫӑ патне хӑнана кайса килнӗччӗ.\n\n\n\n«Мӗншӗн Хӗветӗр Уярӑн ҫак кӗнекине пичете паман?» – ыйтрӑм эпӗ алҫыру шӑпине пӗлес тесе издательствӑра чылай ҫул тӗп редакторта ӗҫленӗ П.Е. Дмитриев-Эйзинран. Йӑлтах маннӑ иккен иккен мӗн пулни-иртнине Петр Егорович.\n\nАванах ас тӑватпӑр, «ҫӗнетӳ» хӗвелӗ ансах ҫитнӗччӗ. Ман шутпала, «Уярсен вӑхӑчӗ иртет иккен-ха, каллех йӗпе-сапаллӑ тапхӑр килсен мӗн калӑпӑр», – тесе асӑннӑ кӗнекене «вырӑн ҫитменнипе» плана кӗртмен.\n\nПӗлтӗр ҫак папкӑри «Ӑҫта эс, тинӗс?» калав историйӗ» асаилӗве «Тӑван Атӑл» тата «Халӑх шкулӗ» журналсене сӗнсе пӑхнӑччӗ. «Пирӗн кун пекки каймасть», – тесе хытӑ тарӑхса каялла персе панӑччӗ ӑна.  Буддӑсем пек пуҫӗсене каҫӑртса ларакан главный редакторсене  ӳкӗте кӗртме хамӑн вӑй ҫитменнипе Юрий Артемьев профессора та хутшӑнтарса пӑхнӑччӗ ҫак ӗҫе, усси пулмарӗ. Кайран ку асаилӗве «Чӑваш халах сайчӗ» пичетлерӗ (4 пин ытла ҫын пӑхнӑ). Кӑҫал вара ӑна сайтран илсе «Тӑван Атӑл» журналта чип-чипер кӑларчӗҫ (5-мӗш номер, 43 – 54 стр.).\n\nЧӑваш наци библиотекинчен пӗлтернӗ тӑрӑх, ҫӳлерех асӑннӑ папкӑри «Иртнипе пуласси» статья тата «Ним пытармасӑр каласан» уҫӑ ҫыру  ниҫта та пичетленмен. Вӗсенчен пӗрне «Чӑваш халӑх сайтне» сӗнсе пӑхасшӑн.\n\n«Иртнипе пуласси» статьяна автор икӗ тапхӑрта ҫырни паллӑ (вӗҫӗ, юлашки страници, таҫта ӳксе юлнӑ пек туйӑнать). Пӗрремӗш пайне хӑҫан ҫырни паллӑ мар, иккӗмӗш пайне вара 1969 ҫулта ҫырнӑ тесе кӑтартса хӑварнӑ. Статьяна издательствӑпа журналсен редакцийӗсем мӗншӗн сивленине ӑнланса илме йывӑр мар: унта  тӗне кӗмен чӑвашсен пурнӑҫӗ пирки самах пырать. Ун чухне питӗ «юраман» тема пулнӑ ку. Ӑна мӗнле уҫса панине идеологи ертӳҫисем анчах мар, Патшалӑх хӑрушсӑрлӑх комитечӗ пӑхса тӑнӑ. Ҫавна пулах «язычниксем» пирки историксем революцичченхи авторсене кӑш-кашт асӑнса иртнипех ҫырлахнӑ. Ман шутпала, ҫакна пулах Хветӗр Уяр  тӗне кӗмен чӑвашсен пурнӑҫне ытларах чухне хурласа ҫырать.\n\n\n\nВалерий Алексин.\n\n\n\nТе тӑшман вӑл ҫав этем - ӑнланма ҫук. Ячӗ те тутарла ун - Идрис. Хӑй чӑваш. Ахаль чӑваш ҫеҫ те мар тата - «чӑн чӑваш». Тӗне кӗменни! Икҫӗр ҫула яхӑн ҫӑкӑр унанӑ пек унасан та тӗне кӗмесӗр юлма хал ҫитернӗ ҫын ачи. Хӑй тахҫанах ача ашшӗ ӗнтӗ, ватлӑхӗ те инҫе мар. Ячӗ пирки калас пулсан, сӑмах нумай. «Ӑна вӗсем патша чиновникӗсемпе пупсем хӑпчӑр тесе ҫапла хунӑ», - терӗ мана пӗр юлташ. Лешсем хӗсӗрле пуҫласан эпир мӑсӑльмансем тенӗ-мӗн те – ӗҫ те пӗтнӗ. Хӑйсем ҫаплах киремете пуҫҫапнӑ-ха, аслӑ ырра парне панӑ, кил-тӗш пӑтти пӗҫернӗ.\n\nИдриса эпӗ яла пырсан виҫҫӗмӗш кунне асӑрхарӑм. Лутра вӑл, чирлӗ сӑнлӑ. Хырӑмне сулахай аллипе тытса, ушкӑна пырса ларать те ҫынсем ҫине кӗтевлӗн, ӑшпиллӗн пӑхать, кӗхӗм-кӗххӗм! ӳсӗрет.\n\nТепӗр ҫӗрте сӑмах-юмах тапранчӗ - унта та Идрис Искакович Ильдиаров курӑнса кайрӗ. Питне-куҫне асаплӑн пӗркелентерсе ҫынсем патне майӗпен ҫывхарчӗ вӑл, итлекелесе тӑчӗ. Аллипе хырӑмне тытнӑ хӑй. Сурчӑкне те темшӗн аран-аран ҫеҫ, мӑйне хур пек тӑсса кӑна ҫӑтать. Куҫӗнче хӑйӗн пурнӑҫ хӗлхемӗ тӗлкӗшсе ҫунать.\n\n- Мӗн пулнӑ ӑна? - ыйтрӑм эп, Идрис кайсан.\n\n- Рак, - терӗҫ мана кӗскен.\n\n- Рак?!\n\n- Рак. Йӗпе пырӗ питӗрӗнсе ларнӑ. Апат ҫӑтаймасть. Ӑна халь тӳрех хырӑмӗнчен тӑрантараҫҫӗ.\n\nУнпа ҫынсем ҫине тӗмсӗлсе пӑхать-ҫке вӑл! Мӗнле те пулин тӗлӗнтермӗш япала чир танатинчен хӑтармӗ-ши тет ӗнтӗ, мӗскӗн. Ку хӑрушӑ инкек тӗлӗкре те курӑнмарӗ-ши тесе, тен, ыйхӑ тӗлӗшпе пырне тыта-тыта пӑхать пуль. Лешӗ иртме мар, йывӑрлансах пырать ав.\n\nТепре курсан, Идрис мана хӑй ҫапла каларӗ:\n\n- Больницӑра пӗрле выртнӑ ачана пытарнӑ. Унӑн та манни пек чирччӗ.\n\nИдрис хӑйне ӑҫта пытармаллине кӑтартса хунӑ-мӗн. Ҫакӑнта анне ҫывӑхне вырттарӑр тенӗ.\n\nТепӗр уйӑхран Идрис яла та тухса ҫӳрейми пулнӑччӗ. Хӑй ҫапах шанма пӑрахманччӗ-ха?\n\n- Тухтӑртан ыратнине чармалли укол тума ыйтрӑм та - килӗшмест. Укол тутарма хӑнӑхса кайӑн та сывалсан чарӑнаймӑн. Усала вӗренесси часах, - тенӗ пулать, тарӑхмасть, савӑнса каласа парать.\n\nПриговор ҫырнӑ, алӑ пусса ҫирӗплетнӗ тенешкел, халь тин ним те тӑваймӑн ҫав. Нумаях та пулмасть-ха кам та пулин пурӑнассипе вилесси Идрисран хӑйӗнчен килнӗ. Калама ҫук чӑрсӑр, пуҫтах, чарусӑр пулнӑ вӑл. Вӑйне ниҫта кайса чикейменнипе шартлама сивӗ хӗл кунӗнче юр ҫине ҫаппа-ҫарамас выртса кустӑрма пек кусса ҫӳренӗ, ҫӗрле урам варрине сике-сике тухса арҫурилле кӑшкӑрнӑ.\n\n- У-у-у! Ы-ы! Уа-а!.. Ай-яй-яй! И-ха-ха! Мяу! Ме-а!\n\n- Тур ҫырлахтӑрах, каллех Идрис кашкӑрсене йыхӑрать, выльӑхсене тухса астӑвас, - тенӗ шарт сиксе тӑрса ларнӑ ватӑсем.\n\nПуҫхӗрлӗ ҫӳресси ҫеҫ юлнӑ Идрисӑн. Ашкӑннӑ вӑл. Эрех ӗҫнӗ. Никама ним вырӑнне хуман. Пурнӑҫ пирки шухӑшламан. Ма пуҫа усӑсӑр ватмалла, йӑлтах хӑй ӑссӗн пулса пырать пулсан. Килте ун пиҫнӗ-хуҫнӑ, ӗҫре ӑна пурте куҫран пӑхаҫҫӗ. Ялта ун пеккинчен никам тӗлӗнмест. Ҫемйи сывӑ ун, хӑй туртсан тимӗр татмалла. Ӗҫӗ килӗшнӗ ӑна - шофер вӑл. Ялӑн тепӗр вӗҫне мар, карта хыҫне те машинӑпа ӗрӗхтерсе кайса килнӗ. Укҫаран татӑлман. Вутӑ кирлӗ сана (вӑрман ҫукран кунти ҫынсене хир енчисем теҫҫӗ), укҫа пулсан, мӗнле вутӑ кирлине ҫеҫ кала, хӑть те тупӑлха вутти пултӑр, ҫӗр айӗнчен чавса кӑларать те - тупса килсе парать-паратех. Ӑҫтан вӑрласа килет вӑл. Таҫтан.\n\nУҫҫа ятлӑ йӗкӗте вӑл ҫапла вӗлернӗ. Идрис шофер терӗмӗр. Ҫамрӑк Уҫҫа ун машини ҫинче грузчикра ӗҫленӗ. Пӗррехинче хулара вӗсем патне «шабашкӑран» таврӑнакан кӳршӗ ял ҫынни пырса тӑнӑ.\n\n- Киле лартса каймастӑр-и?\n\n- Ыйтса тӑрать тата! Лар хӑпарса!\n\nУнччен те хӗрӗнкӗскер, ӗнтӗ киле ҫитнӗпе пӗрех тесе, «шабашник» тата ӗҫнӗ. Унтан тата. Тата. Идриспа Уҫҫана та ӗҫтернӗ. Юлашкинчен тӳнсех кайнӑ.\n\nТытса пӑхать Идрис ун кӗсйине - туллиех укҫа лекет. Шутлаҫҫӗ те - икӗ пин тенкӗ ытла.\n\nМалтан вунӑ тенкӗ ҫеҫ илеҫҫӗ-ха вӗсем. Пӗрре ӗҫмелӗх. «Лартса килнӗшӗн». Унтан ҫирӗм...\n\nТата темиҫе ҫамрӑк пырса хутшӑнать.\n\nӖҫсен-ӗҫсен, юлашки укҫине те «ахаль» хӑварас килмест вӗсен. Пайлаҫҫӗ пӗр-пӗрин хушшинче. Идриса - «аслине» - ытларах параҫҫӗ, ыттисене - хӑюлӑхне кура. Укҫа хуҫине ҫӗре илсе пӑрахаҫҫӗ. Иртен-ҫӳренсем ҫаратса кайнӑ пек пултӑр тесе. Идрис ун кӗсйине тавӑрса хӑварма та манмасть. Сӑмах халӑх хушшине тухасран хӑрамаҫҫӗ. Халӑх хушшине тухсан та, ялтан тухмасть кунта сӑмах. Пӗр-пӗрне хӳтӗлеме пӗлеҫҫӗ ку ялти ҫынсем.\n\nШӑп килӗсене саланмалла тенӗ чух кӗтмен харкашу тапранса каять. Пӑлхав пуҫлать Уҫҫа. Хӑйӗн тӳпине вӑл сӗтел ҫине кӑларса вӑркӑнтарать: кирлӗ мар мана вӑрланӑ укҫа! Килӗшеҫҫӗ унпа. Юрать, теҫҫӗ. Тархасшӑн. Вӑл укҫана та вӑр-вар ҫеҫ пайласа яраҫҫӗ. Каламасӑрах паллӑ пулсан та, сых ятне асӑрхаттаран пекки тӑваҫҫӗ.\n\n- Эсӗ никама та шарламастӑн, паллах.\n\nСовет шкулӗнче вӗреннӗ, совет ҫарӗнче пулнӑ ҫамрӑк ним хӑрамасӑр хуравлать:\n\n- Укҫине пӗр пус юлмиччен пуҫтарса каялла ҫын кӗсйине чиксе хумасан, ыранах милицине пӗлтеретӗп, - тет.\n\nВӑйлӑ Идрис ӑна пӗрре ҫапнипех ҫӗре ыткӑнтарса ярать.\n\n- Ну, мӗнле, халӗ те калатни-ха?\n\n- Ҫитсенех... телефонпа... пӗлтереп, - тет Уҫҫа, ҫӗртен аран тӑрса.\n\nТепре ҫапса ӳкереҫҫӗ ӑна. Тапаҫҫӗ, чышаҫҫӗ.\n\n- Халӗ мӗнле? - тет урса кайнӑ Идрис.\n\n- Пурпӗр... алап (калап), - хӑйӗннех перет чӗп-чӗрӗ юн пулнӑ Уҫҫа.\n\n...Ку инкекӗн вӗҫӗ ҫакӑн пек. Хӗненӗ ҫӗртех вилсе кайнӑ Уҫҫана Идрис машина кабинине лартать те ҫав тери хытӑ пынӑ ҫӗртен ял варрине вӑркӑнтарса хӑварать. Уҫҫа мӗнле вилнине пурте пӗлеҫҫӗ, пӗлменнисем - туяҫҫӗ пулсан та, ют ял ҫыннисемшӗн вӑл машина ҫинчен тухса ӳксе вилнӗ пулать. Ваттисен сӑмахӗ кунта ҫавӑн пек: вилни - вилнӗ, пирӗн чӗррисемпе пурӑнмалла.\n\nУҫҫана пытарма Идрис та пырать. Уҫҫан ҫамрӑк арӑмӗпе, пӗчӗк хӗрачипе пӗрле вӑл та татӑлсах йӗрет. Анчах темшӗн йӗрет-ҫке - те хӑйне айӑпласран хӑранипе, те ӳкӗннипе...\n\nҪук, айӑпламаҫҫӗ ӑна. Тивмеҫҫӗ.\n\nЯл ӳчӗ ҫинчи ҫак вӗри суран паян кунчченех уҫҫӑн тӗлкӗшсе тӑрать. Тепӗр тесен, вӑл кӑна-и унта...\n\nҪапла, тӗлӗнмеҫҫӗ ку ялта Идрис пеккинчен. Кирек мӗн пултӑр та, сасси-хури часах йӑмтӑр теҫҫӗ. Ютта кӑларма юрамасть - \"ваттисем хушман\". Алӑ хуҫӑлсан, алса ӑшне чикнӗ, пуҫ ҫурӑлсан, ҫӗлӗк ӑшне. Ҫынни ытла тарӑхтарса ҫитерсен ҫеҫ ӑна ушкӑнпа тытса вӗтнӗ. Е ялтан кӑларса янӑ. Ку чи йывӑр айӑплав пулнӑ. Тӳре-шарана пӗлтермен. Нихҫан та. Ним пулсан та. Тӳре-шарапа пӗр хутчен ҫеҫ калаҫнӑ вӗсем яла мӗн те пулин илме, мӗн те пулин тӑпӑлтарма килсен. Ытти чухне ял-йыш вӗсене «асӑрхаман», ҫук пекех шутланӑ.\n\nКам та пулин нушана кӗрсе ӳксен, ӑна халӑхпа пулӑшнӑ - ниме тунӑ, укҫа е тырӑ пуҫтарса панӑ (паллах, пуринчен ытла хӑй пеккисем), вӑрӑпа тытӑнсан, йышпа пуҫтарӑнса ҫӑлӑнмалли май шыранӑ. Кашни этем ял халӑхӗшӗн ответлӑ пулнӑ, ял халӑхӗ кашни уйрӑм ҫыншӑн ответ тытнӑ.\n\nПурнӑҫ ҫапла вӗрентнӗ вӗсене. Пӗрне-пӗри хӳтӗленипе ҫеҫ вӗсем пуҫӗпех пӗтмен. Хӑйсен йӑли-йӗркисене, чӗлхине, культурине сыхласа хӑварма пултарнӑ. Сахал-и ку? Уншӑн вара, тӑшманӗнчен хӳтӗленсе, пуҫне ҫунатти айне чикекен страус евӗр пулнине те, ытти хӑш-пӗр айӑпсене те каҫарма юрать, тесе ҫыртӑм та эпӗ шухӑша кайрӑм. Юрать-и каҫарма? Ҫынна вӗлернине, сӑмахран. Е вӑрӑ тунине. Ӗлӗк, тен, юранӑ та пуль, халӗ, пирӗн саманара, юрамасть!\n\nКу ял мӗн Октябрь революцичченех тӗне кӗмесӗр тытӑнса тӑма пултарнӑ сайра чӑваш ялӗсенчен пӗри. Ячӗ те ун хӑйне майлӑ - Тӑванкасси. Пысӑк, пуян ял. Темиҫе урам... Шоссерен пӗр ҫухрӑмра курӑнса ларать. Юнашарах тата темиҫе чӑваш ялӗ - Ҫӗн Пукаш, Кив Пукаш, Мӑрсиел...\n\n1871 ҫулта пуҫласа Тӑванкассине пырса курни чӑваш халӑхне ҫутта кӑларакан И.Я. Яковлева - ун чухне Хусан университечӗн студентне - Колумб Америкӑна уҫнинчен те кая мар тӗлӗнтерсе янӑ: «Сделал важное открытие, которое, как я полагаю, немногим менее удивило и поразило меня, чем открытие Америки Колумбом», - тенӗ И.Я. Яковлев. Малалла вӑл ҫапла ҫырса кайнӑ*: \"Я открыл (впрочем, не излишне наперед вас предупредить, что открытие это скорее было, так сказать, субъективное, открытие собственно по отношению ко мне), - я открыл, говорю, целую деревню, числом до 400 душ, где от мала до велика отпали от христианства** и присоединились к магометанству*** Деревня эта... населена чисто чувашами и находится на весьма важном пункте... Отсюда происходит вся пропаганда и антихристианское влияние на другие чувашские местности двух уездов. Чуваши здесь весьма богаты, многие в этой деревне имеют по нескольку тысяч. Чуваши Туванкасов, крещенные насильственно в 1851 году по распоряжению тогдашнего удельного управляющего Глинки, сделались в настоящее время отъявленными врагами христианства. Спустя несколько лет после крещения они, прежде мирные, мало-помалу переменили свой национальный костюм на татарский и на головы надели чаплашки. Местное духовенство отступилось от них совершенно и игнорирует их отпадение, - поэтому, я думаю, что даже архиерей едва ли знает об этом факте. Впрочем, что они в состоянии сделать. Священник не имеет права в этой деревне показаться. Я был в гостях у одного богатого чувашенина****, который считается нововодом в деле отпадения. Он принял меня сначала весьма радушно, но потом, когда разговор коснулся религии, беседа наша сделалась натянутою, и я поспешил удалиться. Под конец чувашенин принял меня за подосланного чиновника, только их приводило в сильное недоумение то, что я хорошо говорю по-чувашски\".\n\nКу - ҫӗр ҫул ӗлӗкхи Тӑванкасси. Халӗ мӗнле-ши вӑл.\n\nЭ, чимӗр-ха. Тӑванкассинче И.Я. Яковлев мӗнрен тӗлӗнсе хытнине пӗлтӗр-и эсир? Ҫук, ҫырман вӑл ун пирки. Халапҫӑсен пулать ун пекки час-час. Ахлатаҫҫ вӗсем, хӑлаҫланаҫҫӗ, анчах итлесе ларакан нӳ те тумасть, курмасть тӗлӗнмеллине. Хӑй мӗнрен тӗлӗннине каласа, кӑтартса параймасть халапҫӑ. Тепӗр чухне тӗлӗнмелли ҫукран та килет пуль вӑл. Анчах Иван Яковлевичӑн пулнӑ, пулнӑ каласа памалли. Вӑл чӑнах та тӗлӗнсе хытса тӑнӑ, сисӗнет ҫакӑ. Кӗске ҫырура вырӑн ҫитмен пулас. Ҫыру тӗллевӗ те урӑх пулнӑ ун.\n\nЭп пӗлекен ытти ялсенчен нумай енӗпе уйрӑм Тӑванкасси. Пӗр пекки ҫинчен каламастпӑр - паллӑ вӑл. Пӗтӗм ҫӗрти пекех, кунта та колхоз. (Чӑн, кӑштах каярах юлса чӑмӑртаннӑ, ҫапах - чӑмӑртаннӑ, ҫирӗпленсе ҫитнӗ). Машинӑсем ӗҫлеҫҫӗ. Электричество пур. Радио. Телевидени. Телефон...\n\nЫтти енчен ялсен, ҫынсен ячӗсенчен пуҫласа йӑла-йӗркесем таранчченех урӑхла кунта. Урӑх тӗнче. Хӑйсен ял пуҫӗсем, хӑйсен саккунӗсем пулнӑ вӗсен. Пуҫлӑхӗсем, «патшисем» халь ҫук. Анчах йӑлисем, хут ҫине ҫырӑнман саккунӗсем тӑрса юлнӑ. Хӑш-пӗр йӑлисем тепӗр чухне йӑларан та ҫирӗпрех-и тен...\n\nКунти ҫынсен хӑйсен паттӑрӗсем, хӑйсен тӑшманӗсем пулнӑ. Юман ятлӑ ҫын ҫинчен, сӑмахран, ватти-ветти те пӗлет. Халӑха ирӗксӗрлесе тӗне кӳртме пынӑ пупа вӑл шывлӑ стайкка (шетник) тӑхӑнтарса янӑ, тет. Патихан карчӑк та хӑюлӑхӗпе арҫынсенчен ирттеретчӗ теҫҫӗ.\n\nКу ялта пӑртак пурӑнсан, эпӗ чӑваш ячӗ историре мӗншӗн хут ҫине час ҫырӑнса юлманнине ӑнлана пуҫларӑм. Ача ҫуралать-и кунта, вилет-и - тӗнчери халӑх шутне ӳстермен те вӑл, чакарман та. Ҫыртарман ӑна хут ҫине. Пӗр енчен, «чаплах мар» пулнӑ чӑваш ячӗ. Саккунпа килӗшсе тӑман ят. Тепӗр енчен, чӑвашӗсем хӑйсем те тӳре-шарасене «асӑрхасшӑн» пулман. Эсир - хӑвӑр, эпир - хамӑр, тенӗ майлӑ пурӑннӑ. Ку вӑл сӳрӗк хирӗҫӳ пулнӑ.\n\nЯтсем тӗне кӗмен чӑвашсен темиҫе пин - кирек хӑшне суйласа ил. Пур ашшӗ-амӑшсем пекех, Тӑванкассисем те хӑйсен ачисене «хитре» ятсем пама тӑрӑшнӑ. Пӗр сӑвӑҫӑн амӑшӗ, сӑмахран, Шеркун ятлӑ пулнӑ. Виҫпӳрте вӑл Тӑванкассинчен качча пынӑ. Унӑн аппӑшӗ те, сӑвӑҫӑн мӑнаккӑшӗ, ҫав майлах - Шеверпи ятлӑ пулнӑ. Ӗнчӗпексем кунта ик-виҫҫӗн - хӗрсем, арӑмсем. Кӗмӗшпе Сӗверхине пӗрер ҫеҫ.\n\nАкӑ арҫын ячӗсем - Сарука, Мӑрси, Элентюк, Имет, Велюш, Лискав... (Вунӑ ҫынтан пӗри мар пулсан та, нумай кунта Лискавсем, - вырӑссем хушшинчи Ивансем пекех. Григорий Григорьевич Лисков композитор хушамачӗ те ҫав ятран пулнӑ. Ялти тӗп ячӗ ун - Хемит.\n\nЯт хума ҫӑмӑл пулнӑ. Килӗшнӗ ята туп та тӑванусене пӗлтер, ӗҫкӗ ӗҫ - ял ҫине кайрӗ те. Анчах ӳссен хут тутарасси темрен те йывӑр пулнӑ.\n\n- Эсӗ кам? - тӑрахланӑ йӗкӗтрен кантуртисем. Яланхи пек «шӳт» пуҫланасса кӗтсе вӗсем малтанах шӑлӗсене йӗрсе ларнӑ.\n\nҪамрӑк хӑйӗн ятне каланӑ.\n\n- Эптюш, плхарути. Ӗҫлеме кайма хут кирлӗ.\n\n- Эсӗ кам теҫҫӗ сана. Кам эсӗ?\n\n- Ну, ӗнтӗ ара... Этем ӗнтӗ, хӑвӑр куратӑр.\n\n- Этем. Нимле этем те мар эс, мӗлке кӑна. Суя кӗлетке. Катемпи! Этемсене пурне те хут ҫине ҫырнӑ. Вӗсем ӑҫта ҫурални, миҫери, ашшӗ-амӑш кам иккенни паллӑ. Санӑн нимӗн те ҫук. Пфу кӑна эс. Сывлӑш! Вӗрсе кӑларнӑ та вӗҫсе кайнӑ. Ҫук эсӗ тӗнчере! Сана ҫак самантра ҫапса пӑрахсан та ним пулмасть.\n\nСурӑх е укҫа парсан ҫеҫ чӑваша «ҫын шутне» кӗртнӗ: хут ҫине ҫырса хунӑ. Анчах хӑйӗн ячӗпе мар, тӗне кӗнӗ ятпа: Ильмук вырӑнне пӗр-пӗр Илле е Иван, Яшмул вырӑнне Якку. Манпа халь пӗве хӗрринче калаҫса ларакан урасӑр Ухливанов Пиппав та паспорт тӑрӑх Петр Леонтьевич шутланать. Хушамачӗ ҫеҫ ун улшӑнман. Уншӑн та пулин тавтапуҫ тет кӑмӑллӑ Пиппав Ликович.\n\nСовет ҫулӗсенче Тӑванкасси ҫыннисен паспорт илес тесен медицина комиссине кӗме тивнӗ. Салтака илнӗ чух та ҫын миҫерине ҫапла пӗлнӗ.\n\nТакам та йӑнӑшма пултарать. Тухтӑрсем те йӑнӑшкаланӑ: шӑллӗ пиччӗшӗнчен маларах салтака ӑсаннӑ* теприсем салтака кайма вӑхӑт иртиччен те \"ҫитӗнсе ҫитеймен\"...\n\nТӗне кӗмен чӑвашсем... (Ку пуплеве икӗ тӗрлӗ ӑнланма пулать: тӗне кӗмесӗр юлнӑ чӑвашсем тесе те, чӑвашсем тӗне кӗме килӗшмен тесе те. Апла та, капла та тӗрӗс. Хальхинче сӑмах тӗне кӗмесӗр юлнисем пирки пырать).\n\nХалӑхсем тӗрлӗ чӗлхепе калаҫни, тӗрлӗ турра пуҫҫапни, тӗрлӗрен шухӑшлани патша тытӑмӗшӗн карланкӑ патӗнчи ҫӗҫӗрен те хӑрушрах туйӑннӑ. Патша йыттисен ӗмӗчӗ ҫапла пулнӑ: пурин те пӗр чӗлхепе калаҫмалла - вырӑсла, пӗр евӗрлӗ шухӑшламалла - православи хушнӑ пек, пуҫа пӗксе ҫӳремелле. Акӑ лайӑх ҫын: ӗҫлетӗр вӑл, анчах ан шухӑшлатӑр. Шухӑшласси, тур хӑтартӑр та, мӗн те пулин сӳтсе явасси - ятарласа хушнӑ е уйӑрса лартнӑ ҫынсен ӗҫӗ. Ытах, шухӑшлама та юрӗ, чарӑнаймастех пулсан, атя, урлӑ-пирлӗ шухӑшласа пӑхтӑр, анчах хуллен, хӑй ӑшӗнче, ҫын илтмелле мар. Паллах, тӳлеккӗн калаҫма та юрать, анчах тӳре-шарасем ӑнланмалла - вырӑсла.\n\nТӗне кӗртес, халӑхри хирӗҫӳ туйӑмне пӗтерес, антарса хурас тесе мӗнле кӑна асаплантарман пуль чӑвашсене! Штраф ҫине штраф хунӑ - выльӑх мурӗ пуҫланнӑшӑн, ҫын пӳкле вилӗмпе вилнӗшӗн, каланине вӑхӑтра итлеменшӗн, киремете парне кӳнӗшӗн... темшӗн те, темшӗн те. Суха тӑвакана лашисене тӑварттарса лава янӑ. Тӗне кӗнӗ кӳршӗ ялсен куланайне, туймаккине, чиркӳ укҫине вӗсем ҫине хурса юлашки тырӑ пӗрчи юлмиччен шӑлса кайнӑ, пур-ҫук выльӑхне туртса илнӗ, кӳршӗ ялсемпе вӑрҫтарнӑ. Упшур командисем пырса, киремет йывӑҫӗсене касса пӗтернӗ, чӳк тумалли вырӑнсене вараланӑ. Хӑюллӑ ҫынсене Ҫӗпӗре тыта-тыта ӑсатнӑ...\n\nАкӑ 1749 ҫулхи пӗр документра мӗн каланӑ: «Многие обыватели от двойного платежа, во-первых, - настоящих подушных денег, рекрутских и складных денег, а потом - второго расположения за новокрещен подушного сбора, которого забирается с них малым менее того положенного настоящего (основного) в год подушного оклада, а паче от платежа за тех, всех старых от взяться Казани и новых новокрещен рекрут - пришли в самую крайнюю скудость и разорение, ибо вышеозначенный двойной платеж за себя и за новокрещен подушных денег и рекрут и в рекрутские складки складных денег едва не все те обыватели, отстающие в неверии, все свое имение, скот и хлеб, токмо наличный, заготовленный себе впредь на пропитание, но и многие же и в земле посеянной уже продали* многие ж, распродав хоромное строение, домов своих лишились и за взятием взаем денег пошли многие ратных чинов к людям в работы, а другие детей своих заложили. К тому и ныне рогатый скот едва не весь выпал и за тем осталось скота в редких деревнях по малому числу и от такого великого изнеможения некоторые разбежались и пропали безвестно, и из тех иноверцев, пришедших в крайнее изнеможение и скудость, также многие иноверцы из написанных по нынешней ревизии померли»...*****\n\nЯланах пӗр юрӑ илтӗннӗ: «Юлашкисем те вилсе пӗтиччен парӑнӑр, христиан тӗнне йышӑнӑр, хӑвӑрӑн пурнӑҫ йӗркине, уявӑрсене, чӗлхӗре манӑр, вара сире сӑвап пулӗ, пӗр-ик ҫул хушши куланай илмӗпӗр, ҫиелтен укҫа та парӑпӑр».\n\nСлонпа кӑткӑ «кӗрешни» пулнӑ вӑл. Вӑйли вӑйсӑррине пусмӑрлани. Патша тытӑмӗ - слон, тӗне кӗменни - пӗчӗкҫӗ кӑткӑ.\n\nКам ҫӗнтересси, таптаса лапчӑтса каясси куҫкӗретӗнех курӑнсан та, харсӑр кӑткӑ парӑнман. Тӑванкасси ҫыннисем тӗне кӗме килӗшмен, хӑйсен йӑли-йӗркисене те пӑрахӑҫламан, чӗлхине те манман. «Эпир атте-аннене хисеплетпӗр, ҫавӑнпа вӗсем вӗрентнӗ чӗлхене те, вӗсем панӑ ятсене те манмастпӑр», – тенӗ. Пысӑк инкек пӗчӗк инкекрен, пысӑк ултав пӗчӗк ултавран пуҫланать. Паян ҫын хӑйӗн тӑванӗсене, ашшӗ-амӑшне хисеплеми пултӑр, вӗсен ячӗсене улӑштартӑр, унтан тӑван тавралӑхне, тӑван халӑхне, унӑн чӗлхине тиркеме тытӑнтӑр. Малашне мӗн пулӗ ун пек ҫынран.\n\nХӑйсен ятне ҫухатас марччӗ, хӑйсем тӗллӗн пурӑнасчӗ тесе, тем те хӑтланнӑ кунти чӑвашсем. Кӗрешнӗ. Кантуртисене, ҫӑткӑн пупсене ялтан хӳтере-хӳтере кӑларса янӑ. Тӑванкасси ҫыннисен тӑхӑмӗсем ӗлӗк Пугачев ҫарне те хутшӑннӑ пулас. Сехре хӑпартмӑш хура юпана революциччен Тӑванкасси хапхи умне ахальтен лартман пуль ӗнтӗ. Астӑвӑр, кунта вӑрӑ-хурахсем пурӑнаҫҫӗ, тенине пӗлтернӗ вӑл. (Ун чухне пӑлхавҫӑсене ҫапла каланӑ).\n\nАнчах чул тӑва ҫамкапа ҫапса ишме ҫук. Пурӑнасси вилессинчен йывӑр пулсан та, камӑн та пулин ачасене пӑхса ҫитӗнтерсе вӗсене халӑхӑн чунне, ун культурине памалла пулнӑ. Сӑмахран, тӗррине. Каярахпа пӗтӗм культурӑллӑ тӗнчене тӗлӗнтерсе пӑрахнӑ вилӗмсӗр пуянлӑха. (Чӑваш тӗрри пирки пӗр вырӑс писателӗ ҫапла ҫырнӑ: «Это - огненно-южные узоры, похожие на древние орнаменты, бессмертные, известные во всем мире чувашские вышивки «терэ», которые, подобно произведениям египетских мастеров, рассчитаны на то, чтобы прожить века».\n\nТата чӑвашсен вӑййи-юррине илӗр. Ӑна килес ӑрусем валли усрамалла мар-и? «Чӑвашсен юрри те, вӑййи те тӗлӗнмелле илемлӗ-мӗн, ун пеккине эпӗ тӗнче тавра темиҫе хут ҫаврӑнса та урӑх ниҫта та илтмен те, курман та. Ну, ӗнтӗ сцена ҫинче, балетра, оперӑра куркаланӑ. Анчах ку балет та, опера та мар-ҫке, ку вӑл чӑн пурнӑҫ»Ӗ – тесе ҫырнӑ иртнӗ ӗмӗр вӗҫӗнче чӑвашсен ҫывӑхӗнче пурӑнакан Н.Г. Гарин-Михайловский писатель.\n\nПирӗн юмах-халап тата. Чӗнтӗрсем. Халӑхӑн ыр кӑмӑлӗ, ӗҫченлӗхӗ, кӳршӗ халӑхсемпе туслӑ пурӑнма тӑрӑшни... Э, темӗн те пулнӑ пирӗн пулас ӑрусем валли упрамалли. Ҫавӑнпа урнӑ упана хирӗҫ ҫара алӑпа хӑлаҫланнипе ҫеҫ юраман ҫав. Вӑхӑт-вӑхӑт чееленме, ухмаха пеме, пуҫа чиксе ҫӳреме те тивнӗ. Ютта тухнӑ чух чӑваш ҫынни тӗрӗллӗ кӗпи-тумтирне тӑхӑнман. Вӑййи-юррисене те ҫӗрле ҫеҫ ирттернӗ. Ӗҫме-ҫиме пур ҫӗртех хытса пурӑнма хӑнӑхнӑ - ыран тем пулас-килесрен асӑрханнӑ. Савӑнӑҫне ҫынна кӑтартман. Ытларах аслӑ ҫулпа мар, вӑрттӑн сукмаксемпе утнӑ. Тӳре-шарине часрах ҫырлахтарас тесе мӗн ыйтнӑ - ҫавна панӑ. Ӗҫтернӗ, ҫитернӗ. Атя, кӳп, анчах часрах тухса кай... Ырӑ сунса сӑйланӑ пек пултӑр тесе, «хӑнапа» пӗрле хӑй те ӗҫнӗ. Паян та ӗҫнӗ, тепӗр кун та. Пӗлтӗр те, кӑҫал та. Ашшӗ те ӗҫнӗ, кайран ывӑлӗ те тиркесе тӑман. Тен, эпир эрех-сӑрана ҫӑвар умӗнчен тӗксе яманнин сӑлтавӗсенчен пӗри ҫавӑнта.\n\nЧӑвашра усаллине ҫеҫ шыракансем вара савӑнсах элекленӗ. Вӗсен нимӗн те ҫук тенӗ - ни пуянлӑх, ни культура. Иртни - мӗн те пулин пулнӑ пулсан та - истори сӗмлӗхӗнче ҫухалнӑ-мӗн. Пуласлӑх - ҫук вӗсен...\n\nТӑванкасси ялне пуҫласа яракансем кунта пирӗн хальхи Комсомольски районӗнчи Асанкассипе таҫти темӗнле Хӑвай ялӗнчен куҫса килсе ларнӑ теҫҫӗ. (Хӑвай ялӗ тени Тӑвай пулма пултарнӑ). Виҫӗ кил... Кив вырӑнта пурнӑҫ хӗсӗнсе ҫитсен, кил-йышӗпех тухнӑ та тарнӑ ялтан ҫӗрле. Патӑрьел, Шӑмӑршӑ урлӑ ҫакӑнти хура тӑпраллӑ ҫӗр ҫине килсе тымар янӑ. Тӑванкасси историне тӗпчекен пӗр журналист каланӑ тӑрӑх, ку ял вунҫиччӗмӗш ӗмӗрте (пин те ултҫӗр темиҫемӗш ҫулсенче, тен, ӗмӗр вӗҫнерех.) пуҫланнӑ-мӗн.\n\nХалӗ Тӑванкассинче икҫӗре яхӑн кил, пине яхӑн ҫын пурӑнать теҫҫӗ.\n\nТӗне кӗме ӳкӗтлени, илӗртни, хӑратни, хырҫӑ-марҫӑсемпе штрафсем тӳлеттерсе тинке кӑларнисем т. ыт. те, пулӑшманнине кура, удельнӑй кантурӑн управляющийӗ Глинка 1851 ҫулта Тӑванкассине ҫар командипе хупӑрласа илнӗ пулнӑ. Халӑха татӑклӑнах ҫапла пӗлтернӗ: «Е тӗне кӗме килӗшетӗр, е сирӗн тӑршшӗпех салтаксене тӑрантарса пурӑнма тивет, мӗншӗн тесен, сире тӗне кӗртсе пӗтермесӗр эпир ниҫта та каймастпӑр»...\n\nПӗр эрне иртнӗ ҫапла. Вунӑ кун. Ик эрне! Ӗҫсӗр аптранӑ салтаксем ял тӑрӑх сулланса ҫӳренӗ, чӑх йӑвисене, нӳхрепсене тасатнӑ. Ӑна пар, кӑна пар, тенӗ. Паманнине туртса илнӗ.\n\nӖҫҫи вӑхӑчӗ ҫитнипе ҫеҫ ялти ватӑсем канашлӑва пуҫтарӑннӑ.\n\n...Ял халӑхӗ Хӗрҫырми хӗрринче кӗпӗрленсе тӑрать. Вӗсенчен инҫе мар - салтаксен ушкӑнӗ. Старостӑпа темиҫе салтак килӗрен киле чупаҫҫӗ. Анчах усси ҫук пулас - пытанса ларнисене пӗрне те тупаймаҫҫӗ. Вӗсене тупма мар, ушкӑнти халӑх та чакнӑҫем чакса пырать.\n\n- Тытӑн! - теҫҫӗ вара пупа. Лешӗн йӑлтах хатӗр. Чӑвашсем еннелле шикленсе пӑхкаласа вӑл ӗҫе пикенет. Ик-виҫӗ ҫынна кӑларать те сире Иван ят хутӑм, тет, теприсене Василий, Петӗр, Ҫитӑр, Варсонофий... Такӑнкаласа, сӑмахсене сиктере-сиктере хӑварса, пуп требник тӑрӑх кӗлӗ мӑкӑртатса вулать:\n\n\"- Изжены... изжени то-есть... из него... лукавого... по наущению диаволю!..\"\n\nТиечӳкӗ ҫӗнӗрен тӗне кӗртнисене ҫырса пырать.\n\nИрхине ҫӑткӑн команда аранах ялтан тухса каять. Вӗсем курӑнми пулнӑ-пулман ял ҫыннисем пупа хваттерӗнчен сӗтӗрсе кӑлараҫҫӗ. Пӗр тирӗк хӗрес - ӗнер хӑйсен мӑйне ҫакнӑ хӗрессене пуҫтарса тыттараҫҫӗ те ӑна, урам варрине майлаштарса тӑратса, ҫӑпаталлӑ урапа кутӗнчен тапса сиктереҫҫӗ. Тепре килсен, хӑвна шыва чӑмтаратпӑр, теҫҫӗ.\n\nТӗне кӗресси ҫапла вӗҫленет тӑванкассисен. Кайран та нумай сӗтӗреҫҫӗ вӗсене, анчах ним туса та парӑнтараймаҫҫӗ.\n\n…Идрис вӗлернӗ иккӗмӗш ҫын Микулай ятлӑ пулнӑ. Ку та ҫамрӑк ҫын, хальтерех ҫеҫ авланнӑскер.\n\nВутӑ вӑррине Идрис урӑх ҫынпа кайма калаҫса хунӑ-мӗн те, лешӗ, Идрис ӳсӗррине кура (вӑл ӳсӗр чух мӗнлине кунта пурте пӗлеҫҫӗ), тата вӑхӑт та каҫа хирӗҫ тесе, унпа ҫула тухма хӑранӑ. Ҫук, пымастӑп санпа тесе пат татса каламан вӑл, темӗнле урӑх сӑлтав тупнӑ.\n\nТалӑрса ҫитнӗ Идрисӑн вара ирӗксӗрех ун юлташӗпе Микулайпа кайма тивнӗ. (Вӗсен пӗр ҫын валли вутӑ кӳрсе килмеле пулнӑ). Вутӑ ыйтакан ҫыннӑн хӗрне кабинӑна, Микулая кузова лартнӑ та вӑл (тепӗр вариантпа - вырттарнӑ) машинине кӗрлеттерсе хускатнӑ. (Микулай пирки ял ҫынисем икӗ тӗрлӗ калаҫҫӗ: пӗрисем вӑл хӗрӗнкӗччӗ теҫҫӗ, теприсем ӳсӗрех пулнӑ теҫҫӗ. Ҫавӑнпа ун арӑмӗ Идриса ҫапла ӗнентернӗ пулать: вӑрмана ҫитиччен урӑлать вӑл, тенӗ тет.)\n\nУрӑ чух та урнӑ пек ҫӳрекенскер, халӗ тарӑхнӑ Идрис машинине мӗнле чуптарнине каламасӑрах чухлама пулать...\n\nМалалли ӗҫсене эпӗ икӗ ҫӗрте икӗ тӗрлӗ илтрӗм. Пӗри ҫакӑн пек. Ҫул ҫинче машинӑн хыҫалти борчӗ уҫӑлса кайнӑ-мӗн. Кузовра ҫапӑнса пырса тӑнсӑр пулнӑ Микулай машина хӗррине шуса ҫитнӗ те ҫӗре персе аннӑ...\n\nТепӗр вариант. Тӗттӗм уя вӗри машина йӗтре пек ҫурса пынӑ. Е ӗнтӗ вӑл пӗр-пӗр йывӑҫ ҫине пырса тӑрӑнать е хир варринчех сӗлӗ пӗрчи пек саланса ыткӑнать. Апла та, капла та вилӗм тесе, ҫул ҫинче тӑна кӗнӗ Микулай хыҫалти бортне уҫать те сике парать...\n\nСинкерлӗ ӗҫӗн юлашки пайӗ пурин те пӗр пек. Ӗҫ ырӑ маррине сиссе, машинине чарнӑ иккен Идрис. Пӑхнӑ - ҫук Микулай. Ҫӗрти-ҫӳлтине каласа вӑрҫса, машинине каялла ҫавӑрнӑ. Инҫе те каяйман - ҫын ҫине пырса кӗнӗ. Те курмасӑр, те курсах. Чылайӑшӗ курса теҫҫӗ. Хӑех вӑл ӑна больницӑна хурса кайнӑӗ Микулай тӑна кӗмесӗрех вилсе кайнӑ. Ҫаксене пурне те курса тӑнӑ кабинӑри хӗр килне ни чӗрӗ, ни вилӗ таврӑннӑ.\n\nВӗҫӗнче ҫакна каламалла. Чӑвашра халӑх ҫинче саспа макӑракан ҫук та пулӗ. Вӑтанаҫҫӗ. Ик-виҫӗ ҫын хуйхипе пӗтӗм халӑха хурлантарни ырӑ мар теҫҫӗ. Хӑйсен инкекне вӗсем хӑйсен чӑтса ирттермелле. Тепӗр енчен тата вилнӗ ҫынна асӑннӑ каҫ макӑрма та хушман. Вӑл йӑлана ӗлӗкхи чӑвашсем юпа ҫинче ларни, тенӗ. Тӑванӗсем макӑрсан, вилнӗ ҫын та макӑрать, тенӗ. Ҫавӑнпа чӑваш ҫынни пуҫне чикнӗ те шӑпӑрт пулнӑ. Пӗлменни ӑна сисӗм-туйӑмсӑр ҫын теме пултарать.\n\nМикулая пытарнӑ чухне Идрис пӗтӗм халӑх илтмелле кӑшкӑрса макӑрчӗ тет. Тӗнчере пӗр вӑл ҫеҫ шелленӗ тейӗн мӗскӗн йӗкӗте.\n\n\n\nТахҫантанпах эпӗ тӗне кӗмен чӑвашсен ӑҫ-пуҫне (психологине) ӑнланса илме тӑрӑшаттӑм. Христос тӗнне йышӑнас мар тесе кӑна Тӑванкасси ҫыннисем икҫӗр ҫула яхӑн асап чӑтса пурӑннӑ. Мӗншӗн. Мӗне курса. Мӗн хӑратнӑ вӗсене ҫав териех. Мӗн панӑ вӗсене вӑй ҫавна тӳссе ирттерме. Мӗн хавхалантарса тӑнӑ. Хӑйсем тӗрӗс тунине ӗненни-и? Ачисем кӑмӑллӑ ӳснине курни-и? Тен, мӗне те пулин ӗненни тӗне кӗме чарнӑ вӗсене.\n\nВӗсем «ҫӗнтернӗ) - христиан тӗнне йышӑнман.\n\nТӑванкассине кайнӑ чухне мана тепӗр ыйту та интереслентернӗччӗ. Нумай асап тӳснӗ ҫын ялан тенӗ пек хаяр, кутӑн, кӗске турталлӑ пулать теҫҫӗ. Кунти ҫынсем - сакӑрвун тӑватӑ ҫулхи Улентей мучи, унӑн ашшӗ Ухваньтюк, Ухваньтюк ашшӗ Ситул тата ыттисем курман хӗн-хур тӗнчере те юлман пуль. Апла вӗсем пурте пурнӑҫ таптаса кайнӑ ҫынсем пулнӑ-ши. Кашни суярах - пин пайӗнчен пӗр пайӗ те пулин - чӑнни пур тенӗ. Эппин ҫак ҫӳлерех асӑннӑ «теорире» те кӑштах тӗрӗсси пур-тӑр. Ӑна эпӗ пуҫтах Идрис историйӗнче те туйса илнӗччӗ.\n\nТӑванкасси ҫыннисем ӗлӗк мӗнле пулнине хальхи стариксем ҫине пӑхса та чухлама пулать. Акӑ вӗсем, ялти хисеплӗ ватӑсем: Сидулов Улентей, Кузнецов Идрис, Улендеев Туктамӑш, Абдульменова Арихве, Аюгов Питтимӗр, Эндиаров Метер, Иеливанов Тимӗр, Сайдяшев Элентюк. (Ятсене Улендей, Медер, Элендюк тесе вуламалла. Ҫамрӑксем хӑйсем пӗлмен «Таната», «эпи карчӑк» сӑмахсене вырӑслатса «танатта», «эппи карчӑк» тесе вуланине эпӗ темиҫе те илтнӗ).\n\nУлентей мучи эп пынӑ чух пахчара тӑрмашатчӗ. Карта тулашӗнче пӗр кӗтӳ ача тӗмсӗлсе пӑхса тӑрать - ачин ачисем, вӗсен тусӗсем. Ячӗшӗн ҫум курӑксене таткаласан, старик вӑрӑм арки ҫине кишӗрпе ҫарӑк тултарчӗ те карта патне пырса тӑсрӗ. Ачасем пӗр самантра тасатрӗҫ ун кипке аркине...\n\nПӳртелле утнӑ чухне те Улентей мучи хыҫҫӑн чӑх-чӗп, йытӑпа кушак кӗпӗрленсе пычӗҫ. Ахӑртнех, ача-пӑчапа та, кайӑк-кӗшӗкпе те, ӳсен-тӑранпа та ватти пӗр чӗлхе тупма пӗлет пулас. Темӗн пӗрлештерсе тӑраканни пур вӗсене.\n\nПӳртре вӑл сӗтел патне пуканпа ларчӗ, мана хӑйне хирӗҫ лартрӗ. Кӳпшекрех питлӗ ҫирӗп ватӑ вӑл. Ҫаплах чӗрӗ пӑхкалать-ха. Иван Яковлевич Тванкасси шкулне пырса кайнине аса илет. Хура тумтирлӗ ҫӳллӗ старикчӗ, тет. Хӑй калаҫнӑ май йӑл та йӑл кулать, вӑтанса ӳсӗркелесе илет.\n\nПӗрерӗн-икшерӗн кӗре-кӗрех кӗҫ пӗр пӳрт тулли ача пуҫтарӑнчӗ.\n\nИдрис Искендерович Кузнецов вара йӑлтах урӑхла. Вӑл тӑр-пӗччен пурӑнать. Шухӑшлама пӗлекен ҫын. Екки кайнӑ чух калаҫма ӑста. Тепӗр чухне ыйтнине хирӗҫ пӗрер сӑмахӑн ҫеҫ хуравлать. Хура-шур нумай тӳснӗ. Тен, ун тӳпине ытлашширех те лекнӗ пуль. Анчах ҫынсене нимӗн те систермест. Виҫӗ вӑрҫӑ витӗр тухнӑ вӑл! Пӗрне-пӗри кӑмӑлласах тахҫанччен калаҫса лартӑмӑр эпир Идрис Искендеровичпа унӑн пӗчӗк пӳртӗнче, юлашки вӑрҫӑри ӗҫӗсемшӗн вӑл орден илнине мана хӑй мар, колхозри парти организацин секретарӗ Николай Иванович Кураков пӗлтерчӗ. Килӗнче калама ҫук пысӑк инкек пулнине те эпӗ Идрис Искендеровичран мар, ял ҫыннисенчен илтрӗм. Шӑкӑл-шӑкӑл пурӑннӑ карчӑкӗ кӗрхи йӗпе-сапара ял вӗҫӗнчи тарӑн ҫырана кайса вилнӗ-мӗн ун.\n\nИнкек - иккӗн, усал - улттӑн килет тет. Малюк аппа вилни ҫитмен, унӑн йӑмӑкӗ Матря Хӗрҫырминче путса вилнӗ. Унтан Малюкпа Матря йӑмӑкӗ Мерчук хӑйне хӑй пӗтернӗ.\n\nКу иккӗшӗ килти ҫынсем мар, ҫапах ҫывӑх тӑвансем-ҫке.\n\nПурнать халь старик пӗр-пӗччен, шухӑш шухӑшлать, пуҫламӑшӗ те, вӗҫӗ ун ҫук, пӗр чӑвашла кӗнекене ҫӗр те пӗрремӗш хут вулать, ман пек ӑнсӑртран пырса кӗнӗ ҫынпа калаҫать, район хаҫатне... статьясем ҫыркаласа ярать. Ҫапла, мӗн те пулин савӑнтарсан е тарӑхтарсан хаҫата ҫырать. Пурнӑҫран ним чухлӗ те сивӗнмен вӑл. Пурӑнса та йӑлӑхман. Тахҫан колхозра ветеринари фельдщерӗнче ӗҫленӗ. Хӑй ӑссӗн вӗреннипе. Халӗ пенсионер. Чӗрчунсене юратать. Хӑйсен лаши пирки вӑл мана поэма пек каласа пачӗ. Ҫынсемпе туслӑ.\n\nТен, ку ватӑсем совет ҫулӗсенче \"тӳрленнӗ\". Апла та пулӗ. Анчах пур енчен те мар пуль. Малтан та \"пӑсӑк\" этемсемех пулман-тӑр вӗсем.\n\nТӗне кӗме мӗнтен хӑранӑ-ши вӗсем тесе, эпӗ темиҫе ҫынпа та калаҫса пӑхрӑм. Пурнӑҫ курнисемпе. Акӑ вӗсен хуравӗсем.\n\n- Колхоза кӗме хӑраттӑмӑр-и? - ыйтрӗ манран лавкка хуралҫи Эптюш Велитович, вара хӑех хуравларӗ: - Хӑраттӑмӑр. Тӗне кӗме те ҫавӑн пек хӑранӑ.\n\n- Ухмах пулнӑ ҫав! - терӗ Йӑкӑш Имуллин. Хӑй вӑл «шыва кӗнӗ» ҫын. Вӑтам ҫулсенче. Вӑрҫӑран хӑрах урине ҫухатса таврӑннӑ. Сӑмахсене пат татса калаҫать.\n\n- Ытла ирӗксӗрлетчӗҫ те, ара... Мӗн кирлине ҫын хӑех ӑнланать... Ку Улентей мучи хуравӗ. Историре те ун пирки ҫакӑн пек каланӑ: «Самодержавие проводило политику насильственной русификации народов Поволжья». (\"История Чувашской АССР\" кӗнекерен). «Чуваши» кӗнекере патша правительстви вак халӑхсем тӗлӗшпе тытнӑ политикӑна тата кӗскереххӗн ӑнлантарса панӑ: «Насильственная русификация через православие»...\n\n«Русификация» сӑмаха В.Г. Егоров профессор словарӗнче «ирӗксӗрлесе вырӑслантарни (патша чухне вырӑнти нацисен культурине пусарса, вырӑс культурине (вырӑс чӗлхине, вырӑс тӗнне) сарса пыни», тесе куҫарнӑ.\n\nКунти чӑвашсем мӗншӗн тӗне кӗмесӗр юлнӑ тенине хирӗҫ шкул урамӗнчи карчӑксем мана кулкаласа ҫапла хуравларӗҫ:\n\n- Эпир вырӑссем хӑйсем те тӗне пӑрахасса кӗтсе пурӑннӑ, - терӗҫ.\n\nЧӑнах та ара. Халӗ ҫӗр ҫынран пӗри ачине тӗне кӗртет-и е ҫук-и: чӑрмавӗ те чӑрмав, тӑкакӗ те тӑкак. Ыттисем ачи ячӗсене хулара пулсан ЗАГСра, колхозра ял Советӗнче ҫыртараҫҫӗ. Тутарсен темле те, чӑвашсемпе вырӑссен ячӗсем те пӗр пек: Валерий, Светлана, Владимир... Тӗне кӗмен ятсене Тӑванкассинче халь никам та хумасть ӗнтӗ. Хуласенче ҫеҫ Нарсписем, Сетнерсем, Атнерсем тӗл пулкалаҫҫӗ. Чӑваш интеллегенчӗсен ачисем. Анчах ни Нарспийӗ, ни Сетнерӗ чӑвашла пӗлмеҫҫӗ. Ятсемсӗр пуҫне вӗсенче урӑх нимле «чӑвашлӑх» та ҫук.\n\nИртнӗ самана... Хальхи ҫамрӑксемшӗн вӑл япала юмахла ҫӗршыв пек туйӑнса тӑрать пулмалла. Ҫавӑнпа хӑш-пӗр йӗкӗтсем, йӑрӑраххисем, иртерех «ӗлкӗрнисем», вӑтам шкул пӗтернӗ-пӗтермен ӗлӗкхи пурнӑҫ ҫинчен эрешлӗ повеҫ-калавсем хывма тытӑнаҫҫӗ. Пӗлӳ «такмакӗ» хӑйсен - вырӑс авторӗсене вуласа тухнӑ ик-виҫӗ историллӗ роман. Вӗсенче хӑшӗнче те пулин чӑваша кӑтартнӑ пулсан, ҫамрӑк автор ӑна хут ҫине тумлатнӑ ҫу тумламӗ пек сарса ярса «пуянлатать». Чӑвашла вариант тӑвать. Тӗрлӗ кӗслеҫӗсем, юрӑҫӑсем, йывӑҫ ураллӑ «паттӑрсем» сике-сике тухаҫҫӗ вара. Ҫав сӑхӑ авторсенчен илтме пулать: пирӗн ахалех чӳк тума, киреметсем парне кӳме пӑрахнӑ иккен. Чӳксем, ӗлӗкхи уявсем, вӗсен шухӑшӗпе, чӑваш халӑхӗн уйрӑмлӑхне палӑртса тӑраҫҫӗ.\n\nПурнӑҫ националист пеккисем сӳпӗлтетнине те, сӳпӗлтисем ситрелнине те пӑхмасть, малаллах шӑвать. Юлашки хут аслӑ ырра хӑҫан асӑннине Тӑванкассинчи ватӑсем халь хӑйсем те астумаҫҫӗ. Ялти ачасем, шкула чупаканнисем, вӑл йӑласене пӗлме мар, сӑмахӗсене те илтмен.\n\nӖлӗкхи саманара халӑхпа халӑх хушши мар, пӑхса курӑнакан ялпа ял хушши те халӗ Шупашкарпа Владивосток хушшинчен инҫерех пулнӑ. Виҫӗ ҫухрӑм аяккарах мӗн пулнине пӗлмесӗр, кашни хӑйӗн «тӗнчипе» кӑна ҫӑрӑлса пурӑннӑ чухне ҫынсен ирӗксӗрех кам мӗн пӗлет - ҫавӑнпа ҫырлахма тивнӗ. Юрӑсем юрланӑ, вӑйӑсем вылянӑ. Кӗнчеле арланӑ, пир тӗртнӗ... Хӑйчикки тавра чыхӑна-чыхӑна ҫӑпата шаккаса ларнӑ май, ялти хыпар-хӑнарсене сӳтсе явнӑ. Эхтюк чӑххи автанла авӑтрӗ, ыррра мар пуль, тенӗ. Мӑхит ашшӗне киремет тытнӑ-мӗн - алли шыҫса тухнӑ, юмӑҫ карчӑк пӑру пусса чӳклеме хушать, тет...\n\nПӗр-пӗрин умӗнче Мӑххитсене шеллесе калаҫнӑ, ӗҫлемесӗр ирттерни хӑйне, выльӑх пуҫӗ чакни тепре, тенӗ. Ӑшӗнче хӑйсем савӑннӑ уншӑн. Ҫын ҫур утӑм - пӗр утӑм чакнӑ хушӑра, эпӗ пӑртак та пулин малалла кайӑп, тенӗ.\n\nНумай шыв юхнӑ унтанпа ҫут тӗнчере. Ҫын пурнӑҫне ҫӑмӑллатмалли машинӑсем, электричество, телефон, телеграф, самолет, кино, телевизор тата ытти пин тӗрлӗ япала шухӑшласа кӑларнӑ. Чи пахи вара - 1917 ҫулта Октябрь революцийӗ пулни, халӑхсем хушшинчи танмарлӑха пӗтерни. Ҫынсем халь ытларах та ытларах пӗр-пӗринпе хутшӑнаҫҫӗ. Чӑваш этемми мӑкшӑ, вырӑс тутар мӗнле пурӑннине курать. Мари ҫыннипе тутар, вырӑспа чӑваш пӗр заводра, пӗр стройкӑра ӑмӑртса ӗҫлеҫҫӗ. Вӗсене пӗр-пӗринчен уйрӑлса тӑраканнисем сахалланса, пӗтсе пыраҫҫӗ, лайӑххи, пӗрлештерекенни хутшӑннӑҫем хутшӑнать.\n\nЯлпа хула та тахҫанах икӗ полюс мар ӗнтӗ. Пенза облаҫӗнчипе Чӑваш Республикинчи колхозсен пурнӑҫӗ те нумай уйрӑм мар пуль.\n\nАчана чӑпӑл тунӑ шыва тӑкнӑ чух эпир ачине те кӑларса пӑрахмастпӑр-и? - теҫҫӗ пирӗн хӑш-пӗрисем. (Тахҫан эпӗ те ҫапла шухӑшлаттӑм). Вара чӑвашсен асран кайми вӑййисене аса илеҫҫӗ. Карталанса юрланисене вунӑ-вун икӗ ҫул ӗлӗкрех те курма пулатчӗ-ха. Халӗ ҫук ав. Такам чарнипе мар, хӑйсемех пӗтнӗ. Тӑванкассинче те юрламаҫҫӗ. Кашнин килӗнче радио пур. Телевизор нумай. Кино кӑтартаҫҫӗ - телевизорпа та, ялти клубра та. Филармони артисчӗсем килсе ҫӳреҫҫӗ. Чӑваш театрӗсем те манмаҫҫӗ вӗсене. Ҫавсене пӑрахса, урама тухса карталанса юрламалла-и? Вӑл вӑхӑтра телевизорпа пӗр-пӗр балет иртсе кайсан.!\n\nЧӑваш каччи халь вырӑс хӗрне илет. Чӑваш хӗрӗсем вырӑса качча тухаҫҫӗ. Вӑл тӗлӗшрен Тӑванкасси те ҫичӗ тинӗс уттинчен лармасть.\n\nТӗрлӗ наци чӗлхи халӑхсем хушшинче те чи нумая пыракан уйрӑмлӑх тенӗ. Тӑванкассинчи ватӑ ҫынсемех «войнара пултӑм», «Шемуршана кайса, хорошаях вӗренсе килчӗ», - тесе калаҫаҫҫӗ. Сӑмах май каласан, чӑваш писателӗсен кӗнекисенчи ҫынсем ҫех чӑвашла тӗрӗс калаҫаҫҫӗ пулас, ыттисен, хӑшӗ сахалтарах, хӑшӗ нумайрах, анчах пурин чӗлхинче тенӗ пекех вырӑсла сӑмахсем илтӗнеҫҫӗ.\n\n\n\nПӗррехинче манӑн тӑван республикӑн кӑнтӑр пайӗнче пӗр пуян колхозра темиҫе ҫӗр выртмалла пулчӗ. Кунта колхозӗ ҫеҫ мар, ҫыннисем те ытлӑ-ҫитлӗ пурӑнатчӗҫ, пӳртсем кантур пек ларатчӗҫ. (Пӗр вун пилӗк-вун ултӑ ҫул ӗлӗкрех урӑхла сӑнсем те курма пулатчӗ-ха: ҫыннисем пуянччӗ - колхозӗ чухӑн е колхозӗ пуянччӗ - колхозникӗсем юрлӑччӗ). Эп хваттере кӗнӗ ҫынсен пӳрчӗ, крыльци, сӑрлӑ хапхи, карти-хури - ӗлӗкхи ҫӗрме пуянсен те пулман пуль. Анчахрах ҫеҫ ҫӗр типсе ҫитнӗччӗ те, мана сӗтлӗ пултӑран яшки пӗҫерсе пачӗҫ. Витаминлӑ ҫимӗҫ тесе, савӑнсах ҫирӗмӗр. Кӑнтӑрла ҫав яшкана ӑшӑтса пачӗҫ. Юрать, терӗм. Каҫхине те сӗтлӗ пултӑран яшки пӗҫерме тытӑнчӗҫ. Пырать ара. Май килнӗ чух ытларах витаминлӑ апат ҫисе юлас. Каҫхи хырӑм вӑл тиркешессе те питех тиркешмест.\n\nКӗтӳ кӗртрӗҫ те, пирӗн хуҫасем патне (вӗсем виҫҫӗн пурӑнаҫҫӗ) путеклӗ ҫич-сакӑр сурӑх, ӗне, пушмак пӑру пӑрӑнса юлчӗҫ. Унтан икӗ пуслӑх хур какӑлтатса таврӑнчӗ. Шултӑра кӑвакалсем, апатшӑн кастарса, ҫенӗк алӑкӗ умӗнче нартлатса тӑратчӗҫ.\n\nТепӗр кун ирхине йӑлтах ҫӗнӗрен пуҫланса кайрӗ. Ирхи апат та, кӑнтӑрлахи те, каҫхи те... сӗтлӗ пултӑран яшки ҫирӗмӗр.\n\nВиҫҫӗмӗш кунне те ҫавах. Эпӗ какай пирки сӑмах хускатсан, кил хуҫи арӑмӗ манпа юнашар ларсах калаҫрӗ.\n\n- И-и, ан та кала, ачам. Какайне курманни ӗнтӗ... Килте кӑсӑя пӗҫҫи пек татӑк тупсан та вӑрӑ пулӑп.\n\n- Кӗркунне выльӑх пусаймарӑр пуль ҫав...\n\n- Аре, ман ун пек калан. Сакӑр сурӑх, пӗр сысна, чӑх-чӗп, хур-кӑвакал чылай пусрӑмӑр. Вун икӗ рас хӑна кӗртсе пӑх-ха. Хӗл хырӑмӗ те пысӑк...\n\nКил хуҫи арӑмӗн сӑмахӗ мӗне пӗлтернине эпӗ каярахпа тин ӑнланса илтӗм. Ун чухне ӑшра темле ырӑ мар туйӑм ҫеҫ юлчӗ. Ӗненесех те килмерӗ. Мӗнле вӑл ун чухлӗ какай (эпӗ шутланӑ тӑрӑх, кил хуҫисен сахалтан та 250-300 килограмм таса аш пулнӑ) ҫӑва тухма та ҫитмен. Е ҫӑкӑр вырӑнне аш ҫиеҫҫӗ-и вӗсем?\n\nАнчах тата пӑртак куркаласа ҫӳресен, хамӑр енчи чӑвашсене аса илсен, ҫак колхозницӑн сӑмахне ӑнлантӑм та, ӗненессе те ӗнентӗм. Тӗрӗсех каларӗ-мӗн вӑл.\n\nТӑванкасси ялне пӗрремӗш хут эпӗ 1969 ҫулхи июлӗн варринче пытӑм. Хваттер хуҫисем, тӑлӑх хӗрарӑмпа унӑн ҫитӗннӗ хӗрӗ, ҫӗр улми пӗҫерсе пачӗҫ. (Ҫӗр улмине кунта ҫӗрми теҫҫӗ-мӗн. Пӑва тӑрӑхӗнчи чӑвашсем картахви теҫҫӗ. Пирӗн хамӑрӑн улма текелеҫҫӗ. Таҫта паранкӑ текенсем те пур ав. Тата темле-темле калакансем те пур пулас. Анчах пурте пӗр япаланах - нимпе те улӑштарма ҫук вилӗмсӗр ҫӗр улминех пӗлтереҫҫӗ). Выльӑх апачӗ тума кансӗр тесе, кил хуҫисем ӗне усрамаҫҫӗ. Кӳршӗрен уҫланӑ уйран илсе пычӗҫ, амӑшӗ иртнӗ уйӑхра туянӑ ҫӑкӑра ваткаласа хучӗ. (Лавккара ҫӑкӑр сайра хутра ҫеҫ сутнипе пӗр турттарса килнӗ пек чухне кунта ҫителӗклех илсе хураҫҫӗ). Эпӗ Шупашкар кучченеҫне кӑлартӑм - сырпа кӑлпасси. Чип-чиперех апатлантӑмӑр. Ҫирӗм пилӗк ҫухрӑм утнӑ хыҫҫӑн мана уйранӗ те симпыл пекех туйӑнчӗ, ҫӑкӑрӗ те килӗшрӗ. Ҫӗр улми пирки калама та кирлӗ мар, чӑваш унсӑр пурӑнма та пултараймасть, ҫӗр улми ҫеҫ нихҫан та йӑлӑхтармасть.\n\nВулакан хӑех сисет пуль ӗнтӗ, эпир вӑл кун каҫхине те, тепӗр кун ирхине те умран юличчен ҫӗр улми ҫирӗмӗр. Виҫҫӗмӗш кунне темӗнле хӗрача сӗт пырса пачӗ те, каснӑ салма яшки пӗҫерчӗҫ. Вара каллех ҫӗр улми пуҫланса кайрӗ...\n\nПиллӗкмӗш кунне кил хуҫисенчен ыйтрӑм:\n\n- Кӗркунне сирӗн аш нумайччӗ пулмалла...\n\n- Нумайччӗ, ӑҫтан пӗлен? - терӗ амӑшӗ.\n\n- Ара, халь пурте выльӑх усраҫҫӗ те.\n\n- Чӑнах нумайччӗ. Икӗ сурӑх, ҫирӗм икӗ хур, чӑх-чӗп пусрӑмӑр.\n\n- Хӑнасем чылай пулнӑ пуль ҫав ӗнтӗ.\n\n- Ара... пулнӑ ҫав ӗнтӗ. Хурӑнташсем таҫта та пур пирӗн. Ӗҫкӗ-ҫикӗре унсӑр юрамасть...\n\n- Ашӗ ав хӑвӑра валли те юлман.\n\n- Юлма терӗ!.. Мӗн-и... ҫӗрми ҫакса ярар-и?\n\n- Пырать пуль ҫаксан.\n\nМана мӗн. Эпӗ урӑх ҫынсем патӗнче те ҫикелӗп. Лавккара та консервӑ пур. Ӗҫӗ те ман урам тӑрӑх сулланса ҫӳресси ҫеҫ. Хӗрачине йывӑр тивет. Кунӗ-кунӗпе чӗкӗнтӗр те куккурус ҫумлаҫҫӗ вӗсем. Тепӗр чухне васканипе ирхине те ҫимесӗрех тухса чупать. Амӑшӗ ҫӑмарта пӗҫерсе паркаласа ярать те, ҫӑмарта апат-им вӑл? Пӗр-ик кун ҫинӗ хыҫҫӑн курас та килмест ӑна. Ҫӗр улми тӗшне те тӑмасть. Ҫавӑнпа Люба ӗҫрен йӑлт халран кайса таврӑнать, каҫхи апат та ҫиеймест. Кӑнтӑрла ӗҫре куҫ хурала-хурала килет тет. Сӗт-турӑх, аш-пӑш, ҫу кирлӗ те ӑна - ҫук ав, хура кӗркуннепе хӗлле ӗҫкӗ-ҫикӗре тасатса кайнӑ. Халӗ те хӗллене хатӗрленеҫҫӗ вӗсем. Хӗрӗ ӗҫшӗн укҫа, сахӑр, чӗкӗнтӗр илет. Сахӑрӗпе чӗкӗнтӗрӗ ӑҫта-ӑҫта кайнине пурте пӗлетпӗр. Амӑшӗ пенсионер. Вӑл иртен пуҫласа каҫчен хур-кӑвакалсемпе тӑрмашать: апат парать, курӑк ҫинче кӗтсе ҫӳрет, ҫырма хӗррине хӑваласа анать, хурчкасенчен сыхлать... Кӗркунне каллех ҫирӗм-вӑтӑр хур, темиҫе кӑвакал, чӑх-чӗп, ик-виҫӗ сурӑх пусаҫҫӗ. Ытти юр-варпа пӗрле вӑл какай пысӑкрах ҫемьене пӗр ҫул ҫиме ҫитӗччӗ. Кусем те сая ямаҫҫӗ ӑна. Ӗҫкӗ-ҫикӗре, уявсенче хӑнасем кӳртеҫҫӗ. Ҫынтан юлма ырӑ мар. Ҫынсемпе хутшӑнайми пулнӑ тейӗҫ. Тӑван-хурӑнташ, ял-йыш ҫирӗмӗн-вӑтӑрӑн пуҫтарӑнать. Туй-мӗн пулсан, унран ик-виҫӗ хут ытла. Ун чухлӗ ҫынна пӗрре хӑна кӗртме темиҫе хур кирлӗ. Ун ҫумне ытти апат-ҫимӗҫне хуш. Тата ӗҫмине. Тата мар-ха, чи малтан ӑна хатӗрле. Ӗҫми пулмасан, калаҫу та ӑнмасть. Никам пымасть сан патна. Пӗтӗм сӑмах-юмахӑн, ӗҫӗн, уявӑн пуҫламӑшӗ те, пӗтмӗшӗ те ҫавӑ******).\n\nӐна янтӑла. (Вӑл мӗн-мӗн иккенне пурте пӗлетпӗр - ханша вӑл), тӗрлӗ ҫӗрте ку пакӑҫа ачашласа темле те ят парса пӗтернӗ - аншарли те вӑл, сӑмакун та, лапсӑркки те, ҫӑмламасси те, кӑмӑшка та тата ытти те, анчах хӑй пурте пӗр пулӑ пуҫех, ҫав пӗр йӗрӗнчӗк шӗвекех пӗлтерет. Каҫарӑр та, унӑн «техники» те пӗр вырӑнта тӑмасть-мӗн. Ӗлӗкрех ханша ӗҫетчӗҫ. Халӗ унпа ҫеҫ ҫырлахмаҫҫӗ, ӑна икӗ хут юхтарма вӗренсе ҫитнӗ. Кӑвар ҫине чаш! сапсан, кӗрп! ҫеҫ хыпса илмелле юхтарма пӗлеҫҫӗ. Ҫавна кӑшт сыпсанах этем кӗрхи шӑна пек пулса каять).\n\nКу «сӑмакун-перекенӗ» пулчӗ. Унтан лавккаран туянаҫҫӗ - ҫуттине, хӗрлине. Сӑра тӑваҫҫӗ те ҫапла юрласа ӗҫеҫҫӗ:\n\nХӗрӗх пичке еннелле\n\nЧунӑм туртать.\n\nЭп ӗҫесшӗн каламасп,\n\nАхаль калап.\n\nПӗрин патне кӗрсе тухаҫҫӗ, теприн патне. Хурӑнташ-тӑван, тус-йыш, пӗлӗш-тантӑш, кӳршӗ-аршӑ - ялӗпе. Ӗҫкӗ-ҫикӗ эрнене те, ик эрнене те, пӗр уйӑха та тӑсӑлать...\n\nУявсем пӗте пуҫласан, урӑх сӑлтавсем тупӑнаҫҫӗ: ача ятне хуни унта, ваттисене асӑнни, мӗн те пулин туянни... Укҫа нумай илсен савӑннипе ӗҫеҫҫӗ, сахал илсен хурланнипе...\n\nҪемҫерех кӑмӑллисем, хавшаккисем е юнра пуррисем ӗҫке ерсех каяҫӗ вара. Куна эпӗ пурте Тӑванкассинче пулса иртет тесе каламастӑп, тӗрлӗ ҫӗрте курнисене пӗтӗҫтерсе калатӑп. Ӗҫке ернисене асӑнтӑмӑр пулсан Тӑванкассинче те пур вӗсем - арҫынсем те, хӗрарӑмсем те.\n\nӐҫта ӗҫкӗ - унта ятлаҫу, ҫапӑҫу. Леш пуҫтах Ильдиаров Идрис ӳсӗрпе пӗр хӗрарӑмӑн тутине ҫыртса татса илнӗ пулнӑ. Татса илчӗ те урайне лач сурса пӑрахрӗ тет. Хӗрарӑмӗ мӑшкӑла чӑтса пурӑннӑ-пурӑннӑ та ҫакӑнса вилнӗ.\n\nТӑванкассин икӗ масар. Пӗри кивви, 10-15 ҫул каялла пӑрахӑҫа тухни. Ялтан вӑл самаях инҫетре, Сатуркка ҫырми хӗрринче. Йывӑҫ юписем ҫине ҫын кӗлеткисем каскаласа тунӑ, хушамачӗсене чӗркелесе ҫырнӑ, хӑҫан вилнине палӑртнӑ. Хамӑр ҫӑвасем ҫине мӗнлине асӑрхаман эп. Кунта, ҫын сӑнне тӗпӗ енне туса, йывӑҫ юпасем кашнинчех лартнӑ. Хӑш-пӗр тӑприне арман чулӗпе хупланӑ. Ятарласа тутарнӑ чул юпасем те курӑнкалаҫҫӗ. Анчах пурне те чылайранпа ҫын тирпейлесе тӑманни сисӗнет. Карти те ҫук. Те ватса пӗтернӗ, те пулман та.\n\nАрҫынсене ҫав тери чаплӑн пытаратчӗҫ тет тӗне кӗмен чӑвашсем. Мала ярса кӳлнӗ урапа-ҫунасемпе, шур пир тӑрӑхӗнчен хунӑ тилхепепе. Малти лаша ҫине вилнӗ ҫыннӑн ывӑлӗ утланнӑ. Пирне кайран шӑтӑк алтакансене пайласа панӑ. Масар ҫинчен таврӑннӑ чухне каялла ҫаврӑнса пӑхман, ҫӗнӗ виле тухасран хӑранӑ.\n\nТуй таврашӗнчи пекех, ҫынна пытарнӑ чухнехи йӑла-йӗркесене пӗлсе те, ҫырса та пӗтерес ҫук - ҫав тери кӑткӑс вӑл.\n\nҪӗнӗ масарӗ ял ҫывӑхӗнчех. Йӗри-тавра карта тытнӑ. Йывӑҫсем кӑнч-канч чӗрткеленӗ. Кунта халь кама кирлӗ - ҫавна пытараҫҫӗ: тӗне кӗнине те, кӗменнине те, пӳкле вилӗмпе вилнисем таранчченех... Ку ҫӑва тӑванкассисемшӗн ҫӗнӗ япала. Икӗ ӗмӗр тӑршшӗнче хӑйсен йӑлинчен пӗр утӑм чакман чӑвашсем совет ҫулӗнчи ҫирӗм-вӑтӑр ҫул хушшинче паллайми улшӑнса кайнӑ. Чунӗсем ҫемҫелнӗ вӗсен. Куҫӗсем уҫӑлнӑ. Мӑшкӑл тӳссе пурӑннӑ халӑх ыттисемпе пӗр тан халӑх пулса тӑнӑ-ҫке.\n\nЛавкка хуралҫи Эптюш Пикмендеев ӑнсӑртран персе янӑ сӑмах ман чӗрене ҫӗҫӗ пек касса кайрӗ. Пӗлтӗрпе кӑҫал вилнӗ ҫынсене аса илкелесе ларчӗ-ларчӗ те вӑл хӑй те шалтах тӗлӗнчӗ.\n\n- Э, чимӗр-ха, ҫӗнӗ масар ҫинче пирӗн путлӗ вилӗмпе вилнисем ҫук та мар-и?! - терӗ.\n\nҪапла, аҫа ҫапнӑ евӗрлех туйӑнчӗҫ пулсан та, ку сӑмахсене илтме хатӗрленсе ҫитнӗччӗ эпӗ. Ара, кирек кам ҫинчен калаҫсан та сӑмах пӗр евӗр вӗҫлене пуҫланӑччӗ: шыва сиксе вилнӗ, ҫакӑнса вилнӗ...\n\nЫтла хытӑ тимленипеа хӑратас мар тесе Эптюш Велитовичпа ку ыйтупа урӑх калаҫмарӑм эп. Ыттине урӑх ҫынсенчен ыйтса пӗлӗп терӗм. Пикмендеевӗпех те пӗр-ик кунтан тепре сӑмах хускатма пулать. Ӑнсӑртран пек. Халӗ мана историллӗ пӗр факт кӑсӑклантарчӗ. 1678 ҫулхи пӗр документра Парашев Турасай патӗнче тарҫӑра пурӑннӑ Кинбяхтов Севей хуҫа арӑмӗсенчен пӗринпе, Ӑслӑпике ятлипе, сӑмах пӗтерсе тухса тарни ҫинчен каланӑ. Кайран иккӗшне те тытса хупса лартнӑ иккен. Те икӗ арӑм пулнӑ вара Турасай хуҫан, те ытларах та, ун пирки шарламан документра. \"...подговорил одну из жен Турасая\", тенӗ кӑна. Хальхи ҫынсем астӑвасса ик-виҫӗ арӑмпа пурӑнакансем пулман-им Тӑванкассинче?\n\n- Пулнӑ, - терӗ Имуллин салтакла кӗскен. - Упаҫ. Ҫирӗм темиҫемӗш ҫулсенче. Икӗ арӑмпа пурӑнатчӗ.\n\n- Вара... ӑҫта кайса кӗчӗ вӑл?\n\n- Пӗр арӑмӗпе калаҫса татӑлнӑ та - вилчӗҫ. Пусӑнса.\n\nКу ҫитменччӗ тата.\n\n- Ҫемйисем сывах пуль.\n\n- Ывӑлӗ вилчӗ. Ҫакӑнса. Пӗр виҫӗ-тӑватӑ ҫул каялла...\n\nХӑшӗ-пӗри вилӗме ним вырӑнне те хумасть иккен кунта. Хӑнана кайнӑ пек ҫеҫ шутлаҫҫӗ. Юманов Пикмӑрса, сӑмахран. Ҫӑматӑ пусаканскер. Ӗҫчен ҫынччӗ теҫҫӗ. Тӑванӗ-хурӑнташӗсене курса ҫаврӑнчӗ тет те - ҫакӑнса вилнӗ.\n\n- «Ӗнтӗ пурӑнса ҫитӗ», - терӗ тет.\n\nЮлашки ҫулсенче кӑна Тӑванкассинче 34 ҫын ҫапла хӑйсене хӑйсем пӗтернӗ. Вӑл шутра икӗ ача (мӑннисене курса ҫакланса пӑхнӑ та вӗҫерӗнеймен).\n\nҪав япаласене асӑрхамӑр: пурӑнни, айӑп тума пулӑшни пекех, хӑй те преступлени. Халех ялтипе районти пур организацисене ура ҫине тӑратса, халӑхпа калаҫмалла, килӗрен киле ҫӳремелле, ӑнлантармалла. «Симӗс ҫӗлене» пӗтерни те халӑха нумай енчен ҫӑмӑллӑх кӳрӗччӗ...\n\nКу - урӑх ҫӗрте калаҫмалли сӑмах пултӑр. Хальлӗхе мана ку ыйту наука енӗпе ҫеҫ интереслентерет. Мӗншӗн пӗтет халӑх. Мӗн хирет ӑна мур хирнӗ пек. Ханша-и? Тӗрӗс, вӑл та пулӗ. Тата мӗскер. Тен, йӑх хавшани.\n\nПӗр очеркра ҫырнӑччӗ эпӗ: тӗне кӗмен чӑвашсем хӑйсене ҫеҫ чӑвашсем тенӗ, ыттисем вӗсемшӗн кӗрешӗнсем. Урӑхла каласан, «уйрӑлнисем», «вырӑсланнисем».\n\nПиччӗшӗпе шӑллӗ пулччӑр. Пӗри тӗне кӗнӗ тейӗпӗр, тепри ҫаплипех юлнӑ. Малашне вӗсем хутшӑнма пӑрахнӑ.\n\n«Чӑвашсемпе» кӗрешӗнсем те ҫавах - пӗр-пӗринпе хутшӑнман. Хӗр парса илесси пирки калаҫу та пулма пултарайман. «Чӑвашсем» «чӑвашсене» кӑна илнӗ.\n\nМалтанах аптраман-ха вӗсем. Кашни ялтах тӗне кӗменнисем пулнӑ. Унтан хӗсӗне пуҫланӑ вӗсен «тӗнчи». Ял-ялӗпе пӗр ҫын та юлман вара «чӑвашра». Чи ҫывӑхри «тӑвансем» ҫирӗм пилӗк ҫухрӑмри Виҫпӳртре пурӑннӑ. Вӗсем те пулин ҫур ял ҫеҫ. Унтан - чӗрӗк ял. Юлашкинчен вунӑ кил. Чи ҫирӗпписем. Таҫта аякра та «чӑвашсем» пурри ҫинчен илтӗнкеленӗ те, ӗлӗкхи саманара хӑранӑ инҫе ҫула тухса ҫӳреме.\n\nҪапла вара хӑтана та хӑнана ҫӳремелли ҫул пӗрре тӑрса юлнӑ: Тӑванкассинчен Виҫпӳрте, Виҫпӳртрен Тӑванкассине. Хӗр панӑ та хӗр илнӗ... Пӗр аллӑ-утмӑл ҫул хушшинче пурте пӗр-пӗринпе хурӑнташланса пӗтнӗ.\n\nПурнӑҫ малаллах шунӑ. Татах ҫамрӑксем ҫитӗннӗ. Кусемпе мӗн тумалла ӗнтӗ.\n\nМалтан ют ҫынсемпе пӗрлешнӗ-ха. Халӗ ак аяккарахри тӑвансене шыра пуҫланӑ. Виҫ-тӑват хурӑн тӑрринчисене. Кӑшт ҫывӑхраххисене. Вара тӑван юнӗпе тӑван юнӗ хутӑшса кайнӑ. Чӗрчун ун пек чухне ассиленет. Этем йӑхӗ начарланса пӗтме тытӑнать, тет медицина.\n\nОктябрь революцийӗ ҫеҫ Тӑванкасси халӑхне татӑк ҫултан аслӑ ҫул ҫине кӑларнӑ. Ҫамрӑксем халь кама саваҫҫӗ - \"кӗрешӗн\"-и вӑл, урӑх халӑх ҫынни-и - ҫавна илеҫҫӗ, ҫавна каяҫҫӗ.\n\nЭпӗ Тӑванкасси урамӗнче вылякан ачасене сӑнаса ҫӳрерӗм. Парка вӗсем, хӑюллӑ, уҫӑ кӑмӑллӑ, савӑнӑҫлӑ - пулас уй-хир хуҫисем, рабочисем, летчиксем... Хур кӗтӗвӗсене астунӑ, шӑллӗ-йӑмӑкӗсене пӑхнӑ хушӑрах вӗсем велосипедпа та ярӑнма ӗлкӗреҫҫӗ, волейболла-футболла та перкелешсе илеҫҫӗ.\n\n\"Пирӗн, тӗне кӗмен чӑвашсен, тӗн ҫук, кӗнекесем ҫук, пур пеккисем пире валли мар, кӗрешӗнсем валли\", тесе ӳпкелешнӗ ӗлӗк Тӑванкасси ҫыннисем. Ун чухне миҫе ӑслӑ ҫын ниҫта палӑрмасӑр хӑрса ларнӑ пуль! Халӗ Тӑванкассинче пӗр ача вӗренмесӗр тӑрса юлмасть. Хӑйсен ялӗнче пуҫламӑш шкул, пӗр километрти ялта вӑтам шкул. Таврари хуласенче мӗн чухлӗ ҫамрӑк вӗренет тата. Эпӗ вӗсен пулас профессийӗсене шутласа кӑларма хӑтлантӑм та - шутласа пӗтереймерӗм. Юрӑҫӑ та, тухтӑр та, офицер те - такам та пулать. Вӗсем пӗтӗм ҫӗршыв интересӗпе пурӑнаҫҫӗ, аякрине кураҫҫӗ, тата та ҫутӑрах малашлӑх пирки ӗмӗтленеҫҫӗ. Тӗттӗм кӗтесре ҫӑрӑлса ларса, эрни-эрнипе эрех-ханша пехлеме-и? Э, ҫук, улталаймӑн халь ҫамрӑксене.\n\nЧи йывӑрри вӑл - этем ӑс-тӑнне ҫӗнетсе улӑштарасси. Темиҫе ӗмӗр хушши лайӑх тесе шутланнӑ йӑла-йӗркесем пирӗн саманара юрӑхсӑра тухрӗҫ. Тӗне кӗмен чӑвашсене ӗлӗк нуша пӗрлештерсе тӑнӑ. Кирек мӗн сиксе тухсан та, ял шӑпи пирки шухӑшласа, пӗрне-пӗри хӳтӗлеме тивнӗ. Усал ӗҫсене пытарнӑ вӗсем, тӗрӗссине суя тенӗ. Ҫын вӗлерекенпе тӳрӗ ҫын пӗр кӗрекере ларнӑ. Ҫамрӑксен куҫӗ умӗнче вӗсен хак пӗр пулнӑ...\n\nЧирлӗ ҫын пирки усал шухӑшлама ырӑ мар пулсан та, Идрис пирки эпӗ: пурнӑҫ шайлашуне пӑсакансене ҫынсем мар-тӑк, ҫутҫанталӑк та пулин тавӑрать-тавӑратех-мӗн, тесе шухӑшласа илнӗччӗ - тӳрлетрӗҫ мана. «Хамӑр ял» пулнӑшӑн кӑна пӗрне-пӗри хӳтӗлени тӗрес мар терӗҫӗ Пуринчен ытла ҫамрӑксем хирӗҫлеҫҫӗ-мӗн ӑнаӗ Ильдиаров Идриса тӗрмене хуптарнӑ пулнӑ вӗсем. Нумай ҫулах мар та, хуптарнӑ ҫапах. Кунта срокӗ мар, принципӗ паха. Ӗмӗрхи «триадӑна» каласа ларакансемех, курман, илтмен, пӗлместӗп текенсемех, урӑхла калаҫа пуҫланӑ. Куртӑмӑр, тенӗ. Ашкӑнать, чармалла ӑна, тенӗ.\n\nАрӑмне вӗлернӗ Хамит те тӗрмене лекнӗ...\n\n\n\n* Н.И. Ильминский патне янӑ ҫыру. (А.И. Яковлев профессорӑн «Иван Яковлевич Яковлев» 1848-1939» ятлӑ кӗнекин иккӗмӗш кӑларӑмӗ тӑрӑхӗ Чӑваш патшалӑх издательстви, Шупашкар, 1958 ҫ.)\n\n** Христиансем пулайман ҫав вӗсем. Хв.У.\n\n*** Акӑ ӑҫтан вӑл ялти тутар ячӗсем! Хв.У.\n\n**** И.Я. Яковлев яла час-часах килсе ҫӳренӗ. Килмессерен Нямат Лисков патне хваттере чарӑннӑ. Шыва кӗртнӗ чух ӑна тытнӑ май, унпа туслӑ пулнӑ», – тесе ҫырать Тӑванкасси историне тӗпчекен журналисчӗ.\n\n***** И. Кузнецовӑн \"Очерки по истории чувашского крестьянства\" кӗнекинчен. Чӑваш патшалӑх кӗнеке издательстви. Шупашкар, 1957 ҫ.\n\n****** Ку сыпӑка 1969 ҫулта ҫырнӑ. Авт.\n\n\n\nРедакцирен: текста улӑштармасӑр вырнаҫтарнӑ; электронлӑ варианта Times New Roman Chuv шрифтпа наборланӑран, ӑна курӑмлама юсанӑ чухне кӑлтӑксем юлма пултарнӑ, вӗсемшӗн редакци каҫару ыйтать (курнисене юсанӑ).\n\nСӑнсем ҫинче: «Ҫунман» алҫырусем; Хв. Уярпа А. Медведев; Хв. Уярпа В. Алексин журналист калаҫать; Писатель И.Н. Ульянов ячӗллӗ Чӑваш патшалӑх университечӗн студенчӗсемпе; Хӗветӗр Уяр.",
        "Аван-и!!!\n\nЯндекс.Куҫарушӑн кама-кама та тав туса пӗтерейменни те халӗ те тӗплӗн пӗлейместӗп! Яндексра ку енӗпе те пит конкретлӑ ӗҫ-пулӑм пулса пынишӗн чӑннипех хӗпӗртемелле. Шухӑшӑма ҫирӗплетме пӗр кӗске текст кӑна илсе кӑтартатӑп. Чи малтан — яндекс чӑвашла куҫарни пулӗ (чарӑну паллисене те ҫаплах, тӗкӗнмесӗр хӑварнӑ унта), малалла ҫав текстӑн — вырӑсла оригиналӗ, кайран — хамӑр кӑштах юсанӑ вариант.\n\nПуйӑс купинче пӗр ватӑ раввин пырать. Ҫӳлти ҫӳлӗк ҫине ҫамрӑк ҫын вырнаҫрӗ. Ҫывӑрма выртсан ыйтать:\n\n-. Миҫе сехет иккенне каламастӑр-и эсир?\n\nРаввин пӗр сӑмах каламасӑрах стена еннелле ҫаврӑнса ҫывӑрса каять.\n\nИрхине поезд Харьков патне пырать. Пассажирсем иккӗшӗ те тухма хатӗрленеҫҫӗ. Раввин хӑйӗн сехечӗ ҫине пӑхать те калать::\n\n-. Ҫамрӑк ҫын, эсир миҫемӗш сехет ҫинчен ыйтрӑр. Ҫапла, халӗ вуннӑмӗш ҫурри.\n\n- Мӗнех вара. эсир ӗнер чӗнмерӗр-и?\n\n-. Куратӑр-и, эпӗ сире ответ панӑ пулсан, эсир эпӗ ӑҫта каяссине ыйтнӑ пулӑттӑр. Эпӗ Харьковра тесе каланӑ пулӑттӑм. Эсир те Харьковӑна каятӑр, тенӗ пулӑттӑр. Ҫӗр каҫма та вырӑн ҫук сирӗн. Эпӗ, ырӑ ҫын пулнӑ май, сире хам пата чӗнӗттӗм. Манӑн хӗр пур. Эсир ӑна илӗртнӗ пулӑттӑр, вара сирӗн ӑна качча илмелле пулнӑ пулӗччӗ.\n\n- Ну, мӗнех вара ку?\n\nЭпӗ вара: мӗншӗн-ха мана сехетсӗр кӗрӳшӗ? - тесе шухӑшласа илтӗм.\n\nЯндекс ҫапла хӑйӗн миллионшар сӑмахлӑ алтӑрне чӳхентерсе-шыраса тӗрӗсех, пурне те ӑнланмалла текст калӑплать.\n\nМалалла вырӑсла пичетленнӗ оригинал-варианчӗ:\n\nВ купе поезда едет пожилой раввин. На верхней полке устроился молодой человек. Ложась спать, он спрашивает:\n\n-.  Вы не скажите, который час?\n\nРаввин, не говоря ни слова, поворачивается к стене  и засыпает.\n\nУтром поезд подходит к Харькову. Оба пассажира готовятся к выходу. Раввин смотрит на свои часы и говорит:\n\n-.  Молодой человек, вы спрашивали, который час. Так вот, сейчас половина десятого.\n\n-  Что же. вы вчера промолчали?\n\n-. Видите ли, если бы я вам ответил, вы бы спросили, куда я еду. Я бы ответил, что в Харьков. Вы бы сказали, что тоже едете в Харьков. И что вам негде переночевать. Я, как добрый человек, пригласил бы вас к себе. А у меня дочь на выданье. Вы бы  ее наверняка соблазнили, и вам пришлось бы на ней жениться.\n\n- Ну, и что же из этого ?\n\nВот я и подумал : зачем мне зять без часов?\n\nХалӗ тата кӑштах эпир юсанӑ-тӗрӗсленӗ чӑвашла иккӗмӗш вариант. Хӑш-пӗр чӑваш интеллигенчӗ тӳрлеткеленисене йышӑнмасан та пултарать. Анчах та хамӑрӑн чӗре варринче йӗрмӗшекен чӑваш чӗлхи, текст  ҫӑмӑлраххӑн вулантӑр тесессӗн, ҫапла тумах хистет пулӗ. Кунта нимӗнле иккӗлле калани-куҫарни те ҫук.\n\nПуйӑсри  купере пӗр ватӑ раввин ларса пырать. Ҫӳлти ҫӳлӗк ҫине ҫамрӑк ҫын вырнаҫать. Ҫывӑрма выртас умӗн вӑл ҫапларах ыйтать:\n\n-  Халӗ мӗн вӑхӑт (е Миҫе сехет?)? Калаймастӑр-ши эсир?\n\nРаввин пӗр сӑмах каламасӑрах стена еннелле ҫаврӑнса выртать те ҫывӑрса каять.\n\nИрхине поезд Харькова ҫитсе чарӑнать. Хайхи пассажирсем иккӗшӗ те тухма хатӗрленеҫҫӗ. Раввин хӑйӗн сехечӗ ҫине пӑхса илет те ҫапларах калать:\n\n- Ҫамрӑк ҫыннӑм, эсир вӑхӑт миҫе сехет пулнине ыйтнӑччӗ. Ҫапла, халӗ вун(ӑ) сехет ҫурӑ.\n\n- Мӗншӗн вара эсир ӗнер нимӗн те чӗнмерӗр?\n\n- Пӗлетӗр-и, эпӗ сире ӗнер ответ панӑ пулсассӑн, эсир эпӗ ӑҫта каяссине ыйтнӑ пулӑттӑр. Эпӗ Харькова, - тесе каланӑ пулӑттӑм. Эсир те Харьковах каятӑр, - тенӗ пулӑттӑр. Тата манӑн ҫӗр каҫма та вырӑн ҫук тенӗ пулӑттӑр эсир. Эпӗ хам, ырӑ ҫын пулнӑ май, сире пирӗн пата чӗннӗ пулӑттӑм. Манӑн хӗр пур. Эсир ӑна илӗртнӗ пулӑттӑр, вара сирӗн ӑна качча илмелле пулнӑ пулӗччӗ.\n\n- Ну, мӗнех  вара?\n\nЭпӗ вара, кирлех-ши мана сехетсӗр кӗрӳ? - тесе шухӑшласа илнӗ пулӑттӑм.\n\nХушса калани. Чӑваш ҫырулӑхӗ аталанма пуҫланӑранпа 150 ҫул ҫитнине уявлама хатӗрленеҫҫӗ халӗ.\n\nАкӑ, каллех, фейсбукран паян ятарласа илнӗ текста яндексра чӑвашла куҫарнине  лартатӑп: «Кӑҫал эпир чӑваш ҫырулӑхне тума 150 ҫул ҫитнине паллӑ тӑватпӑр. Чӑваш Республикин Наци библиотекинче чӑваш ҫырулӑхне халалласа аталантарассипе ҫыхӑннӑ анлӑ кӗнеке экспозицийӗ уҫӑлӗ. Февралӗн 3-мӗшӗнче библиотека директорӗ Роза Лизакова ертсе пынипе выставка проектне пурнӑҫлас енӗпе йӗркелӳ комитечӗн канашлӑвӗ иртрӗ. Курав планне сӳтсе явнӑ чухне Олег Улангин художник, Чӑваш патшалӑх гуманитари ӑслӑлӑхӗсен институчӗн наука ӗҫченӗсем Алевтина Долгова тата Юрий Гусаров, Чӑваш Республикин вӗренӳ институчӗн ӗҫченӗсем Юрий Виноградовпа Анна Егорова хутшӑнчӗҫ. Канашлура нумайччен сӳтсе яврӗҫ, выставка ятне уҫӑлнӑ ыйту тӑрса юлчӗ.\n\n- Хаклӑ туссем! Сире пӗрле ӗҫлеме чӗнетпӗр тата сирӗнтен интереслӗ те ҫутӑ сӗнӳсем кӗтетпӗр. Чӑваш ҫырулӑхне туса пӗтернӗренпе 150 ҫул ҫитнине халалланӑ курава эсир мӗнле каланӑ пулӑттӑр? https://www.facebook.com/\n\nЧунтанах чӑваш чӗлхишӗн ӑнтӑлакансемшӗн питӗ кирлӗ информаци пулчӗ ку. Вӗсем хӑйсен  шухӑшӗсене  комментарисем туса пӗлтереҫҫех пулӗ тетӗп.\n\nҪавӑнпа пӗрлех, маларах пуҫланӑ ыйтӑва тӑсса, интернетри чӑваш ҫырулӑхӗ епле аталанма пуҫланине тата халӗ вӑл мӗнла шайра пулса пынине, хӑш-пӗрисемсӗр пуҫне,  пӗлсех каймастпӑр. Мӗнлерех маттур пулнӑ-ха, тен, кӑштах пуҫтахрах та, ӑс-туйӑмлӑ чӑваш ачисем! Ку енӗпе халӗ те тӑрӑшсах ӗҫлесе пыракан Николай Плотникова асӑнмасӑр епле  те иртӗн-ха. Халӗ тата темле санкци-манкци вӑхӑтӗнче пурӑннӑ май, хамӑрӑн пуласлӑх ассӑн сывлаттарать. Тӳр чунлӑн пӗлсе ӗҫлесе пыракансене хамӑрӑн патшалӑх та пулӑшмалла,  паллах. Пирӗн шутпа, ҫак ӗҫе куллен туса пыракансем валли — Н.А. Плотников, З.А. Яковлева тата ыт. те (малти пурнӑҫ чӑнлӑхӗ — пулас перепиҫ умӗн пушшех те!!!) ятарлӑ хушупа каланӑ ятарлӑ стипенди пулмаллах. Пӑхӑр-ха, Чӑваш Республикин пуҫлӑхӗн ҫамрӑксем валли уйрӑм пултарулӑх туртӑмӗшӗн стипенди пур. Интернетра чӑвашла тӗллевлӗн тата ӑҫ-хакӑла куллен вӑратмалла ӗҫлесе пыракансене хавхалантармаллах, ялан курмасӑр тенӗ пек иртсе кайса тӑлламаллах мар вӗсене те!!!\n\n\n\nЛ. Атлай\n\n\n\nРедакцирен. «Яндекс.Тӑлмачӑн» куҫару пахалӑхне, паллах, лайӑх тесе хак пама пулать. Ҫапах та «Чӑваш чӗлхи лабораторийӗ» хатӗрлекен куҫаруҫӑн ӗҫӗ пирки те каласа хӑварас пулать. Хӑй тӗллӗн куҫаракан ҫав тӑлмач http://translate.chv.su адреспа вырнаҫнӑ. Танлаштарса кӑтартас тӗллевпе эпир вӑл мӗнле куҫарнине те илсе кӑтартатпӑр:\n\nПуйӑс купинче ватӑрах раввин пырать. Ҫӳлти ҫӳлӗк ҫинче ҫамрӑк ҫын вырнаҫнӑ. Ҫывӑрма выртнӑ чухне вӑл ҫапла ыйтать:\n\n—. Эсир калӑр - ха, хӑш сехет?\n\nРаввин пӗр сӑмах каламасӑрах стена еннелле ҫаврӑнать те ҫывӑрса каять.\n\nИрхине пуйӑс Харьков патне пырать. Иккӗшӗ те пассажирсем тухма хатӗрленеҫҫӗ. Раввин хӑйӗн сехечӗ ҫине пӑхать те калать:\n\n—. Ҫамрӑк ҫыннӑм, эсир хӑш сехетре тесе ыйтрӑр. Акӑ халӗ вуннӑмӗш ҫурри.\n\n— Мӗн, эсир ӗнер шарламарӑр - им?\n\n— Куратӑр - и, эпӗ сире хуравланӑ пулсан, эсир эпӗ ӑҫта каяссине ыйтса пӗлӗттӗр. Эпӗ Харькова каяссине хуравланӑ пулӑттӑм, эсир те Харькова каятӑр, тесе каланӑ пулӑттӑрччӗ, сирӗн ҫӗр каҫма та вырӑн ҫук, эпӗ сире хам пата ырӑ ҫын пек чӗнӗттӗм, манӑн хӗре хам патӑмра панӑ пулӑттӑм, эсир ӑна илӗртнӗ пулӑттӑрччӗ, сире качча илме тиветчӗ.\n\n— Ну, мӗнех вара ку?\n\nҪавӑнпа шутларӑм та: мӗншӗн - ха манӑн пӗр сехетсӗр кӗрӳ?\n\nТӳрех ку куҫару япӑхрах тесе хак пама ан шутлӑр. Хальхи вӑхӑтра моделе ҫӗнетес тӗлӗшпе ӗҫлеҫҫӗ. Унсӑрӑн пуҫне, паллах, Яндексри ӑстасен опычӗ те самай пысӑкрах. Анчах «Чӑваш чӗлхи лабораторийӗн» хастарӗсем те ытлах кая юлса пымаҫӗ. Чи пахи вара: танлаштарсан ку вариантра Яндекс.Тӑлмачран лайӑхрах вырӑнсем пуррине курма пултаратӑр. Апла-тӑк, иккӗшпе усӑ курса тата та аванрах куҫару тума май пур.",
        "Пӗрре пӑхсан, Васильев хушамат пӗрре те япӑх мар пек. Вӑл хушаматпа пурӑнакансем чӑвашсем хушшинче сахал мар. Паллах, Ивановсем тата та ытларах. Ак, сӑмахран, нумай пулмасть Иванова министра лартрӗҫ тесе пӗлтерсен ман ыйту ҫуралчӗ: киввине е урӑххине? Чулхулара ӗҫленӗ чухне пӗрре пай ертӳҫи те манран ыйтсаччӗ: «Сирӗн унта пурте Иванов хушаматлӑ-им?» Мӗншӗн? Ара, Шупашкарти пирӗн уйрӑмра ӗҫлекенсен йышне курнӑ та... Унта вара пӗр пилӗк хушамат Иванов пулнӑччӗ пулас.\n\nҪакнашкал лару-тӑрӑва пулах ӗнтӗ пирӗн ҫыравҫӑсем чылай чухне псевдоним йышӑнаҫҫӗ. Чылай Яковлев хушаматлӑ ҫынна, сӑмахран, эпир пач урӑх ятсемпе пӗлетпӗр. Тӗслӗхрен, Иван Салампекӑн чӑн хушамачӗ Яковлев пулнине нумай пулмасть ҫеҫ пӗлтӗм.\n\nМалтан хушаматсем мӗнле ҫыртарасси кӑсӑклӑрах пулнӑ пулас. Халь вӑл ашшӗ хушамачӗпе (ытларах чухне) пырать, малтан вара урӑхларах йӗрке пулнӑ. Ман хамӑн хушамат, сӑмахран, Плотников. Аттен хушамачӗпе. Апин — Степанова. Аттен хушамачӗ пирки калас пулсан вӑл ҫаплипех куҫса пынӑ пулас. Ни асатте, ни атте хӑй платник пулман. Апи хушамачӗ вара ашшӗ ятӗнчен. Кукаҫи ман Ҫтаппан пулнӑ та вара хӗрне те Степанова Лидия Степановна тесе ҫыртарнӑ пулас. Кукаҫин хушаматне, шел те, тӳрех калаймастӑп. Ҫапла май ӑру хыҫҫӑн ӑру тӗрлӗрех хушаматпа ҫӳренӗ.\n\nПаянхи саккунсем ҫыннӑн хушаматне ҫеҫ мар, ятне те улӑштарма май параҫҫӗ. Вӑл ҫеҫ мар, ашшӗ ятне те чиперех урӑххине йышӑнма пулать — сӑмахран, Иванович пулас килмесен 2000 тенкӗ тӳле те сана темиҫе кун хушшинче урӑх ашшӗ ятне ҫырса хураҫҫӗ. Паспорт улӑштармалла та — ҫӗнӗ ҫын пулса тӑрӑн.\n\nӖнер Никита Васильев та хӑйӗн хушаматне улӑштарни пирки пӗлтерчӗ. Текех пирӗн паллӑ велоҫулҫӳревҫӗ Васильев мар, Тӗнче хушаматлӑ пулӗ. Никита Тӗнче (хут ҫинче, темшӗн Тенче ҫырса хунӑ-ха...).\n\nЧӑвашлӑх тӗнчинчи ҫынсене сӑнанӑ май мана ку питӗ кӑсӑклантарса ячӗ. Хушаматсене улӑштаракансен йышӗнче Васильевсем питӗ нумай. Эпир пурте паллакан ҫынсем хушшинче унччен Владимир Болгарский пурччӗ, кайран чӑвашлӑх анинче Суварин хушамачӗ тухрӗ. Ак халь ӗнтӗ тепӗр хушамат ҫуралчӗ — Тӗнче. Вӗсене пӗрлештерекенни — пурте вӗсем маларах Васильев хушаматпа ҫӳренӗ: Владимир Васильев, Андрей Васильев тата Никита Васильев. Ивановсем те, Николаевсем те, тата ытти анлӑ сарӑлнӑ хушаматлӑ ҫынсем чӑвашлӑх анинче сахал мар, анчах шӑп та лӑп Васильевсем хӑйсен хушамачӗсенчен «тараҫҫӗ», хӑйсене валли индивидуаллӑхне палӑртаканнине суйлаҫҫӗ.\n\nЯтра-хушаматра чӑвашлӑха палӑртни час-часах тӗл пулать. Юлашки вӑхӑтра, сӑмахран, чӑвашла хушма ятсем йышӑнасси йӑлана кӗчӗ. Ачасене чӑвашла ят парасси темшӗн вӑй илеймест (ман шутпа питӗ сахал), хушма чӑваш ят илесси вара ку тӗлӗшрен вӑйлӑрах палӑрчӗ. Мӗншӗннине те палӑртма йывӑр мар пулӗ. Ята тем тесен те ашшӗ-амӑшӗ парать. Ачи ҫитӗнсен кам пулассине ниепле те пӗлме май ҫук. Ӳссе ҫитсен вара чылайӑшӗ тӑна кӗрет, хӑйӗн чӑвашлӑхне палӑртасшӑн пулса тӑрать. Ҫапла Илтимерсемпе Аҫтахарсем, Юмансемпе Алпарухсем йышланаҫҫӗ. Чӑн ята улӑштарма ҫавах та ҫӑмӑл мар: ӑна тем тесен те ют ҫын мар, тӑван атте-анне панӑ-ҫке! Ҫавӑнпа та хушма ятсем вӑйра. Хӑш-пӗр ҫыннисен хушма чӑваш ячӗсене ҫеҫ пӗлетӗн, чӑн ятне хутшӑннӑ чухне аса та илместӗн.\n\nПаллах, хушаматсене улӑштарнине япӑх хак пама май ҫук. Саккун чармасть пулсан — ку кашни ҫыннӑн хӑйӗн ирӗкӗ. Эпир ӑна ҫакӑншӑн хурлама пултараймастпӑр. Хушаматсен расналӑхӗ ӳсни, ҫӗнӗ хушамат чӑвашлӑхпа кӑсӑклантарма май пани — лайӑх енсем тесе шутлатӑп.\n\n\n\nӲкерчӗк ҫинче: Владимир Болгарский, Андрей Суварин, Никита Тӗнче",
        "Пӗрремӗш ҫавра. Г.Н. Волков: «Яковлев ӳстерсе янӑ ҫын вӑл… Эп айӑплӑ халӑх умӗнче… Эп фальсификатор пултӑм…»\n\n\n\n\n\nЧӑваш наци юхӑмӗ хухса та хухса пыни куҫкӗрет/куҫа кӗрет, куҫа тӑрӑнать… Раҫҫейри вырӑс мар чӗлхесене факультативлӑ вӗрентме пуҫласан чӑваш чӗлхин шӑпи паллӑ – типсе ларасси… Ик ҫул каялла ачана, Айтара, пӗрремӗш класа ӑсатрӑмӑр. Вӗренӳ ҫулӗ пуҫланнӑ ятпа ирттернӗ савӑнӑҫлӑ пуху хавхалантармарӗ. Халӑх кӑмӑлне пӗлес тесе, ачана амӑшӗпе хӑварса, пӗрремӗш хута, расписани-пӗлтерӳсем патне антӑм. Кунта чӑнах та шавлӑ хӗвӗшӳ. Сӑнаса итлеме пуҫларӑм. Пӗрле пуҫтарӑннӑ тӑватӑ чӑваш майри (ҫапла калап эп ытла капӑр тумланнӑ инкесем пирки) расписани умӗнче хыттӑнах хӑйсен кӑмӑлне палӑртаҫҫӗ: «Хӑҫан пӗтереҫҫӗ-ши ӗнтӗ чӑваш чӗлхи урокӗсене?!.» Хулари чӑваша чӑваш чӗлхи тарӑхтарать. Чӑваш пулса ҫуралнӑшӑн вара вӑл хӑй ӑшӗнче ҫут тӗнчене ылханасла тарӑхмаллипех тарӑхать. «Тутар тутара тӗл пулать – савӑнать, пушкӑрт пушкӑрта тӗл пулать те – савӑнать, чӑваш чӑваша тӗл пулать те – тутине тӑсать». Александр Егорович Кириллов экскаваторщик ҫакна пӗрре мар сӑнанӑ, вӑл тӗнче каснӑ ҫын. Эрнест – водитель. Тӗнче курнӑ. Амӑшӗ те ун шкулта акӑлчан чӗлхи вӗрентнӗ. Вӑл чӑнтан (ячӗшӗн мар) ман пурнӑҫпа кӑсӑкланнине кура хамӑн «Хурапа шурӑ» пирки каласа патӑм. («Хурапа шурӑ» Ҫемен Элкерӗн  автобиографиллӗ повеҫӗ). «Тӗнче ачи» хӑй кӑмӑлне пытармарӗ: «Чӑваш вӑл – говно», – терӗ… «Мӗншӗн чӑваш чӑваша юратмасть?» – чӑнтан пӑшӑрханса шухӑшлатчӗ Хветӗр Уяр… Мӗншӗн чӑваш чӑвашран йӗрӗнет?..  Ҫӗр тӗрлӗ «Мӗншӗнсем» шайӗнче шырамалла чӑваш пӗтнин тупсӑмне, чӑн сӑлтавне. Шыракансем, пуҫ  ватакансем шел пулин те, курӑнмаҫҫӗ. Йӑпатакансем, суя шанчӑк паракансем вара – ытлашшипех. «Эпӗ пӗрре те иккӗленместӗп: чӑваш чӗлхи  пӗтмест, – тет В.П. Станьял. –  Тӗнче пӗтмест пулсассӑн чӑваш халӑхӗ те пӗтмест». 21 ҫул хушшинче (1989 – 2010) чӑваш  шучӗ 338 пин чакнӑ. Ҫӗр ҫинче (тен, таҫта тӗнче уҫлӑхӗнче, инҫет космосра чӑвашла калаҫаҫҫӗ)  пӗр чӑваш шкулӗ ҫук, Шупашкарта пӗр  чӑваш ача пахчи ҫук, хулара чӑвашлӑх палли-сӗмӗ ҫукпа пӗрех… –  Станьял: «Эпӗ пӗрре те иккӗленместӗп: чӑваш чӗлхи  пӗтмест»… Виталий Петровичӑн 60 ҫулне Правительство ҫурчӗ ҫумӗнчи «Тӗлпулу» кафере паллӑ  тунӑччӗ. Станьялӑн икӗ хӗрӗ юратнӑ ашшӗне саламласа плакатсем ҫырса тултарнӑччӗ. «Пӗрне те чӑвашла ҫырман-ҫке», – наци ертӳҫин ачисем чӑваш чӗлхине пач вырӑна хуманнишӗн кӑмӑлсӑр пулнине пытармарӗ манпа ҫуммӑн ларакан Александр Николаевич Тимуков. Чӑваш чӗлхишӗн Станьял чӑнтан ҫунать-ши?.. Пит иккӗленетӗп. Конгресс Путин патне ҫыру ҫырмасӑр Иуда ӗҫне турӗ (30 кӗмӗл тенкӗпе – грантпа – мутанмаллипе мухтанать) – Станьял: «Пил те пехил сана, конгресӑм!» – тет. Чӑваш ҫамрӑкӗсен театрӗ, тӑван чӗлхе умӗнчи тивӗҫе манса, вырӑсла спектакльсем лартать  – Станьял: «Шире шаг, любимый юнак!» – тесе мухтать. Н.И. Ильминскин чӑвашлӑха  вӑрттӑн пӗтермелли хатӗрӗ-механизмӗ пӗр кӑлтӑксӑр ӗҫленине пӗлет, ҫапах та: «Иван Яковлевич Яковлевран ӗмӗрлӗх тӗслӗх илмелле!» – тет… Суя миххи мар – анчах суя хутаҫҫи теме пулать. Чӑн суя миххисем – Станьялтан аслӑраххисем. «Юмах Мишши» тетчӗҫ Юхма Мишшине. Ялан ӑна тӑрӑ шыв ҫине кӑларатчӗҫ. Шутласа кӑлараканни пӗр Юхма кӑна пулман. Ку вӑл 1950, 1960 ҫулсен ачисен (пятидесятники, шестидесятники) палли.  Ӑру  палли. Пурнӑҫ вӗҫӗнче Г.Н. Волков суя вӑрӑсем акса хӑварнине хӑех йышӑнчӗ. ( «Ҫӗр пин юрӑ, ҫӗр пин тӗрӗ» тата ытти те.).  Г.Н. Волков тупсӑмӗ  гибрид (суяпа чӑнлӑха хутӑштарса, пӑтраштарса янтӑланӑ япала) пулнине эп 1990 ҫулсен пуҫламӑшӗнчех палӑртнӑ.  Тӗслӗхрен, «Хыпарта» (1992, раштав, 8) Мӗтри Юманӑн «1905-мӗш ҫул. Чӑвашсен хушшинче пулнӑ ӗҫсене асӑнни» кӗнекин (Шупашкар, 1925) сыпӑкне «Чӑваш шкулӗ мӑнастырь евӗрлӗччӗ» ятпа пичетлерӗм. Г.Н. Волковӑн черетлӗ юмахне фактпа хирӗҫлерӗм. Ум сӑмахӗнче ҫапла ҫыртӑм: «Чысӑм та, сӑвапӑм та – сирӗнпе…» ят панӑ интервьюра («Чавашьен», 1992, 44 №) Г.Н. Волков академик «Чӗмпӗрти чӑваш шкулӗ вӑл – Европӑри Эрфурт, Гетенген университечӗсенчен ҫӳлте тӑнӑ» тесе И.Я. Яковлева мухтать.\n\nТӗнчери чӑваш тивӗҫӗ пирки ӳстерсе каласси пӗр Волковшӑн кӑна мар, аллӑран иртнисемшӗн пуриншӗн те кӑтартуллӑ пек. Тивӗҫлӗ  чӑнлӑх вӗсемшӗн пӗр хӑйсен чун чӑнлӑхӗ кӑна. Хӑйсем те пӗлмен, ӑсласа илмен чун чӑнлӑхӗ.\n\nЧӑнлӑх тепӗр чух йӳҫек кӑмӑл хӑварать, анчах ӑна пӗлесех пулать. Яковлев шкулӗ пирки тӗрӗслӗх ҫапларах пек. Вӑл Европӑран иртме мар, вӑл вӑхӑтри вырӑс шкулӗнчен те чылай юлса пынӑ. Мӗтри  Юман ун ҫинчен мӗн ҫырса хӑварни, ман шутпа, ҫакна ӗнентерет».\n\n«Айхи пулман пулсан эпӗ пулмастӑм», – тенӗччӗ Петӗр Эйзин. Г.Н. Волков пулман пулсан паянхи И.Я. Яковлев пулмастчӗ. Ваҫанкка хӑйӗн сӑввисене хуткупӑс каласа янраттарнӑ пек сӑмах калаймастчӗҫ паянхи ҫулпуҫем, политиксем. К.Г. Яковлев: «Чӑн та паян ҫавӑн пек тӗлӗнмелле кун. 170 ҫул каялла ҫак ҫут тӗнчене тӗлӗнмелли (кунта ораторсен чӗлхине сыхласа хӑварнӑ. – Ю.Я.) чӑваш улӑпӗ ҫуралнӑ: Иван Яковлевич Яковлев. Его величие, его ум, его разум и сегодня продолжает нас восхищать. Действительно был великим человеком, творцом. Спасибо, тавтапуҫ пурне те. Уявпа». Н.Ф. Угаслов: «Чӑваш халӑхне каласа хӑварчӗ: ытти халӑхсемпе туслӑ пурӑнӑр, пӗр-пӗрне савӑр, Раҫҫей ҫӗршывне ӗненӗр, ӑна юратӑр. Ун чухне вӑл сирӗн амӑшӑр пулӗ терӗ. Еще раз вам всем хорошего настроения, вдохновение, чтобы всегда вместе быть и заниматься добрыми делами». О.Н. Мустаев: «Чӑваш чӗлхи ячӗпе пӗр пулар! Яковлев ячӗ вилӗмсер пултӑр! Сывӑ пултӑр тӑван чӑваш чӗлхи. Ҫапла пултӑр!». В.В. Туркай: «Яковлева ҫуратса ӳстернӗ халӑх вӑйсӑр пулма пултараймасть. Иван Яковлевич Яковлева ҫуратса ӳстернӗ халӑх ҫунатсӑр пулма пултараймасть. Иван Яковлевич Яковлева ҫуратса ӳстернӗ халӑх телейсӗр пулма пултараймасть. Сывӑ пултӑр вилӗмсӗр Иван Яковлевич Яковлев! Сывӑ пултӑр аслӑ чӑваш халӑхӗ!».\n\nИнтернет паян такам калаҫнине та курса итлеме май парать. Тӗнче анлӑшӗнче пӑхсан паянхи пирӗн ҫулпуҫсене политикӑри  Ваҫанккасем теме пулать. «Ну кунтан пархатар кӗтместӗп. Ваҫанкка йӗренет пуль тарӑн шухӑшран», – ҫырнӑ Ефрем Васильевич Еллиев кун кӗнекине (1932, ака, 2). Паянхи ҫулпуҫем йӗрӗнеҫҫӗ кӑна мар –  тарӑн шухӑша хӑвалаҫҫӗ чӑваш тӗнчинчен (антиинтеллектуализм). Чӑваш наци конгресӗн 10 съездӗнче А.П.Хусанкая сӑмах паманни – ҫак туртӑма чӑнтан палӑртакан символ. «Вӑл калаҫнине сывламасӑр итлесе лараттӑмӑрччӗ»,  – аса илет Елена Османова («Чӑваш тӗнчи», 2017, ҫурла, 3 (81) №, 5 с.). Юрӑҫ халӑх ҫинчи, халӑх умӗнчи сӑмах хакне шалтан пӗлет.\n\nВолков-Юхма суя миххи пулман пулсан, тен, паянхи Ваҫанккасем те пулмастчӗҫ. «Малалла, Яковлев патнелле!»  – тесе палӑртрӗ В.Г. Родионов чӑваш идейине (Чӑваш халӑх сайчӗ. 22.04.2018.). Паянхи чӑваш ҫулпуҫӗсем чӑнах та Яковлев патнелле ӑнтӑлаҫҫӗ: «…Иван Яковлев чӑвашла ҫырма ӑнкарман, калаҫасса та та чӑвашла-вырӑсла пӑтраштарса калаҫнӑ,  пӗр вӗҫӗмсӗр эдак-идак тесе пакӑлтатнӑ» (Уткин Г. Яковлев трагедийӗ. Очерк. Тӗпчев. Юркин И.Н. Чӑваш тӑшманӗ. Очерк. Шупашкар: «Ҫӗнӗ  Вӑхӑт», 2014, 17 с.). О.Н. Мустаев Л.П. Куракова: «Иккӗмӗш Иван Яковлевич Яковлев», - тесе чыслать. Риторика тӗлӗшӗнчен пӑхсан, пуплевре вӑл хӑйне епле тытнине кура ку чӑнах та ҫапла. Л.П. Кураков ЧНК 10 съездӗнче тухса калаҫнинчен: «…получается 200 народов проживает на территории Чувашской Республики. Всем членам национального конгресса, всему чувашскому народу от имени этих народов хочу передать нашу любовь – хамӑр юратнине. Сире хисепленине, сирӗнпе ялан пӗрле ӗҫлесси ҫинчен хатӗррине сирӗн пата ҫитересшӗн, сире пӗлтересшӗн. Наконец, я хотел бы завершая свою мысль я сказать. Мы не имеем права никогда забывать предыдущих людей, которые для нас много сделали. Сегодня Михаил Васильевич очень хорошо сказал, Николай Федорович, вы очень хорошо сказали о тех людях, которые внесли вклад в укрепление дружбы народов. Это очень важно, это очень нужно. И, конечно же, великий наш патриарх Иван Яковлевич Яковлев мӗн тери вӑл пысӑк ӗҫсем тунӑ. Вӑл ҫӗр ҫул каялла каланӑ туслӑ пурӑнасси ҫинчен пире каласа хӑварнӑ ырӑ сӑмахсем.  Когда я встречался с президентом Академии наук Росии, когда показал завещание чувашского народа Ивана Яковлевича Яковлева, он не поверил. Вы, говорит, почему в секрете держите, держали долгое время это завещание. Вы должны это завещание довести до всех-до всех народов. Хотя одно выражение сегодня хотел бы перед вами озвучить: «Верьте в Россию, любите ее и она станет вам матерью!» Прошло сколько лет, значимость этого завещания, духовность, нравственность, сила этого завещания не только не теряет силу, а, наоборот, приумножается в силу ряда актуальных причин. Ҫавӑнпа национальный конгресс ирттерни халӗ ҫав тери пысӑк, ҫав тери вырӑнлӑ…».\n\n«Заставлять человека учить язык, который для него родным не является, так же недопустимо, как и снижать уровень и время преподавания русского в школах национальных республик РФ. Обращаю на это особое внимание глав субъектов Российской Федерации». Путин 2017 ҫулхи  утӑ уйӑхӗн 20-мӗшӗнче Йошкар-Олара каланӑ сӑмахӗсем хускатнӑ ӗҫ-пуҫ мана ҫынсен (уйрӑмах урӑх халӑх ҫыннисен) шухӑш-кӑмӑлне ыйтса/тӗпчесе пӗлме хавхалантарчӗ. Шупашкарта пурӑнакан вырӑссем чӑвашсене сӑнаҫҫӗ иккен.Чӑвашсем хӑй чӗлхипе таса калаҫайманни – пӗтекен халӑх палли. «Итлеме йӗрӗнмелле, – теҫҫӗ вӗсем. – Ни чӑвашла, ни вырӑсла… Тутарсем ав тап-таса хӑй чӗлхипе калаҫаҫҫӗ. Пӗр вырӑс сӑмахӗ кӑлармаҫҫӗ…».\n\nПирӗн халӑха юратман ҫынсем  паянхи ҫулпуҫӗн Иван Яковлевич Яковлевла «эдак-идакӗсене» илтсен савӑнмаллипех савӑнаҫҫӗ. Ӗлӗк чӑваша  ҫум курӑкпа танлаштарнӑ пулсан, паян – клоунпа: «Россия без чувашей как цирк без клоуна». Ухмаха перекен чӑваш урӑх халӑх куҫӗпе пӑхсан – клоун. Эп хуралта ӗҫлетӗп. Кӳршӗ ҫуртра пурӑнакансене уҫҫисене панӑ, анчах пурӑнма ирӗк паман-ха. Ҫурт управленийӗ пире, хуралҫӑсене, пӑхкалама ыйтрӗ. Каҫ. Юсав ӗҫӗсем пыраҫҫӗ. Хваттер хуҫисем «йӑвисене» хӑйсене кирлӗ пек майлаҫҫӗ, улӑштараҫҫӗ. Хӑшӗ тӗревлӗ мар/тӗп мар стенисене те ишеҫҫӗ. 3 хутри чӗречерен стена ванчӗкӗсене михӗсемпе пӑрахаҫҫӗ. Полиципе хӑратрӑм. «Эпир – чӑвашсем, каҫарӑр пире», – терӗҫ мана.\n\nБорис Чиндыковӑн «Hotel Chuyashia» калавӗнчи юрӑ аса килет: «Мы, чуваши, дураки». Пирӗн ялти (Етӗрне районӗ, Йӗрӗхкасси ялӗ) Колька мочок эрех ӗҫсен-тусан ялан пӗр юрӑ тӑсатчӗ: «Эпӗр охмах кап…сам, пиртан ыр ҫын полас ҫок».\n\nЧӑваш политика сцени ҫинчи Ваҫанккасем ҫак юррах юрламаҫҫӗ-ши, тепӗр тесен?!. «Сидят на детском горшке и пытаются говорить о важных вопросах», – темшӗн вырӑсла палӑртатчӗ  хӑйӗн шухӑш-кӑмӑлне Иосиф Дмитриев. Сӑнаршӑн, ӳстерсе каланӑ пек туйӑнатчӗ мана театр ачин сӑмахӗ. Халь куратӑп: вӑл мантан чылай мал курӑмлӑрах пулнӑ иккен. Айванла пуплев те, какки те (Валери Туркай хӑйне вӗрентекенӗн – Атнер Хусанкайӑн –  пуҫӗ ҫине хӑпарса сысни  мӗне тӑрать!) чӑваш пурнӑҫӗнче тухрӗ мала. Арсений Тарасов савӑнать пулӗ тетӗп. «Охмах кап..алла» чӑваш вӑл – ун проекчӗ. Хоппа хОпларӗ чӑваш тӗнчине. «Хам чӑваш пулнишӗн намӑсланса ларатӑп вӗсен сцена ҫинчи вӑййине курсан», –  тетчӗ Олимпиада Васильевна Таллерова (А.И. Миттов мӑшӑрӗ) чӑваш артисчӗсем пирки. «Эпир хӑюллӑ! Эпир никамран та вӑтанса тӑмастпӑр. Чӑвашӑн ун пек туйӑм пулмалла та мар!» ( Чӑваш халӑх сайчӗ. 08.01.2017). Хоппа юнӗ чупать Кипечре. Чӑвашшӑн  ҫунатӑп теекен Кипеч ҫыравҫӑ чӑвашла кӗнеке хуплашкисем ҫине Кибеч писатель тесе ҫырни вӑл чӑнтан кам пулни пирки систерет – клоун… Анчах кулас килмест ман вӗсен мыскарисене курса. Ваҫанкка Маяковскине тӗлӗнтернӗ. Паянхи Ваҫанккасен вӑййи йӗклентерет, йӗрӗнтерет… «Сделаемся чувашами и послушаем», – тенӗ Л.Н. Толстой А.З. Воинов патне ҫырнӑ ҫырура (1902, чӳк, 11). «Акӑ куҫӑм умӗнче чӑваш ҫӗрӗ… / Тӑван ҫӗршыв тавра чунӑм вӗҫрӗ»…  Ҫеҫпӗлле шухӑшласа илетӗп те – чӑваша ӑс-тӑн тӗлӗшӗнчен пуш хир хупласа илнине куратӑп. Паян никам та: «Сделаемся чувашами и послушаем»  теес ҫук. «Атьӑр-ха ӑслӑ, философилле калаҫар!» – тетчӗ Геннадий Ильич Исаев художник тус-юлташсемпе эрех ӗҫнӗ чух. Паян кӗрекере те, ҫын ҫинче те, халӑх умӗнче те ӑслӑ калаҫакансем ҫухалса пыраҫҫӗ. Урӑхла пулма та пултараймасть. Пур ҫӗрте те монолог. Хаҫат-журналта та, радио-телевиденире те  –  ниҫта та тавлашу-диспут валли вырӑн ҫук. (Чӑн шухӑш, ӗнентерет пире М.М. Бахтин, диалогра кӑна ҫуралма, пурӑнма пултарать.). «Шел, писательсене пӗр союза пӗрлетештереймерӗмӗр», – хут тӑрӑх хурланса вуласа пачӗ пӗрре Н.Ф. Угаслов. Чӑваш литератури, пӗтӗмӗшле илсен, нихҫан та тарӑн шухӑшлӑ пулман (уйрӑм генисем пур, паллах, пирӗн  – кунта пӗтӗмӗшле шай пирки сӑмах пырать). Угаслов политики вӑй илсе кайсан чӑвашри шухӑш таппине мӗн кӗтесси паллӑ – сӳнесси … Угаслов саманинче Кибеч писатель пророка тухни те ӑнсӑртран мар. Кибеч писатель меслетне пӗр сӑмахпа палӑртма пулать – китч. Кибеч – китч. Пысӑк сӑмах каличчен пысӑк чӗле ҫӑкӑр тыт тенешкел – Кибеч писатель пирки хамӑн энциклопедилле пӗтӗмлетӗве илсе парам:\n\n«КИБЕЧ (псевд.; наст. фам. Ефимов)  Анатолий Ильич (р. 10.8.1937, д. Челкумаги Канаш. Р-на) – прозаик, поэт, драматург, один из активных деятелей Третьего чувашского возрождения (1987 – 1997), идеологов национального движения, кандидат пед. наук (1976), член СП Росс. Фед. (1998). Книги К. так или иначе посвящены темам, наиболее близким к непосредственной политической реальности национальной жизни. Освещает эти проблемы в жанре массовой литературы, «легкого чтения». Популярен среди массового читателя. В прозе нередко апеллирует к половому инстинкту и нездоровому любопытству читателя. Причудливое смешение «серьезных» нац. вопросов с «несерьезной» сферой эротики, «низом» литературы в творчестве К. органически вписывается в широкий контекст «продвинутой» чувашской культуры перестроечного времени (1987 – 1997), в частности газеты «Аван-и», стиль которой А.Хузангай определяет следующим образом: «Публикации «Аван-и» были пестры и мозаичны. Чувашская эстрада, психология и поведение чуваш. и сельских маргиналов, умеренный национализм, попытка говорить с молодежью о серьезных вещах – экономике, бизнесе. Политике, культуре – на ее же языке, внедрение эротического направления в литературе». Его кн.: Пурнӑҫ  ҫулӗ такӑр мар (Тернист жизненный путь). Ш., 1995; Юратусӑр телей ҫук (Без любви счастья нет). Ш., 2000; Улӑп таврӑнни (Возвращение Улыпа). Ш., 2001; Шартлама (Стужа). Ш., 2005 и др.»\n\nУлӑп мар тавранать паян Чӑваша – мӑн сӑтӑр тума пултаракан монстр: Шекспирӑн Калибанӗ майлӑ алпастӑ-арҫури-вупӑр-ийе… хӑраххи. (Владимир Степанов ҫыравҫӑн кун пирки тӗлӗнмелле сӗмленӳсем иксӗлми.) «Чӑваш чунӗнчи монстр», – тенӗ пулӗччӗ Карл Густав Юнг. Шалти усал хӑватсене ӑс-тӑн ҫутинче кӑна алла вӗрентме, культура чиккине кӗртме пулать. Кӑна тума пирӗн ӑс-тӑнӗ те, хӑюлӑхӗ те ҫителӗксӗр. Ҫавӑнпа чӑваш наци пурнӑҫӗн сцени ҫинче чӑваш Калибанӗ пӗр намӑссӑр саркаланать пулӗ тетӗп. Тен, Калибан пулса ҫухалӑпӑр, кайӑпӑр эпир, чӑвашсем, ҫут тӗнчерен?!.\n\n«Ирӗклӗх ҫулӗ» тесе ят панӑ Мӗтри Юман хӑйӗн кӗнекине (1924). «Суя ҫулӗ» тесе ҫырма пулать чӑваш наци аталанӑвӗн ҫӗр ҫулхи историй пирки. Паян наци юхӑмӗ типсе ларнин  сӑлтавӗ – ҫав суяра та. «Суеҫ суеҫтерет, пурнӑҫ ҫулне хӗстерет», –  теҫҫӗ ваттисем. Ҫакна пурнӑҫ вӗҫӗнче те пулин ӑнланни Г.Н. Волкова чыс тӑвать. Геннадий Никандрович 2010 ҫулхи ҫу уйӑхен 27-мӗшӗнче: «Чӑваш халӑхӗ умӗнче эп айӑплӑ… Каҫару ыйтатӑп… Иван Яковлевич Яковлев иккен коварный русификатор», –  тени пирки эп ҫырнӑ. Вулӑр: «Суккӑр тата хӑлхасар вӗреннӗ чӑвашсем пирки» (Чӑваш халӑх сайчӗ. 21.06.2017). Икӗ уйӑх маларах (2010, пуш, 4)  Г.Н. Волков ҫав шухӑшах О.М. Цыпленкова панӑ интервьюре те калать иккен. Яра кун ҫывӑхрах аслати шарлаттарнӑ пек янракан Волковӑн  сӑмахӗсене эп анчахрах асӑрхарӑм. Ӑна  халӑх патне  ҫитересшӗн. Пирӗн пурин те хыт шухӑшламалла: И.Я. Яковлев патне малалла каймалла е чӑнлӑх патне ӑнтӑлмалла. «Волков Геннадий Никандрович академик» ятлӑ интервьюшӗн Олег Михайлович Цыпленкова чыс та мухтав!\n\nГ.Н. Волков сӑмахӗсем: «Яковлев ӳстерсе янӑ ҫын вӑл. Эп айӑплӑ халӑх умӗнче. Эп фальсификатор пултӑм».\n\n«Чӑваш шӑпи тата суя» ыйту мана тахҫанах шухӑшлаттарать. 20 ҫул каялла ҫырнӑ ӗҫсенчен пӗрне вулакана сӗнетӗп.  «Ҫӑлӗ-ши чӑваша чеелӗх?» тӗрленчӗк «Ҫамрӑксен хаҫатӗнче» (1998.21.08) кун ҫути курнӑ.\n\n\n\nВӗреннӗ чӑваш хӑй ӑсӗпе пурӑнасшӑн пулманнине асӑрхакансем пулнӑ. Тӗслӗхрен, Юрий Скворцов ҫыравҫӑ ҫак ҫитменлӗхе ак ҫапла палӑртнӑ: «Пӗр-пӗр пархатарлӑ сӑвӑҫ е калавҫӑ пӗр-пӗр илемлӗ танлаштару тупсан, картана пӑрахнӑ ҫӑкӑр татӑкне чӑх чӗпписем хупӑрласа илнӗ пек, кӑпӑрр! тапӑнатчӗҫ. Вара сӑвӑран сӑвва, калавран калава ҫак танлаштарӑва сӗтӗрсе, ҫак илемлӗ танлаштарӑвах йӗклентерекен таватчӗҫ, ҫак танлаштарӑва малтан тупнӑ пархатарлӑ ҫынран та пистеретчӗҫ». «Поэзире пирӗн тахҫанах ҫӗнӗ тырӑ ҫӑкри ҫиме вӑхӑт ҫитнӗ, халӗ те киввинех ҫиетпӗр», – ҫырнӑ вӑл кун кӗнекине (1961).\n\nЧӑваш ҫӗнӗ йӑла кӑларма юратакан халӑх мар, анчах пурнӑҫа ҫӗнетсе тӑма кирлине ӑнланать: «Ытти тӗлӗшрен кунта пайтах ҫӗрте «чӑваш йӑлипе» тенӗ ҫӗрте те аванӗ пур. – ҫырнӑ Григорий Тимофеев «Тӑхӑръялта». – «Ҫӗнӗ курӑк ҫине пуснӑ йӗркепе», «ҫӗнӗ юр ҫине пуснӑ йӗркепе»,  «ҫӗнӗ тырӑ алла илнӗ йӗркепе» тесе, «турра-пулӗхе тав тӑвас» теҫҫӗ».\n\nХалӑх Турра ҫӗнӗ юрӑ юрласа, сӑвӑ-кӗлӗ каласа тав тунӑ, савӑнтарнӑ.\n\nПирӗн интеллигенци чунне, пуҫне вара ҫӗнӗ юрӑ-сӑвӑ кӑна мар, ҫӗнӗ шухӑш-кӑмӑл та, ҫӗнӗ идейӑсем те сайра килеҫҫӗ. Ҫакна, сӑмахран, И.Я. Яковлев ҫуралнӑранпа 150 ҫул ҫитнӗ май ҫырнӑ тӗпчевсем, ӳкернӗ ӳкерчӗксем, фильмсем те кӑтартса пачӗҫ. «Ҫутта кӑларакан», «патриарх», «ырӑ чаваш», «пирӗн Кириллпа Мефодий», «аслӑ Вӗрентекенӗмӗр», «мухтавлӑ ҫыннӑмӑр» тенисем тавра ҫаврӑнчӗ интеллигенци шухӑшӗ. И.Я. Яковлев ӗҫне-хӗлне ҫӗнӗлле хаклас текенсем те тупӑнчӗҫ. Акӑ, Атнер Хусанкай «Обрусение чуваш или чувашское народное дело? (Опыт деконструкции яковлевского дискурса)» статья ҫырчӗ («Республика», 1998, 15 №, 14 с.).\n\n«Пушкина ҫӗнӗлле юратма вӗрентрӗҫ, – тенӗ хӑй вӑхӑтӗнче Александр Блок. – Анчах Брюсов, Щеголев, Морозов т.ыт. те мар – футуристсем. Вӗсем ӑна ҫӗнӗлле вӑрҫаҫҫӗ, ҫапла вара Пушкин пире ҫывӑхрах пулать».\n\nХусанкай Яковлев мифне аркатасшан мар, вӑл ун тупсӑмне, вӑрттӑнне тупасшӑн. «Народ этот дикий и невежественный», «чуваши вообще дичее русских и татар», – чӑваша ҫавӑн пек хурланисем Яковлевӑн пайтах. «Хӗвел ҫинче те пӑнчӑсем пур», – тесе вӗсене курмӑш тума май ҫук. Эпир Яковлевран наци ялавӗ тӑватпар пулсан, пирӗн унӑн ҫитменлӗхӗсене те ӑнланас, йышӑнас пулать.\n\nКарл Густав Юнг ҫын чунӗн ӗмӗлке пурри пирки ҫырнӑ. Чунри усал, аркатуллӑ, хура вӑй-туртӑмсене вӑл ҫапла ят панӑ. «Ӗмӗлкене ӑсласа илес пулать – ҫакӑнта ҫӑлӑнӑҫ», – тенӗ Швейцари психологӗ.\n\nЭтем чунӗ пирки калакан наука ҫул пуҫсен сӑмахӗ-юмахӗсене те асӑранса йышӑнма вӗрентет. Интеллигенци хушшинче юлашки вӑхӑтра И.Я. Яковлев чеелӗх пирки мӗн шухӑшланине халал пек йышӑнасси вӑй илсе пырать.\n\n«Чее пулӑр. Эпӗ ҫамрӑк чухне иезуит Игнатий Лойола вӗрентнине тишкерсе пӗлтӗм. Чӑвашлӑха чеелӗх кӑна ҫӑлать», – тенӗ имӗш Яковлев. (Мӗтри Юман. Хӑватлӑ ӗмӗр.).\n\nҪӑлӗ-ши чӑваша чеелӗх? Укҫа, услам, суту-илӳ енне кайрӗ ҫӗршыври пурнӑҫ. «Суту-илӳ ултавсӑр пулмасть», «суту-илӳре улталайман, хӑй улталаннӑ», «суту-илӳ хушшине ҫылӑх тирӗнет», – тенисем пур халӑх сӑмахлӑхӗнче. (Патмар И.А., Патмар Э.И. Халӑх ӑслӑлӑхӗ. Канаш, 1994, 89 с.).\n\nПолитикӑра та суеҫӗсем мала тухрӗҫ. Вӗсем пиркиех каланӑн туйӑнать Петӗр Эйзин «Вӑтаммисен юррисем» сӑввинче:\n\nСуяҫҫӗ.\n\nЧике тӑршшех лартаҫҫӗ,\n\nпӗр пуссӑрах сутса яраҫҫӗ,\n\nшуҫ тупаньпе те шутараҫҫӗ,\n\nпуртти-аврипеле те тыттараҫҫӗ… –\n\n\n\nАшшӗсемпе амӑшсене,\n\nачи-пӑчисене,\n\nкӳрши-аршисене\n\nирпе те, кӑнтӑрла та, каҫине те,\n\nхӗлле те, ҫуркунне те, кӗркунне те,\n\nпӳртре те, урамра та,\n\nялта та, хулара та…\n\n\n\n«Шӑтман юман кутӗнче\n\nҫуралман мулкач ҫури выртать».\n\nКам ӳркенмест,\n\nАтьӑр\n\nТытма каятпӑр!\n\nСовет влаҫӗ саланнӑ хыҫҫӑнхи тапхӑр самодержави арканнӑ вӑхӑта аса илтерет. «Ман шухӑшпа, – ҫырнӑ И.Д. Никитин-Юркки кун кӗнекинче (1917), – пур суеҫӗ ҫынсене пухса халь тӗрмене хупсан, тӗрмисем ӗлӗкхинчен те тулли пулӗҫ, тӗрмере ларакансене тӑрантарма ҫӑкӑр ҫитереймӗпӗр. Пысӑк айӑплисене анчах тытса хупас пулать».\n\nҪапла, вӑхӑтне кура ҫуралать паян Яковлев-иезуит сӑнарӗ.\n\n«Яковлев – человек с хитрецой, себе на уме, осторожный на словах, в свои признаниях», – вулатпӑр Александр Жиркевич кун кӗнекинче (1917, раштав, 25).\n\n«У Мотовиловых, Зубцовых, в других домах при признании общественных заслуг Яковлева его ругают как хитрого, себе на уме, пронырливого, всюду умевшего пролезть, человека» (1918, кӑрлач, 11).\n\n«Вообще Вальяно-Штейн сделала несколько наглых выпадов против Яковлева, между прочим, сказав ему в глаза: «Вас обвиняют в том, что Вы двуличны» (1919, нарӑс, 7).\n\nЯковлев чее пулса ҫуралман. «Чӑваш час хӗрсе, ҫилленсе каять, чӑкӑлташ камӑллӑ, чунне тивертсен хӑйне хӑй чараймасар ухмахла ӗҫ туса хума та пултарать (чӑвашӑн хӗрсе каясси ман характерта та палӑрать)», – тет И.Я. Яковлев «Моя жизнь» аса илӳре (М., 1977).\n\nУнтах вӑл гимнази юлашки курсӗнче: «Вӗрентме пӗлместӗр!» – тесе Барсов преподователе йӗкӗлтенине те асӑнать. «Ман енчен ку ухмахлӑх пулнӑ», – тесе хак парать вӑл хӑйне (126 с.).\n\n«В жизни моей я вообще не умел угождать, приспосабливаться», – вулатпӑр кӗнекере (327 с.).\n\n«В ту пору я был резок на язык, говорил энергично, любя, не стесняясь, высказывать в глаза свои суждения, не стесняясь тем, нравится это другим или нет», – ку Хусан университетӗнче вӗреннӗ чунехине аса илни (172 с.).\n\nИльминский вилсен, ӑна халалласа Петербургра ирттернӗ съездра вериленнӗ пирки Яковлев ак мӗн асӑнать. Н.А. Бобровников хӑйӗн докладӗнче Ильминский гимнастика пирки мен шухӑшланине калать. Яковлева ку кӑмӑла каймасть. «Я не выдержал и, обращаясь к находившемуся тут же, в заседании, И.А. Износкову громко заявил: «Слышите ли, Илиодор Александрович? Ильминский никогда ничего подобного не мог говорить! Это принадлежит автору программы, а не Ильминскому. Вероятно, Износков нашел мою вставку в доклад неуместной, так как, сильно покраснев, мне не ответил» (432 с.).\n\nЧееленме Яковлев Н.И. Ильминскипе паллашнӑ хыҫҫӑн пуҫланӑ пулас. Вӑлах, тен, ӑна Лойола вӗрентӗвӗпе паллаштарнӑ. «Ильминский вилсен, К.П. Победоносцев ун ҫырӑвӗсене пичетлесе кӑларчӗ, – тет Яковлев, – мулласем Ильминский икӗ питлӗ пулнине, тус пек пулса, чӑннипе, вӗсене хирӗҫ вӑрттӑн кӗрешнине ӑнланса илчӗҫ» (220 с.).\n\n«Ҫыннӑн хӳрисем ахалех пӗтнӗ, – ҫырнӑ Юрий Скворцов кун кӗнекине (1973). – Хӳрисем пулнӑ пулсан, вӗсен кӑмӑлне сӑнама пит лайӑх пулӗччӗ. Сӑмахран, йӑпӑлти ҫын пуҫлӑх умӗнче тӑнӑ чухне эх! мӗнле вылятнӑ пулӗччӗ ӑна! Курма пит кӑсӑк пулмалла».\n\n«Хӳре вылятнине» паян хӑшӗ-пӗри «чӑваш стилӗ» пек курасшӑн. «Халь тӗнче ултавлӑ. Хӑвна ултавлама памалла кӑна мар, тен, хӑвӑн та улталама пӗлмелле. Атьӑр, пурте яка пулса тӑрар та тӗнчене тепӗр ҫӗнӗ стильпе тӗлӗнтерер. Ку – чӑваш стилӗ, чӑваш манерӗ, чӑваш хапи теччӗр». (Сарри Мишши. Яка чӑваш. – «Хыпар», 1977, кӑрлач, 10.).\n\nСарри ҫыравҫӑ шухӑшланӑ пек яка пулма ыйтать-ши вӑхӑт? Паян пирӗн ҫӗршывра капитализм тени шӑнман пӑр ҫине лартса ямалла тенине пӗлтерет-ши? Ҫитмӗлӗш ҫулсен ҫурринчен пуҫласа Анӑҫ социологинче, экономикинче Макс Вебер (1864 – 1920) ӗҫӗсем мала тухрӗҫ. Нимӗҫ социологӗ, историкӗ, экономисчӗ чуна парса ӗҫлеме кирлине вӗрентнӗ, ӗҫе тӗнпе, Турӑ ирӗкӗпе ҫыхнӑ. (Вулӑр: Вебер М. Протестантская этика и дух капитализма.).\n\nТӳрӗлӗх кирлине пирӗн экономистсем те ӑнланаҫҫӗ. «Нимле рынок та хальлӗхе ҫук, – терӗ Чӑваш Республикин вице-президенчӗ Лев Кураков Гуманитари наукисен институчӗн ӗҫченӗсемпе тӗл пулнӑ чух (1998, ака, 16). – Пур ӗҫре те тасалӑх, уҫӑмлӑх пулмалла. Эпӗ сирен пата уҫӑ чунпа, уҫӑ чӗрепе килтӗм».\n\n«Суя сӑмахӑн ырри ҫук», «Икӗ питлӗ ҫынна шанмаҫҫӗ», «Икӗ питлӗ ҫын ҫынна сутать», – тенӗ ваттисем. Капиталистсем пӗр-пӗринпе епле хутшӑнни пирки вулатӑн та – «ырӑ та ухмах чӑваша» (Николай Казаков композитор халӑха хак панинчен) та тӗнчере телей тупӑнасса шанма пуҫлатӑн. Ултавҫӑсене капиталистсем иккен хӑйсен хутлӑхӗнчен пӗр шелсӗр кӑларса пӑрахаҫҫӗ, хӑйсен йышне тек илмеҫҫӗ.\n\nИ.Я. Яковлев та чееленсе хӑйӗн пурнӑҫ ҫулне самай хӗстернӗ. «Про меня постоянно распускалась клевета в том смысле, что я нажил себе незаконными путями состояние, нагрев, так сказать, руки около Чувашской школы», – тет вӑл аса илӳре (544 с.). Пурӑна-киле ӑна та, чӑвашсене те хула ҫыннисем шанми пулнӑ, хирӗҫ тӑра пуҫланӑ.\n\n«Ҫапла шкул ачисене усрамалӑх ҫуртсем ҫавӑрса ҫитернӗ, –   ҫырать М.П. Петров-Тинехпи «Чӗмпӗрти чӑваш шкулӗпе И.Я. Яковлев ҫинчен кӗскен каласа кӑтартни» кӗнекере (Шупашкар, 1928, 55 с.). – Вӗсене тӑвас пирки Иван Яковлевич округра нумай йӗрӗнтернӗ тата нумай ҫынсенчен те пулӑшу кӑларса илме пӗлнӗ. Ҫавӑнпа ӑна «лиса-строительница» теме пуҫланӑ».\n\n«Шкул палӑра пуласанах, кӗвӗҫӳ тата хирӗҫ тару ҫуралчӗ (ку вӑл вырӑс характерӗн палли)», – ҫапла, сӑмахран, ӑнлантарать  Яковлев хӑйӗн пирки ҫӳрекен усал сӑмах-юмаха. Тӗп сӑлтавӗ, ман шутпа, Яковлев чееленме хӑтланнинче.\n\n«Со мной носились, меня ласкали, отмечали», – аса илет вӑл ҫамрӑк чухнехи вӑхӑта 158 с.). Чееленме пӗлмен Яковлева пурте пулӑшма тӑрӑшнӑ. Аса илнинчен: «Пожертвования на общежитие-школку, по мере пробуждения к ней интереса и со строны начальства и  со стороны общества, начали понемногу поступать. Представители симбирского общества – Лазаревы, Языковы, Назарьев и другие, устроив ряд любительских спектаклей, часть доходов отделили на общежитие, что составило сумму в тысячу с лишком рублей, которую я положил в Банк взаимного кредита на мое имя. Это было в первый год пребывания моего в университете. Сумму эту я, по мере надобности расходовал на общежитие» (141 с.).\n\nЧеепе мала каяймӑн, нумай пурӑнаймӑн, тет чӑваш. Ҫакна И.Я. Яковлев букварӗнче пичетленне «Суеҫӗ» калав та ҫирӗплетет:\n\n«Пӗр ача хирте сурӑхсем кӗтсе ҫӳрет тет. Кашкӑр куран пекки туса ҫынсене:\n\n- Килӗр кунта! Кашкӑр пур, кашкӑ-ӑ-ӑр! – тесе  кӑшкӑра пуҫларӗ тет.\n\nҪынсем чупса пычӗҫ тет, кашкӑрӗ ҫук та тет. Ҫапла ку пӗрре улталарӗ тет, тепре те улталарӗ тет. Хай ача ҫынсене чӑн-чӑнах кӑшкӑра пуҫларӗ тет. Каллех суеҫтерни пулӗ тесе ҫынсем пӗри те пыракан ҫук тет кун патне. Никам ҫуккине кура кашкӑр ачанӑн пӗтӗм кӗтӗвне пӑва-пӑва тухре тет.\n\nПӗрре улталӑн, иккӗ улталӑн, виҫҫӗмӗшӗнче макӑран теҫҫҫӗ ваттисем – ҫав ӗнтӗ вӑл».\n\nХӑш-пӗр ӗҫре чееленме пӗлни, тен, кирлӗ те (калӑпӑр, дипломатире), анчах халӑха, уйрӑмах интеллигенцине вал кирлӗ мар. Библи те тӳрӗ ҫулпа ҫуреме вӗрентет: «Тӳрӗ ҫулпа ҫӳрекен Турӑран хӑрать»,  «Камӑн  ҫулӗ кукӑр, ҫав Турра ӗненмест», «Чӑнлӑх ҫулӗ ҫинче – чӗрӗлӗх, кунта вилӗм ҫук»…\n\nЧӑваша ӑс, тӗплӗлӗх, асӑрхануллӑх ҫӑлнӑ.\n\nЧӑвашӑн, ман шутпа, чеелӗхе мар – урӑххине вӗренмелле, аса илмелле. Халӑха ҫапакан е ҫапӑнакан пулӑмсене усса ҫавӑрма. Ку вӑл чеелӗх мар – пурнӑҫ вӑйӗ, вӑййи…\n\nИосиф Дмитриев ҫак шухӑша ҫапла палӑртать:\n\nЭп тӑларан тӑлла ҫавратӑп,\n\nКаҫ хуринчен кӑвайт хуратӑп.\n\n(«Камитҫӗ»)\n\n19 ӗмӗр вӗҫӗнче–20 ӗмӗр пусламӑшенче чаваш ӗҫне тӑвакансем халӑх пуласлӑхне чеелӗхпе мар – ӑспа, тӗплӗлӗхпе ҫыхнӑ. Акӑ мӗн ҫырнӑ, тӗслӗхрен, Кӗркури С. ятлӑ сӑвӑҫ «Хыпар» хаҫатра (1917, 53 №):\n\nМухтав тӗплӗ чӑваша!\n\nМухтав ӑслӑ йӑваша!\n\nПил пултӑрах халӑха,\n\nҪӑмӑллатма пурнӑҫӑ!\n\n(«Халӑх сисрӗ»)\n\nЧӑваш патшалӑх гуманитари ӑслӑлӑхӗсен институт архивӗнче чеелӗх пирки упранакан юрра та (1 уйр., 86 упр. ед.) ҫитерес килет вулакан патне:\n\nАтте пачӗ хура ӑйӑр,\n\nХуса вӗлертӗр терӗ пуль.\n\nЭпир хамӑр чее-ҫке,\n\nҪӑварлӑхламасӑр ҫӳреместпӗр.\n\n\n\nАпи пачӗ хура ӗне,\n\nТӗксе вӗлертӗр, терӗ пуль.\n\nЭпир хамӑр чее-ҫке.\n\nКӑкармасӑр сумастпӑр.\n\n\n\nАнатолий  Миттов ӳкерчӗкӗ. С. Ю. Ювенальев ӳкерсе илнӗ."
      ],
      "response": "Илья Царевский (Илья Фёдоров) 21 çулта. Вăл Çĕнĕ Шупашкартан тухнă волейболçă, Раççей чемпионĕ. Хусанти «Зенит» командинче 2017 çултанпа вылать.",
      "reference": "Илья Царевский 31 ҫулта.",
      "faithfulness": 0.0,
      "context_precision": 0.0,
      "context_recall": 0.0,
      "answer_relevancy": 0.4522025832498497
    },
    {
      "question": "Илья Царевский 2013 ҫултанпа мӗнле тивӗҫре ӗҫленӗ?",
      "user_input": "Илья Царевский 2013 ҫултанпа мӗнле тивӗҫре ӗҫленӗ?",
      "retrieved_contexts": [
        "Ҫӗнӗ Шупашкар каччи, Илья Фёдоров, воллейбол енӗпе Раҫҫей чемпиоантӗнче ҫӗнтернӗ. Каччӑ Хусанти «Зенит» командӑра вылять. Хусанти команда Мускаври «Динамӑна» ҫӗнтернӗ.\n\nИлья — 21 ҫулта. Хусанти «Зенит» йышӗнче вӑл 2017 ҫултанпа вылять. Унччен маларах каччӑ командӑпа пӗрлРаҫсей кубокӗнче ҫӗнтернӗ кӑна мар, Ҫамрӑксен хушшинче Европа чемпионӗ пулса тӑнӑ.",
        "«Ирӗклӗ сӑмах» пӗлтернӗ тарӑх, чӑваш поэчӗ тата журналисчӗ Илле Иванов тӗрӗк культурине пысӑк тӳпе хывнӑшӑн тӗнче премине тивӗҫнӗ. Тӗрӗссипе, чыслав пуш уйӑхӗн вӗсӗнчех иртнӗ-ха. Ун чухне Турцири Эскишехир хулинче, 2013 ҫулта тӗрӗк халӑхӗн культурин тӗп хулин ятне тивӗҫнӗскерте, уяв пулнӑ. Унта Чӑваш Енрен Илле Ивановсӑр пуҫне Олег Цыпленков тата Маргарита Ильина журналистсем, Праски Витти ӳнерҫӗ, Чӑваш патшалӑх юрӑпа ташӑ ансамблӗ те кайнӑ.\n\nИлле Иванова, ытти лауреат пекех, плакетпа (медаль тӗсӗ) чысланӑ, Эскишехир кӗпӗрнаттарӗн тав хутне панӑ. Чыслава ҫавӑн пекех Тӗрӗк культурин пӗтӗм тӗнчери организацийӗн тӗп секретарӗ Дюсен Касеинов, Турци вӗренӳ министрӗ Наби Авчи хутшӑннӑ. Эскишехир тӗрӗк халӑхӗн культурин тӗп хулин ятне Хусана панӑ.\n\nИлле Иванов — ЧР тава тивӗҫлӗ культура ӗҫченӗ, Митта Ваҫлейӗн фондне тата тӗрӗк тӗнчин культурин чӑваш центрне йӗркелекенӗ. 1993 ҫулта вӑл Ҫемен Элкер ячӗллӗ премине тивӗҫнӗ. 2005 ҫулта Абдюльхак Хамид ячӗллӗ премине илнӗ.",
        "Елчӗк районӗнчи Чӑваш Тӑрӑмӗ ялӗнче пурӑнакан Илья Степанович Волков 100 ҫул тултарнӑ. Вӑл юбилейне Илле кунӗнче, ҫурла уйӑхӗн 2-мӗшӗнче, паллӑ тунӑ.\n\nИлья Степанович – Тӑван ҫӗршывӑн Аслӑ вӑрҫин ветеранӗ. Юбилей ячӗпе ун патне РФ Президентӗнчен Владимир Путинтан саламлӑ ҫыру килнӗ. Ҫавӑн пекех ӑна парнесемпе хавхалантарнӑ.\n\nПӗр ӗмӗре хыҫа хӑварнӑ Илья Волков пурне те сывлӑх, 100 ҫула пурӑнса ҫитме суннӑ.",
        "Шупашкарти Ҫӗнӗ хула текен микрорайонти  урамсенчен пӗрне Чӑваш Енри патшалӑхӑн, политикӑн тата обществӑн паллӑ ӗҫченӗн Илья Проко­пьевӑн ятне пама йышӑннӑ. Ӗслӗ хута республикӑн тӗп хулин администрацийӗн пуҫлӑхӗ Алексей Ладыков ака уйӑхӗн 4-мӗшӗнче алӑ пуснӑ.\n\nИлья Прокопьев пӗлтӗрхи нарӑс уйӑхӗн 20-мӗшӗнче пурнӑҫран уйрӑлнӑччӗ. Вӑл ун чухне 91 ҫула кайнӑччӗ. «Пысӑк чун-чӗреллӗ, пултаруллӑ ертӳҫӗн, ячӗ Чӑваш Республикин тата Раҫҫейӗн историйӗнче ылтӑн саспаллисемпе ҫырӑннӑ ҫын», — тесе ҫырнӑччӗ некрологра.\n\nШӑп та лӑп тепӗр ҫулталӑкран Чӑваш Ен Элтеперӗ Михаил Игнатьев Илья Прокпьевӑн ятне асра тытасси ҫинчен калакан указа алӑ пуснӑччӗ. Ҫав хута ӑнлантарнинче Шупашкарти урамсенчен пӗрне Илья Прокопьев ятне парасси пирки те каланӑччӗ.",
        "Ҫитес ҫул Чӑваш Енре мӗнле ҫулталӑк пулӗ? 2018 ҫулта Чӑваш Ҫуттакӑларуҫи Иван Яковлев ҫуралнӑранпа 170 ҫул ҫитет. Ҫавна май Чӑваш Енре ҫитес ҫула Иван Яковлева халаллама йышӑннӑ. Аса илтерер: Яван Яковлевич 1848 ҫулхи ака уйӑхӗн 25-мӗшӗнче ҫуралнӑ.\n\nҪуттакӑларуҫӑн пултарулӑх еткерне асра тытас тесе тата ҫавра ҫула шута илсе ЧР Культура министерстви ҫитес ҫула Иван Яковлев ҫулталӑкӗ пулнине пӗлтерме хушу проектне хатӗрленӗ. Ӑна каярахпа ЧР Элтеперӗ Михаил Игнатьев алӑ пусӗ.\n\nПалӑртса хӑварар: Иван Яковлев Атӑлҫи тата Урал тӑрӑхӗнчи халӑхсене ҫутта кӑларас, вӗрентес тесе нумай тӑрӑшнӑ, наци кадрӗсем хатӗрленӗ.\n\nСӑмах май, Чӑваш Енре 2015 ҫул Константин Иванов ҫулталӑкӗ пулнӑ."
      ],
      "response": "Илья Царевский (или Илья Иванов, поэт тата журналист) 2013 ҫултанпа тӗрӗк культурине пысӑк тӳпе хывнӑшӑн тӗнче премине тивӗҫнӗ. Преми пуш уйӑхӗн вӗсӗнче Турцири Эскишехир хулинче — тӗрӗк халӑхӗн культурин тӗп хулин ятне тивӗҫнӗскерте — иртнӗ.\n\nЧыслава Тӗрӗк культурин пӗтӗм тӗнчери организацийӗн тӗп секретарӗ Дюсен Касеинов тата Турци вӗренӳ министрӗ Наби Авчи хутшӑннӑ. Илле Иванова плакетпа (медаль тӗсӗ) чысланӑ, Эскишехир кӗпӗрнаттарӗн тав хутне панӑ.\n\nИлле Иванов — Чӑваш Республикин тава тивӗҫлӗ культура ӗҫченӗ, Митта Ваҫлейӗн фондне тата тӗрӗк тӗнчин культурин чӑваш центрне йӗркелекенӗ. 1993 ҫулта вӑл Ҫемен Элкер ячӗллӗ премине, 2005 ҫулта Абдюльхак Хамид ячӗллӗ премине илнӗ.",
      "reference": "Вӑл воспитани парас тата социаллӑ ӗҫ енӗпе проректор пулнӑ.",
      "faithfulness": 0.8125,
      "context_precision": 0.0,
      "context_recall": 0.0,
      "answer_relevancy": 0.559730467529205
    },
    {
      "question": "Илья Царевский академине хӑҫан пӗтернӗ?",
      "user_input": "Илья Царевский академине хӑҫан пӗтернӗ?",
      "retrieved_contexts": [
        "Чӑваш патшалӑх ял хуҫалӑх академийӗнче — каллех улшӑнусем. Аслӑ шкула вӑхӑтлӑх урӑх ҫын ертсе пыни пирки сайтра хыпар паян ирех тухнӑ.\n\nРектор тивӗҫне вӑхӑтлӑха 31 ҫулти Илья Царевский пурнӑҫлӗ. Вӑл 2013 ҫултанпа воспитани парас тата социаллӑ ӗҫ енӗпе проректор пулнӑ.\n\nИлья Царевский хӑй те ял хуҫалӑх акдемийӗнчен 2006 ҫулта вӗренсе тухнӑ. Вӑл ветеринари факультетӗнче ӑс пухнӑ.\n\nАса илтерер: чӳк уйӑхӗн вӗҫӗнче Чӑваш патшалӑх ял хуҫалӑх академийӗн ректорӗн тивӗҫӗсене 69 ҫулти Александр Акимов пурнӑҫлама тытӑннӑ. Ун чухне вӑл ку должноҫре ҫӗнӗ ректора суйличчен пулнине каланӑччӗ.",
        "Чӑваш Ене 14 ҫул ертсе пынӑ Илья Прокопьев ӗнер 90 ҫул тултарнӑ. Ҫав ҫынна халалласа республикӑри массӑллӑ информаци хатӗрӗсем ҫине тӑрсах статья ҫине статья шӑрҫаларӗҫ.\n\nӖнер республикӑн наци вулавӑшӗнче Илья Павловичӑн юбилейне паллӑ тунӑ. Унта тӗрлӗ шайри тӳре-шара кӑна мар, РФ Патшалӑх Думин депутачӗ Анатолий Аксаков та хутшӑннӑ.\n\nУнта пухӑннӑ шур сухалсенчен хӑшӗсем хӑйсен иртнӗ ӗмӗрти ӗҫӗ-хӗлӗ пирки аса илнӗ.\n\nИлья Прокопьев Вӑрнар районӗнчи Мӑчамӑш ялӗнче ҫуралнӑ. Малтанхи пӗлӗвӗпе вӑл — педагог: Хабаровскри пединститутра вӗреннӗ. И.Н. Ульянов ячӗллӗ Чӑваш патшалӑх университетӗнче те ӗҫленӗ. Пурнӑҫӑн тӗп пайне вара парти ӗҫ-хӗлне панӑ.\n\nЧӑваш Ен Элтеперӗн йышӑнӑвӗпе ӗнер «Чӑваш Республики умӗнче тунӑ тава тивӗҫлӗ ӗҫсемшӗн» орденпа чысланӑ.",
        "Ҫӗнӗ Шупашкар каччи, Илья Фёдоров, воллейбол енӗпе Раҫҫей чемпиоантӗнче ҫӗнтернӗ. Каччӑ Хусанти «Зенит» командӑра вылять. Хусанти команда Мускаври «Динамӑна» ҫӗнтернӗ.\n\nИлья — 21 ҫулта. Хусанти «Зенит» йышӗнче вӑл 2017 ҫултанпа вылять. Унччен маларах каччӑ командӑпа пӗрлРаҫсей кубокӗнче ҫӗнтернӗ кӑна мар, Ҫамрӑксен хушшинче Европа чемпионӗ пулса тӑнӑ.",
        "Ӗнер, пушӑн 19-мӗшӗнче, Чӑваш наци вулавӑшӗнче академиксем пухӑнчӗҫ. Кун йӗркинчи тӗп ыйту хушшинче академие ҫӗнетни, унӑн ҫӗнӗ уставӗпе паллашни тата пайташсене ҫӗнӗлле регистрацилесси пулчӗ. Академи ячӗ те ҫӗнелнӗ — халӗ вӑл Чӑваш халӑх ӑсхакӑлӗпе ӳнер академийӗ ятлӑ.\n\nАкадемиксен пуш уйӑхӗн ирформациллӗ пухӑвӗнче ытти чылай ыйтӑва сӳтсе яврӗҫ, тунӑ ӗҫӗсемпе паллашрӗҫ. Академипе патшалӑх хушшинчи юлашки вӑхӑтри хутшӑнусем пирки каласа пачӗҫ, обществӑлла пӗрлешӳн ирӗкӗсемпе тивӗҫӗсемпе паллаштарчӗҫ. Уйрӑмах академи ӗҫӗсен шайне ӳстересси пирки тӗплӗ калаҫрӗҫ. Редакци уйрӑмӗ йӗркелесе ун пуҫлӑхне Эдиссон Патмара лартрӗҫ. Хӑш-пӗр кӗнекесен (уйрӑмах Иван Дубановӑн «Географические названия Чувашской Республики» кӗнекене сӳтсе яврӗҫ) шайӗ пӗчӗк пулни хӑш-пӗрисене чӑн та пӑшӑрхантарать. Ӳстерес тӗлӗшпе малашне кӗнеке тухиччен рецензи ҫырмалли пирки калаҫса татӑлчӗҫ. Рецензи ҫыракансем кӗнекешӗн авторпа пӗр тан яваплӑ пуласси пирки пӗлтерчӗҫ.\n\nЧӗмпӗртен килнӗ Фёдор Искандеров («Азбука чувашских орнаментов и эмблем» альбом авторӗ) хӑйӗн манифесчӗпе паллаштарчӗ. Итлекенсем вӑл текста улшӑнусем кӗртсе ҫемҫетме тата халӑх патне ҫитерме сӗнчӗҫ.\n\nПухура 10 ҫӗнӗ пайташа илчӗҫ. Академи пайташӗсен кӑмӑл-сипечӗпе сумлӑхне хӑпартас тӗлӗшпе 11 ҫынна ваттисен канашне суйларӗҫ — Виталий Станьяла, Денис Гордеева, Эдиссон Патмара, Станислав Отрыванова (аттестаци комисси пуҫлӑхӗ) тата ыттисене.\n\nВӗҫленес умӗн «Атӑлпа Урал таврашӗнчи ҫутҫанталӑка тӗпчеҫ ыйтусем» ятпа дискусси иртрӗ. Итлекенсем нумаях пулмарӗҫ пулин те пирӗн тӑрӑхра виноград е груша епле ӳстересси вӗсемшӗн кӑсӑклӑ пулчӗ.\n\nТепӗр пуху чӳкӗн 26-мӗшӗнче иртмелле.\n\n\n\nСӑнсем (23 сӑн, В. Милютин тунисем)",
        "Паян ЧР премьер-министрӗ Иван Моторин Юрий Исаева ЧР Вӗренӳ интститучӗн ректорӗн должноҫне парасси пирки хушу алӑ пуснӑ.\n\nАса илтерер: кӑҫалхи кӑрлач уйӑхӗччен вӑл ЧР вӗренӳ министрӗ пулнӑ. Кайран ЧР Элтеперӗ Михаил Игнатьев ӑна отставкӑна ярса хӑйӗн администрацийӗн ертӳҫин ҫумне лартнӑ. Ҫав вӑхӑталлах ЧР Вӗренӳ институчӗн унчченхи ректорне Сергей Савина ӗҫрен кӑларнӑ.\n\nЮрий Исаев 1969 ҫулхи нарӑсӑн 13-мӗшӗнче Патӑрьел районӗнчи Нӑрваш Шӑхаль ялӗнче ҫуралнӑ. 1995 ҫулта И.Н.Ульянов ячӗллӗ ЧПУ пӗтернӗ, «Чӑваш чӗлхи тата литература» специальноҫе алла илнӗ. Унтан вӑл юриста вӗреннӗ. Юрий Николаевич – филологи ӑслӑлӑхӗсен докторӗ, доцент. Вӑл – 80 ытла вӗренӳпе методика ӗҫӗсен авторӗ. Вӗсенчен 5-шӗ – монографи."
      ],
      "response": "Илья Царевский Чӑваш патшалӑх ял хуҫалӑх академийӗнче 2006 ҫулта вӗренсе тухнӑ. Вӑл ветеринари факультетӗнче ӑс пухнӑ. Аслӑ шкултан тухнӑ хыҫҫӑн вӑл академире воспитани парас тата социаллӑ ӗҫ енӗпе проректор пулса ӗҫленӗ. Ҫӑва 2013 ҫултанпа пурнӑҫланӑ. Паян академире улшӑнусем тухнӑ, ректор тивӗҫне вӑхӑтлӑха Илья Царевский пурнӑҫлама тытӑннӑ. Вӑл 31 ҫулта. Чӳк уйӑхӗн вӗҫӗнче академие Александр Акимов (69 ҫулти) ертсе пынӑ, ҫӑва ректора суйличчен пулнӑ чухнехи тивӗҫӗ пулнӑ. Илья Царевский ҫӗнӗ вӑхӑтлӑх ректор пулса академи ертсе пырать.",
      "reference": "Вӑл академине 2006 ҫулта пӗтернӗ.",
      "faithfulness": NaN,
      "context_precision": 0.9999999999,
      "context_recall": 1.0,
      "answer_relevancy": 0.34035038562341646
    },
    {
      "question": "Илья Царевский хӑш факультетра вӗреннӗ?",
      "user_input": "Илья Царевский хӑш факультетра вӗреннӗ?",
      "retrieved_contexts": [
        "Чӑваш патшалӑх ял хуҫалӑх академийӗнче — каллех улшӑнусем. Аслӑ шкула вӑхӑтлӑх урӑх ҫын ертсе пыни пирки сайтра хыпар паян ирех тухнӑ.\n\nРектор тивӗҫне вӑхӑтлӑха 31 ҫулти Илья Царевский пурнӑҫлӗ. Вӑл 2013 ҫултанпа воспитани парас тата социаллӑ ӗҫ енӗпе проректор пулнӑ.\n\nИлья Царевский хӑй те ял хуҫалӑх акдемийӗнчен 2006 ҫулта вӗренсе тухнӑ. Вӑл ветеринари факультетӗнче ӑс пухнӑ.\n\nАса илтерер: чӳк уйӑхӗн вӗҫӗнче Чӑваш патшалӑх ял хуҫалӑх академийӗн ректорӗн тивӗҫӗсене 69 ҫулти Александр Акимов пурнӑҫлама тытӑннӑ. Ун чухне вӑл ку должноҫре ҫӗнӗ ректора суйличчен пулнине каланӑччӗ.",
        "Сире улталаҫҫӗ тесе ан шутлӑр. Паян кулӑш кунӗ пулин те мероприятисем чӑннипех иртеҫҫӗ.\n\n\n\nЫйтӑвӗсем вара ҫапла:\n\n1. “Я не раз перечитывал книги Ивана Яковлевича Яковлева, чье имя носит ваш университет. И всегда обнаруживал в них важную мысль – образование должно быть построено на духовном просвещении, воспитании и нравственном совершенствовании.”  Ҫак сӑмахсене кам тата хӑҫан каланӑ?\n\n2. Ӳ саспаллипе хӑш ҫултан пуҫласа усӑ курма тытӑннӑ?\n\n3. 1871 ҫулта 2-мӗш Александр патшана И. Я. Яковлев хӑш хулара курнӑ тата асаилӳре ӑна мӗнле хак парать?\n\n4. И.Я. Яковлев ҫырнӑ тӑрах вӑл 1857 ҫулхи юпа уйӑхӗнче комета курать. Икӗ эрне ытла тӳпере курӑнса тӑнӑ кометӑн ячӗ мӗнле-ши?\n\n5. И.Я. Яковлев ҫӗр виҫсе ҫӳренӗ чухне миҫе тенкӗ шалу илнӗ тата чаплӑ кӗрӗк ҫӗлетересси миҫе ҫула тӑсӑлнӑ?\n\n6. И.Я. Яковлева пӗлекенсем вӑл вӑхӑтран вӑхӑт кӑштах уксахланине палӑртаҫҫӗ. Хӑҫан тата мӗн пулнӑ-ши Иван Яколвлевичпа?\n\n7. Чӗмпӗрти ар гимназине кӗме Иван Яковлевич Яковлевӑн миҫе экзамен тытмалла пулнӑ?\n\n8. XIX ӗмӗрти 70-мӗш ҫулсенче Чӗмпӗрте пурӑнакансем ҫулталӑкра пӗрре ик эрнелӗхе хваттер ярса 2-3 ӗне туянма пултарнӑ. Ҫав кунсенче хваттер  ярасси мӗн сӑлтавпа хакланнӑ?\n\n9. Вырӑссен паллӑ писателӗпе Л. Н. Толстойпа И. Я. Яковлев мӗнле пӗр пек ӗҫсем тунӑ, вырӑс классикӗ чӑваш улӑпӗн ӗҫне мӗнле хак панӑ?\n\n10. Иван Яковлевич Яковлев паянхи техучилищӗсем тата ача сачӗсем евӗрлӗ вӗренӳ учрежденийӗсене те пуҫласа йӗркеленӗ. Ӑҫта вырнаҫнӑ-ши чи малтанхисем?\n\n11. Иван Яколевич Яковлева сӑнӳкерчӗксенчи ҫынсемпе кам ҫывӑхлатнӑ-ши? Унӑн, ҫывӑхлатаканӑн, чӑваш шкулӗпе ҫыхӑннӑ пӗлтерӗшлӗ  ӗҫӗ ҫинчен кӗскен каласа парӑр.\n\n12. И.Я. Яковлев венгрсен хӑш ученӑйӗсемпе тӗл пулнӑ?\n\n\n\nХуравсене ака уйӑхӗн 6-мӗшӗччен ярса памалла.\n\n\n\nХуравсене ӑҫта ярса памаллине, епле хуравламаллине Педканаш сайтӗнче тупма пулать: http://pedkanash.chuvash.org",
        "И.Н. Ульянов ячӗллӗ Чӑваш патшалӑх университечӗ Уҫӑ алӑксен кунне онлайн мелпе унччен те ирттернӗ. Хальхинче ун пеккине машиностроени факультечӗ йӗркелӗ. Вӑл паян, ака уйӑхӗн 18-мӗшӗнче, 12 сехет те 30минутра пуҫланӗ.\n\nАслӑ шкулӑн машиностроени факультетӗнчи специальноҫсем, унта вӗренме кӗрес тесен мӗнле экзаменсем тытмалли ҫинчен каласа кӑтартӗҫ. Уҫӑ алӑксен кунне хутшӑнакансем ытти чылай ыйтӑва та уҫӑмлатайӗҫ. Вӗсене факультетӑн деканӗ Виктор Адольфович Гартфельдер профессор хуравлӗ. Унсӑр пуҫне студентсем, аслӑ шкултан вӗренсе тухнисем, партнер-компанин пайташӗсем калаҫӑва хутшӑнӗҫ.\n\nТӳрӗ эфира ЧПУ «Контактра» халӑх ушкӑнӗнче https://vk.com/chuvsu страницӑра ирттерӗ.\n\nЫйтусене ҫакӑнта https://forms.gle/2BrsvGQ2J5BVGK6Q7 йышӑнаҫҫӗ.",
        "Нарӑсӑн 19-мӗшӗнче Чӑваш филологийӗпе культура факультетӗнче «Уҫӑ алӑксен кунӗ» иртрӗ. Факультет преподавателӗсем пулас абитуриентсемпе тӗл пулса калаҫрӗҫ, факультет ӗҫӗ-хӗлӗ ҫинчен каласа пачӗҫ, вӗрентӳ тата йышӑну йӗркипе тӗплӗн паллаштарчӗҫ, абитуриентсен ыйтӑвӗсем ҫине хуравларӗҫ. Хӑнасем факультет ӗҫӗ-хӗлне ҫутатса паракан презентацисене курчӗҫ. Тӗлпулӑва абитуриентсем хамӑр республикӑн районӗсенчен кӑна мар, Тутарстанри Ҫӗпрел районӗнчен те килнӗ. Факультетри студентсем хушшинче кӳршӗлле республикӑсенчен вӗренме килнӗ студентсем сахал мар, вӗсен йышӗ ӳсессе эпир шансах тӑратпӑр! Хапӑл туса кӗтетпӗр!\n\nТӗлпулӑва килейменнисене ҫак адреспа ҫыру ҫырса ыйтусем пама пултараҫҫӗ: irinakir1@mail.ru.",
        "Шӑматкун, ҫӗртмен 14-мӗшӗнче, И.Н. Ульянов ячӗллӗ Чӑваш патшалӑх университечӗн ӑслӑлӑх канашлӑвӗ йышӑннӑ тӑрӑх филологи факультетне, чӑваш филологийӗпе культура факультетне тата журналистика факультетне утӑн 1-мӗшӗнчен пӗрлештерме йышӑнни ҫинчен хыпар тухнӑ пулнӑ.\n\nЧПУ студентсен канашлӑвӗнче пӗлтернӗ тӑрӑх ҫӗнӗ факультетӑн декан ӗҫ-хӗлне филологи ӑслӑлӑхӗсен докторӗ, профессор Корнилов Геннадий Емельянович тытса пырӗ.\n\nВиҫӗ кафедрӑна пӗрлештернӗ майпа йӗркеленнӗ «Журналистика» ҫӗнӗ кафедрӑн ертсе пыраканӗ вара Данилов Анатолий Порфирьевич пулӗ. Вӑлах университетӑн пресс-центр ӗртӳҫи ӗҫне пурнӑҫласа пырӗ.\n\nҪӗнӗ хыпар факультет ӑсчахӗсемпе пӗрлех студентсене те самай тӗлӗнтернӗ. Нумайӑшӗ факультетсене пӗрлештернӗ йышӑнӑва ырласа каймаҫҫӗ. Студентсен канашлӑвӗнче ӑнлантарса панӑ тӑрӑх университетра вӗренсе тухнине ҫирӗплетекен диплом ҫинче факультет ятне палӑртмалла мар тесе йышӑннӑ, алла илнӗ специальноҫе ҫеҫ ҫырса парӗҫ.\n\nҪӗнӗ факультет мӗнле ятпа ҫӳрессине паянхи куна никам та ҫирӗплетсе параймасть. Ҫапах та хӑш-пӗр факультет ӗҫченӗсем пӗлтернӗ тӑрӑх ҫӗнӗ факультет ячӗ — «Вырӑс филологийӗ, чӑваш филологийӗ тата журналистика факультечӗ» (выр. Факультет русской филологии, чувашской филологии и журналистики) пулма пултарӗ."
      ],
      "response": "Илья Царевский Чăваш патшалăх ял хуçалăх академийĕнче ветеринари факультетĕнче вĕренсе тухнă. Вăл 2013 çултанпа воспитани парас тата социаллă ĕç енĕпе проректор пулнă, халь вара ректор тĕрĕсне пурнăçлать.",
      "reference": "Вӑл ветеринари факультетӗнче вӗреннӗ.",
      "faithfulness": 1.0,
      "context_precision": 0.9999999999,
      "context_recall": 1.0,
      "answer_relevancy": 0.49559966117772375
    },
    {
      "question": "Александр Акимов миҫе ҫулта?",
      "user_input": "Александр Акимов миҫе ҫулта?",
      "retrieved_contexts": [
        "Чӑваш патшалӑх ял хуҫалӑх академийӗн ректорӗн тивӗҫӗсене хальлӗхе урӑх ҫын пурнӑҫлать. Вӑл — Александр Акимов.\n\nПаян, чӳк уйӑхӗн 23-мӗшӗнче, ЧР ял хуҫалӑх министрӗ Сергей Артамонов Ял хуҫалӑх академийӗн ректорне вӑхӑтлӑха палӑртнӑ. Вӑл инженери факультетӗнче транспорт технологийӗн машинин тата комплексӗн кафедрине ертсе пырать.\n\nХушу тухсан Сергей Артамонов ҫӗне пуҫлӑхра иккӗленменнине пӗлтернӗ. Ҫавӑн пекех вӑл юлашки ҫулсенче академи Чӑваш Енри ял хуҫалӑх таварӗсене кӑларакан производительсемпе ҫыхӑну тытманнине палӑртнӑ.\n\nАлександр Акимов вара академин тӗллевсене пурнӑҫламалли майсем пуррине палӑртнӑ. ЧР Ял хуҫалӑх министерствинче пӗлтернӗ тӑрӑх, 69 ҫулти Александр Акимов Ял хуҫалӑх академине ҫӗнӗ ректор палӑртиччен ертсе пырӗ.",
        "Шупашкарти политехника институчӗн директорӗ Александр Акимов техника ӑслӑлӑхӗсен докторӗ, профессор Европӑри ӑслӑлӑхпа промышленноҫ палати ҫирӗплетнӗ Пахалӑх дипломне тата ылтӑн медале тивӗҫнӗ. Ҫӳллӗ шайри наградӑна ӑна «педагогикӑри тата ӑслӑлӑхри пысӑк пахалӑхлӑ ӗҫсемшӗн» панӑ. Маларах ун пеккине Л.М. Рошаль тата Л.А. Бокерия, Е.И. Чазов профессорсем тата ҫӗршыври ытти хӑш-пӗр паллӑ ҫын тивӗҫнӗ иккен.\n\nҪӳлерех асӑннӑ палатӑн Раҫҫейри тата СНГри элчелӗхне 1992 ҫултах йӗркеленӗ. Вӑл ӑслӑлӑхри, культурӑри, производствӑри, вӗрентӳри ҫитӗнӳсене палӑртса патшалӑх тата уйрӑм ҫынсем енчен пулӑшассипе ҫине тӑрать иккен.",
        "Хӑш чух, пушӑ вӑхӑт тупӑнсан, эпӗ ҫынсем Тӗнче тетелӗнсе мӗн шыранине пӗлес йытупа апаланса ларкалатӑп. «Яндекс.ру» шыравҫӑна тӗпе хурса тӗпчетӗп. Калас пулать, тӗлӗнмелле ыйтусем параҫҫӗ тетел хӑнисем. Чи пӗрремӗш вырӑнта «Мӗн вӑл…?» ыйту ларать иккен. Юрату мӗнне пӗлесшӗннисем вара чи йышлисем. Романтика! Ун хыҫҫӑн «Эп ухмах пулсассӑн, ман мӗн тумалла?» ыйту вырнаҫнӑ. Сӑмахран, арҫынсем вӑл ыйтупа муритленмеҫҫӗ. Тӗнче тетелӗ вара ҫак ыйту ҫине 5 млн. хурав парать иккен! «Мӗнле?» — ҫак ыйтупа тухакансем иккӗмӗш вырӑнта тӑраҫҫӗ. Суши апата мӗнле майпа ҫимеллине пӗлес шухӑшлисем малта. Унтан вара мӗнле тӗрӗс чуп тумаллине ыйтакансем. Виҫҫӗмӗш вырӑнтисем  начарланас хуйхӑпа аппаланаҫҫӗ имӗш. «Ӑҫтан укҫа тупас?», «Ӑҫта-ши ман савни?». Юлашки ыйту ҫине 300 порносайт тухса тӑрать. «Кам?», «Кам куна тунӑ?» ыйтусемпе те сахал мар муритленекенсем. «Ҫывӑракан ҫына мӗншӗн фотоаппаратпа ӳкерме юрамасть?», — тесе йытаканнисем те чылай.\n\nПӗррехинче В. Путин телевиденире «Ку сакӑр ҫул эпӗ галера ҫинчи чура евӗрех ӗҫлерӗм (как раб на галерах)», — тенӗ пулать. Тахӑшне «как краб на галерах» тесе илтӗннӗ те, вӑл, паллах, тетелте — «Мӗншӗн Путин краб?» — ыйтса пӗлесшӗн пулнӑ. Ку кӑна та мар, Путина краб евӗр ӳкерсе кӑтартнисем те тупӑнкалаҫҫӗ.\n\nСергей Курехин, паллӑ юрӑҫ, композитор, 1991-мӗш ҫулта Ленин наркӑмӑшла кӑмпа ҫиме юратнӑ пирки хӑй те кӑмпа пулса тӑнӑ тесе телевиденире каласа хунӑ тет. Халӑх вара хурава тетелте шырать — «Владимир Ильич мӗнле майпа кӑмпа пулса тӑнӑ-ши?» — тесе кӑсӑкланать.\n\nЭ-э-х! Шеремет тӗнчи, ӑҫта пырса ҫапӑнмастпӑр-ши, этемсем!",
        "Раҫҫейри велоҫулҫӳревҫӗ Алексей Ильмухин Питӗртен Владивостока ҫитме палӑртнӑ. Унӑн 11 пин ҫухрӑма парӑнтармалла. Хӑйӗн ҫулҫӳревне вӑл Ҫӗнтерӳ пулнӑранпа 80 ҫул ҫитнине халалланӑ.\n\nҪула май Алексей Чӑваш Ене кӗрсе тухнӑ. Ахальтен мар. Унӑн ашшӗ тата аслашшӗ – Улатӑр тӑрӑхӗнчи йӑхран.\n\nАлексей Шупашкарта «Ӗҫ мухтавӗн хули» стела патӗнче чарӑнса сӑн ӳкерӗннӗ. Хостелта ҫӗр каҫнӑ хыҫҫӑн вӑл каллех ҫула тухнӑ: Урал, Ҫӗпӗр урлӑ — Инҫет Хӗвелтухӑҫне.",
        "Ямалти ҫулҫӳревҫӗ Алексей Коротков «Ермак ҫулӗ» ҫӗнӗ маршрут хатӗрленӗ. Вӑл Ҫӗпӗр тата ытти юханшыв урлӑ выртӗ.\n\nАлексей ҫулла Чӑвашри Сӑр юханшывпа резина кимӗпе ишме палӑртнӑ. Ҫамрӑкскер ҫулҫӳревре тӑватӑ ҫул пулӗ.\n\nАлексей Коротков палӑртнӑ тӑрӑх, ҫул ҫине вӑл 100 пин тенке яхӑн тӑкаклама палӑртнӑ. Ытларах пайӗ кимӗ туянма кайӗ. Хӑйӗнпе пӗрле апат-ҫимӗҫ илесшӗн. Капла укҫа-тенкӗ сахалрах тӑкакланӗ.\n\nҪулҫӳревҫӗ шӑрӑхран та, йывӑрлӑхран та хӑрамасть. Уншӑн ку манӑҫми экспедици пулӗ. Алексей — ҫар историкӗ. Тӑватӑ ҫул каялла вӑл велосипедпа Салхардран Белгород облаҫне ҫитнӗ. 2013 ҫулта Салехардран Мускава ҫити утнӑ.\n\nСӑмах май, авӑнӑн 1-мӗшӗнче Ҫӗпӗре парӑнтарнӑ Ермак ҫуралнӑранпа 435 ҫул ҫитет."
      ],
      "response": "Александр Акимов — 69 ҫулта.\n\nВӑл хальхи вӑхӑтра Чӑваш патшалӑх ял хуҫалӑх академийӗн вӑхӑтлӑха палӑртнӑ ректорӗ пулса тӑрать. Ку тава тивӗҫлӗ инженер-ӑсчах, техника ӑслӑхӗсен докторӗ, профессор. Вӑл Шупашкарти политехника институчӗн директорӗ пулнӑ, каярахпа ЧР ял хуҫалӑх министрӗ Сергей Артамонов академире ҫӗнӗ ректор палӑртнӑччен академие ертсе пынӑ.\n\nАлександр Акимовӑн тивӗҫлӗ ӗҫӗсене палӑртас тесе Европӑри ӑслӑлӑхпа промышленноҫ палати Пахалӑх дипломне тата ылтӑн медале панӑ. Ҫак наградӑна вал «педагогикӑри тата ӑслӑлӑхри пысӑк пахалӑхлӑ ӗҫсемшӗн» тивӗҫнӗ.",
      "reference": "Александр Акимов 69 ҫулта.",
      "faithfulness": NaN,
      "context_precision": 0.9999999999,
      "context_recall": 1.0,
      "answer_relevancy": 0.4724020911205418
    },
    {
      "question": "Александр Акимов ректор тивӗҫне хӑҫан пурнӑҫлама тытӑннӑ?",
      "user_input": "Александр Акимов ректор тивӗҫне хӑҫан пурнӑҫлама тытӑннӑ?",
      "retrieved_contexts": [
        "Чӑваш патшалӑх ял хуҫалӑх академийӗн ректорӗн тивӗҫӗсене хальлӗхе урӑх ҫын пурнӑҫлать. Вӑл — Александр Акимов.\n\nПаян, чӳк уйӑхӗн 23-мӗшӗнче, ЧР ял хуҫалӑх министрӗ Сергей Артамонов Ял хуҫалӑх академийӗн ректорне вӑхӑтлӑха палӑртнӑ. Вӑл инженери факультетӗнче транспорт технологийӗн машинин тата комплексӗн кафедрине ертсе пырать.\n\nХушу тухсан Сергей Артамонов ҫӗне пуҫлӑхра иккӗленменнине пӗлтернӗ. Ҫавӑн пекех вӑл юлашки ҫулсенче академи Чӑваш Енри ял хуҫалӑх таварӗсене кӑларакан производительсемпе ҫыхӑну тытманнине палӑртнӑ.\n\nАлександр Акимов вара академин тӗллевсене пурнӑҫламалли майсем пуррине палӑртнӑ. ЧР Ял хуҫалӑх министерствинче пӗлтернӗ тӑрӑх, 69 ҫулти Александр Акимов Ял хуҫалӑх академине ҫӗнӗ ректор палӑртиччен ертсе пырӗ.",
        "Чӑваш патшалӑх ял хуҫалӑх академийӗнче пӗр уйӑхра ректор тивӗҫне пурнӑҫлакана виҫӗ хутчен ылмаштарнӑ. Хальхинче ҫак должноҫе вӑхӑтлӑх пурнӑҫлама Андрей Макушева лартнӑ. Вӑл ҫын Шупашкар районӗнче вырнаҫнӑ «Приволжское» (чӑв. Атӑлҫум) вӗренӳ хуҫалӑхӗнче пуҫлӑхра ӗҫлетчӗ. Пуҫлӑх пуканне ӑна учхоза унччен ертсе пынӑ Георгий Егоров Шупашкар район администрацине ертсе пыма тытӑннӑ хыҫҫӑн шанса пачӗҫ.\n\n«Приволжское» акционерсен уҫӑ обществи (паян унӑн харпӑрлӑх форми ҫавнашкал-мӗн. Хӑй вӑхӑтӗнче вӑл федерацин унитарлӑ предприятийӗ шутланатчӗ) — Ял хуҫалӑх академийӗн вӗренӳ хуҫалӑхӗ. Вӗренӳ заведенийӗнче ректор тивӗҫне пурнӑҫлакана иртнӗ уйӑхӑн 23-мӗшӗнчен тытӑнса виҫӗ хутчен ылмаштарнӑ.\n\nАса илтеретпӗр, ректор тивӗҫне пурнӑҫлама уйӑх каярах Александр Акимова лартнӑ, темиҫе кун каялла —  Илья Царевскине.",
        "Чӑваш патшалӑх ял хуҫалӑх академийӗнче паян ректор суйлассине эпир пӗлтернӗччӗ. Пуҫлӑх пуканне ректор тивӗҫне халӗ пурнӑҫлакан Людмила Линика шанса панӑ иккен. Уншӑн 118 ҫынтан 90-шӗ сасӑланӑ. Пӗлекенсем каланӑ тӑрӑх, суйлава академи алӑкне шал енчен питӗрсех ирттернӗ-мӗн. Унта журналистсем ҫеҫ мар, ректор пулма кандидат пулнӑ Семеновӑн шаннӑ ҫынни те кӗреймен иккен.\n\nВладимир Семенов кадидатуришӗн 25-ӗн сасӑланӑ-мӗн, Николай Кирилловшӑн — 2-ӗн.",
        "Чӑваш патшалӑх ял хуҫалӑх академийӗнче тӑрӑшакансемшӗн ыран хумхануллӑ кун пулӗ тесен те йӑнӑш мар-тӑр. Унта ыран вӗренӳ заведенийӗн ректорне суйлӗҫ.\n\nАса илтеретпӗр, иртнӗ ҫулхи раштавӑн 12-мӗшӗнче ӑсчахсен канашӗн ларӑвӗнче академи ректорне Николай Васильева кӗтмен-туман ҫӗртен ӗҫлеме пӑрахтарнӑччӗ. Яваплӑ тивӗҫе пурнӑҫлама Людмила Линик юриста шаннӑччӗ. Сӑмах май, хӑй вӑхӑтӗнче Людмила Линик Чӑваш Енӗн суйлав комиссийӗн председателӗ пулнӑччӗ. Ректора сасартӑк ылмаштарнине ун чух Раҫҫейӗн Ял хуҫалӑх министерстви аслӑ шкул (академи асӑннӑ ведомствӑна пӑхӑнать) тухӑҫсӑр ӗҫлет тесе ӑнлантарнӑччӗ. Николай Васильев вара капла хаклавпа килӗшменнине, аслӑ шкулсен тухӑҫлӑхне 2011 ҫулхи ӗҫ кӑтартӑвне кура йӗркеленине, академине вара вӑл 2012 ҫулхи ҫуркунне кӑна ертсе пыма пуҫӑннине палӑртнӑччӗ. Ректора хӳтӗлесе студентсем митинга та тухса пӑхнӑччӗ.\n\nЫран вара академин ректора суйлама тивет. Маларах, ҫӗртмен 7-мӗшӗнче, Раҫҫейӗн Ял хуҫалӑх министерствинче ректор пулма тивӗҫ кандидатурӑсене аттестацилемелли лару иртнӗ. Пирӗн республикӑран сакӑр кандидат тӑратнӑ иккен, федераци министерстви вӗсенчен виҫҫӗшне — вӗсем кашниех академире ӗҫлеҫҫӗ — суйласа илнӗ. Ҫапла вара Мускавра ырланӑ кандидатсен списокне ректор тивӗҫне халӗ пурнӑҫлакан Людмила Линик тата биологи ӑслӑлӑхӗсен докторӗсем — пӗри морфологи, физиологи тата зоогигиена кафедрин профессорӗ Владимир Семенов, тепри ҫӗр ӗҫӗпе агрохими кафедрин профессорӗ Николай Кириллов — кӗнӗ.",
        "Чӑваш патшалӑх ял хуҫалӑх академийӗнче — каллех улшӑнусем. Аслӑ шкула вӑхӑтлӑх урӑх ҫын ертсе пыни пирки сайтра хыпар паян ирех тухнӑ.\n\nРектор тивӗҫне вӑхӑтлӑха 31 ҫулти Илья Царевский пурнӑҫлӗ. Вӑл 2013 ҫултанпа воспитани парас тата социаллӑ ӗҫ енӗпе проректор пулнӑ.\n\nИлья Царевский хӑй те ял хуҫалӑх акдемийӗнчен 2006 ҫулта вӗренсе тухнӑ. Вӑл ветеринари факультетӗнче ӑс пухнӑ.\n\nАса илтерер: чӳк уйӑхӗн вӗҫӗнче Чӑваш патшалӑх ял хуҫалӑх академийӗн ректорӗн тивӗҫӗсене 69 ҫулти Александр Акимов пурнӑҫлама тытӑннӑ. Ун чухне вӑл ку должноҫре ҫӗнӗ ректора суйличчен пулнине каланӑччӗ."
      ],
      "response": "Александр Акимов Чӑваш патшалӑх ял хуҫалӑх академийӗн ректорӗн тивӗҫӗсене чӳк уйӑхӗн вӗҫӗнче пурнӑҫлама тытӑннӑ. Вӑл 69 ҫулта, ректора суйламаччен, вӑхӑтлӑх пулӑшӑвӗпе академие ертсе пырӗ. Ҫакна Чӑваш Республикин Ял хуҫалӑх министерствинчен палартнӑ.\n\nАкадемире ректор тивӗҫне пурнӑҫлакансене куннех виҫӗ хутчен улшӑннӑ. Акимов чӳк уйӑхӗн 23-мӗшӗнче вӑхӑтлӑха палӑртнӑ Илья Царевский хыҫҫӑн килнӗ. Ку тапранусем хальхи вӑхӑтра академи ертӳҫин суйлавӗпе ҫыхӑннӑ, унта федераци министерстви виҫӗ кандидата суйласа илнӗ: Людмила Линика, Владимир Семенова тата Николай Кириллова.",
      "reference": "Вӑл чӳк уйӑхӗн вӗҫӗнче ректор тивӗҫне пурнӑҫлама тытӑннӑ.",
      "faithfulness": NaN,
      "context_precision": 0.699999999965,
      "context_recall": 1.0,
      "answer_relevancy": 0.42433053189360637
    },
    {
      "question": "Академире ректор тивӗҫӗпе мӗнле улшӑну пулнӑ?",
      "user_input": "Академире ректор тивӗҫӗпе мӗнле улшӑну пулнӑ?",
      "retrieved_contexts": [
        "Чӑваш патшалӑх ял хуҫалӑх академийӗнче тӑрӑшакансемшӗн ыран хумхануллӑ кун пулӗ тесен те йӑнӑш мар-тӑр. Унта ыран вӗренӳ заведенийӗн ректорне суйлӗҫ.\n\nАса илтеретпӗр, иртнӗ ҫулхи раштавӑн 12-мӗшӗнче ӑсчахсен канашӗн ларӑвӗнче академи ректорне Николай Васильева кӗтмен-туман ҫӗртен ӗҫлеме пӑрахтарнӑччӗ. Яваплӑ тивӗҫе пурнӑҫлама Людмила Линик юриста шаннӑччӗ. Сӑмах май, хӑй вӑхӑтӗнче Людмила Линик Чӑваш Енӗн суйлав комиссийӗн председателӗ пулнӑччӗ. Ректора сасартӑк ылмаштарнине ун чух Раҫҫейӗн Ял хуҫалӑх министерстви аслӑ шкул (академи асӑннӑ ведомствӑна пӑхӑнать) тухӑҫсӑр ӗҫлет тесе ӑнлантарнӑччӗ. Николай Васильев вара капла хаклавпа килӗшменнине, аслӑ шкулсен тухӑҫлӑхне 2011 ҫулхи ӗҫ кӑтартӑвне кура йӗркеленине, академине вара вӑл 2012 ҫулхи ҫуркунне кӑна ертсе пыма пуҫӑннине палӑртнӑччӗ. Ректора хӳтӗлесе студентсем митинга та тухса пӑхнӑччӗ.\n\nЫран вара академин ректора суйлама тивет. Маларах, ҫӗртмен 7-мӗшӗнче, Раҫҫейӗн Ял хуҫалӑх министерствинче ректор пулма тивӗҫ кандидатурӑсене аттестацилемелли лару иртнӗ. Пирӗн республикӑран сакӑр кандидат тӑратнӑ иккен, федераци министерстви вӗсенчен виҫҫӗшне — вӗсем кашниех академире ӗҫлеҫҫӗ — суйласа илнӗ. Ҫапла вара Мускавра ырланӑ кандидатсен списокне ректор тивӗҫне халӗ пурнӑҫлакан Людмила Линик тата биологи ӑслӑлӑхӗсен докторӗсем — пӗри морфологи, физиологи тата зоогигиена кафедрин профессорӗ Владимир Семенов, тепри ҫӗр ӗҫӗпе агрохими кафедрин профессорӗ Николай Кириллов — кӗнӗ.",
        "Чӑваш патшалӑх ял хуҫалӑх академийӗнче паян ректор суйлассине эпир пӗлтернӗччӗ. Пуҫлӑх пуканне ректор тивӗҫне халӗ пурнӑҫлакан Людмила Линика шанса панӑ иккен. Уншӑн 118 ҫынтан 90-шӗ сасӑланӑ. Пӗлекенсем каланӑ тӑрӑх, суйлава академи алӑкне шал енчен питӗрсех ирттернӗ-мӗн. Унта журналистсем ҫеҫ мар, ректор пулма кандидат пулнӑ Семеновӑн шаннӑ ҫынни те кӗреймен иккен.\n\nВладимир Семенов кадидатуришӗн 25-ӗн сасӑланӑ-мӗн, Николай Кирилловшӑн — 2-ӗн.",
        "И.Н. Ульянов ячӗллӗ Чӑваш патшалӑх университетне ертсе пыракан Всеволод Агаков ӗҫрен каять. Ҫитес ҫулхи кӑрлачра вӑл 65 ҫул тултарать иккен. Аслӑ шкулсен ертӳҫисен, саккунпа, ҫав ҫула ҫитсен ӗҫе пӑрахмалла. Ҫапах та чылай правилӑра та «анчах» текен самант та пур та, кунта та ҫавӑн пекех — уйрӑмах хисеплӗ ректорсем 70 ҫула ҫитичченех хӑйсен вырӑнӗнче тар тӑкма пултараҫҫӗ.\n\nРектор ӗҫе мӗн шутпа пӑрахас тени пирки халӗ хӑшӗсем хытах пуҫ ватаҫҫӗ иккен. Асӑннӑ аслӑ шкулпа ҫыхӑннӑ коррупцилле хӑш-пӗр фактсем пирки Раҫҫейӗн Аслӑ шкул министерстви хистемен мар-ши тесе пӑшӑлтатакансем те пур-мӗн.\n\nРектор вырӑнне йышӑнма пултаракан кандидатурӑсем пирки те пуҫ ватакансем пур-мӗн. Вӗсен шучӗпе ҫак должноҫе ЧПУн вӗренӳ енӗпе ӗҫлекен проректорӗ Андрей Александров е тата республикӑн вӗренӳ министрӗ Владимир Иванов йышӑнма пултарать-мӗн.",
        "Ака уйӑхӗн 29-мӗшӗнче ЧР Ял хуҫалӑх академийӗн ҫӗнӗ ректорне суйланӑ. Кун тӗлӗшпе академире ӗҫлекенсен тата вӗренекенсен конференцийӗ иртнӗ.\n\nДелегатсем ҫӗр проценчӗпех килнине палӑртнӑ. Мандат комиссийӗ 85 делегатӑн полномочине ҫирӗплетнӗ.\n\nРектор должноҫне виҫӗ ҫынран пӗрине суйлама сӗннӗ. Вӗсем — Рамиль Айзатов, Ҫӗрпӳри аграрипе технологи техникумӗн директорӗ Николай Васильев, «Агро-Инноваци» унитари предприятийӗн директорӗ Андрей Макушев.\n\nСасӑлава пӗтӗмлетӗвӗ тӑрӑх, ректор тивӗҫне Андрей Макушев пилӗк ҫул пурнӑҫлӗ. Вӑл 80 сасӑ пухнӑ. Николай Васильевшӑн 5-ӗн сасӑланӑ. Рамиль Айзатов 0 сасӑ пухнӑ.",
        "Авӑн уйӑхӗн 3-мӗшӗнче Чӑваш патшалӑх университечӗн культура керменӗнче университет ректорӗ В.Г. Агаков профессор ҫӗнӗ корпусра вӗренекен студентсемпе тӗл пулу ирттерчӗ. Ректор зала пухӑннисене, уйрӑмах 1-мӗш курссене, ҫӗнӗ вӗренӳ ҫулӗ пуҫланнӑ ятпа саламларӗ, ҫитӗнӳсем тума сунчӗ. Ҫӗнӗ курпусра юсав ӗҫӗсем пыраҫҫӗ. Тин кӑна филологсемпе историксем вӗренекен 5 хута строительсем илем кӗртсе пӗтерчӗҫ. Ректор ҫакӑн пек юсав ӗҫӗсем ытти хутсенче те пуласса шантарчӗ. Тирпейлӗ те хӑтлӑ пӳлӗмсене ҫӗнӗ техника хатӗрӗсем илем кӳрӗҫ, вӗренӳре пулӑшса пырӗҫ. Ҫавӑн пекех, В.Г. Агаков студентсен пурнӑҫӗпе те кӑсӑкланчӗ, ыйтусем ҫине хуравларӗ. Ятлӑ стипендисене хута ярас, ытти вузсене тӗрлӗ конференцисене тухса ҫӳрес тата ытти ӗҫсенче пулӑшма шантарчӗ. Авӑн уйӑхӗнче пур студента та стипенди парса хавхалантарасси пирки пӗлтерчӗ. Тӗлпулу савӑнӑҫлӑ концерпа вӗҫленчӗ."
      ],
      "response": "Чăваш патшалăх ял хуçалăх академийĕн ректор тивĕçĕпе улшăнусем иртнĕ. Иртнĕ çулхи раштавăн 12-мĕшĕнче Николай Васильев ректора çĕртен ĕçлеме пăрахтарнă, яваплă тивĕçе Людмила Линик пурнăçланă. Ака уйăхĕн 29-мĕшĕнче академире ĕçлекенсем тата вĕренекенсен конференцийĕ иртнĕ, ректора суйлама виçĕ кандидат тухнă — Рамиль Айзатов, Николай Васильев тата Андрей Макушев. Суйлавăн пĕтĕмлетĕвĕ тăрăх, Андрей Макушев 80 сасă пухнă, ректор тивĕçне пиллĕк çул пурнăçлă шанса илнĕ. Николай Васильевшăн 5 сасă, Рамиль Айзатовшăн сасă çук. Улшăнăвăн хыççăн академи ĕçĕ-хĕлĕ çĕнĕ ректор ертсе пырать.",
      "reference": "Малтан ректор тивӗҫне Александр Акимов пурнӑҫланӑ, кайран вара ку тивӗҫе Илья Царевский куҫнӑ.",
      "faithfulness": NaN,
      "context_precision": 0.0,
      "context_recall": 0.0,
      "answer_relevancy": 0.43094308603001513
    },
    {
      "question": "Илья Царевский хӑш хулара ҫуралнӑ?",
      "user_input": "Илья Царевский хӑш хулара ҫуралнӑ?",
      "retrieved_contexts": [
        "Илен (Илем) кунӗнче ҫуралнӑ тусӑма\n\nГ.А. Дегтярёва\n\nВӗри…\n\nКӑвак тӳпеллӗ утӑ кунӗ\n\nКӑмакари пек туйӑнать:\n\nКӑшт сулхӑнта кӑна халь канлӗ,\n\nАхалӗн макӑр: чун тухать.\n\n\n\nПӑчӑ…\n\nКапашсӑр шӑрӑх — ҫумӑр кирлӗ,\n\nТавралӑх шывшӑн антӑхать.\n\nӐҫта-ши халӗ ҫурҫӗр ҫилӗ?\n\nНиҫта пӗр пӗлӗт курӑнмасть.\n\n\n\nАй-ай…\n\nХӗвел хӗртет, ҫӑлсамччӗ Турӑ —\n\nЧӑтма май ҫук-ҫке кунӗпе.\n\nХӑйӑр ҫинче ҫунать ҫан-ҫурӑм,\n\nӲт-тир сурать сӗвӗннипе.\n\n\n\nВӑй ҫук…\n\nШӑм-шак та йывӑр — чирлӗ тейӗн.\n\nСывлӑш ҫитмест, мунчарилле.\n\nТӗнче чӗр тамӑк халь этемшӗн −\n\nТархасшӑн ҫумӑр пар, Илле!\n\n\n\nЛеонид Кевер (Сильвестров)",
        "Ҫӗнӗ Шупашкар каччи, Илья Фёдоров, воллейбол енӗпе Раҫҫей чемпиоантӗнче ҫӗнтернӗ. Каччӑ Хусанти «Зенит» командӑра вылять. Хусанти команда Мускаври «Динамӑна» ҫӗнтернӗ.\n\nИлья — 21 ҫулта. Хусанти «Зенит» йышӗнче вӑл 2017 ҫултанпа вылять. Унччен маларах каччӑ командӑпа пӗрлРаҫсей кубокӗнче ҫӗнтернӗ кӑна мар, Ҫамрӑксен хушшинче Европа чемпионӗ пулса тӑнӑ.",
        "Кӑҫалхи ака уйӑхӗн 25-мӗшӗнче чӑваш халӑхне ҫутта кӑлараканӑмӑр Иван Яковлевич Яковлев ҫуралнӑранпа 160 ҫул ҫитет. Тӑван чӗлхе аталанӑвӗшӗн, чӑваш халӑхӗшӗн ҫав тери пысӑк ӗҫсем туса хӑварнӑ вӑл. Иван Яковлевич кашни чӑвашшӑн Турӑ вырӑнӗнче. «Нарӑсӑн 21-мӗшӗнче Пӗтӗм тӗнчери тӑван чӗлхе кунне паллӑ тунӑ май хамӑр халӑха хут вӗрентес тесе вӑй-халне шеллемен аслӑ ҫыннӑмӑра И.Я.Яковлева халалласа викторина ирттерес терӗмӗр» — тесе палартаҫҫӗ суварҫӑсем. Кӑмӑл тӑвакансем пурте хутшӑнма пултараҫҫӗ унта. Пур ыйту ҫине те тӗп-тӗрӗс хуравланисене «Сувар» хаҫат редакцийӗнчен парнесем кӗтеҫҫӗ. Чи хастар шкула редакцин Тав хучӗпе ятарлӑ парни кӗтеҫҫӗ.\n\n\n\n«Сувар» редакцийӗ викторина хуравӗсене акан 20-мӗшӗччен йышӑнать, И.Я.Яковлев ҫуралнӑ кунӗ тӗлне пӗтӗмлетме шутлать. Хуравсене почта урлӑ ярас пулсан конверт ҫине «Викторинӑна» тесе ҫырма ан манӑр. Хӑвӑрӑн ятӑра, хушаматӑра, адресӑра, хӑш шкулта, миҫемӗш класра вӗреннине (е ӗҫленине) палӑртма ан манӑр. Ҫавӑн пекех викторина хуравӗсене «Суварӑн» электронлӑ адресӗпе те ярса пама пултаратӑр: suvar@mail.ru.\n\n\n\nВикторина пирки тӗплӗнрех: http://suvar.su/913.html",
        "Чӑваш обкомӗн пӗрремӗш секретарӗнче нумай ҫул вӑй хунӑ Илья Прокопьева хисеп туса тата асра тытса вӑл пурӑннӑ ҫурт ҫине асӑну хӑми вырнаҫтарнӑ. Паян ӑна савӑнӑҫлӑ лару-тӑрура уҫнӑ.\n\nИлья Прокопьев пӗлтӗр ҫут тӗнчерен уйрӑлса кайнӑччӗ. Ун чухне вӑл 90 ҫула ҫитнӗччӗ.\n\nАсӑну хӑми Шупашкарти Ленинград урамӗнчи 26-мӗш ҫурт ҫинче тивӗҫлӗ вырӑн тупнӑ. Хӑмана РФ Художниксен союзӗн пайташӗ Игорь Голубев ӑсталанӑ.\n\nХӑмана уҫнӑ ҫӗре тӗрлӗ шайри тӳре-шара хутшӑннӑ. Вӗсем пурте  Илья Прокопьевӑн ырӑ кӑмӑлне пӗр шухӑшлӑн палӑртнӑ. Чӑваш Ен Элтеперӗ Михаил Игнатьев та ҫавнах каланӑ.\n\nПаллӑ ҫынпа пӗрле ӗҫленӗ Валериан Дубинин Чӑваш Енӗн  ял хуҫалӑх министрӗ пулнӑ. Асӑну хӑмине уҫнӑ ҫӗре хутшӑнӑ Андрей Михайлов журналист Дубинин та Илья Прокопьев сӑпайлӑхпа уйрӑлса тӑнине палӑртнине пӗлтернӗ.",
        "Чӑваш ҫамрӑкӗсен «Сӑвар» пӗрлешӗвӗ кӑҫал ҫула 30-мӗш хут тухӗ. Ҫӗнӗ чунҫӳрев ҫурлан 1-мӗшӗнче пуҫланӗ те 12-мӗшӗнче вӗҫленӗ. Чунҫӳревҫӗсем кӑҫал Аслӑ Арапуҫра (Митта Ваҫлейӗн вилтӑпри ҫине кӗрсе тухӗҫ), Турханта (Кокель музейӗпе паллашӗҫ), Ҫӗньялта (Геннадий Айхине сума сӑвӗҫ) чарӑнӗҫ, Тикеш хулашне кӗрсе тухӗҫ. Ун хыҫҫӑн вӗсен ҫулӗ Чӗмпӗр урлӑ Хура тинӗс хӗрринчи Хӑнакур хулине выртӗ. Севастополе ҫитнӗ хыҫҫӑн каялла Шупашкаралла таврӑнӗҫ.\n\nЧунҫӳреве йӗркелекен Олег Михайлович Цыпленков — Ултиар — пӗлтернӗ тӑрӑх автобусра тата тепӗр 10 вырӑн пур. Кӑмӑлӑр пур пулсан ҫул хакӗ — 10-12 пин. Хура тинӗс хӗрринче 1 эрне ирттерӗҫ.\n\nЫйтусем пулсан Ултиарпа 8-927-667-93-23 номерпе ҫыхӑнма пулать."
      ],
      "response": "Илья Царевский ҫуралнӑ хула пирки предоставленнӑ фрагментсенче ҫук. Анчах вӗсенче Илья ятлӑ ытти паллӑ чӑвашсем пирки каланӑ:\n\n1. **Илья Фёдоров (волейболист)** — Ҫӗнӗ Шупашкарта ҫуралнӑ, Хусанти «Зенит» командинче вылять, Раҫҫей чемпионӗ.\n2. **Илья Прокопьев (политик)** — Чӑваш обкомӗн пӗрремӗш секретарӗ пулнӑ, Шупашкарта пурӑннӑ, ун ҫинче асӑну хӑми вырнаҫтарнӑ.\n3. **Иван Яковлевич Яковлев** — чӑваш халӑхне ҫутта кӑларакан, ҫуралнӑ кунӗ (ака, 25) паллӑ.\n\nИлья Царевский ҫинчен информаци ҫук пулсан, суйласа илнӗ фрагментсене тӑрӑх урӑх Илья ятлӑ чӑваш паллӑ ҫыннисен ҫуралнӑ вырӑнӗсене палӑртма пулать.",
      "reference": "Текстра Илья Царевскин ҫуралнӑ вырӑнӗ ҫинчен каланман.",
      "faithfulness": NaN,
      "context_precision": 0.99999999998,
      "context_recall": 0.0,
      "answer_relevancy": 0.0
    }
  ],
  "noise_sensitivity": {},
  "recommendations": [
    "🔴 Faithfulness низкий (0.60): LLM добавляет информацию не из контекста. Ужесточи system_prompt — укажи явно \"отвечай ТОЛЬКО на основе предоставленного контекста\".",
    "🔴 Context Precision низкий (0.58): ChromaDB возвращает нерелевантные документы. Попробуй уменьшить n_results (сейчас 5) или применить re-ranking (Cross-Encoder).",
    "🟡 Context Recall низкий (0.50): система пропускает нужные документы. Проверь чанкинг данных в ChromaDB — возможно chunk_size слишком велик и информация размыта.",
    "🟡 Answer Relevancy низкий (0.40): ответы отклоняются от темы. Добавь в system_prompt инструкцию отвечать кратко и по существу вопроса.",
    "📌 Чувашский язык: embedding-модель qwen3-embedding-8b обучена преимущественно на китайском/английском. Рекомендуется оценить multilingual e5-large или LaBSE как альтернативу.",
    "📌 Чанкинг диалога: текущий chunk_size=3, overlap=1 при коротком диалоге создаёт дублирующиеся чанки. Рассмотри использование только последнего сообщения для эмбеддинга.",
    "📌 В ChromaDB используется только эмбеддинг первого чанка диалога (см. предупреждение в llm.py). Попробуй mean-pooling векторов всех чанков для более точного представления контекста.",
    "📌 Добавь метаданные в ChromaDB (источник, дата, категория) и используй metadata filtering для повышения Context Precision.",
    "📌 Для чувашскоязычных вопросов рассмотри Hypothetical Document Embeddings (HyDE): сначала генерируй гипотетический ответ, затем ищи по нему в ChromaDB."
  ]
}